h,2689,חֲצֹצְרָה,Noun Feminine,chatsotsrah,(khats-o-tser-aw'),(an ancient) trumpet,trumpeter ,By reduplication from (H2690) chatsar; a trumpet (from its sundered or quavering note) -- trumpet(-er). see HEBREW (H2690) chatsar
h,2690,חָצַר,Verb,chatsar or chatsotser,(khaw-tsar'),to sound a trumpet,"blow, sound, trumpeter ","A primitive root; properly, to surround with a stockade, and thus separate from the open country; but used only in the reduplicated form chatsotser {khast-o-tsare'}; or (2 Chronicles 5:12) chatsorer {khats-o-rare'}; as dem. From (H2689) chatsotsrah; to trumpet, i.e. Blow on that instrument -- blow, sound, trumpeter. see HEBREW (H2689) chatsotsrah "
h,2691,חָצֵר,Noun Masculine,chatser,(khaw-tsare'),"enclosure, court","court, tower, village ","(masculine and feminine); from (H2690) chatsar in its original sense; a yard (as inclosed by a fence); also a hamlet (as similarly surrounded with walls) -- court, tower, village. see HEBREW (H2690) chatsar "
h,2692,חֲצַר אַדָּר,Proper Name Location,Chatsar-addar,(khats-ar' addawr'),a place on the S. border of Canaan,Hazar-addar ,"From (H2691) chatser and (H146) 'Addar; (the) village of Addar; Chatsar-Addar, a place in Palestine -- Hazar-addar. see HEBREW (H2691) chatser see HEBREW (H146) 'Addar "
h,2693,חֲצַר גַּדָּה,Proper Name Location,Chatsar Gaddah,(khats-ar'gad-daw'),a place in S. Judah,Hazar-gaddah ,"From (H2691) chatser and a feminine of (H1408) Gad; (the) village of (female) Fortune; Chatsar-Gaddah, a place in Palestine -- Hazar-gaddah. see HEBREW (H2691) chatser see HEBREW (H1408) Gad "
h,2694,חֲצַר הַתִּיכוֹן,Proper Name Location,Chatser Hattikon,(khats-ar' hat-tee-kone'),a place near the border of Hauran,Hazar-hatticon ,"From (H2691) chatser and (H8484) tiykown with the article interposed; village of the middle; Chatsar-hat-Tikon, a place in Palestine -- Hazar-hatticon. see HEBREW (H2691) chatser see HEBREW (H8484) tiykown "
h,2695,חֶצְרוֹ,Proper Name Masculine,Chetsro,(khets-ro'),one of David\'s heroes,"Hezro, Hezrai ","By an orthographical variation for (H2696) Chetsrown; enclosure; Chetsro, an Israelite -- Hezro, Hezrai. see HEBREW (H2696) Chetsrown "
h,2696,חֶצְרוֹן,"proper name, of a location and person; proper name, masculine",Chetsron,(khets-rone'),"two Israelites, also two places in Judah",Hezron ,"From (H2691) chatser; court-yard; Chetsron, the name of a place in Palestine; also of two Israelites -- Hezron. see HEBREW (H2691) chatser "
h,2697,חֶצְרוֹנִי,Noun Masculine,Chetsroni,(khets-ro-nee'),descendant of Hezron,Hezronites ,Patronymically from (H2696) Chetsrown; a Chetsronite or (collectively) descendants of Chetsron -- Hezronites. see HEBREW (H2696) Chetsrown
h,2698,חֲצֵרוֹת,Proper Name Location,Chatseroth,(khats-ay-roth'),a place in the wilderness,Hazeroth ,"Feminine plural of (H2691) chatser; yards; Chatseroth, a place in Palestine -- Hazeroth. see HEBREW (H2691) chatser "
h,2699,חֲצֵרִים,Proper Name Location,chatserim,(khats-ay-reem'),Hazerim ,Hazerim ,"Plural masculine of (H2691) chatser; yards; Chatserim, a place in Palestine -- Hazerim. see HEBREW (H2691) chatser "
h,2700,חֲצַרְמָוֶת,"proper name, masculine; proper name, of a territory",Chatsarmaveth,(khats-ar-maw'-veth),"a son of Joktan, also his desc",Hazarmaveth ,"From (H2691) chatser and (H4194) maveth; village of death; Chatsarmaveth, a place in Arabia -- Hazarmaveth. see HEBREW (H2691) chatser see HEBREW (H4194) maveth "
h,2701,חֲצַר סוּסָה,Proper Name Location,Chatsar Susah,(khats-ar'soo-saw'),"village of cavalry, a place in Simeon",Hazar-susah ,"From (H2691) chatser and (H5484) cuwcah; village of cavalry; Chatsar-Susah, a place in Palestine -- Hazar-susah. see HEBREW (H2691) chatser see HEBREW (H5484) cuwcah "
h,2702,חֲצַר סוּסִים,Proper Name Location,Chatsar Susim,(khats-ar' soo-seem'),"village of horses, a place in Simeon",Hazar- susim ,"From (H2691) chatser and the plural of (H5483) cuwc; village of horses; Chatsar-Susim, a place in Palestine -- Hazar- susim. see HEBREW (H2691) chatser see HEBREW (H5483) cuwc "
h,2703,חֲצַר עֵינוֹן,Proper Name Location,Chatsar Enon,(khats-ar' ay-none'),a place on the N.E. border of Canaan,Hazar- enon ,"From (H2691) chatser and a derivative of (H5869) ayin; village of springs; Chatsar-Enon, a place in Palestine -- Hazar- enon. see HEBREW (H2691) chatser see HEBREW (H5869) ayin "
h,2704,חֲצַר עֵינָן,Proper Name Location,Chatsar Enan,(khats-ar' ay-nawn'),a place on the N.E. border of Canaan,Hazar-enan ,"From (H2691) chatser and the same as (H5881) Eynan; village of springs; Chatsar-Enan, a place in Palestine -- Hazar-enan. see HEBREW (H2691) chatser see HEBREW (H5881) Eynan "
h,2705,חֲצַר שׁוּעָל,Proper Name Location,Chatsar Shual,(khats-ar' shoo-awl'),"village of the fox, a place in S. Judah",Hazar-shual ,"From (H2691) chatser and (H7776) shuw'al; village of (the) fox; Chatsar-Shual, a place in Palestine -- Hazar-shual. see HEBREW (H2691) chatser see HEBREW (H7776) shuw'al "
h,2706,חֹק,Noun Masculine,choq,(khoke),"something prescribed or owed, a statute","appointed, bound, commandment, convenient, custom, decreed, due, law, ","From (H2710) chaqaq; an enactment; hence, an appointment (of time, space, quantity, labor or usage) -- appointed, bound, commandment, convenient, custom, decree(-d), due, law, measure, X necessary, ordinance(- nary), portion, set time, statute, task. see HEBREW (H2710) chaqaq "
h,2707,חָקָה,Verb,chaqah,(khaw-kaw'),"to cut in, carve","carved work, portrayed, set a print ","A primitive root; to carve; by implication, to delineate; also to entrench -- carved work, portrayed, set a print. "
h,2708,חֻקָּה,Noun Feminine,chuqqah,(khook-kaw'),"something prescribed, an enactment, statute","appointed, custom, manner, ordinance, site, statute ","Feminine of (H2706) choq, and meaning substantially the same -- appointed, custom, manner, ordinance, site, statute. see HEBREW (H2706) choq "
h,2709,חֲקוּפָא,Proper Name Masculine,Chaqupha,(khah-oo-faw'),an Israelite,Hakupha ,"From an unused root probably meaning to bend; crooked; Chakupha, one of the Nethinim -- Hakupha. "
h,2710,חָקַק,Verb,chaqaq,(khaw-kak'),"to cut in, inscribe, decree","appoint, decree, governor, grave, lawgiver, note, portray, print, ","A primitive root; properly, to hack, i.e. Engrave (Judges 5:14, to be a scribe simply); by implication, to enact (laws being cut in stone or metal tablets in primitive times) or (gen.) Prescribe -- appoint, decree, governor, grave, lawgiver, note, pourtray, print, set. "
h,2711,חֵקֶק,Noun Masculine,cheqeq,(khay'-kek),"decree, thought ","decree, thought ","From (H2710) chaqaq; an enactment, a resolution -- decree, thought. see HEBREW (H2710) chaqaq "
h,2712,חֻקֹּק,Proper Name Location,Chuqoq,(Khook-koke'),a place in Naphtali,"Hukkok, Hukok ","Or (fully) Chuwqoq {khoo-koke'}; from (H2710) chaqaq; appointed; Chukkok or Chukok, a place in Palestine -- Hukkok, Hukok. see HEBREW (H2710) chaqaq "
h,2713,חָקַר,Verb,chaqar,(khaw-kar'),to search,"find out, make search out, seek out, sound, try ","A primitive root; properly, to penetrate; hence, to examine intimately -- find out, (make) search (out), seek (out), sound, try. "
h,2714,חֵקֶר,Noun Masculine,cheqer,(khay'-ker),"a searching, a thing (to be) searched out","finding out, number, unsearchable, ","From (H2713) chaqar; examination, enumeration, deliberation -- finding out, number, (un-)search(-able, -ed, out, -ing). see HEBREW (H2713) chaqar "
h,2715,חֹר,Noun Masculine,chor,(khore),a noble,noble ,"Or (fully) chowr {khore}; from (H2787) charar; properly, white or pure (from the cleansing or shining power of fire (compare (H2751) choriy); hence (figuratively) noble (in rank) -- noble. see HEBREW (H2787) charar see HEBREW (H2751) choriy "
h,2716,חֶרֶא,Noun Masculine,chere,(kheh'-reh),dung,"excrement, dung",From an unused (and vulgar) root probably meaning to evacuate the bowels: excrement; -dung. Also chariy {khar-ee'}.
h,2717,חָרַב,Verb,charab,(khaw-rab'),to be dry or dried up,"decay, be desolate, destroyer, be dry up, slay, surely, lay, lie, ","Or chareb {khaw-rabe'}; a primitive root; to parch (through drought) i.e. (by analogy,) to desolate, destroy, kill -- decay, (be) desolate, destroy(-er), (be) dry (up), slay, X surely, (lay, lie, make) waste. "
h,2718,חֲרַב,Verb,charab,(khar-ab'),to be a waste,destroy ,(Aramaic) a root corresponding to (H2717) charab; to demolish -- destroy. see HEBREW (H2717) charab
h,2719,חֶרֶב,Noun Feminine,chereb,(kheh'-reb),a sword,"axe, dagger, knife, mattock, sword, tool ","From (H2717) charab; drought; also a cutting instrument (from its destructive effect), as a knife, sword, or other sharp implement -- axe, dagger, knife, mattock, sword, tool. see HEBREW (H2717) charab "
h,2720,חָרֵב,Adjective,chareb,(khaw-rabe'),dry,"desolate, dry, waste ","From (H2717) charab; parched or ruined -- desolate, dry, waste. see HEBREW (H2717) charab "
h,2721,חֹרֶב,Noun Masculine,choreb,(kho'-reb),"dryness, drought, heat","desolation, drought, dry, heat, utterly, waste ","A collaterally form of (H2719) chereb; drought or desolation -- desolation, drought, dry, heat, X utterly, waste. see HEBREW (H2719) chereb "
h,2722,חֹרֵב,Proper Name Location,Choreb,(kho-rabe'),"waste, a mountain in Sinai",Horeb ,"From (H2717) charab; desolate; Choreb, a (generic) name for the Sinaitic mountains -- Horeb. see HEBREW (H2717) charab "
h,2723,חָרְבָּה,Noun Feminine,chorbah,(khor-baw'),"waste, desolation, ruin","decayed place, desolate place destruction, laid waste place ","Feminine of (H2721) choreb; properly, drought, i.e. (by implication) a desolation -- decayed place, desolate (place, -tion), destruction, (laid) waste (place). see HEBREW (H2721) choreb "
h,2724,חָרָבָה,Noun Feminine,charabah,(khaw-raw-baw'),dry ground,"dry ground, land ","Feminine of (H2720) chareb; a desert -- dry (ground, land). see HEBREW (H2720) chareb "
h,2725,חֲרָבוֹן,Noun Masculine,cherabon,(khar-aw-bone'),drought,drought ,From (H2717) charab; parching heat -- drought. see HEBREW (H2717) charab
h,2726,חַרְבוֹנָא,Proper Name Masculine,Charbona or Charbonah,(khar-bo-naw'),eunuch of Ahasuerus,"Harbona, Harbonah ","Or Charbownah {khar-bo-naw'}; of Persian origin; Charbona or Charbonah, a eunuch of Xerxes -- Harbona, Harbonah. "
h,2727,חָרַג,Verb,charag,(khaw-rag'),to quake,be afraid ,"A primitive root; properly, to leap suddenly, i.e. (by implication) to be dismayed -- be afraid. "
h,2728,חָרְגֹּל,Noun Masculine,chargol,(khar-gole'),(a kind of) locust,beetle ,"From (H2727) charag; the leaping insect, i.e. A locust -- beetle. see HEBREW (H2727) charag "
h,2729,חָרַד,Verb,charad,(khaw-rad'),"to tremble, be terrified","be make afraid, be careful, discomfit, fray away, quake, tremble ","A primitive root; to shudder with terror; hence, to fear; also to hasten (with anxiety) -- be (make) afraid, be careful, discomfit, fray (away), quake, tremble. "
h,2730,חָרֵד,Adjective,chared,(khaw-rade'),trembling,"afraid, trembling ","From (H2729) charad; fearful; also reverential -- afraid, trembling. see HEBREW (H2729) charad "
h,2731,חֲרָדָה,Noun Feminine,charadah,(khar-aw-daw'),"trembling, fear, anxiety","fear, quaking, trembling ","Feminine of (H2730) chared; fear, anxiety -- care, X exceedingly, fear, quaking, trembling. see HEBREW (H2730) chared "
h,2732,חֲרָדָה,Proper Name Location,Charadah,(khar-aw-daw'),a place in the S. desert,Haradah ,"The same as (H2731) charadah; Charadah, a place in the Desert -- Haradah. see HEBREW (H2731) charadah "
h,2733,חֲרֹדִי,Noun Masculine,Charodi,(khar-o-dee'),inhab. of Harod,Harodite ,"Patrial from a derivative of (H2729) charad (compare (H5878) Eyn Charod); a Charodite, or inhabitant of Charod -- Harodite. see HEBREW (H2729) charad see HEBREW (H5878) Eyn Charod "
h,2734,חָרָה,Verb,charah,(khaw-raw'),to burn or be kindled with anger,"be angry, burn, be displeased, earnestly, fret self, grieve, be wax hot, be incensed, ","A primitive root (compare (H2787) charar); to glow or grow warm; figuratively (usually) to blaze up, of anger, zeal, jealousy -- be angry, burn, be displeased, X earnestly, fret self, grieve, be (wax) hot, be incensed, kindle, X very, be wroth. See (H8474) tacharah. see HEBREW (H2787) charar see HEBREW (H8474) tacharah "
h,2735,חֹר הַגִּדְגָּד,Proper Name Location,Chor Haggidgad,(khore hag-ghid-gawd'),"hollow of Gidgad, a place in the S. desert",Hor-hagidgad ,"From (H2356) chowr and a collateral (masculine) form of (H1412) Gudgodah, with the article interposed; hole of the cleft: Chor-hag-Gidgad, a place in the Desert -- Hor-hagidgad. see HEBREW (H2356) chowr see HEBREW (H1412) Gudgodah "
h,2736,חַרְהֲיָה,Proper Name Masculine,Charhayah,(khar-hah-yaw'),Harhaiah ,Harhaiah ,"; from (H2734) charah and (H3050) Yahh; fearing Jah; Charhajah, an Israelite -- Harhaiah. see HEBREW (H2734) charah see HEBREW (H3050) Yahh "
h,2737,חָרוּז,Noun Masculine,charuz,(khaw-rooz'),string of beads,chain ,"From an unused root meaning to perforate; properly, pierced, i.e. A bead of pearl, gems or jewels (as strung) -- chain. "
h,2738,חָרוּל,Noun Masculine,charul,(khaw-rool'),"(a kind of weed), perhaps chickpea","prickly, pointed","Or (shortened) charul {khaw-rool'}; apparently, a passive participle of an unused root probably meaning to be prickly; properly, pointed, i.e. A bramble or other thorny weed: nettle. "
h,2739,חֲרוּמַף,Proper Name Masculine,Charumaph,(khar-oo-maf'),an Israelite,Harumaph ,"From passive participle of (H2763) charam and (H639) 'aph; snub-nosed; Charumaph, an Israelite -- Harumaph. see HEBREW (H2763) charam see HEBREW (H639) 'aph "
h,2740,חָרוֹן,Noun Masculine,charon,(khaw-rone'),(burning of) anger,"sore displeasure, fierceness, fury, fierce wrathful ","Or (shortened) charon {khaw-rone'}; from (H2734) charah; a burning of anger -- sore displeasure, fierce(-ness), fury, (fierce) wrath(-ful). see HEBREW (H2734) charah "
h,2741,חֲרוּפִי,Noun Masculine,Charuphi,(khar-oo-fee'),descendant of Hariph,Haruphite ,A patrial from (probably) a collateral form of (H2756) Chariyph; a Charuphite or inhabitant of Charuph (or Chariph) -- Haruphite. see HEBREW (H2756) Chariyph
h,2742,חֲרוּץ,Adjective; noun masculine; noun masculine,charuwts,(khaw-roots'),"sharp, diligent","decision, diligent, fine gold, pointed things, sharp, threshing instrument, wall ","Or charuts {khaw-roots'}; passive participle of (H2782) charats; properly, incised or (active) incisive; hence (as noun masculine or feminine) a trench (as dug), gold (as mined), a threshing-sledge (having sharp teeth); (figuratively) determination; also eager -- decision, diligent, (fine) gold, pointed things, sharp, threshing instrument, wall. see HEBREW (H2782) charats "
h,2743,חָרוּץ,Proper Name Masculine,Charuts,(khaw-roots'),grandfather of King Amon,Haruz ,"The same as (H2742) charuwts; earnest; Charuts, an Israelite -- Haruz. see HEBREW (H2742) charuwts "
h,2744,חַרְחוּר,Proper Name Masculine,Charchuwr,(khar-khoor'),an Israelite,Harhur ,"A fuller form of (H2746) charchur; inflammation; Charchur, one of the Nethinim -- Harhur. see HEBREW (H2746) charchur "
h,2745,חַרְחַס,Proper Name Masculine,Charchas,(khar-khas'),an Israelite,Harhas ,"From the same as (H2775) cherec; perhaps shining; Charchas, an Israelite -- Harhas. see HEBREW (H2775) cherec "
h,2746,חַרְחֻר,Noun Masculine,charchur,(khar-khoor'),"violent heat, fever",fever ,From (H2787) charar; fever (as hot); -extreme burning. see HEBREW (H2787) charar
h,2747,חֶרֶט,Noun Masculine,cheret,(kheh'-ret),"engraving tool, stylus","graving tool, pen ","From a primitive root meaning to engrave; a chisel or graver; also a style for writing -- graving tool, pen. "
h,2748,חַרְטֹם,Noun Masculine,chartom,(khar-tome'),"an engraver, writer",magician ,From the same as (H2747) cheret; a horoscopist (as drawing magical lines or circles) -- magician. see HEBREW (H2747) cheret
h,2749,חַרְטֹם,Noun Masculine,chartom,(khar-tome'),magician,magician ,(Aramaic) the same as (H2748) chartom -- magician. see HEBREW (H2748) chartom
h,2750,חֱרִי,Noun Masculine,chori,(khor-ee'),burning,"fierce, great, heat ","From (H2734) charah; a burning (i.e. Intense) anger -- fierce, X great, heat. see HEBREW (H2734) charah "
h,2751,חרִי,Noun Masculine,chori,(kho-ree'),white (bread),white bread,From the same as (H2353) chuwr; white bread -- white. see HEBREW (H2353) chuwr
h,2752,חֹרִי,Noun Masculine,Chori,(kho-ree'),"inhab. of Edom, also the name of an Edomite, also the name of a Simeonite","Horims, Horites ","From (H2356) chowr; cave-dweller or troglodyte; a Chorite or aboriginal Idumaean -- Horims, Horites. see HEBREW (H2356) chowr "
h,2753,חֹרִי,Proper Name Masculine,Chori,(kho-ree'),Hori ,Hori ,"Or Chowriy {kho-ree'}; the same as (H2752) Choriy; Chori, the name of two men -- Hori. see HEBREW (H2752) Choriy "
h,2754,חָרִיט,Noun Masculine,charit,(khaw-reet'),"bag, purse","bag, crisping pin ","Or charit {khaw-reet'}; from the same as (H2747) cheret; properly, cut out (or hollow), i.e. (by implication) a pocket -- bag, crisping pin. see HEBREW (H2747) cheret "
h,2755,חֲרֵי־יוֹנִים,Noun Masculine,chare yonim,(khar-ay'-yo-neem'),doves\' dung ,doves\' dung ,"From the plural of (H2716) chere' and the plural of (H3123) yownah; excrements of doves {or perhaps rather the plural of a single word charapyown {khar-aw-yone'}; of similar or uncertain derivation, probably a kind of vegetable -- doves' dung. see HEBREW (H2716) chere' see HEBREW (H3123) yownah "
h,2756,חָרִיף,Proper Name Masculine,Chariph,(khaw-reef'),an Israelite,Hariph ,"From (H2778) charaph.; autumnal; Chariph, the name of two Israelites -- Hariph. see HEBREW (H2778) charaph. "
h,2757,חָרִיץ,Noun Masculine,charits,(khaw-reets'),"a cut, thing cut, sharp instrument","cheese, harrow ","Or charits {khaw-reets'}; from (H2782) charats; properly, incisure or (passively) incised (compare (H2742) charuwts); hence, a threshing-sledge (with sharp teeth): also a slice (as cut) -- + cheese, harrow. see HEBREW (H2782) charats see HEBREW (H2742) charuwts "
h,2758,חָרִישׁ,Noun Masculine,charish,(khaw-reesh'),"a plowing, plowing time","plowing time, ground ","From (H2790) charash; ploughing or its season -- earing (time), ground. see HEBREW (H2790) charash "
h,2759,חֲרִישִׁי,Adjective,charishi,(khar-ee-shee'),perhaps sultry,vehement ,"From (H2790) charash in the sense of silence; quiet, i.e. Sultry (as feminine noun, the sirocco or hot east wind) -- vehement. see HEBREW (H2790) charash "
h,2760,חָרַךְ,Verb,charak,(khaw-rak'),"perhaps to scorch, parch",roast ,A primitive root; to braid (i.e. To entangle or snare) or catch (game) in a net -- roast.
h,2761,חֲרַךְ,Verb,charak,(khar-ak'),to singe,singe ,(Aramaic) a root probably allied to the equivalent of (H2787) charar; to scorch -- singe. see HEBREW (H2787) charar
h,2762,חֶרֶךְ,Noun Masculine,charakkim,(kheh'-rek),a lattice,lattice ,"From (H2760) charak; properly, a net, i.e. (by analogy) lattice -- lattice. see HEBREW (H2760) charak "
h,2763,חָרַם,Verb,charam,(khaw-ram'),"to ban, devote, exterminate","make accursed, consecrate, utterly destroy, devote, forfeit, have a flat nose, utterly slay","A primitive root; to seclude; specifically (by a ban) to devote to religious uses (especially destruction); physical and reflexive, to be blunt as to the nose -- make accursed, consecrate, (utterly) destroy, devote, forfeit, have a flat nose, utterly (slay, make away). "
h,2764,חֵרֶם,Noun Masculine,cherem,(khay'-rem),"devoted thing, devotion, ban","accursed dedicated thing, appointed to utter destruction, Extermination","Or (Zecheriah 14:11) cherem {kheh'-rem}; from (H2763) charam; physical (as shutting in) a net (either literally or figuratively); usually a doomed object; abstr. Extermination -- (ac-)curse(-d, -d thing), dedicated thing, things which should have been utterly destroyed, (appointed to) utter destruction, devoted (thing), net. see HEBREW (H2763) charam "
h,2765,חֱרֵם,Proper Name Location,Chorem,(khor-ame'),"sacred, a place in Naphtali",Horem ,"From (H2763) charam; devoted; Chorem, a place in Palestine -- Horem. see HEBREW (H2763) charam "
h,2766,חָרִם,Proper Name Masculine,Charim,(khaw-reem'),"consecrated, the name of several Israelites",Harim ,"From (H2763) charam; snub-nosed; Charim, an Israelite -- Harim. see HEBREW (H2763) charam "
h,2767,חָרְמָה,Proper Name Location,Chormah,(khor-maw'),"asylum, a place in Simeon",Hormah ,"From (H2763) charam; devoted; Chormah, a place in Palestine -- Hormah. see HEBREW (H2763) charam "
h,2768,חֶרְמוֹן,Proper Name Masculine,Chermon,(kher-mone'),"sacred (mountain), a mountain in S. Aram (Syria) and Northern Israel",Hermon ,"From (H2763) charam; abrupt; Chermon, a mount of Palestine -- Hermon. see HEBREW (H2763) charam "
h,2769,חֶרְמוֹנִים,Proper Name Masculine,Chermonim,(kher-mo-neem'),the Hermonites ,the Hermonites ,"Plural of (H2768) Chermown; Hermons, i.e. Its peaks -- the Hermonites. see HEBREW (H2768) Chermown "
h,2770,חֶרְמֵשׁ,Noun Masculine,chermesh,(kher-mashe'),a sickle,sickle ,From (H2763) charam; a sickle (as cutting) -- sickle. see HEBREW (H2763) charam
h,2771,חָרָן,"proper name, of a location; proper name, masculine",Charan,(kaw-rawn'),"crossroads, a city in N. Mesopotamia",Haran ,"From (H2787) charar; parched; Charan, the name of a man and also of a place -- Haran. see HEBREW (H2787) charar "
h,2772,חֹרֹנִי,Noun Masculine,Choroni,(kho-ro-nee'),inhab. of Beth-horon,Horonite ,Patrial from (H2773) Choronayim; a Choronite or inhabitant of Choronaim -- Horonite. see HEBREW (H2773) Choronayim
h,2773,חֹרֹנַיִם,Proper Name Masculine,Choronayim,(kho-ro-nah'-yim),"two hollows, a place in Moab",Horonaim ,"Dual of a derivative from (H2356) chowr; double cave-town; Choronajim, a place in Moab -- Horonaim. see HEBREW (H2356) chowr "
h,2774,חַרְנֶפֶר,Proper Name Masculine,Charnepher,(khar-neh'fer),an Asherite,Harnepher ,"Of uncertain derivation; Charnepher, an Israelite -- Harnepher. "
h,2775,חֶרֶס,Noun Masculine,cherec,(kheh'-res),the sun,"itch, sun ","Or (with a directive enclitic) charcah (khar'- saw}; from an unused root meaning to scrape; the itch; also (perhaps from the mediating idea of (H2777) charcuwth) the sun -- itch, sun. see HEBREW (H2777) charcuwth "
h,2776,חֶרֶס,Proper Name Location,Cheres,(kheh'-res),"a mountain East of the Jordan, also dwelling place of the Amorites",Heres ,"The same as (H2775) cherec; shining; Cheres, a mountain in Palestine -- Heres. see HEBREW (H2775) cherec "
h,2777,חַרְסוּת,Noun Feminine,charsuth,(khar-sooth'),potsherd,east ,"From (H2775) cherec (apparently in the sense of a red tile used for scraping); a potsherd, i.e. (by implication) a pottery; the name of a gate at Jerusalem -- east. see HEBREW (H2775) cherec "
h,2778,חָרַף,Verb,charaph.,(khaw-raf'),to reproach,"betroth, blaspheme, defy, rail, reproach, upbraid ","A primitive root; to pull off, i.e. (by implication) to expose (as by stripping); specifically, to betroth (as if a surrender); figuratively, to carp at, i.e. Defame; denominative (from (H2779) choreph) to spend the winter -- betroth, blaspheme, defy, jeopard, rail, reproach, upbraid. see HEBREW (H2779) choreph "
h,2779,חֹרֶף,Noun Masculine,choreph,(kho'-ref),"harvest time, autumn","cold, winter house, youth ","From (H2778) charaph.; properly, the crop gathered, i.e. (by implication) the autumn (and winter) season; figuratively, ripeness of age -- cold, winter (-house), youth. see HEBREW (H2778) charaph. "
h,2780,חָרֵף,Proper Name Masculine,Chareph,(khaw-rafe'),a leader in Judah,Hareph ,"From (H2778) charaph.; reproachful; Chareph, an Israelite -- Hareph. see HEBREW (H2778) charaph. "
h,2781,חֶרְפָּה,Noun Feminine,cherpah,(kher-paw'),a reproach,"rebuke, reproachfully, shame ","From (H2778) charaph.; contumely, disgrace, the pudenda -- rebuke, reproach(-fully), shame. see HEBREW (H2778) charaph. "
h,2782,חָרַץ,Verb,charats,(khaw-rats'),"to cut, sharpen, decide","bestir self, decide, decree, determine, maim, move ","A primitive root; properly, to point sharply, i.e. (literally) to wound; figuratively, to be alert, to decide -- bestir self, decide, decree, determine, maim, move. "
h,2783,חֲרַץ,Noun Feminine,charats,(khar-ats'),loin,loin ,(Aramaic) from a root corresponding to (H2782) charats in the sense of vigor; the loin (as the seat of strength) -- loin. see HEBREW (H2782) charats
h,2784,חַרְצֻבָּה,Noun Feminine,chartsubbah,(khar-tsoob-baw'),"bond, fetter, pang",band ,"Of uncertain derivation; a fetter; figuratively, a pain -- band. "
h,2785,חַרְצַן,Noun Masculine,chartsannim,(kchar-tsan'),"probably grape kernels, grape stones",kernel ,From (H2782) charats; a sour grape (as sharp in taste) -- kernel. see HEBREW (H2782) charats
h,2786,חָרַק,Verb,charaq,(khaw-rak'),to gnash or grind,gnash ,A primitive root; to grate the teeth -- gnash.
h,2787,חָרַר,Verb,charar,(khaw-rar'),"to be hot or scorched, to burn","be angry, burn, dry, kindle ","A primitive root; to glow, i.e. Literally (to melt, burn, dry up) or figuratively (to show or incite passion -- be angry, burn, dry, kindle. "
h,2788,חָרֵר,Noun Masculine,charer,(khaw-rare'),a parched place,parched place ,From (H2787) charar; arid -- parched place. see HEBREW (H2787) charar
