h,8446,תּוּר,Verb,tur,(toor),"to seek out, spy out, explore","Tokahath, an Israelite","A primitive root; to meander (causatively, guide) about, especially for trade or reconnoitring -- chap(-man), sent to descry, be excellent, merchant(-man), search (out), seek, (e-)spy (out). "
h,8447,תּוֹר,Noun Masculine,tor,(tore),"a plait, turn","chapman, sent to descry, be excellent, merchantman, search out, seek, espy out ","Or tor {tore}; from (H8446) tuwr; a succession, i.e. A string or (abstractly) order -- border, row, turn. see HEBREW (H8446) tuwr "
h,8448,תּוּר,Noun Feminine,tor,(tore),"border, row, turn ","border, row, turn ",Probably the same as (H8447) towr; a manner (as a sort of turn) -- estate. see HEBREW (H8447) towr
h,8449,תּוֹר,Noun Feminine,tor,(tore),turtledove,estate ,"Or tor {tore}; probably the same as (H8447) towr; a ring-dove, often (figuratively) as a term of endearment -- (turtle) dove. see HEBREW (H8447) towr "
h,8450,תּוֹר,Noun Masculine,tor,(tore),a bullock,turtle dove ,"(Aramaic) corresponding (by permutation) to (H7794) showr; a bull -- bullock, ox. see HEBREW (H7794) showr "
h,8451,תּוֹרָה,Noun Feminine,torah,(to-raw'),"direction, instruction, law","bullock, ox ","Or torah {to-raw'}; from (H3384) yarah; a precept or statute, especially the Decalogue or Pentateuch -- law. see HEBREW (H3384) yarah "
h,8452,תּוֹרָה,Noun Feminine,torah,(to-raw'),law ,law ,Probably feminine of (H8448) towr; a custom -- manner. see HEBREW (H8448) towr
h,8453,תּוֹשָׁב,Noun Masculine,toshab,(to-shawb'),a sojourner,manner ,"Or toshab (1 Kings 17:1) {to-shawb'}; from (H3427) yashab; a dweller (but not outlandish ((H5237) nokriy)); especially (as distinguished from a native citizen (active participle of (H3427) yashab) and a temporary inmate ((H1616) ger) or mere lodger ((H3885) luwn)) resident alien -- foreigner, inhabitant, sojourner, stranger. see HEBREW (H3427) yashab see HEBREW (H5237) nokriy see HEBREW (H3427) yashab see HEBREW (H1616) ger see HEBREW (H3885) luwn "
h,8454,תּוּשִׁיָּה,Noun Feminine,tushiyyah,(too-shee-yaw'),"sound, efficient wisdom, abiding success","foreigner, inhabitant, sojourner, stranger ","Or tushiyah { too-shee-yaw'}; from an unused root probably meaning to substantiate; support or (by implication) ability, i.e. (direct) help, (in purpose) an undertaking, (intellectual) understanding -- enterprise, that which (thing as it) is, substance, (sound) wisdom, working. "
h,8455,תּוֹתָח,Noun Masculine,tothach,(to-thawkh'),"(a weapon) perhaps club, mace","enterprise, that which thing as it is, substance, sound wisdom, working ",From an unused root meaning to smite; a club -- darts.
h,8456,תָּזַז,Verb,tazaz,(taw-zaz'),to strike away,darts ,A primitive root; to lop off -- cut down.
h,8457,תַּזְנוּת,Noun Feminine,taznuth,(taz-nooth'),fornication,cut down ,"Or taznuth {taz-nooth'}; from (H2181) zanah; harlotry, i.e. (figuratively) idolatry -- fornication, whoredom. see HEBREW (H2181) zanah "
h,8458,תַּחְבֻּלָה,Noun Feminine,tachbulah,(takh-boo-law'),"direction, counsel","fornication, whoredom ","Or tachbuwlah {takh-boo-law'}; from (H2254) chabal as denominative from (H2256) chebel; (only in plural) properly, steerage (as a management of ropes), i.e. (figuratively) guidance or (by implication) a plan -- good advice, (wise) counsels. see HEBREW (H2254) chabal see HEBREW (H2256) chebel "
h,8459,תֹּחוּ,Proper Name Masculine,Tochu,(to'-khoo),an ancestor of Samuel,"good advice, wise counsels ","From an unused root meaning to depress; abasement; Tochu, an Israelite -- Tohu. "
h,8460,תְּחוֹת,Preposition,techoth,(tekh-oth'),under,Tohu ,(Aramaic) or tchoth (Aramaic) {tekh-oth'}; corresponding to (H8478) tachath; beneath -- under. see HEBREW (H8478) tachath
h,8461,תַּחְכְּמֹנִי,Proper Name Masculine,Tachkemoni,(takh-kem-o-nee'),a descriptive title for one of David\'s men,under ,"Probably for (H2453) Cahkmowniy; sagacious; Tachkemoni, an Israelite -- Tachmonite. see HEBREW (H2453) Cahkmowniy "
h,8462,תְּחִלָּה,Noun Feminine,techillah,(tekh-il-law'),a beginning,Tachmonite ,"From (H2490) chalal in the sense of opening; a commencement; rel. Original (adverb, -ly) -- begin(-ning), first (time). see HEBREW (H2490) chalal "
h,8463,תַּחֲלוּא,Noun Masculine,tachalu,(takh-al-oo'),disease,"beginning, first time ","Or tachalui {takh-al-oo'}; from (H2456) chala'; a malady -- disease, X grievous, (that are) sick(-ness). see HEBREW (H2456) chala' "
h,8464,תַּחְמָס,Noun Masculine,tachmas,(takh-mawce'),male ostrich,"disease, grievous, that are sickness ","From (H2554) chamac; a species of unclean bird (from its violence), perhaps an owl -- night hawk. see HEBREW (H2554) chamac "
h,8465,תַּחַן,Proper Name Masculine,Tachan,(takh'-an),an Ephraimite,night hawk ,"Probably from (H2583) chanah; station; Tachan, the name of two Israelites -- Tahan. see HEBREW (H2583) chanah "
h,8466,תַּחֲנָה,Noun Feminine,tachanah,(takh-an-aw'),"an encamping, encampment",Tahan ,From (H2583) chanah; (only plural collectively) an encampment -- camp. see HEBREW (H2583) chanah
h,8467,תְּחִנָּה,Noun Feminine,techinnah,(tekh-in-naw'),"favor, supplication for favor",camp ,"From (H2603) chanan; graciousness; causatively, entreaty -- favour, grace, supplication. see HEBREW (H2603) chanan "
h,8468,תְּחִנָּה,Proper Name Masculine,Techinnah,(tekh-in-naw'),"favor, a descendant of Judah","favor, grace, supplication ","The same as (H8467) tchinnah; Techinnah, an Israelite -- Tehinnah. see HEBREW (H8467) tchinnah "
h,8469,תַּחֲנוּן,Noun Masculine,tachanun,(takh-an-oon'),supplication for favor,Tehinnah ,"Or (feminine) tachanuwnah {takh-an-oo-naw'}; from (H2603) chanan; earnest prayer -- intreaty, supplication. see HEBREW (H2603) chanan "
h,8470,תַּחֲנִי,Adjective,Tachani,(takh-an-ee'),descendant of Tahan,"entreaty, supplication ",Patronymically from (H8465) Tachan; a Tachanite (collectively) or descendants of Tachan -- Tahanites. see HEBREW (H8465) Tachan
h,8471,תַּחְפַנְחֵס,Proper Name Location,Tachpanches or Techaphneches,(takh-pan-khace'),a city in Egypt,Tahanites ,"Or Tchaphnchec (Ezek. 30:18) {tekh- af-nekh-ace'}; or Tachpnec (Jeremiah 2:16) {takh-pen-ace'}; of Egyptian derivation; Tachpanches, Techaphneches or Tachpenes, a place in Egypt -- Tahapanes, Tahpanhes, Tehaphnehes. "
h,8472,תַּחְפְנֵיס,Proper Name Feminine,Tachpenes,(takh-pen-ace'),an Eg. queen,"Tahapanes, Tahpanhes, Tehaphnehes ","Of Egyptian derivation; Tachpenes, an Egyptian woman -- Tahpenes. "
h,8473,תַּחֲרָא,Noun Masculine,tachra,(takh-ar-aw'),a corselet,Tahpenes ,From (H2734) charah in the original sense of (H2352) chuwr or (H2353) chuwr; a linen corslet (as white or hollow) -- habergeon. see HEBREW (H2734) charah see HEBREW (H2352) chuwr see HEBREW (H2353) chuwr
h,8474,תַּחָרָה,Verb,tacharah,(takh-aw-raw'),habergeon ,habergeon ,"A facitious root from (H2734) charah through the idea of the heat of jealousy; to vie with a rival -- close, contend. see HEBREW (H2734) charah "
h,8475,תַּחְרֵעַ,Proper Name Masculine,Tacharea,(takh-ray'-ah),a descendant of Saul,"close, contend ","For (H8390) Ta'area'; Tachrea, an Israelite -- Tahrea. see HEBREW (H8390) Ta'area' "
h,8476,תַּחַשׁ,Noun Masculine,tachash,(takh'-ash),perhaps porpoise (a kind of leather or skin),Tahrea ,"Probably of foreign derivation; a (clean) animal with fur, probably a species of antelope -- badger. "
h,8477,תַּחַשׁ,Proper Name Masculine,Tachash,(takh'-ash),a son of Nahor,badger ,"The same as (H8476) tachash; Tachash, a relative of Abraham -- Thahash. see HEBREW (H8476) tachash "
h,8478,תַּחַת,Noun Masculine,tachath,(takh'-ath),"underneath, below, instead of",Thahash ,"From the same as (H8430) Towach; the bottom (as depressed); only adverbially, below (often with prepositional prefix underneath), in lieu of, etc. -- as, beneath, X flat, in(-stead), (same) place (where...is), room, for...sake, stead of, under, X unto, X when...was mine, whereas, (where-)fore, with. see HEBREW (H8430) Towach "
h,8479,תַּחַת,Preposition,tachath,(takh'-ath),"in lieu of, as, beneath, flat, instead, same place where ","in lieu of, as, beneath, flat, instead, same place where ",(Aramaic) corresponding to (H8478) tachath -- under. see HEBREW (H8478) tachath
h,8480,תַּחַת,proper name; masculine a.; location,Tachath,(takh'-ath),"a place in the desert, also two Israelites",under ,"The same as (H8478) tachath; Tachath, the name of a place in the Desert, also of three Israelites -- Tahath. see HEBREW (H8478) tachath "
h,8481,תַּחְתּוֹן,Adjective,tachton,(takh-tone'),"lower, lowest",Tahath ,"Or tachton {takh-tone'}; from (H8478) tachath; bottommost -- lower(-est), nether(-most). see HEBREW (H8478) tachath "
h,8482,תַּחְתִּי,Adjective,tachti,(takh-tee'),"lower, lowest","lowest, nethermost ","From (H8478) tachath; lowermost; as noun (feminine plural) the depths (figuratively, a pit, the womb) -- low (parts, -er, -er parts, - est), nether (part). see HEBREW (H8478) tachath "
h,8483,תַּחְתִּים חָדְשִׁי,Proper Name Location,Tachtim Chodshi,(takh-teem' khod-shee'),a place visited by Joab,low parts nether part ,"Apparently from the plural masculine of (H8482) tachtiy or (H8478) tachath and (H2320) chodesh; lower (ones) monthly; Tachtim-Chodshi, a place in Palestine -- Tahtim-hodshi. see HEBREW (H8482) tachtiy see HEBREW (H8478) tachath see HEBREW (H2320) chodesh "
h,8484,תִּיכוֹן,Adjective,tikon,(tee-kone'),middle,"middlemost, midst ","Or tiykon {tee-kone'}; from (H8432) tavek; central -- middle(-most), midst. see HEBREW (H8432) tavek "
h,8485,תֵּימָא,"proper name, of a territory or people",Tema,(tay-maw'),"a son of Ishmael, also his desc. and the region settled by them",Tema ,"Or Temao {tay-maw'}; probably of foreign derivation; Tema, a son of Ishmael, and the region settled by him -- Tema. "
h,8486,תֵּימָן,Noun Feminine,teman,(tay-mawn'),"south, south wind","south side, ","Or teman {tay-mawn'}; denominative from (H3225) yamiyn; the south (as being on the right hand of a person facing the east) -- south (side, -ward, wind). see HEBREW (H3225) yamiyn "
h,8487,תֵּימָן,proper name; masculine,Teman,(tay-mawn'),"a N. district of Edom, also an Edomite chief","south, Teman ","Or Teman {tay-mawn'}; the same as (H8486) teyman; Teman, the name of two Edomites, and of the region and descendant of one of them -- south, Teman. see HEBREW (H8486) teyman "
h,8488,תֵּימְנִי,Proper Name Masculine,Temeni,(tay-men-ee'),a man of Judah,Temeni ,"Probably for (H8489) Teymaniy; Temeni, an Israelite -- Temeni. see HEBREW (H8489) Teymaniy "
h,8489,תֵּימָנִי,Proper Name Masculine,Temani,(tay-maw-nee'),inhab. of Teman,"Temani, Temanite ","Patronymically from (H8487) Teyman; a Temanite or descendant of Teman -- Temani, Temanite. see HEBREW (H8487) Teyman "
h,8490,תִּימָרָה,Noun Feminine,timarah,(tee-maw-raw'),(palm-like) column,pillar ,"Or timarah {tee-maw-raw'}; from the same as (H8558) tamar; a column, i.e. Cloud -- pillar. see HEBREW (H8558) tamar "
h,8491,תִּיצִי,"adjective, of a people",Titsi,(tee-tsee'),descriptive title of one of David\'s heroes,Tizite ,Patrial or patronymically from an unused noun of uncertain meaning; a Titsite or descendant or inhabitant of an unknown Tits -- Tizite.
h,8492,תִּירוֹשׁ,Noun Masculine,tirosh,(tee-roshe'),"must, fresh or new wine","new, sweet wine ","Or tiyrosh {tee-roshe'}; from (H3423) yarash in the sense of expulsion; must or fresh grape-juice (as just squeezed out); by implication (rarely) fermented wine -- (new, sweet) wine. see HEBREW (H3423) yarash "
h,8493,תִּירְיָא,Proper Name Masculine,Tireya,(tee-reh-yaw'),a man of Judah,Tiria ,"Probably from (H3372) yare'; fearful, Tirja, an Israelite -- Tiria. see HEBREW (H3372) yare' "
h,8494,תִּירָס,Proper Name Masculine,Tiras,(tee-rawce'),a son of Japheth and his desc,"Tiras, a son of Japheth","Probably of foreign derivation; Tiras, a son of Japheth -- Tiras. "
h,8495,תַּיִשׁ,Noun Masculine,tayish,(tah'-yeesh),male goat,he-goat,From an unused root meaning to butt; a buck or he-goat (as given to butting) -- he goat.
h,8496,תֹּךְ,Noun Masculine,tok,(toke),"injury, oppression","deceit, fraud ","Or towk (Psa. 72:14) {toke}; from the same base as (H8432) tavek (in the sense of cutting to pieces); oppression -- deceit, fraud. see HEBREW (H8432) tavek "
h,8497,תָּכָה,Verb,takah,(taw-kaw'),perhaps to follow,sit down ,"A primitive root; to strew, i.e. Encamp -- sit down. "
h,8498,תְּכוּנָה,Noun Feminine,tekunah,(tek-oo-naw'),"fashion, store ","fashion, store ","Feminine passive participle of (H8505) takan; adjustment, i.e. Structure; by implication, equipage -- fashion, store. see HEBREW (H8505) takan "
h,8499,תְּכוּנָה,Noun,tekunah,(tek-oo-naw'),"arrangement, preparation, fixed place",seat ,"From (H3559) kuwn; or probably ident. With (H8498) tkuwnah; something arranged or fixed, i.e. A place -- seat. see HEBREW (H3559) kuwn see HEBREW (H8498) tkuwnah "
h,8500,תֻּכִּי,Noun Masculine,tukkiyyim,(took-kee'),peacocks,peacock ,"Or tuwkkiy {took-kee'}; probably of foreign derivation; some imported creature, probably a peacock -- peacock. "
h,8501,תָּכָךְ,Noun Masculine,takak,(taw-kawk'),deceitful ,deceitful ,"From an unused root meaning to dissever, i.e. Crush -- deceitful. "
h,8502,תִּכְלָה,Noun Feminine,tiklah,(tik-law'),"completeness, perfection",perfection ,From (H3615) kalah; completeness -- perfection. see HEBREW (H3615) kalah
h,8503,תַּכְלִית,Noun Feminine,taklith,(tak-leeth'),"end, completeness","end, perfection ","From (H3615) kalah; completion; by implication, an extremity -- end, perfect(-ion). see HEBREW (H3615) kalah "
h,8504,תְּכֵלֶת,Noun Feminine,tekeleth,(tek-ay'-leth),"violet, violet thread",blue ,"Probably for (H7827) shcheleth; the cerulean mussel, i.e. The color (violet) obtained therefrom or stuff dyed therewith -- blue. see HEBREW (H7827) shcheleth "
h,8505,תָּכַן,Verb,takan,(taw-kan'),"to regulate, measure, estimate","bear up, direct, be unequal, mete, ponder, tell, weigh ","A primitive root; to balance, i.e. Measure out (by weight or dimension); figuratively, arrange, equalize, through the idea of levelling (ment. Estimate, test) -- bear up, direct, be ((un-))equal, mete, ponder, tell, weigh. "
h,8506,תֹּכֶן,Noun Masculine,token,(to'-ken),a measurement,"measure, tale ","From (H8505) takan; a fixed quantity -- measure, tale. see HEBREW (H8505) takan "
h,8507,תֹּכֶן,Proper Name Location,Token,(to'-ken),"measurement, a city in Simeon",Tochen ,"The same as (H8506) token; Token, a place in Palestine -- Tochen. see HEBREW (H8506) token "
h,8508,תָּכְנִית,Noun Feminine,toknith,(tok-neeth'),"measurement, proportion","pattern, sum ","From (H8506) token; admeasurement, i.e. Consummation -- pattern, sum. see HEBREW (H8506) token "
h,8509,תַּכְרִיךְ,Noun Masculine,takrik,(tak-reek'),a robe,garment ,Apparently from an unused root meaning to encompass; a wrapper or robe -- garment.
h,8510,תֵּל,Noun Masculine,tel,(tale),a mound,"heap, strength ","By contraction from (H8524) talal; a mound -- heap, X strength. see HEBREW (H8524) talal "
h,8511,תָּלָא,Verb,tala,(taw-law'),to hang,"be bent, hang in doubt ","A primitive root; to suspend; figuratively (through hesitation) to be uncertain; by implication (of mental dependence) to habituate -- be bent, hang (in doubt). "
h,8512,תֵּל אָבִיב,Proper Name Location,Tel Abib,(tale aw-beeb'),"hill of grain, a place in Babylon",Tel-abib ,"From (H8510) tel and (H24) 'abiyb; mound of green growth; Tel-Abib, a place in Chaldaea -- Tel-abib. see HEBREW (H8510) tel see HEBREW (H24) 'abiyb "
h,8513,תְּלָאָה,Noun Feminine,telaah,(tel-aw-aw'),"weariness, hardship","travail, travel, trouble ","From (H3811) la'ah; distress -- travail, travel, trouble. see HEBREW (H3811) la'ah "
h,8514,תַּלְאוּבָה,Noun Feminine,talubah,(tal-oo-baw'),drought,great drought ,From (H3851) lahab; desiccation -- great drought. see HEBREW (H3851) lahab
h,8515,תְּלַאשַּׂר,Proper Name Location,Telassar,(tel-as-sar'),a city in Mesopotamia,Telassar ,"Or Tlassar {tel-as-sar'}; of foreign derivation; Telassar, a region of Assyria -- Telassar. "
h,8516,תַּלְבּשֶׁת,Noun Feminine,tilbosheth,(tal-bo'-sheth),raiment,clothing ,From (H3847) labash; a garment -- clothing. see HEBREW (H3847) labash
h,8517,תְּלַג,Noun Masculine,telag,(tel-ag'),snow,snow ,(Aramaic) corresponding to (H7950) sheleg; snow -- snow. see HEBREW (H7950) sheleg
h,8518,תָּלָה,Verb,talah,(taw-law'),to hang,hang up ,A primitive root; to suspend (especially to gibbet) -- hang (up).
h,8519,תְּלוּנָה,Noun Feminine,tluwnah,(tel-oo-naw'),"exalted, lofty",murmuring ,Or tlunnah {tel-oon-naw'}; from (H3885) luwn in the sense of obstinacy; a grumbling -- murmuring. see HEBREW (H3885) luwn
h,8520,תֶּלַח,Proper Name Masculine,Telach,(teh'-lakh),an Ephraimite,Telah ,"Probably from an unused root meaning to dissever; breach; Telach, an Israelite -- Telah. "
h,8521,תֵּל חַרְשָׁא,Proper Name Location,Tel Charsha,(tale khar-shaw'),"mound of a craftsman, a city in Babylon","Tel-haresha, Tel-harsa ","From (H8510) tel and the feminine of (H2798) Charashiym; mound of workmanship; Tel-Charsha, a place in Babylonia -- Tel-haresha, Tel-harsa. see HEBREW (H8510) tel see HEBREW (H2798) Charashiym "
h,8522,תְּלִי,Noun Masculine,teli,(tel-ee'),a quiver (with its arrows),quiver ,Probably from (H8518) talah; a quiver (as slung) -- quiver. see HEBREW (H8518) talah
h,8523,תְּלִיתַי,Adjective,telithay,(tel-ee-thah'-ee),third,third ,(Aramaic) or taltiy (Aramaic) {tal-tee'}; ordinal from (H8532) tlath; third -- third. see HEBREW (H8532) tlath
h,8524,תָּלַל,Verb,talal,(taw-lal'),"to mock, deceive, trifle with",eminent ,"A primitive root; to pile up, i.e. Elevate -- eminent. Compare (H2048) hathal. see HEBREW (H2048) hathal "
h,8525,תֶּלֶם,Noun Masculine,telem,(teh'-lem),a furrow,"furrow, ridge ","From an unused root meaning to accumulate; a bank or terrace -- furrow, ridge. "
h,8526,תַּלִמַי,Proper Name Masculine,Talmay,(tal-mah'-ee),"plowman, a father-in-law of David, also a descendant of Anak",Talmai ,"From (H8525) telem; ridged; Talmai, the name of a Canaanite and a Syrian -- Talmai. see HEBREW (H8525) telem "
h,8527,תַּלְמִיד,Noun Masculine,talmid,(tal-meed'),a scholar,scholar ,From (H3925) lamad; a pupil -- scholar. see HEBREW (H3925) lamad
h,8528,תֵּל מֶלַח,Proper Name Location,Tel Melach,(tale meh'-lakh),"mound of salt, a place in Babylon",Tel-melah ,"From (H8510) tel and (H4417) melach; mound of salt; Tel-Melach, a place in Babylonia -- Tel-melah. see HEBREW (H8510) tel see HEBREW (H4417) melach "
h,8529,תָּלַע,Verb,tala,(taw-law'),to clothe in scarlet,scarlet ,"A denominative from (H8438) towla'; to crimson, i.e. Dye that color -- X scarlet. see HEBREW (H8438) towla' "
h,8530,תַּלְפִיָּה,Noun Feminine,talpiyyoth,(tal-pee-yaw'),perhaps weapons,armory ,"Feminine from an unused root meaning to tower; something tall, i.e. (plural collective) slenderness -- armoury. "
h,8531,תְּלַת,Noun Masculine,telath,(tel-ath'),a third part,third ,(Aramaic) from (H8532) tlath; a tertiary rank -- third. see HEBREW (H8532) tlath
h,8532,תְּלָת,Noun,telath or telathah,(tel-awth'),three,"third, three ","(Aramaic) masculine tlathah (Aramaic) {tel-aw-thaw'}; or tlatha (Aramaic) {tel-aw-thaw'}; corresponding to (H7969) shalowsh; three or third -- third, three. see HEBREW (H7969) shalowsh "
h,8533,תְּלָתִין,Noun,tlathiyn,(tel-aw-theen'),third,thirty ,(Aramaic) mult. Of (H8532) tlath; ten times three -- thirty. see HEBREW (H8532) tlath
h,8534,תַּלְתַּל,Noun Feminine,taltallim,(tal-tal'),perhaps locks (of hair),bushy ,"By reduplication, from (H8524) talal through the idea of vibration; a trailing bough (as pendulous) -- bushy. see HEBREW (H8524) talal "
h,8535,תָּם,Adjective,tam,(tawm),complete,"coupled together, perfect, plain, undefiled, upright ","From (H8552) tamam; complete; usually (morally) pious; specifically, gentle, dear -- coupled together, perfect, plain, undefiled, upright. see HEBREW (H8552) tamam "
h,8536,תָּם,Adverb,tam or tammah,(tawm),there,"thence, there, where ","(Aramaic) corresponding to (H8033) sham; there -- X thence, there, X where. see HEBREW (H8033) sham "
h,8537,תֹּם,Noun Masculine,tom,(tome),"completeness, integrity, also part of the high priest\'s breastplate","full, integrity, perfection, simplicity, uprightly at a venture ","From (H8552) tamam; completeness; figuratively, prosperity; usually (morally) innocence -- full, integrity, perfect(-ion), simplicity, upright(-ly, -ness), at a venture. See (H8550) Tummiym. see HEBREW (H8552) tamam see HEBREW (H8550) Tummiym "
h,8538,תֻּמָּה,Noun Feminine,tummah,(toom-maw'),integrity,integrity ,Feminine of (H8537) tom; innocence -- integrity. see HEBREW (H8537) tom
h,8539,תָּמַהּ,Verb,tamah,(taw-mah'),to be astounded or dumbfounded,"be amazed, be astonished, marvelously, wonder ","A primitive root; to be in consternation -- be amazed, be astonished, marvel(-lously), wonder. "
h,8540,תְּמַהּ,Noun Masculine,temah,(tem-ah'),a wonder,wonder ,(Aramaic) from a root corresponding to (H8539) tamahh; a miracle -- wonder. see HEBREW (H8539) tamahh
h,8541,תִּמָּהוֹן,Noun Masculine,timmahon,(tim-maw-hone'),bewilderment,astonishment ,From (H8539) tamahh; consternation -- astonishment. see HEBREW (H8539) tamahh
h,8542,תַּמּוּז,Proper Name,Tammuz,(tam-mooz'),a Bab. god,Tammuz ,"Of uncertain derivation; Tammuz, a Phoenician deity -- Tammuz. "
h,8543,תְּמוֹל,Adverb,temol,(tem-ole'),"yesterday, recently, formerly","before time, these three days, heretofore, time past, yesterday ","Or tmol {tem-ole'}; probably for (H865) 'ethmowl; properly, ago, i.e. A (short or long) time since; especially yesterday, or (with (H8032) shilshowm) day before yesterday -- + before (-time), + these (three) days, + heretofore, + time past, yesterday. see HEBREW (H865) 'ethmowl see HEBREW (H8032) shilshowm "
h,8544,תִּמוּנָה,Noun Feminine,temunah,(tem-oo-naw'),"likeness, form","image, likeness, similitude ","Or tmunah {tem-oo-naw'}; from (H4327) miyn; something portioned (i.e. Fashioned) out, as a shape, i.e. (indefinitely) phantom, or (specifically) embodiment, or (figuratively) manifestation (of favor) -- image, likeness, similitude. see HEBREW (H4327) miyn "
h,8545,תְּמוּרָה,Noun Feminine,temurah,(tem-oo-raw'),"exchange, recompense","exchanging, recompense, restitution ","From (H4171) muwr; barter, compensation -- (ex-)change(-ing), recompense, restitution. see HEBREW (H4171) muwr "
h,8546,תִּמוּתָה,Noun Feminine,timuthah,(tem-oo-thaw'),death,"death, die ","From (H4191) muwth; execution (as a doom) -- death, die. see HEBREW (H4191) muwth "
h,8547,תֶּמַח,Proper Name Masculine,Tamach,(teh'-makh),head of a postexilic family,"Tamah, Thamah ","Of uncertain derivation; Temach, one of the Nethinim -- Tamah, Thamah. "
h,8548,תָּמִיד,Noun Masculine,tamid,(taw-meed'),continuity,"always, continual employment daily, nevermore, perpetual ","From an unused root meaning to stretch; properly, continuance (as indefinite extension); but used only (attributively as adjective) constant (or adverbially, constantly); ellipt. The regular (daily) sacrifice -- alway(-s), continual (employment, -ly), daily, ((n-))ever(-more), perpetual. "
h,8549,תָּמִים,Adjective,tamim,(taw-meem'),"complete, sound","without blemish, complete, full, perfect, sincerely ity, sound, without spot, undefiled, ","From (H8552) tamam; entire (literally, figuratively or morally); also (as noun) integrity, truth -- without blemish, complete, full, perfect, sincerely (-ity), sound, without spot, undefiled, upright(-ly), whole. see HEBREW (H8552) tamam "
h,8550,תֻּמִים,Proper Name Masculine,Tummim,(toom-meem'),Thummim ,Thummim ,"Plural of (H8537) tom; perfections, i.e. (techn.) One of the epithets of the objects in the high-priest's breastplate as an emblem of complete Truth -- Thummim. see HEBREW (H8537) tom "
h,8551,תָּמַךְ,Verb,tamak,(taw-mak'),"to grasp, support, attain","take, uphold up, maintain, retain, stay up ","A primitive root; to sustain; by implication, to obtain, keep fast; figuratively, to help, follow close -- (take, up-)hold (up), maintain, retain, stay (up). "
h,8552,תָּמַם,Verb,tamam,(taw-mam'),to be complete or finished,"accomplish, cease, be clean passed, consume, have done, come to an end","A primitive root; to complete, in a good or a bad sense, literal, or figurative, transitive or intransitive (as follows) -- accomplish, cease, be clean (pass-)ed, consume, have done, (come to an, have an, make an) end, fail, come to the full, be all gone, X be all here, be (make) perfect, be spent, sum, be (shew self) upright, be wasted, whole. "
h,8553,תִּמְנָה,Proper Name Location,Timnah,(tim-naw'),"territory, two cities in Judah","Timnah, Timnath, Thimnathah ","From (H4487) manah; a portion assigned; Timnah, the name of two places in Palestine -- Timnah, Timnath, Thimnathah. see HEBREW (H4487) manah "
h,8554,תִּמְנִי,Adjective,Timni,(tim-nee'),inhab. of Timnah,Timnite ,Patrial from (H8553) Timnah; a Timnite or inhabitant of Timnah -- Timnite. see HEBREW (H8553) Timnah
