h,2002,הַמְנִיךְ,Noun Masculine,hamnika,(ham-neek'),"a chain, necklace",chain ,(Aramaic) but the text is hamuwnek {ham-oo-nayk'}; of foreign origin; a necklace -- chain.
h,2003,הָמָס,Noun Masculine,hemes,(haw-mawce'),brushwood,melting ,From an unused root apparently meaning to crackle; a dry twig or brushwood -- melting.
h,2004,הֵן,pronoun plural feminine,hen,(hane),they,"in, such like, with them, thereby, therein, more than they, wherein, in which, ","Feminine plural from (H1931) huw'; they (only used when emphatic) -- X in, such like, (with) them, thereby, therein, (more than) they, wherein, in which, whom, withal. see HEBREW (H1931) huw' "
h,2005,הֵן,demonstrative adverb; interjection; hypothetical particle; conjunction,hen,(hane),lo! behold!,"behold, if, lo, though ","A primitive particle; lo!; also (as expressing surprise) if -- behold, if, lo, though. "
h,2006,הֵן,Interjection,hen,(hane),"if, whether","that if, or, whether ","(Aramaic) corresponding to (H2005) hen: lo! Also there(-fore), (un-)less, whether, but, if -- (that) if, or, whether. see HEBREW (H2005) hen "
h,2007,הֵנָּה,pronoun plural feminine,hennah,(hane'-naw),they,"in, such and such things, their, into them, thence, therein, these, they had, ","Prolongation for (H2004) hen; themselves (often used emphatic for the copula, also in indirect relation) -- X in, X such (and such things), their, (into) them, thence, therein, these, they (had), on this side, whose, wherein. see HEBREW (H2004) hen "
h,2008,הֵנָּה,Adverb,hennah,(hane'-naw),hither,"here, hitherto, now, on this that side, since, this that way, thitherward, thus far, ","From (H2004) hen; hither or thither (but used both of place and time) -- here, hither(-to), now, on this (that) side, + since, this (that) way, thitherward, + thus far, to...fro, + yet. see HEBREW (H2004) hen "
h,2009,הִנֵּה,demonstrative particle,hinneh,(hin-nay'),lo! behold!,"behold, lo, see ","Prolongation for (H2005) hen; lo! -- behold, lo, see. see HEBREW (H2005) hen "
h,2010,הֲנָחָה,Noun Feminine,hanachah,(han-aw-khaw'),a giving of rest,release ,"From (H5117) nuwach; permission of rest, i.e. Quiet -- release. see HEBREW (H5117) nuwach "
h,2011,הִנֹּם,Proper Name Location,Hinnom,(hin-nome'),a valley Southwest of Jer,Hinnom ,"Probably of foreign origin; Hinnom, apparently a Jebusite -- Hinnom. "
h,2012,הֵנַע,Noun Masculine Location,Hena,(hay-nah'),a city in Aram (Syria) or Mesopotamia,Hena ,"Probably of foreign derivation; Hena, a place apparently in Mesopotamia -- Hena. "
h,2013,הָסָה,Verb,has,(haw-saw'),hush! keep silence!,"hold peace tongue, keep silence, be silent, still ","A primitive root; to hush -- hold peace (tongue), (keep) silence, be silent, still. "
h,2014,הֲפֻגָה,Noun Feminine,haphugah,(haf-oo-gaw'),"benumbing, cessation",intermission ,From (H6313) puwg; relaxation -- intermission. see HEBREW (H6313) puwg
h,2015,הָפַךְ,Verb,haphak,(haw-fak'),"to turn, overturn","become, change, come, be converted, give, make a bed, overthrow turn, perverse, ","A primitive root; to turn about or over; by implication, to change, overturn, return, pervert -- X become, change, come, be converted, give, make (a bed), overthrow (-turn), perverse, retire, tumble, turn (again, aside, back, to the contrary, every way). "
h,2016,הֶפֶךְ,Noun Masculine,hephek,(heh'-fek),"the contrary, contrariness, perversity",contrary ,": or hephek {hay'-fek}; from (H2015) haphak; a turn, i.e. The reverse -- contrary. see HEBREW (H2015) haphak "
h,2017,הֹפֶךְ,Noun Masculine,hophek,(ho'-fek),"perversity, turning of things upside down ","perversity, turning of things upside down ","From (H2015) haphak; an upset, i.e. (abstract) perversity -- turning of things upside down. see HEBREW (H2015) haphak "
h,2018,הֲפֵכָה,Noun Feminine,haphekah,(haf-ay-kaw'),an overthrow,overthrow ,Feminine of (H2016) hephek; destruction -- overthrow. see HEBREW (H2016) hephek
h,2019,הֲפַכְפַךְ,Adjective,haphakpak,(haf-ak-pak'),crooked,froward ,By reduplication from (H2015) haphak; very perverse -- froward. see HEBREW (H2015) haphak
h,2020,הַצָּלָה,Noun Feminine,hatstsalah,(hats-tsaw-law'),deliverance,deliverance ,From (H5337) natsal; rescue -- deliverance. see HEBREW (H5337) natsal
h,2021,הֹצֶן,Noun Masculine,hotsen,(ho'-tsen),perhaps a weapon (of war),chariot ,From an unused root meaning apparently to be sharp or strong; a weapon of war -- chariot.
h,2022,הַר,Noun Masculine,har,(har),"mountain, hill, hill country","hill country, mountain, promotion ","A shortened form of (H2042) harar; a mountain or range of hills (sometimes used figuratively) -- hill (country), mount(-ain), X promotion. see HEBREW (H2042) harar "
h,2023,הֹר,Proper Name Location,Hor,(hore),two mountains in Palestine,Hor ,"Another form of (H2022) har; mountain; Hor, the name of a peak in Idumaea and of one in Syria -- Hor. see HEBREW (H2022) har "
h,2024,הָרָא,Proper Name Location,Hara,(haw-raw'),a region of N. Mesopotamia,Hara ,"Perhaps from (H2022) har; mountainousness; Hara, a region of Media -- Hara. see HEBREW (H2022) har "
h,2025,הַרְאֵל,Noun Masculine,harel,(har-ale'),altar ,altar ,"From (H2022) har and (H410) 'el; mount of God; figuratively, the altar of burnt-offering -- altar. Compare (H739) 'ariy'el. see HEBREW (H2022) har see HEBREW (H410) 'el see HEBREW (H739) 'ariy'el "
h,2026,הָרַג,Verb,harag,(haw-rag'),"to kill, slay","destroy, out of hand, kill, murderer, put to death, make slaughter, slayer, surely","A primitive root; to smite with deadly intent -- destroy, out of hand, kill, murder(-er), put to (death), make (slaughter), slay(-er), X surely. "
h,2027,הֶרֶג,Noun Masculine,hereg,(heh'-reg),a slaughter,"be slain, slaughter ","From (H2026) harag; slaughter -- be slain, slaughter. see HEBREW (H2026) harag "
h,2028,הֲרֵגָה,Noun Feminine,haregah,(har-ay-gaw'),a slaughter,slaughter ,Feminine of (H2027) hereg; slaughter -- slaughter. see HEBREW (H2027) hereg
h,2029,הָרָה,Verb,harah,(haw-raw'),"to conceive, become pregnant","been, be with child, conceive, progenitor ","A primitive root; to be (or become) pregnant, conceive (literally or figuratively) -- been, be with child, conceive, progenitor. "
h,2030,הָרֶה,Noun Feminine,harah,(haw-reh'),pregnant,"woman with child, conceive, great ","Or hariy (Hosea 14:1) {haw-ree'}; from (H2029) harah; pregnant -- (be, woman) with child, conceive, X great. see HEBREW (H2029) harah "
h,2031,הַרְהֹר,Noun Masculine,harhor,(har-hor'),"fancy, imagining",thought ,(Aramaic) from a root corresponding to (H2029) harah; a mental conception -- thought. see HEBREW (H2029) harah
h,2032,הֵרוֹן,Noun Masculine,heron or herayon,(hay-rone'),"conception, pregnancy",conception ,Or herayown {hay-raw-yone'}; from (H2029) harah; pregnancy -- conception. see HEBREW (H2029) harah
h,2033,הֲרוֹרִי,Proper Name Location,Harori,(har-o-ree'),an inhabitant of Harod,Harorite ,Another form for (H2043) Harariy; a Harorite or mountaineer -- Harorite. see HEBREW (H2043) Harariy
h,2034,הֲרִיסָה,Noun Feminine,hariycah,(har-ee-saw'),pregnant,ruin ,From (H2040) harac; something demolished -- ruin. see HEBREW (H2040) harac
h,2035,הֲרִיסוּת,Noun Feminine,harisuth,(har-ee-sooth'),"an overthrow, destruction, ruin",destruction ,From (H2040) harac; demolition -- destruction. see HEBREW (H2040) harac
h,2036,הֹרָם,Proper Name Masculine,Horam,(ho-rawm'),a Canaanite king,Horam ,"From an unused root (meaning to tower up); high; Horam, a Canaanitish king -- Horam. "
h,2037,הָרֻם,Proper Name Masculine,Harum,(haw-room'),a descendant of Judah,Harum ,"Passive participle of the same as (H2036) Horam; high; Harum, an Israelite -- Harum. see HEBREW (H2036) Horam "
h,2038,הַרְמוֹן,Proper Name Location,Harmon,(har-mone'),a place name,palace ,From the same as (H2036) Horam; a castle (from its height) -- palace. see HEBREW (H2036) Horam
h,2039,הָרָן,"proper name, masculine; proper name, of a location",Haran,(haw-rawn'),"mountaineer, a brother of Abram, also an Israelite",Haran ,"Perhaps from (H2022) har; mountaineer; Haran, the name of two men -- Haran. see HEBREW (H2022) har "
h,2040,הָרַס,Verb,haras,(haw-ras'),"to throw down, break or tear down","beat down, break down, through, destroy, overthrow, pluck down, pull down, ruin, ","A primitive root; to pull down or in pieces, break, &? Destroy -- beat down, break (down, through), destroy, overthrow, pluck down, pull down, ruin, throw down, X utterly. "
h,2041,הֶרֶס,noun masculine,heres,(heh'-res),"an overthrow, destruction",destruction ,From (H2040) harac; demolition -- destruction. see HEBREW (H2040) harac
h,2042,הרָר,Noun Masculine,harar,(haw-rawr'),"hill, mountain ","hill, mountain ","From an unused root meaning to loom up; a mountain -- hill, mount(-ain). "
h,2043,הֲרָרִי,"Adjective; proper name, of a location",Harari,(hah-raw-ree'),"mountain dweller, descriptive of two of David\'s heroes",Hararite ,"Or Harariy (2 Sam. 23:11) {haw-raw-ree'}; or Haarariy (2 Sam. 23:34, last clause), {haw-raw-ree'}; apparently from (H2042) harar; a mountaineer -- Hararite. see HEBREW (H2042) harar "
h,2044,הָשֵׁם,Proper Name Masculine,Hashem,(haw-shame'),father of one of David\'s heroes,Hashem ,"Perhaps from the same as (H2828) Chashum; wealthy; Hashem, an Israelite -- Hashem. see HEBREW (H2828) Chashum "
h,2045,הַשְׁמָעוּת,Noun Feminine,hashmauth,(hashmaw-ooth'),a causing to hear,to cause to hear ,From (H8085) shama'; announcement -- to cause to hear. see HEBREW (H8085) shama'
h,2046,הִתּוּךְ,Noun Masculine,hittuk,(hit-took'),a melting,is melted ,From (H5413) nathak; a melting -- is melted. see HEBREW (H5413) nathak
h,2047,הֲתָךְ,Proper Name Masculine,Hathak,(hath-awk'),a person official,Hatach ,"Probably of foreign origin; Hathak, a Persian eunuch -- Hatach. "
h,2048,הָתַל,Verb,hathal,(haw-thal'),"to deceive, mock","deal deceitfully, deceive, mock ","A primitive root; to deride; by implication, to cheat -- deal deceitfully, deceive, mock. "
h,2049,הָתֹל,Noun Masculine,hathulim,(haw-thole'),mockery,mocker ,From (H2048) hathal (only in plural collectively); a derision -- mocker. see HEBREW (H2048) hathal
h,2050,הָתַת,Verb,hathath,(haw-thath'),imagine mischief ,imagine mischief ,"A primitive root; properly, to break in upon, i.e. To assail -- imagine mischief. "
h,2051,רְדָן,Proper Name Location,Vedan,(ved-awn'),a place of unknown location,Dan also ,"Perhaps for (H5730) eden; Vedan (or Aden), a place in Arabia -- Dan also. see HEBREW (H5730) eden "
h,2052,וָהֵב,Proper Name Location,Vaheb,(vaw-habe'),perhaps a place in Moab,what he did ,"Of uncertain derivation; Vaheb, a place in Moab -- what he did. "
h,2053,וָו,Noun Masculine,vav,(vaw),"a hook, pin, peg",hook ,Probably a hook (the name of the sixth Heb. Letter) -- hook.
h,2054,וָזָר,Noun Masculine,vazar,(vaw-zawr'),"criminal, guilty",strange ,Presumed to be from an unused root meaning to bear guilt; crime -- X strange.
h,2055,וַיְזָתָא,Proper Name Masculine,Vayzatha,(vah-yez-aw'-thaw),a son of Haman,Vajezatha ,"Of foreign origin; Vajezatha, a son of Haman -- Vajezatha. "
h,2056,וָלָד,Noun Masculine,valad,(vaw-lawd'),"offspring, child",child ,For (H3206) yeled; a boy -- child. see HEBREW (H3206) yeled
h,2057,וַנְיָה,Proper Name Masculine,Vanyah,(van-yaw'),an Israelite,Vaniah ,"Perhaps for (H6043) Anayah; Vanjah, an Israelite -- Vaniah. see HEBREW (H6043) Anayah "
h,2058,וָפְסִי,Proper Name Masculine,Vophsi,(vof-see'),a Naphtalite,Vophsi ,"Probably from (H3254) yacaph; additional; Vophsi, an &? Israelite -- Vophsi. see HEBREW (H3254) yacaph "
h,2059,וַשִׁנִי,Proper Name Masculine,Vashni,(vash-nee'),Vashni ,Vashni ,"Probably from (H3461) Yishmray; weak; Vashni, an Israelite -- Vashni. see HEBREW (H3461) Yishmray "
h,2060,וַשְׁתִּי,Proper Name Feminine,Vashti,(vash-tee'),queen of Pers,Vashti ,"Of Persian origin; Vashti, the queen of Xerxes -- Vashti. "
h,2061,זְאֵב,Noun Masculine,zeeb,(zeh-abe'),a wolf,wolf ,From an unused root meaning to be yellow; a wolf -- wolf.
h,2062,זְאֵב,Proper Name Masculine,Zeeb,(zeh-abe'),"wolf, a leader in Midian",Zeeb ,"The same as (H2061) z'eb; Zeeb, a Midianitish prince -- Zeeb. see HEBREW (H2061) z'eb "
h,2063,זֹאת,pronoun feminine; demonstrative pronoun; adverb;,zoth,(zothe'),"hereby in it, likewise, the one other, same, she, so much, such deed, that, ","hereby in it, likewise, the one other, same, she, so much, such deed, that, ","Irregular feminine of (H2089) zeh; this (often used adverb) -- hereby (-in, -with), it, likewise, the one (other, same), she, so (much), such (deed), that, therefore, these, this (thing), thus. see HEBREW (H2089) zeh "
h,2064,זַָבַד,Verb,zabad,(zaw-bad'),"bestow upon, endow with",endure ,A primitive root; to confer -- endure.
h,2065,זֶבֶד,Noun Masculine,zebed,(zeh'-bed),"endowment, gift",dowry ,From (H2064) zabad; a gift -- dowry. see HEBREW (H2064) zabad
h,2066,זָבָד,Proper Name Masculine,Zabad,(zaw-bawd'),"he has given, the name of several Israelites",Zabad ,"From (H2064) zabad; giver; Zabad, the name of seven Israelites -- Zabad. see HEBREW (H2064) zabad "
h,2067,זַבְדִּי,Proper Name Masculine,Zabdi,(zab-dee'),"gift, four Israelites",Zabdi ,"From (H2065) zebed; giving; Zabdi, the name of four &? Israelites -- Zabdi. see HEBREW (H2065) zebed "
h,2068,זַבְדִּיאֵל,Proper Name Masculine,Zabdiel,(zab-dee-ale'),"my gift is God, two Israelites",Zabdiel ,"From (H2065) zebed and (H410) 'el; gift of God: zabdiel, the name of two Israelites -- Zabdiel. see HEBREW (H2065) zebed see HEBREW (H410) 'el "
h,2069,זְבַדיָה,Proper Name Masculine,Zebadyah or Zebadyahu,(zeb-ad-yaw'),"Yah has bestowed, the name of several Israelites",Zebadiah ,"Or Zbadyahuw {zeb-ad-yaw'-hoo}; from (H2064) zabad and (H3050) Yahh; Jah has given; Zebadjah, the name of nine Israelites -- Zebadiah. see HEBREW (H2064) zabad see HEBREW (H3050) Yahh "
h,2070,זְבוּב,Noun Masculine,zebub,(zeb-oob'),a fly,fly ,From an unused root (meaning to flit); a fly (especially one of a stinging nature) -- fly.
h,2071,זָבוּד,Proper Name Masculine,Zabud,(zaw-bood'),"bestowed, an officer of Solomon",Zabud ,"From (H2064) zabad; given, Zabud, an Israelite -- Zabud. see HEBREW (H2064) zabad "
h,2072,זַבּוּד,Proper Name Masculine,Zabbud,(zab-bood'),"bestowed, an Israelite",Zabbud ,"A form of (H2071) Zabuwd; given; Zabbud, an Israelite -- Zabbud. see HEBREW (H2071) Zabuwd "
h,2073,זְבוּל,Noun Masculine,zebul,(ze-bool'),"elevation, height, lofty abode","dwell in, dwelling, habitation ","Or zbul {zeb-ool'}; from (H2082) zabal; a residence -- dwell in, dwelling, habitation. see HEBREW (H2082) zabal "
h,2074,זְבוּלוּן,Proper Name Masculine,Zebulun,(zeb-oo-loon'),"a son of Jacob, also his desc. and their territory",Zebulun ,"Or Zbuluwn {zeb-oo-loon'}; or Zbuwlun {zeb-oo-loon'}; from (H2082) zabal; habitation; Zebulon, a son of Jacob; also his territory and tribe -- Zebulun. see HEBREW (H2082) zabal "
h,2075,זָבוּלנִי,Adjective,Zebuloni,(zeb-oo-lo-nee'),descendant of Zebulun,Zebulonite ,Patronymically from (H2074) Zbuwluwn; a Zebulonite or descendant of Zebulun -- Zebulonite. see HEBREW (H2074) Zbuwluwn
h,2076,זָבַח,Verb,zabach,(zaw-bakh'),to slaughter for sacrifice,"kill, offer, do sacrifice, slay ","A primitive root; to slaughter an animal (usually in sacrifice) -- kill, offer, (do) sacrifice, slay. "
h,2077,זֶבַח,Noun Masculine,zebach,(zeh'-bakh),a sacrifice,offer sacrifice ,"From (H2076) zabach; properly, a slaughter, i.e. The flesh of an animal; by implication, a sacrifice (the victim or the act) -- offer(- ing), sacrifice. see HEBREW (H2076) zabach "
h,2078,זֶבַח,Proper Name Masculine,Zebach,(zeh'-bakh),a Midianite king,Zebah ,"The same as (H2077) zebach; sacrifice; Zebach, a Midianitish prince -- Zebah. see HEBREW (H2077) zebach "
h,2079,זַבַּי,Proper Name Masculine,Zabbay,(zab-bah'-ee),an Israelite,Zabbai ,"Probably by orthographical error for (H2140) Zakkay; Zabbai (or Zaccai), an Israelite -- Zabbai. see HEBREW (H2140) Zakkay "
h,2080,זְבִידָה,Proper Name Feminine,Zebiddah,(zeb-ee-daw'),mother of Jehoiakim,Zebudah ,"Feminine from (H2064) zabad; giving; Zebidah, an Israelitess -- Zebudah. see HEBREW (H2064) zabad "
h,2081,זְבִינָא,Proper Name Masculine,Zebina,(zeb-ee-naw'),"bought, an Israelite",Zebina ,"From an unused root (meaning to purchase); gainfulness; Zebina, an Israelite -- Zebina. "
h,2082,זָבַל,Verb,zabal,(zaw-bal'),probably to dwell,dwell with ,"A primitive root; apparently properly, to inclose, i.e. To reside -- dwell with. "
h,2083,זְבֻל,Proper Name Masculine,Zebul,(zeb-ool'),an officer of Abimelech,Zebul ,"The same as (H2073) zbuwl; dwelling; Zebul, an Israelite -- Zebul. Compare (H2073) zbuwl. see HEBREW (H2073) zbuwl see HEBREW (H2073) zbuwl "
h,2084,זְבַן,Verb,zeban,(zeb-an'),"to buy, gain",gain ,(Aramaic) corresponding to the root of (H2081) Zbiyna'; to acquire by purchase -- gain. see HEBREW (H2081) Zbiyna'
h,2085,זָג,Noun Masculine,zag,(zawg),skin (of the grape),husk ,From an unused root probably meaning to inclose; the skin of a grape -- husk.
h,2086,זֵד,Noun Masculine,zed,(zade'),"insolent, presumptuous","presumptuous, proud ","From (H2102) zuwd; arrogant -- presumptuous, proud. see HEBREW (H2102) zuwd "
h,2087,זָדוֹן,Noun Masculine,zadon,(zaw-done'),"insolence, presumptuousness","presumptuously, pride, proud man ","From (H2102) zuwd; arrogance -- presumptuously, pride, proud (man). see HEBREW (H2102) zuwd "
h,2088,זֶה,Pronoun masculine demonstrative,zeh,(zeh),"this, here","he, hence, here, itself, now, of him, the one ","A primitive word; the masculine demonstrative pronoun, this or that -- he, X hence, X here, it(-self), X now, X of him, the one...the other, X than the other, (X out of) the (self) same, such (a one) that, these, this (hath, man), on this side...on that side, X thus, very, which. Compare (H2063) zo'th, (H2090) zoh, (H2097) zow, (H2098) zuw. see HEBREW (H2063) zo'th see HEBREW (H2090) zoh see HEBREW (H2097) zow see HEBREW (H2098) zuw "
h,2089,זֶה,Noun Masculine,zeh,(zeh),lamb ,lamb ,((H1) 'ab Samuel by permutation for (H7716) seh; a sheep -- lamb. see HEBREW (H1) 'ab see HEBREW (H7716) seh
h,2090,זֹה,Pronoun Feminine,zoh,(zo),this,"as well as another, it, this, that, thus and thus ","For (H2088) zeh; this or that -- as well as another, it, this, that, thus and thus. see HEBREW (H2088) zeh "
h,2091,זָהָב,Noun Masculine,zahab,(zaw-hawb'),gold,"golden, fair weather ","From an unused root meaning to shimmer; gold, figuratively, something gold-colored (i.e. Yellow), as oil, a clear sky -- gold(-en), fair weather. "
h,2092,זָהַם,Verb,zaham,(zaw-ham'),"to be foul, loathsome",abhor ,"A primitive root; to be rancid, i.e. (transitively) to loathe -- abhor. "
h,2093,זַהַם,Proper Name Masculine,Zaham,(zah'-ham),"loathing, a son of Rehoboam",Zaham ,"From (H2092) zaham; loathing; Zaham, an Israelite -- Zaham. see HEBREW (H2092) zaham "
h,2094,זָהַר,Verb,zahar,(zaw-har'),to be light or shining,"admonish, shine, teach, give warning ","A primitive root; to gleam; figuratively, to enlighten (by caution) -- admonish, shine, teach, (give) warn(-ing). "
h,2095,זְהַר,Verb,zehar,(zeh-har'),to warn,take heed ,(Aramaic) corresponding to (H2094) zahar; (passively) be admonished -- take heed. see HEBREW (H2094) zahar
h,2096,זֹהַר,Noun Masculine,zohar,(zo'-har),"shining, brightness",brightness ,From (H2094) zahar; brilliancy -- brightness. see HEBREW (H2094) zahar
h,2097,זוֹ,Pronoun,zo,(zo),this,"that, this ","For (H2088) zeh; this or that -- that, this. see HEBREW (H2088) zeh "
h,2098,זוּ,pronoun; demonstrative,zu,(zoo),"this, which, who","that, this, wherein, which, whom ","For (H2088) zeh; this or that -- that, this, X wherein, which, whom. see HEBREW (H2088) zeh "
h,2099,זִו,Proper Name Masculine,Ziv,(zeev'),the second month of the Jewish calendar,Zif ,"Probably from an unused root meaning to be prominent; properly, brightness (compare (H2122) ziyv), i.e. (figuratively) the month of flowers; Ziv (corresponding to Ijar or May) -- Zif. see HEBREW (H2122) ziyv "
h,2100,זוּב,Verb,zub,(zoob),"to flow, gush","flow, gush out, have a running issue, pine away, run ","A primitive root; to flow freely (as water), i.e. (specifically) to have a (sexual) flux; figuratively, to waste away; also to overflow -- flow, gush out, have a (running) issue, pine away, run. "
h,2101,זוֹב,Noun Masculine,zob,(zobe),an issue (of fluid),issue ,From (H2100) zuwb; a seminal or menstrual flux -- issue. see HEBREW (H2100) zuwb
h,2102,זוּד,Verb,zud or zid,(zood),"to boil up, seethe, act proudly or presumptuously or rebelliously","be proud, deal proudly, come presumptuously","Or (by permutation) ziyd {zeed}; a primitive root; to seethe; figuratively, to be insolent -- be proud, deal proudly, &? Presume, (come) presumptuously, sod. "
h,2103,זוּד,Verb,zud,(zood),to be presumptuous,in pride ,(Aramaic) corresponding to (H2102) zuwd; to be proud -- in pride. see HEBREW (H2102) zuwd
h,2104,זוּזַים,Noun Masculine,Zuzim,(zoo-zeem'),a people East of the Jordan,Zuzims ,"Plural probably from the same as (H2123) ziyz; prominent; Zuzites, an aboriginal tribe of Palestine -- Zuzims. see HEBREW (H2123) ziyz "
h,2105,זוֹחֵת,Proper Name Masculine,Zocheth,(zo-khayth'),a descendant of Judah,Zoheth ,"Of uncertain origin; Zocheth, an Israelite -- Zoheth. "
h,2106,זָוִית,Noun Feminine,zavith,(zaw-veeth'),a corner,cornerstone ,"Apparently from the same root as (H2099) Ziv (in the sense of prominence); an angle (as projecting), i.e. (by implication) a corner-column (or anta) -- corner(stone). see HEBREW (H2099) Ziv "
h,2107,זוּל,Verb,zul,(zool),to lavish,"lavish, despise ","A primitive root (compare (H2151) zalal); probably to shake out, i.e. (by implication) to scatter profusely; figuratively, to treat lightly -- lavish, despise. see HEBREW (H2151) zalal "
h,2108,זוּלָה,noun feminine; preposition; conjunction; preposition,zulah,(zoo-law'),"except, only","beside, but, only, save ","From (H2107) zuwl; probably scattering, i.e. Removal; used adverbially, except -- beside, but, only, save. see HEBREW (H2107) zuwl "
h,2109,זוּן,Verb,zun,(zoon),to feed,feed ,"A primitive root; perhaps properly, to be plump, i.e. (transitively) to nourish -- feed. "
h,2110,זוּן,Verb,zun,(zoon),to feed,feed ,(Aramaic) corresponding to (H2109) zuwn -- feed. see HEBREW (H2109) zuwn
h,2111,זוּעַ,Verb,zua,(zoo'-ah),"to tremble, quake","move, tremble, vex ","A primitive root; properly, to shake off, i.e. (figuratively) to agitate (as with fear) -- move, tremble, vex. "
h,2112,זוּעַ,Verb,zua,(zoo'-ah),to tremble,tremble ,(Aramaic) corresponding to (H2111) zuwa'; to shake (with fear) -- tremble. see HEBREW (H2111) zuwa'
h,2113,זְוָעָה,Noun Feminine,zevaah,(zev-aw-aw'),"a trembling, an object of trembling or terror","be removed, trouble, vexation ","From (H2111) zuwa'; agitation, fear -- be removed, trouble, vexation. Compare (H2189) za'avah. see HEBREW (H2111) zuwa' see HEBREW (H2189) za'avah "
h,2114,זוּר,Verb,zuwr,(zoor),to be a stranger,"come from another man, place, fanner, go away, estranger, thing, woman ","A primitive root; to turn aside (especially for lodging); hence to be a foreigner, strange, profane; specifically (active participle) to commit adultery -- (come from) another (man, place), fanner, go away, (e-)strange(-r, thing, woman). "
h,2115,זוּר,Verb,zur,(zoor),to press down and out,"close, rush, thrust together ","A primitive root (compare (H6695) tsowq); to press together, &? Tighten -- close, rush, thrust together. see HEBREW (H6695) tsowq "
h,2116,זוּרֶה,Noun Masculine,zureh,(zoo-reh'),trodden on,trodden on,From (H2115) zuwr; trodden on -- that which is crushed. see HEBREW (H2115) zuwr
h,2117,זָזָא,Proper Name Masculine,Zaza,(zaw-zaw'),a descendant of Judah,Zaza ,"Probably from the root of (H2123) ziyz; prominent; Zaza, an Israelite -- Zaza. see HEBREW (H2123) ziyz "
h,2118,זָחַח,Verb,zachach,(zaw-khakh'),"to remove, displace",loose ,A primitive root; to shove or displace -- loose.
h,2119,זָחַל,Verb,zachal,(zaw-khal'),"to shrink back, crawl away","be afraid, serpent, worm ","A primitive root; to crawl; by implication, to fear -- be afraid, serpent, worm. "
h,2120,זֹחֶלֶת,Proper Name Feminine,zocheleth,(zo-kheh'-leth),"a crawling thing, serpent",Zoheleth ,"Feminine active participle of (H2119) zachal; crawling (i.e. Serpent); Zocheleth, a boundary stone in. Palestine -- Zoheleth. see HEBREW (H2119) zachal "
h,2121,זֵידוֹן,Adjective,zedon,(zay-dohn'),"insolent, raging",proud ,"From (H2102) zuwd; boiling of water, i.e. Wave -- proud. see HEBREW (H2102) zuwd "
h,2122,זִיו,Noun Masculine,ziv,(zeev),"brightness, splendor","brightness, countenance ","(Aramaic) corresponding to (H2099) Ziv; (figuratively) cheerfulness -- brightness, countenance. see HEBREW (H2099) Ziv "
h,2123,זִיז,noun masculine; collective; noun masculine,ziyz,(zeez),moving things (i.e. beasts),"abundance, wild beast ","From an unused root apparently meaning to be conspicuous; fulness of the breast; also a moving creature -- abundance, wild beast. "
h,2124,זִיזָא,Proper Name Masculine,Ziza,(zee-zaw'),two Israelites,Ziza ,"Apparently from the same as (H2123) ziyz; prominence; Ziza, the name of two Israelites -- Ziza. see HEBREW (H2123) ziyz "
h,2125,זִיזָה,Proper Name Masculine,Zizah,(zee-zaw'),a Levite,Zizah ,"Another form for (H2124) Ziyza'; Zizah, an Israelite -- Zizah. see HEBREW (H2124) Ziyza' "
