g,4127,"πληγή, ῆς, ἡ","Noun, Feminine",plégé,(play-gay'),"a blow, wound","wound, stripe","From  (G4141) plesso; a stroke; by implication, a wound; figuratively, a calamity -- plague, stripe, wound(-ed). see GREEK  (G4141) plesso "
g,4128,"πλῆθος, ους, τό","Noun, Neuter",pléthos,(play'-thos),a great number,"company, multitude. ","From  (G4130) pletho; a fulness, i.e. A large number, throng, populace -- bundle, company, multitude. see GREEK  (G4130) pletho "
g,4129,πληθύνω,Verb,pléthunó,(play-thoo'-no),"to increase, to be increased",multiply. ,"From another form of  (G4128) plethos; to increase (transitively or intransitively) -- abound, multiply. see GREEK  (G4128) plethos "
g,4130,πλήθω,"VerbPhonetic Spelling: (play\'-tho)Definition: furnish, accomplish, fill, supplyUsage: I fill, fulfill, complete.HELPS Word-studies4130 pl\xe1\xb8\x97th\xc5\x8d (or pimpl\xc4\x93mi) \xe2\x80\x93 properly, fill to the maximum (full extent), &quot;the limit&quot; (CBL).  4130 /pl\xe1\xb8\x97th\xc5\x8d (&quot;full&quot;) implies &quot;filled to one\'s (individual) capacity.&quot;[This root (pl\xc4\x93-) expresses totality, and implies full quantity (&quot;up to the max&quot;).  DNTT (1,733) notes its cognates (pl\xc4\x93r\xc4\x93s, pl\xc4\x93ro\xc5\x8d, pl\xc4\x93r\xc5\x8dma) all come from the root (pl\xc4\x93-/pl\xc4\x93th\xc5\x8d) meaning &quot;full in quantity.&quot;  Thus 4130 /pl\xe1\xb8\x97th\xc5\x8d (&quot;to fill or complete&quot;) refers to &quot;that which is complete in itself because of plentitude, entire number or quantity.\xc2\xa0.\xc2\xa0.\xc2\xa0.\xc2\xa0the whole aggregate,&quot; WS, 395,96).4130 (pl\xc4\x93th\xc5\x8d) may be a by-form derived from the same root as pimpl\xc4\x93mi.  All these terms (cognates) emphasize the idea of &quot;maximum (full extent).&quot;]Thayer\'s Greek LexiconSTRONGS NT 4130: \xcf\x80\xce\xaf\xce\xbc\xcf\x80\xce\xbb\xce\xb7\xce\xbc\xce\xb9\xcf\x80\xce\xaf\xce\xbc\xcf\x80\xce\xbb\xce\xb7\xce\xbc\xce\xb9; (a lengthened form of the theme \xce\xa0\xce\x9b\xce\x91\xce\xa9, whence \xcf\x80\xce\xbb\xce\xad\xce\xbf\xcf\x82, \xcf\x80\xce\xbb\xce\xae\xcf\x81\xce\xb7\xcf\x82 (cf. Curtius, \xc2\xa7 366)): 1 aorist \xe1\xbc\x94\xcf\x80\xce\xbb\xce\xb7\xcf\x83\xce\xb1; passive, 1 future \xcf\x80\xce\xbb\xce\xb7\xcf\x83\xce\xb8\xce\xae\xcf\x83\xce\xbf\xce\xbc\xce\xb1\xce\xb9; 1 aorist \xe1\xbc\x90\xcf\x80\xce\xbb\xce\xae\xcf\x83\xce\xb8\xce\xb7\xce\xbd; from Homer on; the Sept. for \xd7\x9e\xd6\xb8\xd7\x9c\xd6\xb5\xd7\x90, also for \xd7\x94\xd6\xb4\xd7\xa9\xd6\xb0\xd7\x82\xd7\x91\xd6\xb4\xd6\xbc\xd7\x99\xd7\xa2\xd6\xb7  (to satiate) and passive, \xd7\xa9\xd6\xb8\xd7\x82\xd7\x91\xd6\xb7\xd7\xa2  (to be full); to fill: \xcf\x84\xce\xaf, Luke 5:7; \xcf\x84\xce\xaf \xcf\x84\xce\xaf\xce\xbd\xce\xbf\xcf\x82 (Winer\'s Grammar, \xc2\xa7 30, 8 b.), a thing with something, Matthew 27:48; (John 19:29 R G); in the passive, Matthew 22:10; Acts 19:29; (\xe1\xbc\x90\xce\xba \xcf\x84\xe1\xbf\x86\xcf\x82 \xe1\xbd\x80\xcf\x83\xce\xbc\xe1\xbf\x86\xcf\x82, John 12:3 Tr marginal reading; cf. Winers Grammar, as above note; Buttmann, \xc2\xa7 132, 12). what wholly takes possession of the mind is said to fill it: passive, \xcf\x86\xce\xbf\xce\xb2\xce\xbf\xe1\xbf\xa6, Luke 5:26; \xce\xb8\xce\xac\xce\xbc\xce\xb2\xce\xbf\xcf\x85\xcf\x82, Acts 3:10; \xe1\xbc\x80\xce\xbd\xce\xbf\xce\xaf\xce\xb1\xcf\x82, Luke 6:11; \xce\xb6\xce\xae\xce\xbb\xce\xbf\xcf\x85, Acts 5:17; Acts 13:45; \xce\xb8\xcf\x85\xce\xbc\xce\xbf\xe1\xbf\xa6, Luke 4:28; Acts 3:10; \xcf\x80\xce\xbd\xce\xb5\xcf\x8d\xce\xbc\xce\xb1\xcf\x84\xce\xbf\xcf\x82 \xe1\xbc\x81\xce\xb3\xce\xaf\xce\xbf\xcf\x85, Luke 1:15, 41, 67; Acts 2:4; Acts 4:8, 31; Acts 9:17; Acts 13:9. prophecies are said \xcf\x80\xce\xbb\xce\xb7\xcf\x83\xce\xb8\xe1\xbf\x86\xce\xbd\xce\xb1\xce\xb9, i. e. to come to pass, to be confirmed by the event, Luke 21:22 G L T Tr WH (for Rec. \xcf\x80\xce\xbb\xce\xb7\xcf\x81\xcf\x89\xce\xb8\xe1\xbf\x86\xce\xbd\xce\xb1\xce\xb9). time is said \xcf\x80\xce\xbb\xce\xb7\xcf\x83\xce\xb8\xe1\xbf\x86\xce\xbd\xce\xb1\xce\xb9, to be fulfilled or completed, i. e. finished, elapsed, Luke 1:23, 57 (Winers Grammar, 324 (304); Buttmann, 267 (230)); f; so \xd7\xa0\xd6\xb4\xd7\x9e\xd6\xb0\xd7\x9c\xd6\xb8\xd7\x90, Job 15:32; and \xd7\x9e\xd6\xb4\xd7\x9c\xd6\xb5\xd6\xbc\xd7\x90 to (ful-)fill the time, i. e. to complete, fill up, Genesis 29:27; Job 39:2. (Compare: \xe1\xbc\x90\xce\xbc\xcf\x80\xce\xaf\xcf\x80\xce\xbb\xce\xb7\xce\xbc\xce\xb9.)   STRONGS NT 4130: \xcf\x80\xce\xbb\xce\xae\xce\xb8\xcf\x89\xcf\x80\xce\xbb\xce\xae\xce\xb8\xcf\x89, see  \xcf\x80\xce\xaf\xce\xbc\xcf\x80\xce\xbb\xce\xb7\xce\xbc\xce\xb9.   Strong\'s Exhaustive Concordancefurnish, accomplish, fill, supplyA prolonged form of a primary pleo (pleh\'-o) (which appears only as an alternate in certain tenses and in the reduplicated form pimplemi) to ""fill"" (literally or figuratively (imbue, influence, supply)); specially, to fulfil (time) -- accomplish, full (...come), furnish. g,4131,"πλήκτης, ου, ὁ","Noun, Masculine",pléktés,(plake'-tace),a striker,"bully, striker. ","From  (G4141) plesso; a smiter, i.e. Pugnacious (quarrelsome) -- striker. see GREEK  (G4141) plesso "
g,4132,"πλημμύρα, ας, ἡ","Noun, Feminine",plémmura,(plame-moo'-rah),a flood,flood. ,"Prolonged from  (G4130) pletho; flood-tide, i.e. (by analogy) a freshet -- flood. see GREEK  (G4130) pletho "
g,4133,πλήν,Adverb,plén,(plane),"yet, except","nevertheless, however, notwithstanding, save, than. ","From  (G4119) pleion; moreover (besides), i.e. Albeit, save that, rather, yet -- but (rather), except, nevertheless, notwithstanding, save, than. see GREEK  (G4119) pleion "
g,4134,"πλήρης, ες",Adjective,plérés,(play'-race),full,full. ,"From  (G4130) pletho; replete, or covered over; by analogy, complete -- full. see GREEK  (G4130) pletho "
g,4135,πληροφορέω,Verb,plérophoreó,(play-rof-or-eh'-o),"to bring in full measure, to fulfill","fulfill, fully know, make full proof of. ","From  (G4134) pleres and  (G5409) phoreo; to carry out fully (in evidence), i.e. Completely assure (or convince), entirely accomplish -- most surely believe, fully know (persuade), make full proof of. see GREEK  (G4134) pleres see GREEK  (G5409) phoreo "
g,4136,"πληροφορία, ας, ἡ","Noun, Feminine",plérophoria,(play-rof-or-ee'-ah),full assurance,full assurance. ,From  (G4135) plerophoreo; entire confidence -- (full) assurance. see GREEK  (G4135) plerophoreo
g,4137,πληρόω,Verb,pléroó,(play-ro'-o),"to make full, to complete","accomplish, complete, fulfill","From  (G4134) pleres; to make replete, i.e. (literally) to cram (a net), level up (a hollow), or (figuratively) to furnish (or imbue, diffuse, influence), satisfy, execute (an office), finish (a period or task), verify (or coincide with a prediction), etc. -- accomplish, X after, (be) complete, end, expire, fill (up), fulfil, (be, make) full (come), fully preach, perfect, supply. see GREEK  (G4134) pleres "
g,4138,"πλήρωμα, ατος, τό","Noun, Neuter",pléróma,(play'-ro-mah),"fullness, a filling up","fullness, fulfilling, full,  ","From  (G4137) pleroo; repletion or completion, i.e. (subjectively) what fills (as contents, supplement, copiousness, multitude), or (objectively) what is filled (as container, performance, period) -- which is put in to fill up, piece that filled up, fulfilling, full, fulness. see GREEK  (G4137) pleroo "
g,4139,πλησίον,Adverb,plésion,(play-see'-on),"near, neighboring","near, neighbor. ","Neuter of a derivative of pelas (near); (adverbially) close by; as noun, a neighbor, i.e. Fellow (as man, countryman, Christian or friend) -- near, neighbour. "
g,4140,"πλησμονή, ῆς, ἡ","Noun, Feminine",plésmoné,(place-mon-ay'),a filling up,"gratification, satisfaction. ","From a presumed derivative of  (G4130) pletho; a filling up, i.e. (figuratively) gratification -- satisfying. see GREEK  (G4130) pletho "
g,4141,πλήσσω,Verb,pléssó,(place'-so),to strike,"smite, strike. ","Apparently another form of  (G4111) plasso (through the idea of flattening out); to pound, i.e. (figuratively) to inflict with (calamity) -- smite. Compare  (G5180) tupto. see GREEK  (G5180) tupto see GREEK  (G4111) plasso "
g,4142,"πλοιάριον, ου, τό","Noun, Neuter",ploiarion,(ploy-ar'-ee-on),a little boat,"boat, small ship. ","Neuter of a presumed derivative of  (G4143) ploion; a boat -- boat, little (small) ship. see GREEK  (G4143) ploion "
g,4143,"πλοῖον, ου, τό","Noun, Neuter",ploion,(ploy'-on),a boat,a boat,"From  (G4126) pleo; a sailer, i.e. Vessel -- ship(-ing). see GREEK  (G4126) pleo "
g,4144,"πλόος, οῦς","Noun, Masculine",ploos or plous,(plo'-os),a voyage,"course, sailing, voyage. ","From  (G4126) pleo; a sail, i.e. Navigation -- course, sailing, voyage. see GREEK  (G4126) pleo "
g,4145,"πλούσιος, α, ον",Adjective,plousios,(ploo'-see-os),wealthy,rich. ,"From  (G4149) ploutos; wealthy; figuratively, abounding with -- rich. see GREEK  (G4149) ploutos "
g,4146,πλουσίως,Adverb,plousiós,(ploo-see'-oce),richly,"abundantly, richly. ","Adverb from  (G4145) plousios; copiously -- abundantly, richly. see GREEK  (G4145) plousios "
g,4147,πλουτέω,Verb,plouteó,(ploo-teh'-o),to be rich,be rich. ,"From  (G4148) ploutizo; to be (or become) wealthy (literally or figuratively) -- be increased with goods, (be made, wax) rich. see GREEK  (G4148) ploutizo "
g,4148,πλουτίζω,Verb,ploutizó,(ploo-tid'-zo),to make rich,enrich. ,From  (G4149) ploutos; to make wealthy (figuratively) -- en- (make) rich. see GREEK  (G4149) ploutos
g,4149,"πλοῦτος, ου, ὁ","Noun, Masculine; Noun, Neuter",ploutos,(ploo'-tos),wealth,riches. ,"From the base of  (G4130) pletho; wealth (as fulness), i.e. (literally) money, possessions, or (figuratively) abundance, richness, (specially), valuable bestowment -- riches. see GREEK  (G4130) pletho "
g,4150,πλύνω,Verb,plunó,(ploo'-no),to wash,wash. ,"A prolonged form of an obsolete pluo (to ""flow""); to ""plunge"", i.e. Launder clothing -- wash. Compare  (G3068) louo,  (G3538) nipto. see GREEK  (G3068) louo see GREEK  (G3538) nipto "
g,4151,"πνεῦμα, ατος, τό","Noun, Neuter",pneuma,(pnyoo'-mah),"wind, spirit","spirit, ghost","From  (G4154) pneo; a current of air, i.e. Breath (blast) or a breeze; by analogy or figuratively, a spirit, i.e. (human) the rational soul, (by implication) vital principle, mental disposition, etc., or (superhuman) an angel, demon, or (divine) God, Christ's spirit, the Holy Spirit -- ghost, life, spirit(-ual, -ually), mind. Compare  (G5590) psuche. see GREEK  (G4154) pneo see GREEK  (G5590) psuche "
g,4152,"πνευματικός, ή, όν",Adjective,pneumatikos,(pnyoo-mat-ik-os'),spiritual,spiritual. ,"From  (G4151) pneuma; non-carnal, i.e. (humanly) ethereal (as opposed to gross), or (daemoniacally) a spirit (concretely), or (divinely) supernatural, regenerate, religious -- spiritual. Compare  (G5591) psuchikos. see GREEK  (G4151) pneuma see GREEK  (G5591) psuchikos "
g,4153,πνευματικῶς,Adverb,pneumatikós,(pnyoo-mat-ik-oce'),spiritually,spiritually. ,"Adverb from  (G4152) pneumatikos; non-physically, i.e. Divinely, figuratively -- spiritually. see GREEK  (G4152) pneumatikos "
g,4154,πνέω,Verb,pneó,(pneh'-o),to blow,blow. ,"A primary word; to breathe hard, i.e. Breeze -- blow. Compare  (G5594) psucho. see GREEK  (G5594) psucho "
g,4155,πνίγω,Verb,pnigó,(pnee'-go),to choke,"choke, take by the throat. ","Strengthened from  (G4154) pneo; to wheeze, i.e. (causative, by implication) to throttle or strangle (drown) -- choke, take by the throat. see GREEK  (G4154) pneo "
g,4156,"πνικτός, ή, όν",Adjective,pniktos,(pnik-tos'),strangled,strangled. ,"From  (G4155) pnigo; throttled, i.e. (neuter concretely) an animal choked to death (not bled) -- strangled. see GREEK  (G4155) pnigo "
g,4157,"πνοή, ῆς, ἡ","Noun, Feminine",pnoé,(pno-ay'),"a blowing, wind, breath","breath, wind. ","From  (G4154) pneo; respiration, a breeze -- breath, wind. see GREEK  (G4154) pneo "
g,4158,"ποδήρης, ες",Adjective,podérés,(pod-ay'-race),reaching to the feet,"long robe, dress",From  (G4228) pous and another element of uncertain affinity; a dress ( (G2066) esthes implied) reaching the ankles -- garment down to the foot. see GREEK  (G4228) pous see GREEK  (G2066) esthes
g,4159,πόθεν,"Adverb, Interrogative",pothen,(poth'-en),from where,whence. ,"From the base of  (G4213) posis with enclitic adverb of origin; from which (as interrogative) or what (as relative) place, state, source or cause -- whence. see GREEK  (G4213) posis "
g,4160,ποιέω,Verb,poieó,(poy-eh'-o),"to make, do",to make or do,"Apparently a prolonged form of an obsolete primary; to make or do (in a very wide application, more or less direct) -- abide, + agree, appoint, X avenge, + band together, be, bear, + bewray, bring (forth), cast out, cause, commit, + content, continue, deal, + without any delay, (would) do(-ing), execute, exercise, fulfil, gain, give, have, hold, X journeying, keep, + lay wait, + lighten the ship, make, X mean, + none of these things move me, observe, ordain, perform, provide, + have purged, purpose, put, + raising up, X secure, shew, X shoot out, spend, take, tarry, + transgress the law, work, yield. Compare  (G4238) prasso. see GREEK  (G4238) prasso "
g,4161,"ποίημα, ατος, τό","Noun, Neuter",poiéma,(poy'-ay-mah),a work,workmanship. ,"From  (G4160) poieo; a product, i.e. Fabric (literally or figuratively) -- thing that is made, workmanship. see GREEK  (G4160) poieo "
g,4162,"ποίησις, εως, ἡ","Noun, Feminine",poiésis,(poy'-ay-sis),"a making, a doing",deed. ,"From  (G4160) poieo; action, i.e. Performance (of the law) -- deed. see GREEK  (G4160) poieo "
g,4163,"ποιητής, οῦ, ὁ","Noun, Masculine",poiétés,(poy-ay-tace'),"a maker, a doer","poet, doer ","From  (G4160) poieo; a performer; specially, a ""poet""; --doer, poet. see GREEK  (G4160) poieo "
g,4164,"ποικίλος, η, ον",Adjective,poikilos,(poy-kee'-los),many colored,"diverse, manifold. ","Of uncertain derivation; motley, i.e. Various in character -- divers, manifold. "
g,4165,ποιμαίνω,Verb,poimainó,(poy-mah'-ee-no),to act as a shepherd,"to shepherd, rule","From  (G4166) poimen; to tend as a shepherd of (figuratively, superviser) -- feed (cattle), rule. see GREEK  (G4166) poimen "
g,4166,"ποιμήν, ένος, ὁ","Noun, Masculine",poimén,(poy-mane'),a shepherd,"shepherd, pastor. ","Of uncertain affinity; a shepherd (literally or figuratively) -- shepherd, pastor. "
g,4167,"ποίμνη, ης, ἡ","Noun, Feminine",poimné,(poym'-nay),a flock,"flock, fold. ","Contraction from  (G4165) poimaino; a flock (literally or figuratively) -- flock, fold. see GREEK  (G4165) poimaino "
g,4168,"ποίμνιον, ου, τό","Noun, Neuter",poimnion,(poym'-nee-on),a flock,flock. ,"Neuter of a presumed derivative of  (G4167) poimne; a flock, i.e. (figuratively) group (of believers) -- flock. see GREEK  (G4167) poimne "
g,4169,"ποῖος, α, ον",Interrogative Pronoun,poios,(poy'-os),of what sort?,"what manner of, which. ","From the base of  (G4226) pou and  (G3634) hoios; individualizing interrogative (of character) what sort of, or (of number) which one -- what (manner of), which. see GREEK  (G4226) pou see GREEK  (G3634) hoios "
g,4170,πολεμέω,Verb,polemeó,(pol-em-eh'-o),to make war,"to battle, make war. ","From  (G4171) polemos; to be (engaged) in warfare, i.e. To battle (literally or figuratively): -fight, (make) war. see GREEK  (G4171) polemos "
g,4171,"πόλεμος, ου, ὁ","Noun, Masculine",polemos,(pol'-em-os),war,"battle, fight, war. ","From pelomai (to bustle); warfare (literally or figuratively; a single encounter or a series) -- battle, fight, war. "
g,4172,"πόλις, εως, ἡ","Noun, Feminine",polis,(pol'-is),a city,city. ,"Probably from the same as  (G4171) polemos, or perhaps from  (G4183) polus; a town (properly, with walls, of greater or less size) -- city. see GREEK  (G4183) polus see GREEK  (G4171) polemos "
g,4173,"πολιτάρχης, ου, ὁ","Noun, Masculine",politarchés,(pol-it-ar'-khace),the ruler of a city,ruler of the city. ,"From  (G4172) polis and  (G757) archo; a town-officer, i.e. Magistrate -- ruler of the city. see GREEK  (G4172) polis see GREEK  (G757) archo "
g,4174,"πολιτεία, ας, ἡ","Noun, Feminine",politeia,(pol-ee-ti'-ah),citizenship,citizenship,"From  (G4177) polites (""polity""); citizenship; concretely, a community -- commonwealth, freedom. see GREEK  (G4177) polites "
g,4175,"πολίτευμα, ατος, τό","Noun, Neuter",politeuma,(pol-it'-yoo-mah),"a form of government, citizenship","citizenship, community, conversation. ","From  (G4176) politeuomai; a community, i.e. (abstractly) citizenship (figuratively) -- conversation. see GREEK  (G4176) politeuomai "
g,4176,πολιτεύομαι,Verb,politeuomai,(pol-it-yoo'-om-ahee),to live as a citizen,"let conversation be, live. ","Middle voice of a derivative of  (G4177) polites; to behave as a citizen (figuratively) -- let conversation be, live. see GREEK  (G4177) polites "
g,4177,"πολίτης, ου, ὁ","Noun, Masculine",polités,(pol-ee'-tace),a citizen,citizen. ,From  (G4172) polis; a townsman -- citizen. see GREEK  (G4172) polis
g,4178,πολλάκις,Adverb,pollakis,(pol-lak'-is),often,often,"Multiplicative adverb from  (G4183) polus; many times, i.e. Frequently -- oft(-en, -entimes, -times). see GREEK  (G4183) polus "
g,4179,"πολλαπλασίων, ον",Adjective,pollaplasión,(pol-lap-las-ee'-ohn),many times more,manifold more. ,"From  (G4183) polus and probably a derivative of  (G4120) pleko; manifold, i.e. (neuter as noun) very much more -- manifold more. see GREEK  (G4183) polus see GREEK  (G4120) pleko "
g,4180,"πολυλογία, ας, ἡ","Noun, Feminine",polulogia,(pol-oo-log-ee'-ah),much speaking,wordiness,"From a compound of  (G4183) polus and  (G3056) logos; loquacity, i.e. Prolixity -- much speaking. see GREEK  (G4183) polus see GREEK  (G3056) logos "
g,4181,πολυμερῶς,Adverb,polumerós,(pol-oo-mer'-oce),in many parts,"variously, at sundry times. ","Adverb from a compound of  (G4183) polus and  (G3313) meros; in many portions, i.e. Variously as to time and agency (piecemeal) -- at sundry times. see GREEK  (G4183) polus see GREEK  (G3313) meros "
g,4182,"πολυποίκιλος, ον",Adjective,polupoikilos,(pol-oo-poy'-kil-os),of differing colors,manifold. ,"From  (G4183) polus and  (G4164) poikilos; much variegated, i.e. Multifarious -- manifold. see GREEK  (G4183) polus see GREEK  (G4164) poikilos "
g,4183,"πολύς, πολλή, πολύ",Adjective,polus,(pol-oos'),"much, many","abundant, many, much ","Including the forms from the alternate pollos; (singular) much (in any respect) or (plural) many; neuter (singular) as adverbial, largely; neuter (plural) as adverb or noun often, mostly, largely -- abundant, + altogether, common, + far (passed, spent), (+ be of a) great (age, deal, -ly, while), long, many, much, oft(-en (-times)), plenteous, sore, straitly. Compare  (G4118) pleistos,  (G4119) pleion. see GREEK  (G4118) pleistos see GREEK  (G4119) pleion "
g,4184,"πολύσπλαγχνος, ον",Adjective,polusplagchnos,(pol-oo'-splankh-nos),very compassionate,"compassionate, pitiful. ",From  (G4183) polus and  (G4698) splagchnon (figuratively); extremely compassionate -- very pitiful. see GREEK  (G4183) polus see GREEK  (G4698) splagchnon
g,4185,"πολυτελής, ές",Adjective,polutelés,(pol-oo-tel-ace'),very costly,"costly, very precious, of great price. ","From  (G4183) polus and  (G5056) telos; extremely expensive -- costly, very precious, of great price. see GREEK  (G4183) polus see GREEK  (G5056) telos "
g,4186,"πολύτιμος, ον",Adjective,polutimos,(pol-oot'-ee-mos),very precious,"very costly, of great price. ","From  (G4183) polus and  (G5092) time; extremely valuable -- very costly, of great price. see GREEK  (G4183) polus see GREEK  (G5092) time "
g,4187,πολυτρόπως,Adverb,polutropós,(pol-oot-rop'-oce),in many ways,in many ways,"Adverb from a compound of  (G4183) polus and  (G5158) tropos; in many ways, i.e. Variously as to method or form -- in divers manners. see GREEK  (G4183) polus see GREEK  (G5158) tropos "
g,4188,"πόμα, ατος, τό","Noun, Neuter",poma,(pom'-ah),a drink,drink. ,From the alternate of  (G4095) pino; a beverage -- drink. see GREEK  (G4095) pino
g,4189,"πονηρία, ας, ἡ","Noun, Feminine",ponéria,(pon-ay-ree'-ah),iniquity,"iniquity, wickedness. ","From  (G4190) poneros; depravity, i.e. (specially), malice; plural (concretely) plots, sins -- iniquity, wickedness. see GREEK  (G4190) poneros "
g,4190,"πονηρός, ά, όν",Adjective,ponéros,(pon-ay-ros'),"toilsome, bad","evil, grievous","From a derivative of  (G4192) ponos; hurtful, i.e. Evil (properly, in effect or influence, and thus differing from  (G2556) kakos, which refers rather to essential character, as well as from  (G4550) sapros, which indicates degeneracy from original virtue); figuratively, calamitous; also (passively) ill, i.e. Diseased; but especially (morally) culpable, i.e. Derelict, vicious, facinorous; neuter (singular) mischief, malice, or (plural) guilt; masculine (singular) the devil, or (plural) sinners -- bad, evil, grievous, harm, lewd, malicious, wicked(-ness). See also  (G4191) poneroteros. see GREEK  (G4192) ponos see GREEK  (G2556) kakos see GREEK  (G4550) sapros see GREEK  (G4191) poneroteros "
g,4191,πονηρότερα,Adjective,ponéroteros,(pon-ay-rot'-er-os),more wicked,more wicked. ,Comparative of  (G4190) poneros; more evil -- more wicked. see GREEK  (G4190) poneros
g,4192,"πόνος, ου, ὁ","Noun, Masculine",ponos,(pon'-os),labor,pain. ,"From the base of  (G3993) penes; toil, i.e. (by implication) anguish -- pain. see GREEK  (G3993) penes "
g,4193,"Ποντικός, ή, όν",Adjective,Pontikos,(pon-tik-os'),of Pontus,born in Pontus. ,"From  (G4195) Pontos; a Pontican, i.e. Native of Pontus -- born in Pontus. see GREEK  (G4195) Pontos "
g,4194,"Πόντιος, ου, ὁ","Noun, Masculine",Pontios,(pon'-tee-os),"Pontius (Pilate), a governor of Judea",Pontius. ,"Of Latin origin; apparently bridged; Pontius, a Roman -- Pontius. "
g,4195,"Πόντος, ου, ὁ","Noun, Masculine",Pontos,(pon'-tos),"a sea, Pontus, a region of Asia Minor",Pontus. ,"A sea; Pontus, a region of Asia Minor -- Pontus. "
g,4196,"Πόπλιος, ου, ὁ","Noun, Masculine",Poplios,(pop'-lee-os),"Publius, an inhabitant of Malta",Publius. ,"Of Latin origin; apparently ""popular""; Poplius (i.e. Publius), a Roman -- Publius. "
g,4197,"πορεία, ας, ἡ","Noun, Feminine",poreia,(por-i'-ah),a journey,"journey, way. ","From  (G4198) poreuomai; travel (by land); figuratively (plural) proceedings, i.e. Career -- journey(-ing), ways. see GREEK  (G4198) poreuomai "
g,4198,πορεύομαι,Verb,poreuomai,(por-yoo'-om-ahee),to go,"depart, go forth, walk. ","Middle voice from a derivative of the same as  (G3984) peira; to traverse, i.e. Travel (literally or figuratively; especially to remove (figuratively, die), live, etc.); --depart, go (away, forth, one's way, up), (make a, take a) journey, walk. see GREEK  (G3984) peira "
g,4199,πορθέω,Verb,portheó,(por-theh'-o),to destroy,"destroy, waste. ","Prolongation from pertho (to sack); to ravage (figuratively) -- destroy, waste. "
g,4200,"πορισμός, οῦ, ὁ","Noun, Masculine",porismos,(por-is-mos'),"a providing, a means of gain",gain. ,"From a derivative of poros (a way, i.e. Means); furnishing (procuring), i.e. (by implication) money-getting (acquisition) -- gain. "
g,4201,"Πόρκιος, ου, ὁ","Noun, Masculine",Porkios,(por'-kee-os),"Porcius (Festus), a governor of Judea",Porcius. ,"Of Latin origin; apparently swinish; Porcius, a Roman -- Porcius. "
g,4202,"πορνεία, ας, ἡ","Noun, Feminine",porneia,(por-ni'-ah),fornication,fornication. ,"From  (G4203) porneuo; harlotry (including adultery and incest); figuratively, idolatry -- fornication. see GREEK  (G4203) porneuo "
g,4203,πορνεύω,Verb,porneuó,(porn-yoo'-o),to commit fornication,commit fornication. ,"From  (G4204) porne; to act the harlot, i.e. (literally) indulge unlawful lust (of either sex), or (figuratively) practise idolatry -- commit (fornication). see GREEK  (G4204) porne "
g,4204,"πόρνη, ης, ἡ","Noun, Feminine",porné,(por'-nay),a prostitute,"prostitute, harlot","Feminine of  (G4205) pornos; a strumpet; figuratively, an idolater -- harlot, whore. see GREEK  (G4205) pornos "
g,4205,"πόρνος, ου, ὁ","Noun, Masculine",pornos,(por'-nos),a fornicator,"fornicator, whoremonger. ","From pernemi (to sell; akin to the base of  (G4097) piprasko); a (male) prostitute (as venal), i.e. (by analogy) a debauchee (libertine) -- fornicator, whoremonger. see GREEK  (G4097) piprasko "
g,4206,πόρρω,"Adverb; Adverb, Comparative",porró,(por'-rho),far off,"far, a great way off. ","Adverb from  (G4253) pro; forwards, i.e. At a distance -- far, a great way off. See also  (G4207) porrhothen. see GREEK  (G4253) pro see GREEK  (G4207) porrhothen "
g,4207,πόρρωθεν,Adverb,porróthen,(por'-rho-then),from afar,afar off. ,"From  (G4206) porrho with adverbial enclitic of source; from far, or (by implication) at a distance, i.e. Distantly -- afar off. see GREEK  (G4206) porrho "
g,4208,πορρωτέρω,Verb,porróteron,(por-rho-ter'-o),farther,farther. ,"Adverb comparative of  (G4206) porrho; further, i.e. A greater distance -- farther. see GREEK  (G4206) porrho "
