h,2470,חָלָה,Verb,chalah,(khaw-law'),to be weak or sick,"beseech, be diseased, put to grief, be grieved, be grievous, infirmity","A primitive root (compare (H2342) chuwl, (H2470) chalah, (H2490) chalal); properly, to be rubbed or worn; hence (figuratively) to be weak, sick, afflicted; or (causatively) to grieve, make sick; also to stroke (in flattering), entreat -- beseech, (be) diseased, (put to) grief, be grieved, (be) grievous, infirmity, intreat, lay to, put to pain, X pray, make prayer, be (fall, make) sick, sore, be sorry, make suit (X supplication), woman in travail, be (become) weak, be wounded. see HEBREW (H2342) chuwl see HEBREW (H2470) chalah see HEBREW (H2490) chalal "
h,2471,חַלָּה,Noun Feminine,challah,(khal-law'),a cake (a type used in offerings),cake ,From (H2490) chalal; a cake (as usually punctured) -- cake. see HEBREW (H2490) chalal
h,2472,חֲלוֹם,Noun Masculine,chalom,(khal-ome'),a dream,dreamer ,Or (shortened) chalom {khal-ome'}; from (H2492) chalam; a dream -- dream(-er). see HEBREW (H2492) chalam
h,2473,חֹלוֹן,Proper Name Location,Cholon,(kho-lone'),"a place in Moab, also a city in Judah",Holon ,"Or (shortened) Cholon {kho-lone'}; probably from (H2344) chowl; sandy; Cholon, the name of two places in Palestine -- Holon. see HEBREW (H2344) chowl "
h,2474,חַלּוֹן,Noun,challon,(khal-lone'),a window,window ,A window (as perforated) -- window.
h,2475,חֲלוֹף,Noun Masculine,chaloph,(khal-ofe'),"a passing away, vanishing",destruction ,"From (H2498) chalaph; properly, surviving; by implication (collectively) orphans -- X destruction. see HEBREW (H2498) chalaph "
h,2476,חֲלוּשָׁה,Noun Feminine,chalushah,(khal-oo-shaw'),"weakness, prostration",being overcome ,Feminine passive participle of (H2522) chalash; defeat -- being overcome. see HEBREW (H2522) chalash
h,2477,חֲלַח,Proper Name Location,Chalach,(khal-akh'),an area under Assyr. control,Halah ,"Probably of foreign origin; Chalach, a region of Assyria -- Halah. "
h,2478,חַלְחוּל,Proper Name Location,Chalchul,(khal-khool'),a city in Judah,Halhul ,"By reduplication from (H2342) chuwl; contorted; Chalchul, a place in Palestine -- Halhul. see HEBREW (H2342) chuwl "
h,2479,חַלְחָלָה,Noun Feminine,chalchalah,(khal-khaw-law'),anguish,"great, much pain ","Feminine from the same as (H2478) Chalchuwl; writhing (in childbirth); by implication, terror -- (great, much) pain. see HEBREW (H2478) Chalchuwl "
h,2480,חָלַט,Verb,chalat,(khaw-lat'),to catch,catch ,A primitive root; to snatch at -- catch.
h,2481,חֲלִי,Noun Masculine,chali,(khal-ee'),an ornament,"jewel, ornament ","From (H2470) chalah; a trinket (as polished) -- jewel, ornament. see HEBREW (H2470) chalah "
h,2482,חֲלִי,Proper Name Location,Chali,(khal-ee'),a place in Asher,Hali ,"The same as (H2481) chaliy; Chali, a place in Palestine -- Hali. see HEBREW (H2481) chaliy "
h,2483,חֱלִי,Noun Masculine,choli,(khol-ee'),sickness,"disease, grief, is sickness ","From (H2470) chalah; malady, anxiety, calamity -- disease, grief, (is) sick(-ness). see HEBREW (H2470) chalah "
h,2484,חֶלְיָה,Noun Feminine,chelyah,(khel-yaw'),jewelry,jewel ,Feminine of (H2481) chaliy; a trinket -- jewel. see HEBREW (H2481) chaliy
h,2485,חָלִיל,Noun Masculine,chalil,(khaw-leel'),"flute, pipe",pipe ,From (H2490) chalal; a flute (as perforated) -- pipe. see HEBREW (H2490) chalal
h,2486,חָלִילָה,Interjection,chalilah,(khaw-lee'-law),far be it!,"be far, God forbid ","Or chalilah {khaw-lee'-law}; a directive from (H2490) chalal; literal for a profaned thing; used (interj.) Far be it! -- be far, (X God) forbid. see HEBREW (H2490) chalal "
h,2487,חלִיפָה,Noun Feminine,chaliphah,(khal-ee-faw'),a change,"change, course ","From (H2498) chalaph; alternation -- change, course. see HEBREW (H2498) chalaph "
h,2488,חֲלִיצָה,Noun Feminine,chalitsah,(khal-ee-tsaw'),what is stripped off (a person),armour ,From (H2503) Chelets; spoil -- armour. see HEBREW (H2503) Chelets
h,2489,חֵלְכָא,Adjective,chelekah,(khay-lek-aw'),"hapless, unfortunate",poor ,"Or chelkah {khay-lek-aw'}; apparently from an unused root probably meaning to be dark or (figuratively) unhappy; a wretch, i.e. Unfortunate -- poor. "
h,2490,חָלַל,Verb,chalal,(khaw-lal'),"to bore, pierce","begin men began, defile, break, defile, eat as common things","A primitive root (compare (H2470) chalah); properly, to bore, i.e. (by implication) to wound, to dissolve; figuratively, to profane (a person, place or thing), to break (one's word), to begin (as if by an \""opening wedge\""); denom. (from (H2485) chaliyl) to play (the flute) -- begin (X men began), defile, X break, defile, X eat (as common things), X first, X gather the grape thereof, X take inheritance, pipe, player on instruments, pollute, (cast as) profane (self), prostitute, slay (slain), sorrow, stain, wound. see HEBREW (H2470) chalah see HEBREW (H2485) chaliyl "
h,2491,חָלָל,noun masculine; Adjective,chalal,(khaw-lawl'),pierced,"kill, profane, slain man, slew, deadly wounded ","From (H2490) chalal; pierced (especially to death); figuratively, polluted -- kill, profane, slain (man), X slew, (deadly) wounded. see HEBREW (H2490) chalal "
h,2492,חָלַם,Verb,chalam,(khaw-lam'),to be healthy or strong,"cause to dreamer, be in good liking, recover ","A primitive root; properly, to bind firmly, i.e. (by implication) to be (causatively to make) plump; also (through the figurative sense of dumbness) to dream -- (cause to) dream(-er), be in good liking, recover. "
h,2493,חֵלֶם,Noun Masculine,chelem,(khay'-lem),a dream,dream ,(Aramaic) from a root corresponding to (H2492) chalam; a dream -- dream. see HEBREW (H2492) chalam
h,2494,חֵלֶם,Proper Name Masculine,Chelem,(khay'lem),"strength, an Israelite",Helem ,"From (H2492) chalam; a dream; Chelem, an Israelite -- Helem. Compare (H2469) Chelday. see HEBREW (H2492) chalam see HEBREW (H2469) Chelday "
h,2495,חַלָּמוּת,Noun Masculine,challamuth,(khal-law-mooth'),"(a plant), probably a purslane",egg ,From (H2492) chalam (in the sense of insipidity); probably purslain -- egg. see HEBREW (H2492) chalam
h,2496,חַלָּמִישׁ,Noun Masculine,challamish,(klal-law-meesh'),flint,"flinty, rock ","Probably from (H2492) chalam (in the sense of hardness); flint -- flint(-y), rock. see HEBREW (H2492) chalam "
h,2497,חֵלןֹ,Proper Name Masculine,Chelon,(khay-lone'),a man of Zebulon,Helon ,"From (H2428) chayil; strong; Chelon, an Israelite -- Helon. see HEBREW (H2428) chayil "
h,2498,חָלַף,Verb,chalaph,(khaw-laf'),"to pass on or away, pass through","abolish, alter, change, cut off, go on forward, grow up, be over, pass away, ","A primitive root; properly, to slide by, i.e. (by implication) to hasten away, pass on, spring up, pierce or change -- abolish, alter, change, cut off, go on forward, grow up, be over, pass (away, on, through), renew, sprout, strike through. "
h,2499,חֲלַף,Verb,chalaph,(khal-af'),to pass (over),pass ,(Aramaic) corresponding to (H2498) chalaph; to pass on (of time) -- pass. see HEBREW (H2498) chalaph
h,2500,חֵלֶף,noun masculine,cheleph,(klay'-lef),an exchange,for ,"From (H2498) chalaph; properly, exchange; hence (as preposition) instead of -- X for. see HEBREW (H2498) chalaph "
h,2501,חֶלֶף,Proper Name Location,Cheleph,(kheh'lef),a place in Naphtali,Heleph ,"The same as (H2500) cheleph; change; Cheleph, a place in Palestine -- Heleph. see HEBREW (H2500) cheleph "
h,2502,חָלַץ,Verb,chalats,(khaw-lats'),"to draw off or out, withdraw","arm self, go, ready armed man, soldier, deliver, draw out, make fat, loose, ","A primitive root; to pull off; hence (intensively) to strip, (reflex.) To depart; by implication, to deliver, equip (for fight); present, strengthen -- arm (self), (go, ready) armed (X man, soldier), deliver, draw out, make fat, loose, (ready) prepared, put off, take away, withdraw self. "
h,2503,חֶלֶץ,Proper Name Masculine,Chelets,(kheh'-lets),two Israelites,Helez ,"Or Chelets {khay'-lets; from (H2502) chalats; perhaps, strength; Chelets, the name of two Israelites -- Helez. see HEBREW (H2502) chalats "
h,2504,חָלָץ,Noun Feminine; noun Masculine,chalats,(khaw-lawts'),loins,"loins, reins ","From (H2502) chalats (in the sense of strength); only in the dual; the loins (as the seat of vigor) -- loins, reins. see HEBREW (H2502) chalats "
h,2505,חָלַק,Verb,chalaq,(khaw-lak'),"to divide, share","deal, distribute, divide, flatter, give, have, imparter, take away a portion, ","A primitive root; to be smooth (figuratively); by implication (as smooth stones were used for lots) to apportion or separate -- deal, distribute, divide, flatter, give, (have, im-)part(-ner), take away a portion, receive, separate self, (be) smooth(-er). "
h,2506,חֵלֶק,Noun Masculine,cheleq,(khay'lek),"portion, tract, territory","flattery, inheritance, part, partake, portion ","From (H2505) chalaq; properly, smoothness (of the tongue); also an allotment -- flattery, inheritance, part, X partake, portion. see HEBREW (H2505) chalaq "
h,2507,חֵלֶק,Proper Name Masculine,Cheleq,(khay'-lek),a Gileadite,Helek ,"The same as (H2506) cheleq; portion; Chelek, an Israelite -- Helek. see HEBREW (H2506) cheleq "
h,2508,חֲלָק,Noun Masculine,chalaq,(khal-awk'),"portion, possession",portion ,(Aramaic) from a root corresponding to (H2505) chalaq; a part -- portion. see HEBREW (H2505) chalaq
h,2509,חָלָק,Adjective,chalaq,(khaw-lawk'),smooth,"flattering, smooth ","From (H2505) chalaq; smooth (especially of tongue) -- flattering, smooth. see HEBREW (H2505) chalaq "
h,2510,חָלָק,Proper Name Location,Chalaq,(khaw-lawk'),"smooth, a mountain South of the Dead Sea",Halak ,"The same as (H2509) chalaq; bare; Chalak, a mountain of Idumaea -- Halak. see HEBREW (H2509) chalaq "
h,2511,חַלָּק,Noun Masculine,challaq,(khal-lawk'),smooth ,smooth ,From (H2505) chalaq; smooth -- smooth. see HEBREW (H2505) chalaq
h,2512,חַלֻּק,Noun Masculine,challuq,(khal-look'),smooth,smooth ,From (H2505) chalaq; smooth -- smooth. see HEBREW (H2505) chalaq
h,2513,חֶלְקָה,Noun Feminine,chelqah,(khel-kaw'),a portion (of ground),"field, ground, parcel, part, piece of land ground, plat, portion, ","Feminine of (H2506) cheleq; properly, smoothness; figuratively, flattery; also an allotment -- field, flattering(-ry), ground, parcel, part, piece of land (ground), plat, portion, slippery place, smooth (thing). see HEBREW (H2506) cheleq "
h,2514,חֲלַקָּה,Noun Feminine,chalaqqah,(khal-ak-kaw'),"smoothness, flattery",flattery ,Feminine from (H2505) chalaq; flattery -- flattery. see HEBREW (H2505) chalaq
h,2515,חֲלֻקָּה,Noun Feminine,chaluqqah,(khal-ook-kaw'),"part, portion",division ,Feminine of (H2512) challuq; a distribution -- division. see HEBREW (H2512) challuq
h,2516,חֶלְקִי,Noun Masculine,Chelqi,(khel-kee'),descendant of Helek,Helkites ,Patronymically from (H2507) Cheleq; a Chelkite or descendant of Chelek -- Helkites. see HEBREW (H2507) Cheleq
h,2517,חֶלְקַי,Proper Name Masculine,Chelqay,(khel-kah'ee),an Israelite priest,Helkai ,"From (H2505) chalaq; apportioned; Chelkai, an Israelite -- Helkai. see HEBREW (H2505) chalaq "
h,2518,חִלְקִיָּה,Proper Name Masculine,Chilqiyyahu or Chilqiyyah,(khil-kee-yaw'),"my portion is Yah, the name of several Israelites",Hillkiah ,"Or Chilqiyahuw {khil-kee-yaw'-hoo}'from (H2506) cheleq and (H3050) Yahh; portion of Jah; {Chilhijah, the name of eight Israelites -- Hillkiah. see HEBREW (H2506) cheleq see HEBREW (H3050) Yahh "
h,2519,חֲלַקְלַקָּה,Noun Feminine,chalaqlaqqoth,(khal-ak-lak-kaw'),smoothness,"flattery, slippery ","By reduplication from (H2505) chalaq; properly, something very smooth; i.e. A treacherous spot; figuratively, blandishment -- flattery, slippery. see HEBREW (H2505) chalaq "
h,2520,חֶלְקַת,Proper Name Location,Chelqath,(khel-kath'),"portion, possession, a city in Asher",Helkath ,"A form of (H2513) chelqah; smoothness; Chelkath, a place in Palestine -- Helkath. see HEBREW (H2513) chelqah "
h,2521,חֶלְקַת הַצֻּרִים,Proper Name Location,Chelqath Hatstsurim,(khel-kath' hats-tsoo-reem'),a place near the pool of Gibeon,Helkath-hazzurim ,"From (H2520) Chelqath and the plural of (H6697) tsuwr, with the article inserted; smoothness of the rocks; Chelkath Hats-tsurim, a place in Palestine -- Helkath-hazzurim. see HEBREW (H2520) Chelqath see HEBREW (H6697) tsuwr "
h,2522,חָלַשׁ,Verb,chalash,(khaw-lash'),to be weak or prostrate,"discomfit, waste away, weaken ","A primitive root; to prostrate; by implication, to overthrow, decay -- discomfit, waste away, weaken. "
h,2523,חַלָּשׁ,Adjective,challash,(khal-lawsh'),weak,weak ,From (H2522) chalash; frail -- weak. see HEBREW (H2522) chalash
h,2524,חָם,Noun Masculine,cham,(khawm),husband\'s father,father in law ,From the same as (H2346) chowmah; a father-in-law (as in affinity) -- father in law. see HEBREW (H2346) chowmah
h,2525,חָם,Adjective,cham,(khawm),hot,"hot, warm ","From (H2552) chamam; hot -- hot, warm. see HEBREW (H2552) chamam "
h,2526,חָם,"proper name, masculine person; location",Cham,(khawm),"a son of Noah, also his desc., also a name for Egyptians",Ham ,"The same as (H2525) cham; hot (from the tropical habitat); Cham, a son of Noah; also (as a patronymic) his descendants or their country -- Ham. see HEBREW (H2525) cham "
h,2527,חֹם,Noun Masculine,chom,(khome),heat,"heat, to be hot warm ","From (H2552) chamam; heat -- heat, to be hot (warm). see HEBREW (H2552) chamam "
h,2528,חֱמָא,Noun Feminine,chema,(khem-aw'),a rage,fury ,(Aramaic) or chamah (Aramaic) {kham-aw'}; corresponding to (H2534) chemah; anger -- fury. see HEBREW (H2534) chemah
h,2529,חֶמְאָה,Noun Feminine,chemah,(khem-aw'),curd,butter ,Or (shortened) chemah {khay-maw'}; from the same root as (H2346) chowmah; curdled milk or cheese -- butter. see HEBREW (H2346) chowmah
h,2530,חָמַד,Verb,chamad,(khaw-mad'),"to desire, take pleasure in","beauty, greatly beloved, covet, delectable thing, great delight, desire, lust, ","A primitive root; to delight in -- beauty, greatly beloved, covet, delectable thing, (X great) delight, desire, goodly, lust, (be) pleasant (thing), precious (thing). "
h,2531,חֶמֶד,Noun Masculine,chemed,(kheh'-med),"desire, delight","desirable, pleasant ","Om (H2530) chamad; delight -- desirable, pleasant. see HEBREW (H2530) chamad "
h,2532,חֶמְדָּה,noun feminine,chemdah,(khem-daw'),"desire, delight","desire, goodly, pleasant, precious ","Feminine of (H2531) chemed; delight -- desire, goodly, pleasant, precious. see HEBREW (H2531) chemed "
h,2533,חֶמְדָּן,Proper Name Masculine,Chemdan,(khem-dawn'),an Edomite,Hemdan ,"From (H2531) chemed; pleasant; Chemdan, an Idumaean -- Hemdan. see HEBREW (H2531) chemed "
h,2534,חֵמָה,Noun Feminine,chemah,(khay-maw'),"heat, rage","anger, bottles, hot displeasure, furiously heat, indignation, poison, rage, wrath ful","Or (Dan. 11:44) chemac {khay-maw'}; from (H3179) yacham; heat; figuratively, anger, poison (from its fever) -- anger, bottles, hot displeasure, furious(-ly, -ry), heat, indignation, poison, rage, wrath(- ful). See (H2529) chem'ah. see HEBREW (H3179) yacham see HEBREW (H2529) chem'ah "
h,2535,חַמָּה,Noun Feminine,chammah,(kham-maw'),"heat, sun","heat, sun ","From (H2525) cham; heat; by implication, the sun -- heat, sun. see HEBREW (H2525) cham "
h,2536,חַמּוּאֵל,Proper Name Masculine,Chammuw\'el,(kham-moo-ale'),"anger of God, a Simeonite",Hamuel ,"From (H2535) chammah and (H410) 'el; anger of God; Chammuel, an Israelite -- Hamuel. see HEBREW (H2535) chammah see HEBREW (H410) 'el "
h,2537,חֲמוּטַל,Proper Name Feminine,Chamutal,(kham-oo-tal'),"perhaps ""my husband\'s father is the dew"", mother of two kings of Judah",Hamutal ,"Or Chamiytal {kham-ee-tal'}; from (H2524) cham and (H2919) tal; father-in-law of dew; Chamutal or Chamital, an Israelitess -- Hamutal. see HEBREW (H2524) cham see HEBREW (H2919) tal "
h,2538,חָמוּל,Proper Name Masculine,Chamul,(khaw-mool'),"spared, grandson of Judah",Hamul ,"From (H2550) chamal; pitied; Chamul, an Israelite -- Hamul. see HEBREW (H2550) chamal "
h,2539,חָמוּלִי,Noun Masculine,Chamuli,(khaw-moo-lee'),descendant of Hamul,Hamulites ,Patronymically from (H2538) Chamuwl: a Chamulite (collectively) or descendants of Chamul -- Hamulites. see HEBREW (H2538) Chamuwl
h,2540,חַמּוֹן,Proper Name Location,Chammon,(kham-mone'),"hot (spring), two cities, one in Asher and one in Naphtali",Hammon ,"From (H2552) chamam; warm spring; Chammon, the name of two places in Palestine -- Hammon. see HEBREW (H2552) chamam "
h,2541,חָמוֹץ,Noun Masculine,chamots,(khaw-motse'),the ruthless (ones),oppressed ,"From (H2556) chamets; properly, violent; by implication, a robber -- oppressed. see HEBREW (H2556) chamets "
h,2542,חַמּוּק,Noun Masculine,chammuq,(kham-mook'),"curving, curve",joints ,"From (H2559) chamaq; a wrapping, i.e. Drawers -- joints. see HEBREW (H2559) chamaq "
h,2543,חֲמוֹר,Noun Masculine,chamor,(kham-ore'),a male ass,he-ass ,Or (shortened) chamor {kham-ore}; from (H2560) chamar; a male ass (from its dun red) -- (he)ass. see HEBREW (H2560) chamar
h,2544,חֲמוֹר,Proper Name Masculine,Chamor,(kham-ore'),father of Shechem,Hamor ,"The same as (H2543) chamowr; donkey; Chamor, a Canaanite -- Hamor. see HEBREW (H2543) chamowr "
h,2545,חֲמוֹת,Noun Feminine,chamoth,(kham-oth'),husband\'s mother,mother in law ,Or (shortened) chamoth {kham-oth'}; feminine of (H2524) cham; a mother-in-law -- mother in law. see HEBREW (H2524) cham
h,2546,חֹמֶט,Noun Masculine,chomet,(kho'met),(a kind of) lizard,snail ,"From an unused root probably meaning, to lie low; a lizard (as creeping) -- snail. "
h,2547,חֻמְטָה,Proper Name Location,Chumtah,(khoom-taw'),a city in Judah,Humtah ,"Feminine of (H2546) chomet; low; Chumtah, a place in Palestine -- Humtah. see HEBREW (H2546) chomet "
h,2548,חָמִיץ,Adjective,chamits,(khaw-meets'),seasoned (with salt),clean ,"From (H2556) chamets; seasoned, i.e. Salt provender -- clean. see HEBREW (H2556) chamets "
h,2549,חֲמִישִׁי,Adjective,chamishi,(kham-ee-shee'),fifth,fifth part ,Or chamishshiy {kham-ish-shee'}; ord. From (H2568) chamesh; fifth; also a fifth -- fifth (part). see HEBREW (H2568) chamesh
h,2550,חָמַל,Verb,chamal,(khaw-mal'),to spare,"have compassion, have pity, spare ","A primitive root; to commiserate; by implication, to spare -- have compassion, (have) pity, spare. "
h,2551,חֶמְלָה,Noun Feminine,chemlah,(khem-law'),"compassion, mercy","merciful, pity ","From (H2550) chamal; commiseration -- merciful, pity. see HEBREW (H2550) chamal "
h,2552,חָמַם,Verb,chamam,(khaw-mam'),to be or become warm,"enflame self, get have heat, be wax hot, be, wax warm self, at ","A primitive root; to be hot (literally or figuratively) -- enflame self, get (have) heat, be (wax) hot, (be, wax) warm (self, at). "
h,2553,חַמָּן,Noun Masculine,chamman,(kham-mawn'),a sun pillar,"idol, image ","From (H2535) chammah; a sun-pillar -- idol, image. see HEBREW (H2535) chammah "
h,2554,חָמַס,Verb,chamas,(khaw-mas'),to treat violently or wrong,"make bare, shake off, violate, do violence, take away violently, wrong","A primitive root; to be violent; by implication, to maltreat -- make bare, shake off, violate, do violence, take away violently, wrong, imagine wrongfully. "
h,2555,חָמָס,Noun Masculine,chamas,(khaw-mawce'),"violence, wrong","cruelty, damage, false, injustice, oppressor, unrighteous, violence against, done, ","From (H2554) chamac; violence; by implication, wrong; by meton. Unjust gain -- cruel(-ty), damage, false, injustice, X oppressor, unrighteous, violence (against, done), violent (dealing), wrong. see HEBREW (H2554) chamac "
h,2556,חָמֵץ,Verb,chamets,(khaw-mates'),to be sour or leavened,"cruel man, dyed, be grieved, leavened ","A primitive root; to be pungent; i.e. In taste (sour, i.e. Literally fermented, or figuratively, harsh), in color (dazzling) -- cruel (man), dyed, be grieved, leavened. "
h,2557,חָמֵץ,Noun Masculine,chamets,(khaw-mates'),that which is leavened,"leaven, leavened bread ","From (H2556) chamets; ferment, (figuratively) extortion -- leaven, leavened (bread). see HEBREW (H2556) chamets "
h,2558,חֹמֶץ,Noun Masculine,chomets,(kho'-mets),vinegar,vinegar ,From (H2556) chamets; vinegar -- vinegar. see HEBREW (H2556) chamets
h,2559,חָמַק,Verb,chamaq,(khaw-mak'),to turn away,"go about, withdraw self ","A primitive root; properly, to wrap; hence, to depart (i.e. Turn about) -- go about, withdraw self. "
h,2560,חָמַר,Verb,chamar,(khaw-mar'),"to ferment, boil or foam up","daub, befoul, be red, trouble ","A primitive root; properly, to boil up; hence, to ferment (with scum); to glow (with redness); as denominative (from (H2564) chemar) to smear with pitch -- daub, befoul, be red, trouble. see HEBREW (H2564) chemar "
h,2561,חֶמֶר,Noun Masculine,chemer,(kheh'-mer),wine,"pure, red wine ","From (H2560) chamar; wine (as fermenting) -- X pure, red wine. see HEBREW (H2560) chamar "
h,2562,חֲמַר,Noun Masculine,chamar,(kham-ar'),wine,wine ,(Aramaic) corresponding to (H2561) chemer; wine -- wine. see HEBREW (H2561) chemer
h,2563,חֹמֶר,Noun Masculine,chomer,(kho'mer),"cement, mortar, clay","clay, heap, homer, mire, motion ","From (H2560) chamar; properly, a bubbling up, i.e. Of water, a wave; of earth, mire or clay (cement); also a heap; hence, a chomer or dry measure -- clay, heap, homer, mire, motion. see HEBREW (H2560) chamar "
h,2564,חֵמָר,Noun Masculine,chemar,(khay-mawr'),"bitumen, asphalt",slimepit ,From (H2560) chamar; bitumen (as rising to the surface) -- slime(-pit). see HEBREW (H2560) chamar
h,2565,חֲמֹרָה,Noun Masculine,chamorah or chamor,(kham-o-raw'),a heap,heap ,From (H2560) chamar (compare (H2563) chomer); a heap -- heap. see HEBREW (H2560) chamar see HEBREW (H2563) chomer
h,2566,חַמְרָן,Proper Name Masculine,Chamran,(kham-rawn'),a descendant of Esau,Amran ,"From (H2560) chamar; red; Chamran, an Idumaean -- Amran. see HEBREW (H2560) chamar "
h,2567,חָמַשׁ,Verb,chamash,(khaw-mash'),to take the fifth part,take up the fifth participle ,A denominative from (H2568) chamesh; to tax a fifth -- take up the fifth participle see HEBREW (H2568) chamesh
h,2568,חָמֵשׁ,Noun,chamesh or chamishshah,(khaw-maysh'),five,"fifteen, fifth, five apiece ","Masculine chamishshah {kham-ish-shaw}; a primitive numeral; five -- fif(-teen), fifth, five (X apiece). "
h,2569,חֹמֶשׁ,Noun Masculine,chomesh,(kho'-mesh),fifth part,fifth participle ,From (H2567) chamash; a fifth tax -- fifth participle see HEBREW (H2567) chamash
h,2570,חֹמֶשׁ,Noun Masculine,chomesh,(kho'-mesh),belly,fifth rib ,"From an unused root probably meaning, to be stout; the abdomen (as obese) -- fifth (rib). "
h,2571,חָמֻשׁ,Adjective,chamushim,(khaw-moosh'),in battle array,"armed men, harnessed ","Passive participle of the same as (H2570) chomesh; staunch, i.e. Able-bodied soldiers -- armed (men), harnessed. see HEBREW (H2570) chomesh "
h,2572,חֲמִשִּׁים,noun plural,chamishshim,(kham-ish-sheem'),fifty,fifty ,Multiple of (H2568) chamesh; fifty -- fifty. see HEBREW (H2568) chamesh
h,2573,חֵמֶת,Noun Masculine,chemeth,(klay'-meth),a water skin,bottle ,From the same as (H2346) chowmah; a skin bottle (as tied up) -- bottle. see HEBREW (H2346) chowmah
h,2574,חֲמָת,"proper name, of a location",Chamath,(kham-awth'),a place North of Damascus,"Hamath, Hemath ","From the same as (H2346) chowmah; walled; Chamath, a place in Syria -- Hamath, Hemath. see HEBREW (H2346) chowmah "
h,2575,חַמַּת,Proper Name Location,Chammath,(klam-math'),"hot (spring), a city in Naphtali",Hammath ,"A variation for the first part of (H2576) Chammoth Do'r; hot springs; Chammath, a place in Palestine -- Hammath. see HEBREW (H2576) Chammoth Do'r "
h,2576,חַמֹּת דֹּאר,Proper Name Location,Chammoth Dor,(kham-moth' dore),a Levitical city in Naphtali,Hamath-Dor ,"From the plural of (H2535) chammah and (H1756) Dowr; hot springs of Dor; Chammath-Dor, a place in Palestine -- Hamath-Dor. see HEBREW (H2535) chammah see HEBREW (H1756) Dowr "
h,2577,חֲמָתִי,Noun Masculine,Chamathi,(kham-aw-thee'),descendant of Canaan,Hamathite ,Patrial from (H2574) Chamath; a Chamathite or native of Chamath -- Hamathite. see HEBREW (H2574) Chamath
h,2578,חֲמַת צוֹבָה,Proper Name Location,Chamath Tsobah,(kham-ath' tso-baw'),a place North of Damascus,Hamath-Zobah ,From (H2574) Chamath and (H6678) Tsowba'; Chamath of Tsobah; Chamath-Tsobah; probably the same as (H2574) Chamath -- Hamath-Zobah. see HEBREW (H2574) Chamath see HEBREW (H6678) Tsowba' see HEBREW (H2574) Chamath
h,2579,חֲמַת רַבָּה,Proper Name Location,Chamath Rabbah,(kham-ath' rab-baw'),Chamath-Rabbah ,Chamath-Rabbah ,"From (H2574) Chamath and (H7237) Rabbah; Chamath of Rabbah; Chamath-Rabbah, probably the same as (H2574) Chamath. see HEBREW (H2574) Chamath see HEBREW (H7237) Rabbah see HEBREW (H2574) Chamath "
h,2580,חֵן,Noun Masculine,chen,(khane),"favor, grace","favor, gracious, pleasant, precious, well-favored ","From (H2603) chanan; graciousness, i.e. Subjective (kindness, favor) or objective (beauty) -- favour, grace(-ious), pleasant, precious, (well-)favoured. see HEBREW (H2603) chanan "
h,2581,חֵן,Proper Name Masculine,Chen,(khane),"favor, a contemporary of Zerubbabel",Hen ,"The same as (H2580) chen; grace; Chen, a figurative name for an Israelite -- Hen. see HEBREW (H2580) chen "
