h,2243,חֹב,Noun Masculine,chob,(khobe),bosom,bosom ,"By contraction from (H2245) chabab; properly, a cherisher, i.e. The bosom -- bosom. see HEBREW (H2245) chabab "
h,2244,חָבָא,Verb,chaba,(khaw-baw'),"to withdraw, hide","held, hide self, do secretly ","A primitive root (compare (H2245) chabab); to secrete -- X held, hide (self), do secretly. see HEBREW (H2245) chabab "
h,2245,חָבַב,Verb,chabab,(khaw-bab'),to love,love ,"A primitive root (compare (H2244) chaba', (H2247) chabah); properly, to hide (as in the bosom), i.e. To cherish (with affection) -- love. see HEBREW (H2244) chaba' see HEBREW (H2247) chabah "
h,2246,חֹבָב,Proper Name Masculine,Chobab,(kho-bawb'),father-in-law of Moses,Hobab ,"From (H2245) chabab; cherished; Chobab, father-in-law of Moses -- Hobab. see HEBREW (H2245) chabab "
h,2247,חָבָה,Verb,chabah,(khaw-bah'),"to withdraw, hide",hide self ,A primitive root (compare (H2245) chabab); to secrete -- hide (self). see HEBREW (H2245) chabab
h,2248,חֲבוּלָה,Noun Masculine,chabula,(khab-oo-law'),"a hurtful act, crime",hurt ,"(Aramaic) from (H2255) chabal; properly, overthrown, i.e. (morally) crime -- hurt. see HEBREW (H2255) chabal "
h,2249,חָבוֹר,Proper Name Location,Chabor,(khaw-bore'),a river of Assyr,Habor ,"From (H2266) chabar; united; Chabor, a river of Assyria -- Habor. see HEBREW (H2266) chabar "
h,2250,חַבּוּרָה,Noun Feminine,chabburah,(khab-boo-raw'),"a stripe, blow","blueness, bruise, hurt, stripe, wound ","Or chabburah {khab-boo-raw'}; or chaburah {khab-oo-raw'}; from (H2266) chabar; properly, bound (with stripes), i.e. A weal (or black-and-blue mark itself) -- blueness, bruise, hurt, stripe, wound. see HEBREW (H2266) chabar "
h,2251,חָבַט,Verb,chabat,(khaw-bat'),"to beat off, beat out","beat off, out, thresh ","A primitive root; to knock out or off -- beat (off, out), thresh. "
h,2252,חֲבַיָּה,Proper Name Masculine,Chabayah,(khab-ah-yaw'),"Yah has hidden, an Israelite",Habaiah ,"Or Chabayah {khab-aw-yaw'}; from (H2247) chabah and (H3050) Yahh; Jah has hidden; Chabajah, an Israelite -- Habaiah. see HEBREW (H2247) chabah see HEBREW (H3050) Yahh "
h,2253,חֶבְיוֹן,Noun Masculine,chebyon,(kheb-yone'),"a hiding, hiding place",hiding ,From (H2247) chabah; a concealment -- hiding. see HEBREW (H2247) chabah
h,2254,חָבַל,Verb,chabal,(khaw-bal'),"to bind, pledge","band, bring forth, deal corruptly, destroy, offend, spoil, ","A primitive root; to wind tightly (as a rope), i.e. To bind; specifically, by a pledge; figuratively, to pervert, destroy; also to writhe in pain (especially of parturition) -- X at all, band, bring forth, (deal) corrupt(-ly), destroy, offend, lay &? To (take a) pledge, spoil, travail, X very, withhold. "
h,2255,חֲבַל,Verb,chabal,(khab-al'),"to destroy, hurt","destroy, hurt ","(Aramaic) corresponding to (H2254) chabal; to ruin -- destroy, hurt. see HEBREW (H2254) chabal "
h,2256,חֶבֶל,Noun Masculine,chebel,(kheh'-bel),"cord, territory, band","band, coast, company, cord, country, destruction, line, lot, ","Or chebel {khay'-bel}; from (H2254) chabal; a rope (as twisted), especially a measuring line; by implication, a district or inheritance (as measured); or a noose (as of cords); figuratively, a company (as if tied together); also a throe (especially of parturition); also ruin -- band, coast, company, cord, country, destruction, line, lot, pain, pang, portion, region, rope, snare, sorrow, tackling. see HEBREW (H2254) chabal "
h,2257,חֲבַל,Noun Masculine,chabal,(khab-al'),"a hurt, injury","damage, hurt ","(Aramaic) from (H2255) chabal; harm (personal or pecuniary) -- damage, hurt. see HEBREW (H2255) chabal "
h,2258,חֲבֹל,Noun Masculine,chabol,(khab-ole'),a pledge,pledge ,Or (feminine) chabolah {khab-o-law'}; from (H2254) chabal; a pawn (as security for debt) -- pledge. see HEBREW (H2254) chabal
h,2259,חֹבֵל,Noun Masculine,chobel,(kho-bale'),sailor,"pilot, shipmaster ","Active participle from (H2254) chabal (in the sense of handling ropes); a sailor -- pilot, shipmaster. see HEBREW (H2254) chabal "
h,2260,חִבֵּל,Noun Masculine,chibbel,(khib-bale'),probably a mast,mast ,From (H2254) chabal (in the sense of furnished with ropes); a mast -- mast. see HEBREW (H2254) chabal
h,2261,חֲבַצֶּלֶת,Noun Feminine,chabatstseleth,(khab-ats-tseh'-leth),meadow saffron or crocus,rose ,Of uncertain derivation; probably meadow-saffron -- rose.
h,2262,חֲבַצַּנְיָה,Proper Name Masculine,Chabatstsanyah,(khab-ats-tsan-yaw'),a Rechabite,Habazaniah ,"Of uncertain derivation; Chabatstsanjah, a Rechabite -- Habazaniah. "
h,2263,חָבַק,Verb,chabaq,(khaw-bak'),"to clasp, embrace","embrace, fold ","A primitive root; to clasp (the hands or in embrace) -- embrace, fold. "
h,2264,חִבֻּק,Noun Masculine,chibbuq,(khib-book'),"a clasping, folding (of the hands)",fold ,From (H2263) chabaq; a clasping of the hands (in idleness) -- fold. see HEBREW (H2263) chabaq
h,2265,חֲבַקּוּק,Proper Name Masculine,Chabaqquq,(khab-ak-kook'),a Hebrew prophet,Habakkuk ,"By reduplication from (H2263) chabaq; embrace; Chabakkuk, the prophet -- Habakkuk. see HEBREW (H2263) chabaq "
h,2266,חָבַר,Verb,chabar,(khaw-bar'),"to unite, be joined, to tie a magic knot or spell, to charm","compact, couple together, have fellowship with, heap up, join self, together, league","A primitive root; to join (literally or figuratively); specifically (by means of spells) to fascinate -- charm(- er), be compact, couple (together), have fellowship with, heap up, join (self, together), league. "
h,2267,חֶבֶר,Noun Masculine,cheber,(kheh'-ber),"company, association, spell","charmer company, enchantment, wide ","From (H2266) chabar; a society; also a spell -- + charmer(- ing), company, enchantment, X wide. see HEBREW (H2266) chabar "
h,2268,חֶבֶר,Proper Name Masculine,Cheber,(kheh'-ber),"a Kenite, also several Israelites",Heber ,"The same as (H2267) cheber; community; Cheber, the name of a Kenite and of three Israelites -- Heber. see HEBREW (H2267) cheber "
h,2269,חֲבַר,Noun Masculine,chabar,(khab-ar'),"fellow, comrade","companion, fellow ","(Aramaic) from a root corresponding to (H2266) chabar; an associate -- companion, fellow. see HEBREW (H2266) chabar "
h,2270,חָבֵר,Adjective; noun masculine; noun; feminine,chaber,(khaw-bare'),"united, associate, companion","companion, fellow, knit together ","From (H2266) chabar; an associate -- companion, fellow, knit together. see HEBREW (H2266) chabar "
h,2271,חַבָּר,Noun Masculine,chabbar,(khab-bawr'),"associate, partner (in a trade)",companion ,From (H2266) chabar; a partner -- companion. see HEBREW (H2266) chabar
h,2272,חֲבַרְבֻּרָה,Noun Feminine,chabarburah,(khab-ar-boo-raw'),"stripe, mark",spot ,"By reduplication from (H2266) chabar; a streak (like a line), as on the tiger -- spot. see HEBREW (H2266) chabar "
h,2273,חַבְרָה,Noun Feminine,chabrah,(khab-raw'),a fellow,other ,(Aramaic) feminine of (H2269) chabar; an associate -- other. see HEBREW (H2269) chabar
h,2274,חֶבְרָה,Noun Feminine,chebrah,(kheb-raw'),"association, company",company ,Feminine of (H2267) cheber; association -- company. see HEBREW (H2267) cheber
h,2275,חֶבְרוֹן,"proper name, of a location; proper name, masculine",Chebrown,(kheb-rone'),"association, league, a city in S. Judah",Hebron ,"From (H2267) cheber; seat of association; Chebron, a place in Palestine, also the name of two Israelites -- Hebron. see HEBREW (H2267) cheber "
h,2276,חֶבְרוֹנִי,Noun Masculine,Chebroni,(kheb-ro-nee'),inhab. of Hebron,Hebronites ,"Or Chebroniy {kheb-ro-nee'}; patronymically from (H2275) Chebrown; Chebronite (collectively), an inhabitant of Chebron -- Hebronites. see HEBREW (H2275) Chebrown "
h,2277,חֶבְרִי,Noun Masculine,Chebri,(kheb-ree'),descendant of Heber,Heberites ,Patronymically from (H2268) Cheber; a Chebrite (collectively) or descendants of Cheber -- Heberites. see HEBREW (H2268) Cheber
h,2278,חֲבֶרֶת,Noun Feminine,chabereth,(khab-eh'-reth),consort,companion ,Feminine of (H2270) chaber; a consort -- companion. see HEBREW (H2270) chaber
h,2279,חֹבֶרֶת,Noun Feminine,chobereth,(kho-beh'-reth),a thing that joins or is joined,"which couples, coupling ","Feminine active participle of (H2266) chabar; a joint -- which coupleth, coupling. see HEBREW (H2266) chabar "
h,2280,חָבַשׁ,Verb,chabash,(khaw-bash'),"to bind, bind on, bind up","bind up, gird about, govern, healer, put, saddle, wrap about ","A primitive root; to wrap firmly (especially a turban, compress, or saddle); figuratively, to stop, to rule -- bind (up), gird about, govern, healer, put, saddle, wrap about. "
h,2281,חָבֵת,Noun Masculine,chabittim,(khaw-bayth'),"flat cakes, bread wafers",pan ,"From an unused root probably meaning to cook (compare (H4227) machabath); something fried, probably a griddle-cake -- pan. see HEBREW (H4227) machabath "
h,2282,חַג,Noun Masculine,chag,(khag),"a festival gathering, feast, pilgrim feast","solemn feast day, sacrifice, solemnity ","Or chag {khawg}; from (H2287) chagag; a festival, or a victim therefor -- (solemn) feast (day), sacrifice, solemnity. see HEBREW (H2287) chagag "
h,2283,חָגָא,Noun Feminine,chagga,(khaw-gaw'),a reeling,terror ,"From an unused root meaning to revolve (compare (H2287) chagag); properly, vertigo, i.e. (figuratively) fear -- terror. see HEBREW (H2287) chagag "
h,2284,חָגָב,Noun Masculine,chagab,(khaw-gawb'),"locust, grasshopper",locust ,Of uncertain derivation; a locust -- locust.
h,2285,חָגָב,Proper Name Masculine,Chagab,(khaw-gawb'),an Israelite,Hagab ,"The same as (H2284) chagab; locust; Chagab, one of the Nethinim -- Hagab. see HEBREW (H2284) chagab "
h,2286,חֲגָבָא,Proper Name Masculine,Chagaba\',(khag-aw-baw'),an Israelite,"Hagaba, Hagabah ","Or Chagabah {khag-aw-baw'}; feminine of (H2285) Chagab; locust; Chagaba or Chagabah, one of the Nethinim -- Hagaba, Hagabah. see HEBREW (H2285) Chagab "
h,2287,חָגַג,Verb,chagag,(khaw-gag'),"to make a pilgrimage, keep a pilgrim feast","celebrate, dance, keep, hold a solemn feast holiday, reel to and fro ","A primitive root (compare (H2283) chagra', (H2328) chuwg); properly, to move in a circle, i.e. (specifically) to march in a sacred procession, to observe a festival; by implication, to be giddy -- celebrate, dance, (keep, hold) a (solemn) feast (holiday), reel to and fro. see HEBREW (H2283) chagra' see HEBREW (H2328) chuwg "
h,2288,חֲגָו,Noun Masculine,chagavim,(khag-awv'),"places of concealment, retreats",cleft ,From an unused root meaning to take refuge; a rift in rocks -- cleft.
h,2289,חָגוֹר,Noun Masculine,chagor,(khaw-gore'),girded,girded with ,From (H2296) chagar; belted -- girded with. see HEBREW (H2296) chagar
h,2290,חֲגוֹר,Proper Name Masculine,chagowr,(khag-ore'),"a belt, girdle","apron, armor, girdle ","Or chagor {khag-ore'}; and (feminine) chagowrah {khag-o-raw'}; or chagorah {khag-o-raw'}; from (H2296) chagar; a belt (for the waist) -- apron, armour, gird(-le). see HEBREW (H2296) chagar "
h,2291,חַגִּי,"proper name, masculine; Adjective, of a people",Chaggi,(khag-ghee'),"festal, a son of Gad, also his desc","Haggi, Haggites ","From (H2287) chagag; festive, Chaggi, an Israelite; also (patronymically) a Chaggite, or descendant of the same -- Haggi, Haggites. see HEBREW (H2287) chagag "
h,2292,חַגַּי,Proper Name Masculine,Chaggay,(khag-gah'-ee),"festal, a Hebrew prophet",Haggai ,"From (H2282) chag; festive; Chaggai, a Heb. Prophet -- Haggai. see HEBREW (H2282) chag "
h,2293,חַגִּיָּה,Proper Name Masculine,Chaggiyyah,(khag-ghee-yaw'),"feast of Yah, a Levite",Haggiah ,"From (H2282) chag and (H3050) Yahh; festival of Jah; Chaggijah, an Israelite -- Haggiah. see HEBREW (H2282) chag see HEBREW (H3050) Yahh "
h,2294,חַגִּית,Proper Name Feminine,Chaggith,(khag-gheeth'),"festal, a wife of David",Haggith ,"Feminine of (H2291) Chaggiy; festive; Chaggith, a wife of David -- Haggith. see HEBREW (H2291) Chaggiy "
h,2295,חָגְלָה,Proper Name Feminine,Choglah,(khog-law'),"partridge, a female descendant of Manasseh",Hoglah ,"Of uncertain derivation; probably a partridge; Choglah, an Israelitess -- Hoglah. See also (H1031) Beyth Choglah. see HEBREW (H1031) Beyth Choglah "
h,2296,חָגַר,Verb,chagar,(khaw-gar'),"to gird, gird on, gird oneself","be able to put on, be afraid, appointed, gird, restrain, on every side ","A primitive root; to gird on (as a belt, armor, etc.) -- be able to put on, be afraid, appointed, gird, restrain, X on every side. "
h,2297,חַד,Adjective,chad,(khad),one,one ,Abridged from (H259) 'echad; one -- one. see HEBREW (H259) 'echad
h,2298,חַד,Adjective,chad,(khad),one,"a, first, one, together ","(Aramaic) corresponding to (H2297) chad; as card. One; as article single; as an ordinal, first; adverbially, at once -- a, first, one, together. see HEBREW (H2297) chad "
h,2299,חַד,Adjective,chad,(khad),sharp,sharp ,From (H2300) chadad; sharp -- sharp. see HEBREW (H2300) chadad
h,2300,חָדַד,Verb,chadad,(khaw-dad'),"to be sharp, keen","be fierce, sharpen ","A primitive root; to be (causatively, make) sharp or (figuratively) severe -- be fierce, sharpen. "
h,2301,חֲדַד,Proper Name Masculine,Chadad,(khad-ad'),a son of Ishmael,Hadad ,"From (H2300) chadad; fierce; Chadad, an Ishmaelite -- Hadad. see HEBREW (H2300) chadad "
h,2302,חָדָה,Verb,chadah,(khaw-daw'),to be or grow sharp,"make glad, be joined, rejoice ","A primitive root; to rejoice -- make glad, be joined, rejoice. "
h,2303,חַדּוּד,Adjective,chaddud,(khad-dood'),"sharpened, sharp, pointed",sharp ,From (H2300) chadad; a point -- sharp. see HEBREW (H2300) chadad
h,2304,חֶדְוָה,Noun Feminine,chedvah,(khed-vaw'),joy,"gladness, joy ","From (H2302) chadah; rejoicing -- gladness, joy. see HEBREW (H2302) chadah "
h,2305,חֶדְוָה,Noun Feminine,chedvah,(khed-vaw'),joy,joy ,(Aramaic) corresponding to (H2304) chedvah -- joy. see HEBREW (H2304) chedvah
h,2306,חֲדִי,Noun Masculine,chadi,(khad-ee'),breast,breast ,(Aramaic) corresponding to (H2373) chazeh; a breast -- breast. see HEBREW (H2373) chazeh
h,2307,חָדִיד,Proper Name Masculine,Chadid,(khaw-deed'),a place in Benjamin,Hadid ,"From (H2300) chadad; a peak; Chadid, a place in Palestine -- Hadid. see HEBREW (H2300) chadad "
h,2308,חָדַל,Verb,chadal,(khaw-dal'),to cease,"cease, end, fall, forbear, forsake, leave off, let alone, rest, ","A primitive root; properly, to be flabby, i.e. (by implication) desist; (figuratively) be lacking or idle -- cease, end, fall, forbear, forsake, leave (off), let alone, rest, be unoccupied, want. "
h,2309,חֶדֶל,Noun Masculine,chedel,(kheh'-del),world ,world ,"From (H2308) chadal; rest, i.e. The state of the dead -- world. see HEBREW (H2308) chadal "
h,2310,חָדֵל,Adjective,chadel,(khaw-dale'),"forbearing, lacking","he that forbears, frail, rejected ","From (H2308) chadal; vacant, i.e. Ceasing or destitute -- he that forbeareth, frail, rejected. see HEBREW (H2308) chadal "
h,2311,חַדְלַי,Proper Name Masculine,Chadlay,(khad-lah'-ee),an Ephraimite,Hadlai ,"From (H2309) chedel; idle; Chadlai, an Israelite -- Hadlai. see HEBREW (H2309) chedel "
h,2312,חֵדֶק,Noun Masculine,chedeq,(khay'-dek),a briar,"brier, thorn ","From an unused root meaning to sting; a prickly plant -- brier, thorn. "
h,2313,חִדֶּקֶל,Proper Name Masculine,Chiddeqel,(khid-deh'-kel),"Hiddekel, ancient name of a Mesopotamian river",Hiddekel ,Probably of foreign origin; the Chiddekel (or Tigris) river -- Hiddekel.
h,2314,חָדַר,Verb,chadar,(khaw-dar'),"to surround, enclose",enter a privy chamber ,"A primitive root; properly, to inclose (as a room), i.e. (by analogy,) to beset (as in a siege) -- enter a privy chamber. "
h,2315,חֶדֶר,Noun Masculine,cheder,(kheh'-der),"a chamber, room","inner chamber, innermost part, parlor, south, within ","From (H2314) chadar; an apartment (usually literal) -- ((bed) inner)chamber, innermost(-ward) part, parlour, + south, X within. see HEBREW (H2314) chadar "
h,2316,חֲדַר,Proper Name Masculine,Chadar,(khad-ar'),Hadar ,Hadar ,"Another form for (H2315) cheder; chamber; Chadar, an Ishmaelite -- Hadar. see HEBREW (H2315) cheder "
h,2317,חַדְרָךְ,Proper Name Location,Chadrak,(khad-rawk'),a region in Aram (Syria),Hadrach ,"Of uncertain derivation; Chadrak, a Syrian deity -- Hadrach. "
h,2318,חָדַשׁ,Verb,chadash,(khaw-dash'),"to renew, repair","renew, repair ","A primitive root; to be new; causatively, to rebuild -- renew, repair. "
h,2319,חָדָשׁ,Adjective,chadash,(khaw-dawsh'),new,"fresh, new thing ","From (H2318) chadash; new -- fresh, new thing. see HEBREW (H2318) chadash "
h,2320,חֹדֶשׁ,Noun Masculine,chodesh,(kho'-desh),"new moon, a month","monthly, new moon ","From (H2318) chadash; the new moon; by implication, a month -- month(-ly), new moon. see HEBREW (H2318) chadash "
h,2321,חֹדֶשׁ,Proper Name Feminine,Chodesh,(kho'-desh),an Israelite woman,Hodesh ,"The same as (H2320) chodesh; Chodesh, an Israelitess -- Hodesh. see HEBREW (H2320) chodesh "
h,2322,חֲדָשָׁה,Proper Name Location,Chadashah,(khad-aw-shaw'),"new, a city in Judah",Hadashah ,"Feminine of (H2319) chadash; new; Chadashah, a place in Palestine -- Hadashah. see HEBREW (H2319) chadash "
h,2323,חֲדָת,Adjective,chadath,(khad-ath'),new ,new ,(Aramaic) corresponding to (H2319) chadash; new -- new. see HEBREW (H2319) chadash
h,2324,חֲוָא,Verb,chava,(khav-aw'),show ,show ,(Aramaic) corresponding to (H2331) chavah; to show -- shew. see HEBREW (H2331) chavah
h,2325,חוּב,Verb,chub,(khoob),to be guilty,endanger ,"Also chayab {khaw-yab'}; a primitive root; properly, perhaps to tie, i.e. (figuratively and reflexively) to owe, or (by implication) to forfeit -- make endanger. "
h,2326,חוֹב,Noun Masculine,chob,(khobe),debt,debtor ,From (H2325) chuwb; debt -- debtor. see HEBREW (H2325) chuwb
h,2327,חוֹבָה,Proper Name Location,Chobah,(kho-baw'),a place North of Damascus,Hobah ,"Feminine active participle of (H2247) chabah; hiding place; Chobah, a place in Syria -- Hobah. see HEBREW (H2247) chabah "
h,2328,חוּג,Verb,chug,(khoog),"to draw around, make a circle",compass ,A primitive root (compare (H2287) chagag); to describe a circle -- compass. see HEBREW (H2287) chagag
h,2329,חוּג,Noun Masculine,chug,(khoog),"vault, horizon","circle, circuit, compass ","From (H2328) chuwg; a circle -- circle, circuit, compass. see HEBREW (H2328) chuwg "
h,2330,חוּד,Verb,chud,(khood),to propound a riddle,put forth ,"A primitive root; properly, to tie a knot, i.e. (figuratively) to propound a riddle -- put forth. "
h,2331,חָוָה,Verb,chavah,(khaw-vah'),"to tell, declare",show ,"A primitive root; (compare (H2324) chava', (H2421) chayah); properly, to live; by implication (intensively) to declare or show -- show. see HEBREW (H2324) chava' see HEBREW (H2421) chayah "
h,2332,חַוָּה,Proper Name Feminine,Chavvah,(khav-vaw'),"life, the first woman",Eve ,"Causatively from (H2331) chavah; life-giver; Chavvah (or Eve), the first woman -- Eve. see HEBREW (H2331) chavah "
h,2333,חַוָּה,Noun Feminine,chavvah,(khav-vaw'),a tent village,small town ,"Properly, the same as (H2332) Chavvah (life-giving, i.e. Living-place); by implication, an encampment or village -- (small) town. see HEBREW (H2332) Chavvah "
h,2334,חַוּוֹת יָעִיר,Proper Name Location,Chavvoth Yair,(khav-vothe' yaw-eer'),"tent villages of Jair, an area East of the Jordan","Bashan, Havoth-jair ","From the plural of (H2333) chavvah and a modification of (H3265) Ya'uwr; hamlets of Jair, a region of Palestine -- (Bashan-)Havoth-jair. see HEBREW (H2333) chavvah see HEBREW (H3265) Ya'uwr "
h,2335,חוֹזַי,Noun Masculine,Chozay,(kho-zah'-ee),"seer, a keeper of records",the seers ,"From (H2374) chozeh; visionary; Chozai, an Israelite -- the seers. see HEBREW (H2374) chozeh "
h,2336,חוֹחַ,Noun Masculine,choach,(kho'-akh),"briar, bramble, hook, ring, fetter","bramble, thistle, thorn ","From an unused root apparently meaning to pierce; a thorn; by analogy, a ring for the nose -- bramble, thistle, thorn. "
h,2337,חָוָח,Noun Masculine,chavach,(khaw-vawkh'),thicket ,thicket ,Perhaps the same as (H2336) chowach; a dell or crevice (as if pierced in the earth) -- thicket. see HEBREW (H2336) chowach
h,2338,חוּט,Verb,chut,(khoot),to repair (foundations),join ,"(Aramaic) corresponding to the root of (H2339) chuwt, perhaps as a denominative; to string together, i.e. (figuratively) to repair -- join. see HEBREW (H2339) chuwt "
h,2339,חוּט,Noun Masculine,chut,(khoot),"thread, cord, line","cord, fillet, line, thread ","From an unused root probably meaning to sew; a string; by implication, a measuring tape -- cord, fillet, line, thread. "
h,2340,חִוִּי,Noun Masculine,Chivvi,(khiv-vee'),"probably ""villagers"", a Canaanite tribe",Hivite ,"Perhaps from (H2333) chavvah; a villager; a Chivvite, one of the aboriginal tribes of Palestine -- Hivite. see HEBREW (H2333) chavvah "
h,2341,חֲוִילָה,"proper name, of a territory",Chavilah,(khav-ee-law'),"a son of Cush, also a son of Joktan, also territories of unc. location",Havilah ,"Probably from (H2342) chuwl; circular; Chavilah, the name of two or three eastern regions; also perhaps of two men -- Havilah. see HEBREW (H2342) chuwl "
h,2342,חוּל,Verb,chuwl,(khool),"to whirl, dance, writhe","bear, make to bring forth, make to calve, dance, drive away, fall grievously with pain","Or chiyl {kheel}; a primitive root; properly, to twist or whirl (in a circular or spiral manner), i.e. (specifically) to dance, to writhe in pain (especially of parturition) or fear; figuratively, to wait, to pervert -- bear, (make to) bring forth, (make to) calve, dance, drive away, fall grievously (with pain), fear, form, great, grieve, (be) grievous, hope, look, make, be in pain, be much (sore) pained, rest, shake, shapen, (be) sorrow(-ful), stay, tarry, travail (with pain), tremble, trust, wait carefully (patiently), be wounded. "
h,2343,חוּל,Proper Name Masculine,Chul,(khool),a son of Aram,"Chul, a son of Aram; also the region settled by him","From (H2342) chuwl; a circle; Chul, a son of Aram; also the region settled by him -- Hul. see HEBREW (H2342) chuwl "
h,2344,חוֹל,Noun Masculine,chol,(khole),sand,sand ,From (H2342) chuwl; sand (as round or whirling particles) -- sand. see HEBREW (H2342) chuwl
h,2345,חוּם,Adjective,chum,(khoom),"darkened, dark brown or black",brown ,"From an unused root meaning to be warm, i.e. (by implication) sunburnt or swarthy (blackish) -- brown. "
h,2346,חוֹמָה,Noun Feminine,chomah,(kho-maw'),a wall,"wall, walled ","Feminine active participle of an unused root apparently meaning to join; a wall of protection -- wall, walled. "
h,2347,חוּס,Verb,chus,(khoos),"to pity, look upon with compassion","pity, regard, spare ","A primitive root; properly, to cover, i.e. (figuratively) to compassionate -- pity, regard, spare. "
h,2348,חוֹף,Noun Masculine,choph,(khofe),"shore, coast","coast of the sea, haven, shore, seaside ","From an unused root meaning to cover; a cove (as a sheltered bay) -- coast (of the sea), haven, shore, (sea-)side. "
h,2349,חוּפָם,Proper Name Masculine,Chupham,(khoo-fawm'),a Benjamite,Hupham ,"From the same as (H2348) chowph; protection: Chupham, an Israelite -- Hupham. see HEBREW (H2348) chowph "
h,2350,חוּפָמִי,Noun Masculine,Chuphami,(khoo-faw-mee'),descendant of Hupham,Huphamites ,Patronymically from (H2349) Chuwpham; a Chuphamite or descendant of Chupham -- Huphamites. see HEBREW (H2349) Chuwpham
h,2351,חוּץ,Noun Masculine,chuts,(khoots),"the outside, a street","abroad, field, forth, highway, more, outside street, without ","Or (shortened) chuts {khoots}; (both forms feminine in the plural) from an unused root meaning to sever; properly, separate by a wall, i.e. Outside, outdoors -- abroad, field, forth, highway, more, out(-side, -ward), street, without. "
h,2352,חוּר,Noun Masculine,chuwr,(khoor),a city in Asher,hole ,Or (shortened) chur {khoor}; from an unused root probably meaning to bore; the crevice of a serpent; the cell of a prison -- hole.
h,2353,חוּר,Noun Masculine,chur,(khoor),white stuff,white linen,From (H2357) chavar; white linen -- white. see HEBREW (H2357) chavar
h,2354,חוּר,Proper Name Masculine,Chur,(khoor),"four Israelites, also a Midianite",Hur ,"The same as (H2353) chuwr or (H2352) chuwr; Chur, the name of four Israelites and one Midianite -- Hur. see HEBREW (H2353) chuwr see HEBREW (H2352) chuwr "
h,2355,חוֹר,Noun Masculine,chor,(khore),network ,network ,The same as (H2353) chuwr; white linen -- network. Compare (H2715) chor. see HEBREW (H2353) chuwr see HEBREW (H2715) chor
h,2356,חוֹר,Noun Masculine,chor,(khore),a hole,"cave, hole ","Or (shortened) chor {khore}; the same as (H2352) chuwr; a cavity, socket, den -- cave, hole. see HEBREW (H2352) chuwr "
h,2357,חָוַר,Verb,chavar,(khaw-var'),to be or grow white or pale,wax pale ,A primitive root; to blanch (as with shame) -- wax pale.
h,2358,חִוָּר,Adjective,chivvar,(khiv-vawr'),white,white ,(Aramaic) from a root corresponding to (H2357) chavar; white -- white. see HEBREW (H2357) chavar
h,2359,חוּרִי,Proper Name Masculine,Churi,(khoo-ree'),a Gadite,Huri ,"Probably from (H2353) chuwr; linen-worker; Churi, an Israelite -- Huri. see HEBREW (H2353) chuwr "
h,2360,חוּרַי,Proper Name Masculine,Chuwray,(khoo-rah'ee),white stuff,Hurai ,"Probably an orthographical variation for (H2359) Chuwriy; Churai, an Israelite -- Hurai. see HEBREW (H2359) Chuwriy "
