g,5521,"χολή, ῆς, ἡ","Noun, Feminine",cholé,(khol-ay'),gall (a bitter herb),gall. ,"Feminine of an equivalent perhaps akin to the same as  (G5514) Chloe (from the greenish hue); ""gall"" or bile, i.e. (by analogy) poison or an anodyne (wormwood, poppy, etc.) -- gall. "
g,5522,"χοῦς, χοός, ὁ","Noun, Masculine",choos,(kho'-os),dust,dust. ,"From the base of  (G5494) cheimon; a heap (as poured out), i.e. Rubbish; loose dirt -- dust. <p>see GREEK  (G5494) cheimon "
g,5523,"Χοραζίν, ἡ","Proper Noun, Indeclinable",Chorazin,(khor-ad-zin'),"Chorazin, a city of Galilee",Chorazin. ,"Of uncertain derivation; Chorazin, a place in Palestine -- Chorazin. "
g,5524,χορηγέω,Verb,chorégeó,(khor-ayg-eh'-o),"to lead a chorus (i.e. a group of performers), to defray the cost of a chorus","give, minister. ","From a compound of  (G5525) choros and  (G71) ago; to be a dance-leader, i.e. (generally) to furnish -- give, minister. <p>see GREEK  (G5525) choros <p>see GREEK  (G71) ago "
g,5525,"χορός, οῦ, ὁ","Noun, Masculine",choros,(khor-os'),"a dance, chorus",dancing. ,"Of uncertain derivation; a ring, i.e. Round dance (""choir"" -- dancing. "
g,5526,χορτάζω,Verb,chortazó,(khor-tad'-zo),"to feed, fatten, fill, satisfy","feed, fill, satisfy. ","From  (G5528) chortos; to fodder, i.e. (generally) to gorge (supply food in abundance) -- feed, fill, satisfy. <p>see GREEK  (G5528) chortos "
g,5527,"χόρτασμα, ατος, τό","Noun, Neuter",chortasma,(khor'-tas-mah),fodder,sustenance. ,"From  (G5526) chortazo; forage, i.e. Food -- sustenance. <p>see GREEK  (G5526) chortazo "
g,5528,"χόρτος, ου, ὁ","Noun, Masculine",chortos,(khor'-tos),"a feeding place, food, grass","grass, hay. ","Apparently a primary word; a ""court"" or ""garden"", i.e. (by implication, of pasture) herbage or vegetation -- blade, grass, hay. "
g,5529,"Χουζᾶς, ᾶ, ὁ","Noun, Masculine",Chouzas,(khood-zas'),"Chuza, an officer of Herod",Chuza. ,"Of uncertain origin; Chuzas, an officer of Herod -- Chuza. "
g,5530,χράομαι,Verb,chraomai,(khrah'-om-ahee),"to use, make use of","use, entreat","Middle voice of a primary verb (perhaps rather from  (G5495) cheir, to handle); to furnish what is needed; (give an oracle, ""graze"" (touch slightly), light upon, etc.), i.e. (by implication) to employ or (by extension) to act towards one in a given manner -- entreat, use. Compare  (G5531) chrao;  (G5534) chre. <p>see GREEK  (G5531) chrao <p>see GREEK  (G5495) cheir <p>see GREEK  (G5534) chre "
g,5531,χράω,Verb,chraó or kichrémi,(khrah'-o),to lend,lend. ,Probably the same as the base of  (G5530) chraomai; to loan -- lend. <p>see GREEK  (G5530) chraomai
g,5532,"χρεία, ας, ἡ","Noun, Feminine",chreia,(khri'-ah),"need, business","need, want","From the base of  (G5530) chraomai or  (G5534) chre; employment, i.e. An affair; also (by implication) occasion, demand, requirement or destitution -- business, lack, necessary(-ity), need(-ful), use, want. <p>see GREEK  (G5534) chre <p>see GREEK  (G5530) chraomai "
g,5533,"χρεωφειλέτης, ου, ὁ","Noun, Masculine",chreopheiletés,(khreh-o-fi-let'-ace),a debtor,debtor. ,"From a derivative of  (G5531) chrao and  (G3781) opheiletes; a loan-ower, i.e. Indebted person -- debtor. <p>see GREEK  (G5531) chrao <p>see GREEK  (G3781) opheiletes "
g,5534,χρή,Verb,chré,(khray),"it is necessary, fitting",ought. ,Third person singular of the same as  (G5530) chraomai or  (G5531) chrao used impersonally; it needs (must or should) be -- ought. <p>see GREEK  (G5530) chraomai <p>see GREEK  (G5531) chrao
g,5535,χρῄζω,Verb,chrézó,(khrade'-zo),"to need, have need of",have need. ,"From  (G5532) chreia; to make (i.e. Have) necessity, i.e. Be in want of -- (have) need. <p>see GREEK  (G5532) chreia "
g,5536,"χρῆμα, ατος, τό","Noun, Neuter",chréma,(khray'-mah),a thing that one uses or needs,"money, riches. ","Something useful or needed, i.e. Wealth, price -- money, riches. "
g,5537,χρηματίζω,Verb,chrématizó,(khray-mat-id'-zo),"to transact business, to make answer","instruct, reveal, warn","From  (G5536) chrema; to utter an oracle (compare the original sense of  (G5530) chraomai), i.e. Divinely intimate; by implication, (compare the secular sense of  (G5532) chreia) to constitute a firm for business, i.e. (generally) bear as a title -- be called, be admonished (warned) of God, reveal, speak. <p>see GREEK  (G5536) chrema <p>see GREEK  (G5530) chraomai <p>see GREEK  (G5532) chreia "
g,5538,"χρηματισμός, οῦ, ὁ","Noun, Masculine",chrématismos,(khray-mat-is-mos'),"a divine response, an oracle",a divine response,From  (G5537) chrematizo; a divine response or revelation -- answer of God. <p>see GREEK  (G5537) chrematizo
g,5539,"χρήσιμος, η, ον",Adjective,chrésimos,(khray'-see-mos),useful,profit. ,From  (G5540) chresis; serviceable -- profit. <p>see GREEK  (G5540) chresis
g,5540,"χρῆσις, εως, ἡ","Noun, Feminine",chrésis,(khray'-sis),use (as in a sexual sense),use. ,"From  (G5530) chraomai; employment, i.e. (specially), sexual intercourse (as an occupation of the body) -- use. <p>see GREEK  (G5530) chraomai "
g,5541,χρηστεύομαι,Verb,chrésteuomai,(khraste-yoo'-om-ahee),to be kind,be kind. ,"Middle voice from  (G5543) chrestos; to show oneself useful, i.e. Act benevolently -- be kind. <p>see GREEK  (G5543) chrestos "
g,5542,"χρηστολογία, ας, ἡ","Noun, Feminine",chréstologia,(khrase-tol-og-ee'-ah),smooth speech,good words. ,"From a compound of  (G5543) chrestos and  (G3004) lego; fair speech, i.e. Plausibility -- good words. <p>see GREEK  (G5543) chrestos <p>see GREEK  (G3004) lego "
g,5543,"χρηστός, ή, όν",Adjective,chréstos,(khrase-tos'),"serviceable, good","better, easy, gracious, kind. ","From  (G5530) chraomai; employed, i.e. (by implication) useful (in manner or morals) -- better, easy, good(-ness), gracious, kind. <p>see GREEK  (G5530) chraomai "
g,5544,"χρηστότης, τητος, ἡ","Noun, Feminine",chréstotés,(khray-stot'-ace),"goodness, excellence, uprightness","gentleness, goodness, kindness. ","From  (G5543) chrestos; usefulness, i.e. Morally, excellence (in character or demeanor) -- gentleness, good(-ness), kindness. <p>see GREEK  (G5543) chrestos "
g,5545,"χρίσμα, ατος, τό","Noun, Neuter",chrisma,(khris'-mah),"an anointing, unction","anointing, unction. ","From  (G5548) chrio; an unguent or smearing, i.e. (figuratively) the special endowment (""chrism"") of the Holy Spirit -- anointing, unction. <p>see GREEK  (G5548) chrio "
g,5546,"Χριστιανός, οῦ, ὁ","Noun, Masculine",Christianos,(khris-tee-an-os'),a Christian,Christian. ,"From  (G5547) Christos; a Christian, i.e. Follower of Christ -- Christian. <p>see GREEK  (G5547) Christos "
g,5547,"Χριστός, οῦ, ὁ","Noun, Masculine",Christos,(khris-tos'),"the Anointed One, Messiah, Christ",Christ. ,"From  (G5548) chrio; Anointed One, i.e. The Messiah, an epithet of Jesus -- Christ. <p>see GREEK  (G5548) chrio "
g,5548,χρίω,Verb,chrió,(khree'-o),to anoint,anoint. ,"Probably akin to  (G5530) chraomai through the idea of contact; to smear or rub with oil, i.e. (by implication) to consecrate to an office or religious service -- anoint. <p>see GREEK  (G5530) chraomai "
g,5549,χρονίζω,Verb,chronizó,(khron-id'-zo),"to spend or take time, delay","delay, tarry. ","From  (G5550) chronos; to take time, i.e. Linger -- delay, tarry. <p>see GREEK  (G5550) chronos "
g,5550,"χρόνος, ου, ὁ","Noun, Masculine",chronos,(khron'-os),time,"time, season","Of uncertain derivation; a space of time (in general, and thus properly distinguished from  (G2540) kairos, which designates a fixed or special occasion; and from  (G165) aion, which denotes a particular period) or interval; by extension, an individual opportunity; by implication, delay -- + years old, season, space, (X often-)time(-s), (a) while. <p>see GREEK  (G2540) kairos <p>see GREEK  (G165) aion "
g,5551,χρονοτριβέω,Verb,chronotribeó,(khron-ot-rib-eh'-o),to spend time,spend time. ,"From a presumed compound of  (G5550) chronos and the base of  (G5147) tribos; to be a time-wearer, i.e. To procrastinate (linger) -- spend time. <p>see GREEK  (G5550) chronos <p>see GREEK  (G5147) tribos "
g,5552,"χρυσοῦς, ῆ, οῦν",Adjective,chrusous,(khroo'-seh-os),golden,golden,"From  (G5557) chrusos; made of gold -- of gold, golden. <p>see GREEK  (G5557) chrusos "
g,5553,"χρυσίον, ου, τό","Noun, Neuter",chrusion,(khroo-see'-on),"a piece of gold, gold",gold. ,"Diminutive of  (G5557) chrusos; a golden article, i.e. Gold plating, ornament, or coin -- gold. <p>see GREEK  (G5557) chrusos "
g,5554,"χρυσοδακτύλιος, ον",Adjective,chrusodaktulios,(khroo-sod-ak-too'-lee-os),with a gold ring,with a gold ring. ,"From  (G5557) chrusos and  (G1146) daktulios; gold-ringed, i.e. Wearing a golden finger-ring or similar jewelry -- with a gold ring. <p>see GREEK  (G5557) chrusos <p>see GREEK  (G1146) daktulios "
g,5555,"χρυσόλιθος, ου, ὁ","Noun, Masculine",chrusolithos,(khroo-sol'-ee-thos),a chrysolite (a yellow gem),chrysolite. ,"From  (G5557) chrusos and  (G3037) lithos; gold-stone, i.e. A yellow gem (""chrysolite"") -- chrysolite. <p>see GREEK  (G5557) chrusos <p>see GREEK  (G3037) lithos "
g,5556,"χρυσόπρασος, ου, ὁ","Noun, Masculine",chrusoprasos,(khroo-sop'-ras-os),a chrysoprase (a greenish-yellow gem),chrysoprase. ,"From  (G5557) chrusos and prason (a leek); a greenish-yellow gem (""chrysoprase"") -- chrysoprase. <p>see GREEK  (G5557) chrusos "
g,5557,"χρυσός, οῦ, ὁ","Noun, Masculine",chrusos,(khroo-sos'),gold,gold. ,"Perhaps from the base of  (G5530) chraomai (through the idea of the utility of the metal); gold; by extension, a golden article, as an ornament or coin -- gold. <p>see GREEK  (G5530) chraomai "
g,5558,χρυσόω,Verb,chrusoó,(khroo-so'-o),"to gild, to cover with gold","adorn, deck","From  (G5557) chrusos; to gild, i.e. Bespangle with golden ornaments -- deck. <p>see GREEK  (G5557) chrusos "
g,5559,"χρώς, ωτός, ὁ","Noun, Masculine",chrós,(khroce),"the surface of the body, skin",skin,"Probably akin to the base of  (G5530) chraomai through the idea of handling; the body (properly, its surface or skin) -- body. <p>see GREEK  (G5530) chraomai "
g,5560,"χωλός, ή, όν",Adjective,chólos,(kho-los'),"lame, halt, maimed",lame,"Apparently a primary word; ""halt"", i.e. Limping -- cripple, halt, lame. "
g,5561,"χώρα, ας, ἡ","Noun, Feminine",chóra,(kho'-rah),"a space, place, land","county, fields, ground, land, region. ","Feminine of a derivative of the base of  (G5490) chasma through the idea of empty expanse; room, i.e. A space of territory (more or less extensive; often including its inhabitants) -- coast, county, fields, ground, land, region. Compare  (G5117) topos. <p>see GREEK  (G5117) topos <p>see GREEK  (G5490) chasma "
g,5562,χωρέω,Verb,chóreó,(kho-reh'-o),"to make room, advance, hold","make room, hold","From  (G5561) chora; to be in (give) space, i.e. (intransitively) to pass, enter, or (transitively) to hold, admit (literally or figuratively) -- come, contain, go, have place, (can, be room to) receive. <p>see GREEK  (G5561) chora "
g,5563,χωρίζω,Verb,chórizó,(kho-rid'-zo),"to separate, divide","separate, depart, put asunder","From  (G5561) chora; to place room between, i.e. Part; reflexively, to go away -- depart, put asunder, separate. <p>see GREEK  (G5561) chora "
g,5564,"χωρίον, ου, τό","Noun, Neuter",chórion,(kho-ree'-on),"a place, property","field, land, parcel of ground","Diminutive of  (G5561) chora; a spot or plot of ground -- field, land, parcel of ground, place, possession. <p>see GREEK  (G5561) chora "
g,5565,χωρίς,Adverb,chóris,(kho-rece'),"separately, separate from","beside, by itself, without. ","Adverb from  (G5561) chora; at a space, i.e. Separately or apart from (often as preposition) -- beside, by itself, without. <p>see GREEK  (G5561) chora "
g,5566,"χῶρος, ου, ὁ","Noun, Masculine",chóros,(kho'-ros),the northwest wind,northwest wind,Of Latin origin; the north-west wind -- north west.
g,5567,ψάλλω,Verb,psalló,(psal'-lo),"to pull, twitch, twang, play, sing","sing, make melody","Probably strengthened from psao (to rub or touch the surface; compare  (G5597) psocho); to twitch or twang, i.e. To play on a stringed instrument (celebrate the divine worship with music and accompanying odes) -- make melody, sing (psalms). <p>see GREEK  (G5597) psocho "
g,5568,"ψαλμός, οῦ, ὁ","Noun, Masculine",psalmos,(psal-mos'),"a striking (of musical strings), a psalm",psalm. ,"From  (G5567) psallo; a set piece of music, i.e. A sacred ode (accompanied with the voice, harp or other instrument; a ""psalm""); collectively, the book of the Psalms -- psalm. Compare  (G5603) oide. <p>see GREEK  (G5567) psallo <p>see GREEK  (G5603) oide "
g,5569,"ψευδάδελφος, ου, ὁ","Noun, Masculine",pseudadelphos,(psyoo-dad'-el-fos),a false brother,false brethren. ,"From  (G5571) pseudes and  (G80) adephos; a spurious brother, i.e. Pretended associate -- false brethren. <p>see GREEK  (G5571) pseudes <p>see GREEK  (G80) adephos "
g,5570,"ψευδαπόστολος, ου, ὁ","Noun, Masculine",pseudapostolos,(psyoo-dap-os'-tol-os),a false apostle,false teacher. ,"From  (G5571) pseudes and  (G652) apostolos; a spurious apostle, i.e. Pretended pracher -- false teacher. <p>see GREEK  (G5571) pseudes <p>see GREEK  (G652) apostolos "
g,5571,"ψευδής, ές",Adjective,pseudés,(psyoo-dace'),"lying, false","false, lying","From  (G5574) pseudomai; untrue, i.e. Erroneous, deceitful, wicked -- false, liar. <p>see GREEK  (G5574) pseudomai "
g,5572,"ψευδοδιδάσκαλος, ου, ὁ","Noun, Masculine",pseudodidaskalos,(psyoo-dod-id-as'-kal-os),a false teacher,false teacher. ,"From  (G5571) pseudes and  (G1320) didaskalos; a spurious teacher, i.e. Propagator of erroneous Christian doctrine -- false teacher. <p>see GREEK  (G5571) pseudes <p>see GREEK  (G1320) didaskalos "
g,5573,"ψευδολόγος, ον",Adjective,pseudologos,(psyoo-dol-og'-os),"speaking falsely, lying",speaking lies. ,"From  (G5571) pseudes and  (G3004) lego; mendacious, i.e. Promulgating erroneous Christian doctrine -- speaking lies. <p>see GREEK  (G5571) pseudes <p>see GREEK  (G3004) lego "
g,5574,ψεύδομαι,Verb,pseudomai,(psyoo'-dom-ahee),to lie,"to lie, speak falsely","Middle voice of an apparently primary verb; to utter an untruth or attempt to deceive by falsehood -- falsely, lie. "
g,5575,"ψευδόμαρτυς, υρος, ὁ","Noun, Masculine<br><span class=""tophdg"">Phonetic Spelling: </span>(psyoo-dom-ar\'-toor)<br><span class=""tophdg"">Definition: </span>false witness<br><span class=""tophdg"">Usage: </span>a false witness.<div class=""vheading2"">Thayer\'s Greek Lexicon</div><span class=""maintitle"">STRONGS NT 5575: \xcf\x88\xce\xb5\xcf\x85\xce\xb4\xce\xbf\xce\xbc\xce\xb1\xcf\x81\xcf\x84\xcf\x85\xcf\x81</span><br><br><span class=""arttitle""><span class=""grktitle"">\xcf\x88\xce\xb5\xcf\x85\xce\xb4\xce\xbf\xce\xbc\xce\xb1\xcf\x81\xcf\x84\xcf\x85\xcf\x81</span></span>, unless more correctly <span class=""greek2"">\xcf\x88\xce\xb5\xcf\x85\xce\xb4\xcf\x8c\xce\xbc\xce\xb1\xcf\x81\xcf\x84\xcf\x85\xcf\x82</span> or rather <span class=""greek2"">\xcf\x88\xce\xb5\xcf\x85\xce\xb4\xcf\x8c\xce\xbc\xce\xb1\xcf\x81\xcf\x84\xcf\x85\xcf\x82</span> (as <span class=""greek2"">\xe1\xbc\x80\xcf\x85\xcf\x84\xce\xbf\xce\xbc\xce\xb1\xcf\x81\xcf\x84\xcf\x85\xcf\x81</span>; see <span class=""abbreviation"">Passow</span>, under the word, <span class=""greek2"">\xcf\x88\xce\xb5\xcf\x85\xce\xb4\xcf\x8c\xce\xbc\xce\xb1\xcf\x81\xcf\x84\xcf\x85\xcf\x82</span> (especially Lob. Paralip., p. 217; cf. <span class=""abbreviation"">Etym. Magn.</span> 506, 26)), <span class=""greek2"">\xcf\x88\xce\xb5\xcf\x85\xce\xb4\xce\xbf\xce\xbc\xce\xb1\xcf\x81\xcf\x84\xcf\x85\xcf\x81\xce\xbf\xcf\x82</span>, <span class=""greek2"">\xe1\xbd\x81</span>, (<span class=""greek2"">\xcf\x88\xce\xb5\xcf\x85\xce\xb4\xce\xae\xcf\x82</span> and <span class=""greek2"">\xce\xbc\xce\xac\xcf\x81\xcf\x84\xcf\x85\xcf\x81</span> (which see)), <span class=""accented"">a false witness</span>: <a href=""/interlinear/matthew/26-60.htm"">Matthew 26:60</a>; <span class=""greek2"">\xcf\x84\xce\xbf\xe1\xbf\xa6</span> <span class=""greek2"">\xce\xb8\xce\xb5\xce\xbf\xe1\xbf\xa6</span>, false witnesses of i. e. concerning God (<span class=""abbreviation"">Winer</span>\'s Grammar, \xc2\xa7 30, 1 a.), <a href=""/interlinear/1_corinthians/15-15.htm"">1 Corinthians 15:15</a>. (<span class=""abbreviation"">Plato</span>, Gorgias, p. 472b.; <span class=""abbreviation"">Aristotle</span>, pol. 2, 9, 8 (p. 1274b, 6; but the true reading here is <span class=""greek2"">\xcf\x88\xce\xb5\xcf\x85\xce\xb4\xce\xbf\xce\xbc\xce\xb1\xcf\x81\xcf\x84\xcf\x85\xcf\x81\xce\xb9\xcf\x89\xce\xbd</span> (see Bentley\'s Works, Dyce edition, vol. i., p. 408); a better example is <span class=""abbreviation"">Aristotle</span>, rhet. ad Alex. 16, p. 1432{a}, 6; cf. <span class=""abbreviation"">Plutarch</span>, praec. ger. reip. 29, 1; Apostolic Constitutions 5, 9; <span class=""abbreviation"">Pollux</span> 6, 36, 153).)<FOOTNOTE:1>   <p><span class=""maintitle"">STRONGS NT 5575: \xcf\x88\xce\xb5\xcf\x85\xce\xb4\xcf\x8c\xce\xbc\xce\xb1\xcf\x81\xcf\x84\xcf\x85\xcf\x82</span><span class=""arttitle""><span class=""grktitle"">\xcf\x88\xce\xb5\xcf\x85\xce\xb4\xcf\x8c\xce\xbc\xce\xb1\xcf\x81\xcf\x84\xcf\x85\xcf\x82</span></span>, see  <span class=""greek2""><span class=""lexref"">\xcf\x88\xce\xb5\xcf\x85\xce\xb4\xce\xbf\xce\xbc\xce\xb1\xcf\x81\xcf\x84\xcf\x85\xcf\x81</span></span>.   <br><br><iframe width=""100%"" height=""85"" scrolling=no src=""/bsoft.htm"" frameborder=0 cellpadding=0></iframe><div class=""vheading2"">Strong\'s Exhaustive Concordance</div>false witness. <p>From <a href=""/greek/5571.htm"">pseudes</a> and a kindred form of <a href=""/greek/3144.htm"">martus</a>; a spurious witness, i.e. Bearer of untrue testimony -- false witness. <p>see GREEK <a href=""/greek/5571.htm"">pseudes</a> <p>see GREEK <a href=""/greek/3144.htm"">martus</a> <div cla",pseudomartus,(psyoo-dom-ar'-toor),false witness,false witness. ,"From  (G5571) pseudes and a kindred form of  (G3144) martus; a spurious witness, i.e. Bearer of untrue testimony -- false witness. <p>see GREEK  (G5571) pseudes <p>see GREEK  (G3144) martus "
g,5576,ψευδομαρτυρέω,Verb,pseudomartureó,(psyoo-dom-ar-too-reh'-o),"to bear false witness, give false testimony",bear false witness. ,"From  (G5575) pseudomartur; to be an untrue testifier, i.e. Offer falsehood in evidence -- be a false witness. <p>see GREEK  (G5575) pseudomartur "
g,5577,"ψευδομαρτυρία, ας, ἡ","Noun, Feminine",pseudomarturia,(psyoo-dom-ar-too-ree'-ah),"false witness, false testimony",false witness. ,From  (G5575) pseudomartur; untrue testimony -- false witness. <p>see GREEK  (G5575) pseudomartur
g,5578,"ψευδοπροφήτης, ου, ὁ","Noun, Masculine",pseudoprophétés,(psyoo-dop-rof-ay'-tace),a false prophet,false prophet. ,"From  (G5571) pseudes and  (G4396) prophetes; a spurious prophet, i.e. Pretended foreteller or religious impostor -- false prophet. <p>see GREEK  (G5571) pseudes <p>see GREEK  (G4396) prophetes "
g,5579,"ψεῦδος, ους, τό","Noun, Neuter",pseudos,(psyoo'-dos),"a falsehood, untruth, lie","lie, lying. ","From  (G5574) pseudomai; a falsehood -- lie, lying. <p>see GREEK  (G5574) pseudomai "
g,5580,"ψευδόχριστος, ου, ὁ","Noun, Masculine",pseudochristos,(psyoo-dokh'-ris-tos),a false Christ or Messiah,false Christ. ,From  (G5571) pseudes and  (G5547) Christos; a spurious Messiah -- false Christ. <p>see GREEK  (G5571) pseudes <p>see GREEK  (G5547) Christos
g,5581,"ψευδώνυμος, ον",Adjective,pseudónumos,(psyoo-do'-noo-mos),"under a false name, falsely called",falsely called. ,From  (G5571) pseudes and  (G3686) onoma; untruly named -- falsely so called. <p>see GREEK  (G5571) pseudes <p>see GREEK  (G3686) onoma
g,5582,"ψεῦσμα, ατος, τό","Noun, Neuter",pseusma,(psyoos'-mah),"a lie, falsehood",lie. ,"From  (G5574) pseudomai; a fabrication, i.e. Falsehood -- lie. <p>see GREEK  (G5574) pseudomai "
g,5583,"ψεύστης, ου, ὁ","Noun, Masculine",pseustés from the same as NG5574,(psyoos-tace'),liar,liar. ,From  (G5574) pseudomai; a falsifier -- liar. <p>see GREEK  (G5574) pseudomai
g,5584,ψηλαφάω,Verb,psélaphaó,(psay-laf-ah'-o),to feel or grope about,"grope around, handle, touch. ","From the base of  (G5567) psallo (compare  (G5586) psephos); to manipulate, i.e. Verify by contact; figuratively, to search for -- feel after, handle, touch. <p>see GREEK  (G5567) psallo <p>see GREEK  (G5586) psephos "
g,5585,ψηφίζω,Verb,pséphizó,(psay-fid'-zo),"to count, calculate","to count up, calculate","From  (G5586) psephos; to use pebbles in enumeration, i.e. (generally) to compute -- count. <p>see GREEK  (G5586) psephos "
g,5586,"ψῆφος, ου, ἡ","Noun, Feminine",pséphos,(psay'-fos),"a small smooth stone, a pebble","a voting-pebble, small stone","From the same as  (G5584) pselaphao; a pebble (as worn smooth by handling), i.e. (by implication, of use as a counter or ballot) a verdict (of acquittal) or ticket (of admission); a vote -- stone, voice. <p>see GREEK  (G5584) pselaphao "
g,5587,"ψιθυρισμός, οῦ, ὁ","Noun, Masculine",psithurismos,(psith-oo-ris-mos'),a whispering,whispering. ,"From a derivative of psithos (a whisper; by implication, a slander; probably akin to  (G5574) pseudomai); whispering, i.e. Secret detraction -- whispering. <p>see GREEK  (G5574) pseudomai "
g,5588,"ψιθυριστής, οῦ, ὁ","Noun, Masculine",psithuristés,(psith-oo-ris-tace'),a whisperer,whisperer. ,From the same as  (G5587) psithurismos; a secret calumniator -- whisperer. <p>see GREEK  (G5587) psithurismos
g,5589,"ψιχίον, ου, τό","Noun, Neuter",psichion,(psikh-ee'-on),a crumb (of bread),crumb. ,Diminutive from a derivative of the base of  (G5567) psallo (meaning a crumb); a little bit or morsel -- crumb. <p>see GREEK  (G5567) psallo
g,5590,"ψυχή, ῆς, ἡ","Noun, Feminine",psuché,(psoo-khay'),"breath, the soul","soul, life, self","From  (G5594) psucho; breath, i.e. (by implication) spirit, abstractly or concretely (the animal sentient principle only; thus distinguished on the one hand from  (G4151) pneuma, which is the rational and immortal soul; and on the other from  (G2222) zoe, which is mere vitality, even of plants: these terms thus exactly correspond respectively to the Hebrew  (H5315) nephesh,  (H7307) ruwach and  (H2416) chay) -- heart (+ -ily), life, mind, soul, + us, + you. <p>see GREEK  (G5594) psucho <p>see GREEK  (G4151) pneuma <p>see GREEK  (G2222) zoe <p>see HEBREW  (H5315) nephesh <p>see HEBREW  (H7307) ruwach <p>see HEBREW  (H2416) chay "
g,5591,"ψυχικός, ή, όν",Adjective,psuchikos,(psoo-khee-kos'),"natural, of the soul or mind","natural, sensual. ","From  (G5590) psuche; sensitive, i.e. Animate (in distinction on the one hand from  (G4152) pneumatikos, which is the higher or renovated nature; and on the other from  (G5446) phusikos, which is the lower or bestial nature) -- natural, sensual. <p>see GREEK  (G5590) psuche <p>see GREEK  (G4152) pneumatikos <p>see GREEK  (G5446) phusikos "
g,5592,"ψῦχος, ους, τό","Noun, Neuter",psuchos,(psoo'-khos),cold,cold. ,From  (G5594) psucho; coolness -- cold. <p>see GREEK  (G5594) psucho
g,5593,"ψυχρός, ά, όν",Adjective,psuchros,(psoo-chros'),cold,cold. ,From  (G5592) psuchos; chilly (literally or figuratively) -- cold. <p>see GREEK  (G5592) psuchos
g,5594,ψύχω,Verb,psuchó,(psoo'-kho),"to breathe, blow, to make cool",grow cold,"A primary verb; to breathe (voluntarily but gently, thus differing on the one hand from  (G4154) pneo, which denotes properly a forcible respiration; and on the other from the base of  (G109) aer, which refers properly to an inanimate breeze), i.e. (by implication, of reduction of temperature by evaporation) to chill (figuratively) -- wax cold. <p>see GREEK  (G4154) pneo <p>see GREEK  (G109) aer "
g,5595,ψωμίζω,Verb,psómizó,(pso-mid'-zo),to feed with morsels,to feed with morsels,"From the base of  (G5596) psomion; to supply with bits, i.e. (generally) to nourish -- (bestow to) feed. <p>see GREEK  (G5596) psomion "
g,5596,"ψωμίον, ου, τό","Noun, Neuter",psómion,(pso-mee'-on),"a fragment, morsel","morsel, crumb","Diminutive from a derivative of the base of  (G5597) psocho; a crumb or morsel (as if rubbed off), i.e. A mouthful -- sop. <p>see GREEK  (G5597) psocho "
g,5597,ψώχω,Verb,psóchó,(pso'-kho),to rub,rub. ,"Prolongation from the same base as  (G5567) psallo; to triturate, i.e. (by analogy) to rub out (kernels from husks with the fingers or hand) -- rub. <p>see GREEK  (G5567) psallo "
g,5598,Ὦ,Indeclinable Letter (Noun),O,(o'-meg-ah),the last letter of the Greek  alphabet,Omega. ,"The last letter of the Greek alphabet, i.e. (figuratively) the finality -- Omega. "
g,5599,ὦ,Interjection,ó,(o),"O, oh!",O. ,"A primary interjection; as a sign of the vocative case, O; as a note of exclamation, oh -- O. "
g,5600,"ὦ,",-,ó,(o),"may, might","may, might","Including the oblique forms, as well as es (ace); e (ay); etc. The subjunctive of  (G1510) eimi; (may, might, can, could, would, should, must, etc.; also with  (G1487) ei and its comparative, as well as with other particles) be -- + appear, are, (may, might, should) be, X have, is, + pass the flower of her age, should stand, were. <p>see GREEK  (G1510) eimi <p>see GREEK  (G1487) ei "
