g,1135,"γυνή, αικός, ἡ","Noun, Feminine",guné,(goo-nay'),a woman,"wife, woman. ","Probably from the base of  (G1096) ginomai; a woman; specially, a wife -- wife, woman. <p>see GREEK  (G1096) ginomai "
g,1136,"Γώγ, ὁ","Proper Noun, Indeclinable",Góg,(gogue),"Gog, associated with Magog",Gog. ,"Of Hebrew origin ( (H1463) Gowg); Gog, a symbolic name for some future Antichrist -- Gog. <p>see HEBREW  (H1463) Gowg "
g,1137,"γωνία, ας, ἡ","Noun, Feminine",gónia,(go-nee'-ah),"an angle, a corner","angle, corner, quarter. ","Probably akin to  (G1119) gonu; an angle -- corner, quarter. <p>see GREEK  (G1119) gonu "
g,1138,"Δαυίδ, ὁ","Proper Noun, Indeclinable",Dabid,(dab-eed'),David,David. ,"Of Hebrew origin ( (H1732) David); Dabid (i.e. David), the Israelite king -- David. <p>see HEBREW  (H1732) David "
g,1139,δαιμονίζομαι,Verb,daimonizomai,(dahee-mon-id'-zom-ahee),to be possessed by a demon,to be demon possessed,"Middle voice from  (G1142) daimon; to be exercised by a d?Mon -- have a (be vexed with, be possessed with) devil(-s). <p>see GREEK  (G1142) daimon "
g,1140,"δαιμόνιον, ου, τό","Noun, Neuter",daimonion,(dahee-mon'-ee-on),"an evil spirit, a demon",a demon,"Neuter of a derivative of  (G1142) daimon; a d?Monic being; by extension a deity -- devil, god. <p>see GREEK  (G1142) daimon "
g,1141,"δαιμονιώδης, ες",Adjective,daimoniódés,(dahee-mon-ee-o'-dace),demon-like,devilish. ,From  (G1140) daimonion and  (G1142) daimon; d?Mon-like -- devilish. <p>see GREEK  (G1140) daimonion <p>see GREEK  (G1142) daimon
g,1142,"δαίμων, ονος, ὁ","Noun, Masculine",daimón,(dah'-ee-mown),a demon,"demon, evil spirit",From daio (to distribute fortunes); a d?Mon or supernatural spirit (of a bad nature) -- devil.
g,1143,δάκνω,Verb,daknó,(dak'-no),to bite,bite. ,"A prolonged form of a primary root; to bite, i.e. (figuratively) thwart -- bite. "
g,1144,"δάκρυον, ου, τό","Noun, Neuter",dakruon,(dak'-roo),a teardrop,tear. ,Or dakruon dak'-roo-on; of uncertain affinity; a tear -- tear.
g,1145,δακρύω,Verb,dakruó,(dak-roo'-o),to weep,weep. ,From  (G1144) dakru; to shed tears -- weep. Compare  (G2799) klaio. <p>see GREEK  (G1144) dakru <p>see GREEK  (G2799) klaio
g,1146,"δακτύλιος, ου, ὁ","Noun, Masculine",daktulios,(dak-too'-lee-os),a ring,ring. ,From  (G1147) daktulos; a finger-ring -- ring. <p>see GREEK  (G1147) daktulos
g,1147,"δάκτυλος, ου, ὁ","Noun, Masculine",daktulos,(dak'-too-los),a finger,finger. ,Probably from  (G1176) deka; a finger -- finger. <p>see GREEK  (G1176) deka
g,1148,"Δαλμανουθά, ἡ","Proper Noun, Indeclinable",Dalmanoutha,(dal-man-oo-thah'),"Dalmanutha, an unidentified place near the Sea of Galilee",Dalmanutha. ,"Probably of Chaldee origin; Dalmanutha, a place in Palestine -- Dalmanutha. "
g,1149,"Δαλματία, ας, ἡ","Noun, Feminine",Dalmatia,(dal-mat-ee'-ah),"Dalmatia, southern Illyricum on the Adriatic Sea",Dalmatia. ,"Probably of foreign derivation; Dalmatia, a region of Europe -- Dalmatia. "
g,1150,δαμάζω,Verb,damazó,(dam-ad'-zo),to tame,"tame, subdue",A variation of an obsolete primary of the same meaning; to tame -- tame.
g,1151,"δάμαλις, εως, ἡ","Noun, Feminine",damalis,(dam'-al-is),a heifer,heifer. ,Probably from the base of  (G1150) damazo; a heifer (as tame) -- heifer. <p>see GREEK  (G1150) damazo
g,1152,"Δάμαρις, ιδος, ἡ","Noun, Feminine",Damaris,(dam'-ar-is),"Damaris, an Athenian woman",Damaris. ,"Probably from the base of  (G1150) damazo; perhaps gentle; Damaris, an Athenian woman -- Damaris. <p>see GREEK  (G1150) damazo "
g,1153,"Δαμασκηνός, ή, όν",Adjective,Damaskénos,(dam-as-kay-nos'),of Damascus,Damascene. ,From  (G1154) Damaskos; a Damascene or inhabitant of Damascus -- Damascene. <p>see GREEK  (G1154) Damaskos
g,1154,"Δαμασκός, οῦ, ἡ","Noun, Feminine",Damaskos,(dam-as-kos'),"Damascus, a city of Syria",Damascus. ,"Of Hebrew origin ( (H1834) Dammeseq); Damascus, a city of Syria -- Damascus. <p>see HEBREW  (H1834) Dammeseq "
g,1155,δανείζω,Verb,danizó,(dan-ide'-zo),"to lend, borrow","borrow, lend. ","From  (G1156) daneion; to loan on interest; reflexively, to borrow -- borrow, lend. <p>see GREEK  (G1156) daneion "
g,1156,"δάνειον, ου, τό","Noun, Neuter",daneion,(dan'-i-on),a loan,debt. ,From danos (a gift); probably akin to the base of  (G1325) didomi; a loan -- debt. <p>see GREEK  (G1325) didomi
g,1157,"δανειστής, οῦ, ὁ","Noun, Masculine",danistés,(dan-ice-tace'),a moneylender,creditor. ,From  (G1155) daneizo; a lender -- creditor. <p>see GREEK  (G1155) daneizo
g,1158,"Δανιήλ, ὁ","Proper Noun, Indeclinable",Daniél,(dan-ee-ale'),"Daniel, the prophet",Daniel. ,"Of Hebrew origin ( (H1840) Daniye'l); Daniel, an Israelite -- Daniel. <p>see HEBREW  (H1840) Daniye'l "
g,1159,δαπανάω,Verb,dapanaó,(dap-an-ah'-o),"to spend, spend freely","consume, spend. ","From  (G1160) dapane; to expend, i.e. (in a good sense) to incur cost, or (in a bad one) to waste -- be at charges, consume, spend. <p>see GREEK  (G1160) dapane "
g,1160,"δαπάνη, ης, ἡ","Noun, Feminine",dapane,(dap-an'-ay),"expense, cost",cost. ,From dapto (to devour); expense (as consuming) -- cost.
g,1161,δέ,Conjunction,de,(deh),"but, and, now, (a connective or adversative particle)","also, and, but, moreover, now. ","A primary particle (adversative or continuative); but, and, etc. -- also, and, but, moreover, now (often unexpressed in English). "
g,1162,"δέησις, εως, ἡ","Noun, Feminine",deésis,(deh'-ay-sis),"a need, entreaty","prayer, request, supplication. ","From  (G1189) deomai; a petition -- prayer, request, supplication. <p>see GREEK  (G1189) deomai "
g,1163,δεῖ,Verb,dei,(die),it is necessary,"needful, ought, should. ","3d person singular active present of  (G1210) deo; also deon deh-on'; neuter active participle of the same; both used impersonally; it is (was, etc.) Necessary (as binding) -- behoved, be meet, must (needs), (be) need(-ful), ought, should. <p>see GREEK  (G1210) deo "
g,1164,"δεῖγμα, ατος, τό","Noun, Neuter",deigma,(digh'-mah),"a thing shown, specimen",example. ,From the base of  (G1166) deiknuo; a specimen (as shown) -- example. <p>see GREEK  (G1166) deiknuo
g,1165,δειγματίζω,Verb,deigmatizó,(digh-mat-id'-zo),"to expose, make a show of",make a show. ,From  (G1164) deigma; to exhibit -- make a shew. <p>see GREEK  (G1164) deigma
g,1166,δείκνυμι,Verb,deiknumi,(dike-noo'-o),to show,show,A prolonged form of an obsolete primary of the same meaning; to show (literally or figuratively) -- shew.
g,1167,"δειλία, ας, ἡ","Noun, Feminine",deilia,(di-lee'-ah),cowardice,fear. ,From  (G1169) deilos; timidity -- fear. <p>see GREEK  (G1169) deilos
g,1168,δειλιάω,Verb,deiliaó,(di-lee-ah'-o),to be cowardly,be afraid. ,From  (G1167) deilia; to be timid -- be afraid. <p>see GREEK  (G1167) deilia
g,1169,"δειλός, ή, όν",Adjective,deilos,(di-los'),"cowardly, fearful",fearful. ,"From deos (dread); timid, i.e. (by implication) faithless -- fearful. "
g,1170,"δεῖνα, ὁ, ἡ, τό",Adjective,deina,(di'-nah),a certain one,such a man. ,"Probably from the same as  (G1171) deinos (through the idea of forgetting the name as fearful, i.e. Strange); so and so (when the person is not specified) -- such a man. <p>see GREEK  (G1171) deinos "
g,1171,δεινῶς,Adverb,deinós,(di-noce'),"terribly, vehemently","grievously, vehemently. ","Adverb from a derivative of the same as  (G1169) deilos; terribly, i.e. Excessively -- grievously, vehemently. <p>see GREEK  (G1169) deilos "
g,1172,δειπνέω,Verb,deipneó,(dipe-neh'-o),"to eat, dine","to eat, dine","From  (G1173) deipnon; to dine, i.e. Take the principle (or evening) meal -- sup (X -er). <p>see GREEK  (G1173) deipnon "
g,1173,"δεῖπνον, ου, τό","Noun, Neuter",deipnon,(dipe'-non),"dinner, supper",supper. ,"From the same as  (G1160) dapane; dinner, i.e. The chief meal (usually in the evening) -- feast, supper. <p>see GREEK  (G1160) dapane "
g,1174,"δεισιδαίμων, ον",Adjective,deisidaimonesteros,(dice-ee-dahee-mon-es'-ter-os),"very fearful of gods, religious, superstitious","devout, religious, superstitious. ",The compound of a derivative of the base of  (G1169) deilos and  (G1142) daimon; more religious than others -- too superstitious. <p>see GREEK  (G1169) deilos <p>see GREEK  (G1142) daimon
g,1175,"δεισιδαιμονία, ας, ἡ","Noun, Feminine",deisidaimonia,(dice-ee-dahee-mon-ee'-ah),"a religion, superstition",religion,From the same as  (G1174) deisidaimonesteros; religion -- superstition. <p>see GREEK  (G1174) deisidaimonesteros
g,1176,δέκα,Indeclinable Numeral (Adjective),deka,(dek'-ah),ten,ten. ,"A primary number; ten -- (eight-)een, ten. "
g,1177,δεκαδύο,Indeclinable Numeral (Adjective),dekaduo,(dek-ad-oo'-o),twelve,twelve. ,"From  (G1176) deka and  (G1417) duo; two and ten, i.e. Twelve -- twelve. <p>see GREEK  (G1176) deka <p>see GREEK  (G1417) duo "
g,1178,δεκαπέντε,Indeclinable Numeral (Adjective),dekapente,(dek-ap-en'-teh),eighteen,fifteen. ,"From  (G1176) deka and  (G4002) pente; ten and five, i.e. Fifteen -- fifteen. <p>see GREEK  (G1176) deka <p>see GREEK  (G4002) pente "
g,1179,"Δεκάπολις, εως, ἡ","Noun, Feminine",Dekapolis,(dek-ap'-ol-is),"Decapolis, a region East of the Jordan",Decapolis. ,"From  (G1176) deka and  (G4172) polis; the ten-city region; the Decapolis, a district in Syria -- Decapolis. <p>see GREEK  (G1176) deka <p>see GREEK  (G4172) polis "
g,1180,"δεκατέσσαρες, ων",Adjective,dekatessares,(dek-at-es'-sar-es),fourteen,fourteen. ,"From  (G1176) deka and  (G5064) tessares; ten and four, i.e. Fourteen -- fourteen. <p>see GREEK  (G1176) deka <p>see GREEK  (G5064) tessares "
g,1181,"δεκάτη, ης, ἡ",Adjective,dekaté,(dek-at'-ay),"a tenth part, a tithe","tenth, tithe. ","Feminine of  (G1182) dekatos; a tenth, i.e. As a percentage or (technically) tithe -- tenth (part), tithe. <p>see GREEK  (G1182) dekatos "
g,1182,"δέκατος, η, ον",Adjective,dekatos,(dek'-at-os),tenth,tenth. ,Ordinal from  (G1176) deka; tenth -- tenth. <p>see GREEK  (G1176) deka
g,1183,δεκατόω,Verb,dekatoó,(dek-at-o'-o),to collect tithes,pay or receive tithes. ,"From  (G1181) dekate; to tithe, i.e. To give or take a tenth -- pay (receive) tithes. <p>see GREEK  (G1181) dekate "
g,1184,"δεκτός, ή, όν",Adjective,dektos,(dek-tos'),acceptable,acceptable. ,From  (G1209) dechomai; approved; (figuratively) propitious -- accepted(-table). <p>see GREEK  (G1209) dechomai
g,1185,δελεάζω,Verb,deleazó,(del-eh-ad'-zo),to lure,"allure, beguile, entice. ","From the base of  (G1388) dolos; to entrap, i.e. (figuratively) delude -- allure, beguile, entice. <p>see GREEK  (G1388) dolos "
g,1186,"δένδρον, ου, τό","Noun, Neuter",dendron,(den'-dron),a tree,tree. ,Probably from drus (an oak); a tree -- tree.
g,1187,"δεξιόλαβος, ου, ὁ","Noun, Masculine",dexiolabos,(dex-ee-ol-ab'-os),probably a spearman or slinger,spearman. ,From  (G1188) dexios and  (G2983) lambano; a guardsman (as if taking the right) or light-armed soldier -- spearman. <p>see GREEK  (G1188) dexios <p>see GREEK  (G2983) lambano
g,1188,"δεξιός, ά, όν",Adjective,dexios,(dex-ee-os'),the right hand or side,right hand or side. ,"From  (G1209) dechomai; the right side or (feminine) hand (as that which usually takes) -- right (hand, side). <p>see GREEK  (G1209) dechomai "
g,1189,δέομαι,Verb,deomai,(deh'-om-ahee),"to want, entreat","beseech, pray to, make request. ","Middle voice of  (G1210) deo; to beg (as binding oneself), i.e. Petition -- beseech, pray (to), make request. Compare  (G4441) punthanomai. <p>see GREEK  (G1210) deo <p>see GREEK  (G4441) punthanomai "
g,1190,"Δερβαῖος, α, ον",Adjective,Derbaios,(der-bah'-ee-os),"fear, reverence",of Derbe. ,From  (G1191) Derbe; a Derb?An or inhabitant of Derbe -- of Derbe. <p>see GREEK  (G1191) Derbe
g,1191,"Δέρβη, ης, ἡ","Noun, Feminine",Derbé,(der-bay'),"Derbe, a city of Lycaonia",Derbe. ,"Of foreign origin; Derbe, a place in Asia Minor -- Derbe. "
g,1192,"δέρμα, ατος, τό","Noun, Neuter",derma,(der'-mah),the skin,skin. ,From  (G1194) dero; a hide -- skin. <p>see GREEK  (G1194) dero
g,1193,"δερμάτινος, η, ον",Adjective,dermatinos,(der-mat'-ee-nos),"made of skin, leathern","leathern, of a skin. ","From  (G1192) derma; made of hide -- leathern, of a skin. <p>see GREEK  (G1192) derma "
g,1194,δέρω,Verb,deró,(der'-o),"to skin, to thrash","beat, smite. ","A primary verb; properly, to flay, i.e. (by implication) to scourge, or (by analogy) to thrash -- beat, smite. "
g,1195,δεσμεύω,Verb,desmeuó,(des-myoo'-o),"to bind together, to fetter",bind together,"From a (presumed) derivative of  (G1196) desmeo; to be a binder (captor), i.e. To enchain (a prisoner), to tie on (a load) -- bind. <p>see GREEK  (G1196) desmeo "
g,1196,δεσμέω,Verb,desmeó,(des-meh'-o),"bind, shackle","bind, shackle","From  (G1199) desmon; to tie, i.e. Shackle -- bind. <p>see GREEK  (G1199) desmon "
g,1197,"δέσμη, ης, ἡ","Noun, Feminine",desmé,(des-may'),a bundle,bundle. ,From  (G1196) desmeo; a bundle -- bundle. <p>see GREEK  (G1196) desmeo
g,1198,"δέσμιος, ου, ὁ","Noun, Masculine",desmios,(des'-mee-os),"binding, bound",prisoner. ,"From  (G1199) desmon; a captive (as bound) -- in bonds, prisoner. <p>see GREEK  (G1199) desmon "
g,1199,"δεσμός, οῦ, ὁ","Noun, Masculine; Noun, Neuter",desmos,(des-mon'),"a band, bond","ligament, chain, string. ","Or desmos des-mos' neuter and masculine respectively from  (G1210) deo; a band, i.e. Ligament (of the body) or shackle (of a prisoner); figuratively, an impediment or disability -- band, bond, chain, string. <p>see GREEK  (G1210) deo "
g,1200,"δεσμοφύλαξ, ακος, ὁ","Noun, Masculine",desmophulax,(des-mof-oo'-lax),a prison keeper,"jailor, keeper of the prison. ","From  (G1199) desmon and  (G5441) phulax; a jailer (as guarding the prisoners) -- jailor, keeper of the prison. <p>see GREEK  (G1199) desmon <p>see GREEK  (G5441) phulax "
g,1201,"δεσμωτήριον, ου, τό","Noun, Neuter",desmótérion,(des-mo-tay'-ree-on),a prison,prison. ,"From a derivative of  (G1199) desmon (equivalent to  (G1196) desmeo); a place of bondage, i.e. A dungeon -- prison. <p>see GREEK  (G1199) desmon <p>see GREEK  (G1196) desmeo "
g,1202,"δεσμώτης, ου, ὁ","Noun, Masculine",desmótés,(des-mo'-tace),a prisoner,prisoner. ,From the same as  (G1201) desmoterion; (passively) a captive -- prisoner. <p>see GREEK  (G1201) desmoterion
g,1203,"δεσπότης, ου, ὁ","Noun, Masculine",despotés,(des-pot'-ace),"lord, master","Lord, master. ","Perhaps from  (G1210) deo and posis (a husband); an absolute ruler (""despot"") -- Lord, master. <p>see GREEK  (G1210) deo "
g,1204,δεῦρο,Adverb; Verb,deuro,(dyoo'-ro),"until now, come here!",come hither.,"Of uncertain affinity; here; used also imperative hither!; and of time, hitherto -- come (hither), hither(-to). "
g,1205,δεῦτε,Verb,deute,(dyoo'-teh),come!,"come, follow. ","From  (G1204) deuro and an imperative form of eimi (to go); come hither! -- come, X follow. <p>see GREEK  (G1204) deuro "
g,1206,"δευτεραῖος, αία, αῖον",Adjective,deuteraios,(dyoo-ter-ah'-yos),on the second day,next day. ,"From  (G1208) deuteros; secondary, i.e. (specially) on the second day -- next day. <p>see GREEK  (G1208) deuteros "
g,1207,"δευτερόπρωτος, ον","Adjective<br><span class=""tophdg"">Phonetic Spelling: </span>(dyoo-ter-op\'-ro-tos)<br><span class=""tophdg"">Definition: </span>second, after the first<br><span class=""tophdg"">Usage: </span>second-first, a word of uncertain meaning.<div class=""vheading2"">Thayer\'s Greek Lexicon</div><span class=""maintitle"">STRONGS NT 1207: \xce\xb4\xce\xb5\xcf\x85\xcf\x84\xce\xb5\xcf\x81\xcf\x8c\xcf\x80\xcf\x81\xcf\x89\xcf\x84\xce\xbf\xcf\x82</span><br><br><span class=""arttitle""><span class=""grktitle"">\xce\xb4\xce\xb5\xcf\x85\xcf\x84\xce\xb5\xcf\x81\xcf\x8c\xcf\x80\xcf\x81\xcf\x89\xcf\x84\xce\xbf\xcf\x82</span></span>, <span class=""greek2"">\xce\xb4\xce\xb5\xcf\x85\xcf\x84\xce\xb5\xcf\x81\xcf\x8c\xcf\x80\xcf\x81\xcf\x89\xcf\x84\xce\xbf\xce\xbd</span>, <span class=""accented"">second-first</span> (cf. <span class=""greek2"">\xce\xb4\xce\xb5\xcf\x85\xcf\x84\xce\xb5\xcf\x81\xce\xb5\xcf\x83\xcf\x87\xce\xb1\xcf\x84\xce\xbf\xcf\x82</span> second-last, last but one): <span class=""greek2"">\xe1\xbc\x90\xce\xbd</span> <span class=""greek2"">\xcf\x83\xce\xb1\xce\xb2\xce\xb2\xce\xac\xcf\x84\xe1\xbf\xb3</span> <span class=""greek2"">\xce\xb4\xce\xb5\xcf\x85\xcf\x84\xce\xb5\xcf\x81\xce\xbf\xcf\x80\xcf\x81\xcf\x8e\xcf\x84\xe1\xbf\xb3</span> in <a href=""/interlinear/luke/6-1.htm"">Luke 6:1</a> seems to be, <span class=""accented"">the second of the first sabbaths after the feast of the Passover</span>; cf. Redslob in the Intelligenzblatt zur Hall. Lit. Zeit. 1847, N. 70; Ewald, Jahrbb. d. Biblical Wissensch. i., p. 72; (<span class=""manuref"">WH</span>\'s Appendix, at the passage). The various opinions of others are reviewed by Meyer (and McClellan) at the passage and L\xc3\xbcbkert in the Studien und Kritiken for 1835, p. 664ff (Eustrat. in vita Eutych. n. 95 calls the first Sunday after Easter <span class=""greek2"">\xce\xb4\xce\xb5\xcf\x85\xcf\x84\xce\xb5\xcf\x81\xce\xbf\xcf\x80\xcf\x81\xcf\x89\xcf\x84\xce\xb7\xce\xbd</span> <span class=""greek2"">\xce\xba\xcf\x85\xcf\x81\xce\xb9\xce\xb1\xce\xba\xce\xb7\xce\xbd</span>). (But the genuineness of the word is questionable. It is lacking in <span class=""hebrew"">\xd7\x90</span> B <span class=""manuref"">L</span> 1, 33, 69 and some other authorities. Hence, <span class=""manuref"">Tr</span> text <span class=""manuref"">WH</span> omit the word; <span class=""manuref"">L</span> <span class=""manuref"">Tr</span> marginal reading brackets it. Tischendorf, after expunging it in his 2nd edition, restored it in his 7th edition, subsequently put it in brackets, and finally (8th edition) inserted it again. It is questioned or discarded, by Meyer, Bleek, Alford, Weiss (on Mark, p. 101), Holtz., Hilgenf., Volkm., Farrar (commentary at the passage and Life of Christ 1:435), others. For the evidence see <span class=""manuref"">Tdf.</span>s note, and for discussions of it see <span class=""manuref"">WH</span>s Appendix at the passage; <span class=""abbreviation"">Scrivener</span>, Introduction, p. 515f; <span class=""abbreviation"">Green</span>, <span class=""accented"">Developed Criticism</span> at the passage.)<FOOTNOTE:1>   <br><br><iframe width=""100%"" height=""85"" scrolling=no src=""/bsoft.htm"" frameborder=0 cellpadding=0></iframe><div class=""vheading2"">Strong\'s Exhaustive Concordance</div>second, after the first. <p>From <a href=""/greek/1208.htm"">deuteros</a> and <a href=""/greek/4413.htm"">protos</a>; second-first, i.e. (specially) a designation of the Sabbath immediately after the Paschal week (being the second after Passover day, and the first of the seven Sabbaths intervening before Pentecost) -- second... After the first. <p>see GREEK <a href=""/greek/1208.htm"">deuteros</a> <p>see GREEK <a href=""/greek/4413.htm"">protos</a> <div cla",deuteroprótos,(dyoo-ter-op'-ro-tos),"second, after the first","second, after the first. ","From  (G1208) deuteros and  (G4413) protos; second-first, i.e. (specially) a designation of the Sabbath immediately after the Paschal week (being the second after Passover day, and the first of the seven Sabbaths intervening before Pentecost) -- second... After the first. <p>see GREEK  (G1208) deuteros <p>see GREEK  (G4413) protos "
g,1208,"δεύτερος, α, ον",Adjective; Adverb,deuteros,(dyoo'-ter-os),second,"afterward, again, secondarily. ","As the compare of  (G1417) duo; (ordinal) second (in time, place, or rank; also adverb) -- afterward, again, second(-arily, time). <p>see GREEK  (G1417) duo "
g,1209,δέχομαι,Verb,dechomai,(dekh'-om-ahee),to receive,"accept, receive, take. ","Middle voice of a primary verb; to receive (in various applications, literally or figuratively) -- accept, receive, take. Compare  (G2983) lambano. <p>see GREEK  (G2983) lambano "
g,1210,δέω,Verb,deó,(deh'-o),"to tie, bind","bind, be in bonds, knit, tie, wind. ","A primary verb; to bind (in various applications, literally or figuratively) -- bind, be in bonds, knit, tie, wind. See also  (G1163) dei,  (G1189) deomai. <p>see GREEK  (G1163) dei <p>see GREEK  (G1189) deomai "
g,1211,δή,"Particle, Disjunctive Particle",dé,(day),"indeed, now (used to give emphasis or urgency to a statement)","also, and, doubtless, now, therefore. ","Probably akin to  (G1161) de; a particle of emphasis or explicitness; now, then, etc. -- also, and, doubtless, now, therefore. <p>see GREEK  (G1161) de "
g,1212,"δῆλος, η, ον",Adjective,délos,(day'-los),"clear, evident","certain, evident, manifest.","Of uncertain derivation; clear -- + bewray, certain, evident, manifest. "
g,1213,δηλόω,Verb,déloó,(day-lo'-o),"to make plain, declare","declare, show, signify. ","From  (G1212) delos; to make plain (by words) -- declare, shew, signify. <p>see GREEK  (G1212) delos "
g,1214,"Δημᾶς, ᾶ, ὁ","Noun, Masculine",Démas,(day-mas'),"Demas, a companion of Paul",Demas. ,"Probably for  (G1216) Demetrios; Demas, a Christian -- Demas. <p>see GREEK  (G1216) Demetrios "
g,1215,δημηγορέω,Verb,démégoreó,(day-may-gor-eh'-o),to deliver a public address,make an oration. ,"From a compound of  (G1218) demos and  (G58) agora; to be a people-gatherer, i.e. To address a public assembly -- make an oration. <p>see GREEK  (G1218) demos <p>see GREEK  (G58) agora "
g,1216,"Δημήτριος, ου, ὁ","Noun, Masculine",Démétrios,(day-may'-tree-os),"Demetrius, the name of a silversmith and of a Christian",Demetrius. ,"From Demeter (Ceres); Demetrius, the name of an Ephesian and of a Christian -- Demetrius. "
g,1217,"δημιουργός, οῦ, ὁ","Noun, Masculine",démiourgos,(day-me-oor-gos'),"builder, maker, creator",maker. ,"From  (G1218) demos and  (G2041) ergon; a worker for the people, i.e. Mechanic (spoken of the Creator) -- maker. <p>see GREEK  (G1218) demos <p>see GREEK  (G2041) ergon "
g,1218,"δῆμος, οῦ, ὁ","Noun, Masculine",démos,(day'-mos),"a district or country, the common people, the people assembled",people. ,From  (G1210) deo; the public (as bound together socially) -- people. <p>see GREEK  (G1210) deo
g,1219,"δημόσιος, α, ον",Adjective,démosios,(day-mos'ee-os),public,"common, open, public. ","From  (G1218) demos; public; (feminine singular dative case as adverb) in public -- common, openly, publickly. <p>see GREEK  (G1218) demos "
g,1220,"δηνάριον, ου, τό","Noun, Neuter",dénarion,(day-nar'-ee-on),denarius (a Roman coin),"denarius, pence, penny. ","Of Latin origin; a denarius (or ten asses) -- pence, penny(-worth). "
g,1221,δήποτε,"Particle, Disjunctive Particle",dépote,(day'-pot-eh),sometime,whatsoever. ,"From  (G1211) de and  (G4218) pote; a particle of generalization; indeed, at any time -- (what-)soever. <p>see GREEK  (G1211) de <p>see GREEK  (G4218) pote "
g,1222,δήπου,Adverb,dépou,(day'-poo),"of course, surely",verily. ,From  (G1211) de and  (G4225) pou; a particle of asseveration; indeed doubtless -- verily. <p>see GREEK  (G1211) de <p>see GREEK  (G4225) pou
g,1223,διά,Preposition,dia,(dee-ah'),"through, on account of, because of","through, on account of","A primary preposition denoting the channel of an act; through (in very wide applications, local, causal, or occasional) -- after, always, among, at, to avoid, because of (that), briefly, by, for (cause)... Fore, from, in, by occasion of, of, by reason of, for sake, that, thereby, therefore, X though, through(-out), to, wherefore, with (-in). In composition it retains the same general importance. "
g,1224,διαβαίνω,Verb,diabainó,(dee-ab-ah'-ee-no),to step across,"come over, pass through. ","From  (G1223) dia and the base of  (G939) basis; to cross -- come over, pass (through). <p>see GREEK  (G1223) dia <p>see GREEK  (G939) basis "
g,1225,διαβάλλω,Verb,diaballó,(dee-ab-al'-lo),to bring charges (usually with hostile intent),accuse. ,From  (G1223) dia and  (G906) ballo; (figuratively) to traduce -- accuse. <p>see GREEK  (G1223) dia <p>see GREEK  (G906) ballo
g,1226,διαβεβαιόομαι,Verb,diabebaioomai,(dee-ab-eb-ahee-o'-om-ahee),to affirm confidently,affirm constantly. ,"Middle voice of a compound of  (G1223) dia and  (G950) bebaioo; to confirm thoroughly (by words), i.e. Asseverate -- affirm constantly. <p>see GREEK  (G1223) dia <p>see GREEK  (G950) bebaioo "
g,1227,διαβλέπω,Verb,diablepó,(dee-ab-lep'-o),"to look through, to see clearly",see clearly. ,"From  (G1223) dia and  (G991) blepo; to look through, i.e. Recover full vision -- see clearly. <p>see GREEK  (G1223) dia <p>see GREEK  (G991) blepo "
g,1228,"διάβολος, ον",Adjective,diabolos,(dee-ab'-ol-os),"slanderous, accusing falsely","false accuser, devil, slanderer. ","From  (G1225) diaballo; a traducer; specially, Satan (compare  (H7854) satan) -- false accuser, devil, slanderer. <p>see GREEK  (G1225) diaballo <p>see HEBREW  (H7854) satan "
g,1229,διαγγέλλω,Verb,diaggelló,(de-ang-gel'-lo),"to publish abroad, proclaim","declare, preach, signify. ","From  (G1223) dia and the base of  (G32) aggelos; to herald thoroughly -- declare, preach, signify. <p>see GREEK  (G1223) dia <p>see GREEK  (G32) aggelos "
