g,5601,"Ὠβήδ, ὁ","Proper Noun, Indeclinable",Obéd,(o-bade'),Obed,Obed. ,"Of Hebrew origin ( (H5744) Owbed); Obed, an Israelite -- Obed. <p>see HEBREW  (H5744) Owbed "
g,5602,ὧδε,Adverb,hóde,(ho'-deh),"so, to here, here","here, hither, in this place, there. ","From an adverb form of  (G3592) hode; in this same spot, i.e. Here or hither -- here, hither, (in) this place, there. <p>see GREEK  (G3592) hode "
g,5603,"ᾠδή, ῆς, ἡ","Noun, Feminine",ódé,(o-day'),"a song, ode",song. ,"From  (G103) aido; a chant or ""ode"" (the general term for any words sung; while  (G5215) humnos denotes especially a religious metrical composition, and  (G5568) psalmos still more specially, a Hebrew cantillation) -- song. <p>see GREEK  (G103) aido <p>see GREEK  (G5215) humnos <p>see GREEK  (G5568) psalmos "
g,5604,"ὠδίν, ῖνος, ἡ","Noun, Feminine",ódin,(o-deen'),a birth pang,"pain, sorrow, travail. ","Akin to  (G3601) odune; a pang or throe, especially of childbirth -- pain, sorrow, travail. <p>see GREEK  (G3601) odune "
g,5605,ὠδίνω,Verb,ódinó,(o-dee'-no),"to have birth pangs, to travail",birth pains,From  (G5604) odin; to experience the pains of parturition (literally or figuratively) -- travail in (birth). <p>see GREEK  (G5604) odin
g,5606,"ὦμος, ου, ὁ","Noun, Masculine",ómos,(o'-mos),the shoulder,shoulder. ,Perhaps from the alternate of  (G5342) phero; the shoulder (as that on which burdens are borne) -- shoulder. <p>see GREEK  (G5342) phero
g,5607,"ὤν,",-,"ón, ousa, on",(oan),"be, come, have","be, come, have. ","Including the feminine ousa (oo'-sah); and the neuter on (on) present participle of  (G1510) eimi; being -- be, come, have. <p>see GREEK  (G1510) eimi "
g,5608,ὠνέομαι,Verb,óneomai,(o-neh'-om-ahee),to buy,buy. ,Middle voice from an apparently primary onos (a sum or price); to purchase (synonymous with the earlier  (G4092) pimpremi) -- buy. <p>see GREEK  (G4092) pimpremi
g,5609,"ᾠόν, οῦ, τό","Noun, Neuter",óon,(o-on'),an egg,egg. ,"Apparently a primary word; an ""egg"" -- egg. "
g,5610,"ὥρα, ας, ἡ","Noun, Feminine",hóra,(ho'-rah),"a time or period, an hour","day, hour, instant, season","Apparently a primary word; an ""hour"" (literally or figuratively) -- day, hour, instant, season, X short, (even-)tide, (high) time. "
g,5611,"ὡραῖος, αία, αῖον",Adjective,hóraios,(ho-rah'-yos),"seasonable, timely",beautiful. ,"From  (G5610) hora; belonging to the right hour or season (timely), i.e. (by implication) flourishing (beauteous (figuratively)) -- beautiful. <p>see GREEK  (G5610) hora "
g,5612,ὠρύομαι,Verb,óruomai,(o-roo'-om-ahee),"to roar, howl",roar. ,"Middle voice of an apparently primary verb; to ""roar"" -- roar. "
g,5613,ὡς,Adverb,hós,(hoce),"as, like as, even as, when, since, as long as","as, that about, how","Probably adverb of comparative from  (G3739) hos; which how, i.e. In that manner (very variously used, as follows) -- about, after (that), (according) as (it had been, it were), as soon (as), even as (like), for, how (greatly), like (as, unto), since, so (that), that, to wit, unto, when(-soever), while, X with all speed. <p>see GREEK  (G3739) hos "
g,5614,ὡσαννά,Hebrew Form (Indclinable),hósanna,(ho-san-nah'),"save, we pray",hosanna. ,"Of Hebrew origin ( (H3467) yasha' and  (H4994) na'); oh save!; hosanna (i.e. Hoshia-na), an exclamation of adoration -- hosanna. <p>see HEBREW  (H3467) yasha' <p>see HEBREW  (H4994) na' "
g,5615,ὡσαύτως,Adverb,hósautós,(ho-sow'-toce),in like manner,"even so, likewise","From  (G5613) hos and an adverb from  (G846) autos; as thus, i.e. In the same way -- even so, likewise, after the same (in like) manner. <p>see GREEK  (G5613) hos <p>see GREEK  (G846) autos "
g,5616,ὡσεί,Adverb,hósei,(ho-si'),"as if, as it were, like","like, about","From  (G5613) hos and  (G1487) ei; as if -- about, as (it had been, it were), like (as). <p>see GREEK  (G5613) hos <p>see GREEK  (G1487) ei "
g,5617,"Ὡσηέ, ὁ","Proper Noun, Indeclinable",Hósée,(ho-say-eh'),"Hosea, an Israelite prophet",Osee. ,"Of Hebrew origin ( (H1954) Howshea'); Hosee (i.e. Hoshea), an Israelite -- Osee. <p>see HEBREW  (H1954) Howshea' "
g,5618,ὥσπερ,Adverb,hósper,(hoce'-per),"just as, even as","just as, even as","From  (G5613) hos and  (G4007) per; just as, i.e. Exactly like -- (even, like) as. <p>see GREEK  (G5613) hos <p>see GREEK  (G4007) per "
g,5619,ὡσπερεί,Adverb,hósperei,(hoce-per-i'),"as, as it were",as. ,"From  (G5618) hosper and  (G1487) ei; just as if, i.e. As it were -- as. <p>see GREEK  (G5618) hosper <p>see GREEK  (G1487) ei "
g,5620,ὥστε,Conjunction,hóste,(hoce'-teh),"so as to, so then, therefore",so that,"From  (G5613) hos and  (G5037) te; so too, i.e. Thus therefore (in various relations of consecution, as follow) -- (insomuch) as, so that (then), (insomuch) that, therefore, to, wherefore. <p>see GREEK  (G5613) hos <p>see GREEK  (G5037) te "
g,5621,"ὠτίον, ου, τό","Noun, Neuter",otion,(o-tee'-on),an ear,ear. ,"Diminutive of  (G3775) ous; an earlet, i.e. One of the ears, or perhaps the lobe of the ear -- ear. <p>see GREEK  (G3775) ous "
g,5622,"ὠφέλεια, ας, ἡ","Noun, Feminine",ópheleia,(o-fel'-i-ah),"assistance, profit, benefit","advantage, profit. ","From a derivative of the base of  (G5624) ophelimos; usefulness, i.e. Benefit -- advantage, profit. <p>see GREEK  (G5624) ophelimos "
g,5623,ὠφελέω,Verb,ópheleó,(o-fel-eh'-o),"to help, benefit, do good","profit, prevail","From the same as  (G5622) opheleia; to be useful, i.e. To benefit -- advantage, better, prevail, profit. <p>see GREEK  (G5622) opheleia "
g,5624,"ὠφέλιμος, ον",Adjective,óphelimos,(o-fel'-ee-mos),"useful, profitable","useful, profitable","From a form of  (G3786) ophelos; helpful or serviceable, i.e. Advantageous -- profit(-able). <p>see GREEK  (G3786) ophelos "