g3830,"πανδοχεύς, έως, ὁ","Noun, Masculine",pandocheus,(pan-dokh-yoos'),"an innkeeper, a host","innkeeper, host. ",From the same as  (G3829) pandocheion; an innkeeper (warden of a caravanserai) -- host. <p>see GREEK  (G3829) pandocheion
g3831,"πανήγυρις, εως, ἡ","Noun, Feminine",panéguris,(pan-ay'-goo-ris),a festal assembly,general assembly. ,"From  (G3956) pas and a derivative of  (G58) agora; a mass-meeting, i.e. (figuratively) universal companionship -- general assembly. <p>see GREEK  (G3956) pas <p>see GREEK  (G58) agora "
g3832,πανοικί,Adverb,panoikei,(pan-oy-kee'),with all the household,with the whole family,Adverb from  (G3956) pas and  (G3624) oikos; with the whole family -- with all his house. <p>see GREEK  (G3956) pas <p>see GREEK  (G3624) oikos
g3833,"πανοπλία, ας, ἡ","Noun, Feminine",panoplia,(pan-op-lee'-ah),full armor,full armor. ,"From a compound of  (G3956) pas and  (G3696) hoplon; full armor (""panoply"") -- all (whole) armour. <p>see GREEK  (G3956) pas <p>see GREEK  (G3696) hoplon "
g3834,"πανουργία, ας, ἡ","Noun, Feminine",panourgia,(pan-oorg-ee'-ah),"cleverness, craftiness","cunning, craftiness, subtilty. ","From  (G3835) panougos; adroitness, i.e. (in a bad sense) trickery or sophistry -- (cunning) craftiness, subtilty. <p>see GREEK  (G3835) panougos "
g3835,"πανοῦργος, ον","Noun, Masculine",panourgos,(pan-oor'-gos),"ready to do anything, crafty, skillful",crafty. ,"From  (G3956) pas and  (G2041) ergon; all-working, i.e. Adroit (shrewd) -- crafty. <p>see GREEK  (G3956) pas <p>see GREEK  (G2041) ergon "
g3836,πανταχόθεν,Adverb,pantachothen,(pan-takh-oth'-en),everywhere,from every quarter. ,Adverb (of source) from  (G3837) pantachou; from all directions -- from every quarter. <p>see GREEK  (G3837) pantachou
g3837,πανταχοῦ,Adverb,pantachou,(pan-takh-oo'),everywhere,"in all places, everywhere. ","Genitive case (as adverb of place) of a presumed derivative of  (G3956) pas; universally -- in all places, everywhere. <p>see GREEK  (G3956) pas "
g3838,"παντελής, ές",Adjective,pantelés,(pan-tel-ace'),"all complete, entire",uttermost,"From  (G3956) pas and  (G5056) telos; full-ended, i.e. Entire (neuter as noun, completion) -- + in (no) wise, uttermost. <p>see GREEK  (G3956) pas <p>see GREEK  (G5056) telos "
g3839,πάντῃ,Adverb,panté,(pan'-tay),"every way, entirely",always. ,Adverb (of manner) from  (G3956) pas; wholly -- always. <p>see GREEK  (G3956) pas
g3840,πάντοθεν,Adverb,pantothen,(pan-toth'-en),from all sides,"on every side, round about. ","Adverb (of source) from  (G3956) pas; from (i.e. On) all sides -- on every side, round about. <p>see GREEK  (G3956) pas "
g3841,"παντοκράτωρ, ορος, ὁ","Noun, Masculine",pantokratór,(pan-tok-rat'-ore),almighty,"Almighty, Omnipotent. ","From  (G3956) pas and  (G2904) kratos; the all-ruling, i.e. God (as absolute and universal sovereign) -- Almighty, Omnipotent. <p>see GREEK  (G3956) pas <p>see GREEK  (G2904) kratos "
g3842,πάντοτε,Adverb,pantote,(pan'-tot-eh),at all times,"always, evermore. ","From  (G3956) pas and  (G3753) hote; every when, i.e. At all times -- alway(-s), ever(-more). <p>see GREEK  (G3956) pas <p>see GREEK  (G3753) hote "
g3843,πάντως,Adverb,pantós,(pan'-toce),"altogether, by all means","altogether, by all means, no doubt. ","Adverb from  (G3956) pas; entirely; specially, at all events, (with negative, following) in no event -- by all means, altogether, at all, needs, no doubt, in (no) wise, surely. <p>see GREEK  (G3956) pas "
g3844,παρά,Preposition,para,(par-ah'),"from beside, by the side of, by, beside","beside, among, at, before, by","A primary preposition; properly, near; i.e. (with genitive case) from beside (literally or figuratively), (with dative case) at (or in) the vicinity of (objectively or subjectively), (with accusative case) to the proximity with (local (especially beyond or opposed to) or causal (on account of) -- above, against, among, at, before, by, contrary to, X friend, from, + give (such things as they), + that (she) had, X his, in, more than, nigh unto, (out) of, past, save, side...by, in the sight of, than, (there-)fore, with. In compounds it retains the same variety of application. "
g3845,παραβαίνω,Verb,parabainó,(par-ab-ah'-ee-no),"to go by the side of, to go past",transgress. ,"From  (G3844) para and the base of  (G939) basis; to go contrary to, i.e. Violate a command -- (by) transgress(-ion). <p>see GREEK  (G3844) para <p>see GREEK  (G939) basis "
g3846,παραβάλλω,Verb,paraballó,(par-ab-al'-lo),to throw beside,"arrive, cross over ","From  (G3844) para and  (G906) ballo; to throw alongside, i.e. (reflexively) to reach a place, or (figuratively) to liken -- arrive, compare. <p>see GREEK  (G3844) para <p>see GREEK  (G906) ballo "
g3847,"παράβασις, εως, ἡ","Noun, Feminine",parabasis,(par-ab'-as-is),"a going aside, a transgression","breaking, transgression. ","From  (G3845) parabaino; violation -- breaking, transgression. <p>see GREEK  (G3845) parabaino "
g3848,"παραβάτης, ου, ὁ","Noun, Masculine",parabatés,(par-ab-at'-ace),one who stands beside,"breaker, transgressor. ","From  (G3845) parabaino; a violator -- breaker, transgress(-or). <p>see GREEK  (G3845) parabaino "
g3849,παραβιάζομαι,Verb,parabiazomai,(par-ab-ee-ad'-zom-ahee),to force against (nature),constrain. ,"From  (G3844) para and the middle voice of  (G971) biazo; to force contrary to (nature), i.e. Compel (by entreaty) -- constrain. <p>see GREEK  (G3844) para <p>see GREEK  (G971) biazo "
g3850,"παραβολή, ῆς, ἡ","Noun, Feminine",parabole,(par-ab-ol-ay'),to expose oneself to danger,"comparison, figure, parable, proverb. ","From  (G3846) paraballo; a similitude (""parable""), i.e. (symbolic) fictitious narrative (of common life conveying a moral), apothegm or adage -- comparison, figure, parable, proverb. <p>see GREEK  (G3846) paraballo "
g3851,παραβουλεύομαι,Verb,parabouleuomai,(par-ab-ool-yoo'-om-ahee),"risk, disregard","risk, disregard","From  (G3844) para and the middle voice of  (G1011) bouleuo; to misconsult, i.e. Disregard -- not (to) regard(-ing). <p>see GREEK  (G3844) para <p>see GREEK  (G1011) bouleuo "
g3852,"παραγγελία, ας, ἡ","Noun, Feminine",paraggelia,(par-ang-gel-ee'-ah),"an instruction, a command","mandate, charge, command. ","From  (G3853) paraggello; a mandate -- charge, command. <p>see GREEK  (G3853) paraggello "
g3853,παραγγέλλω,Verb,paraggelló,(par-ang-gel'-lo),"to transmit a message, to order","to command, charge","From  (G3844) para and the base of  (G32) aggelos; to transmit a message, i.e. (by implication) to enjoin -- (give in) charge, (give) command(-ment), declare. <p>see GREEK  (G3844) para <p>see GREEK  (G32) aggelos "
g3854,παραγίνομαι,Verb,paraginomai,(par-ag-in'-om-ahee),"to be beside, to arrive","come, go, be present. ","From  (G3844) para and  (G1096) ginomai; to become near, i.e. Approach (have arrived); by implication, to appear publicly -- come, go, be present. <p>see GREEK  (G3844) para <p>see GREEK  (G1096) ginomai "
g3855,παράγω,Verb,paragó,(par-ag'-o),"to lead by, to pass by or away","depart, pass by","From  (G3844) para and  (G71) ago; to lead near, i.e. (reflexively or intransitively) to go along or away -- depart, pass (away, by, forth). <p>see GREEK  (G3844) para <p>see GREEK  (G71) ago "
g3856,παραδειγματίζω,Verb,paradeigmatizó,(par-ad-igue-mat-id'-zo),to set forth as an example,"expose, make a public example","From  (G3844) para and  (G1165) deigmatizo; to show alongside (the public), i.e. Expose to infamy -- make a public example, put to an open shame. <p>see GREEK  (G3844) para <p>see GREEK  (G1165) deigmatizo "
g3857,"παράδεισος, ου, ὁ","Noun, Masculine",paradeisos,(par-ad'-i-sos),"a park, a garden, a paradise",paradise. ,"Of Oriental origin (compare  (H6508) pardec); a park, i.e. (specially), an Eden (place of future happiness, ""paradise"") -- paradise. <p>see HEBREW  (H6508) pardec "
g3858,παραδέχομαι,Verb,paradechomai,(par-ad-ekh'-om-ahee),"to receive, admit",receive. ,"From  (G3844) para and  (G1209) dechomai; to accept near, i.e. Admit or (by implication) delight in -- receive. <p>see GREEK  (G3844) para <p>see GREEK  (G1209) dechomai "
g3859,"παραδιατριβή, ῆς, ἡ","Noun, Feminine",paradiatribé,(par-ad-ee-at-ree-bay'),"wrangling, constant arguing","wrangling, constant arguing","From a compound of  (G3844) para and  (G1304) diatribo; misemployment, i.e. Meddlesomeness -- perverse disputing. <p>see GREEK  (G3844) para <p>see GREEK  (G1304) diatribo "
g3860,παραδίδωμι,Verb,paradidómi,(par-ad-id'-o-mee),"to hand over, to give or deliver over, to betray","betray, bring forth","From  (G3844) para and  (G1325) didomi; to surrender, i.e yield up, intrust, transmit -- betray, bring forth, cast, commit, deliver (up), give (over, up), hazard, put in prison, recommend. <p>see GREEK  (G3844) para <p>see GREEK  (G1325) didomi "
g3861,"παράδοξος, ον",Adjective,paradoxos,(par-ad'-ox-os),contrary to opinion or expectation,strange. ,"From  (G3844) para and  (G1391) doxa (in the sense of seeming); contrary to expectation, i.e. Extraordinary (""paradox"") -- strange. <p>see GREEK  (G3844) para <p>see GREEK  (G1391) doxa "
g3862,"παράδοσις, εως, ἡ","Noun, Feminine",paradosis,(par-ad'-os-is),"a handing down or over, a tradition","tradition, ordinance","From  (G3860) paradidomi; transmission, i.e. (concretely) a precept; specially, the Jewish traditionary law -- ordinance, tradition. <p>see GREEK  (G3860) paradidomi "
g3863,παραζηλόω,Verb,parazéloó,(par-ad-zay-lo'-o),to provoke to jealousy,provoke to jealousy. ,"From  (G3844) para and  (G2206) zeloo; to stimulate alongside, i.e. Excite to rivalry -- provoke to emulation (jealousy). <p>see GREEK  (G3844) para <p>see GREEK  (G2206) zeloo "
g3864,"παραθαλάσσιος, ία, ιον",Adjective,parathalassios,(par-ath-al-as'-see-os),by the sea,by the sea,"From  (G3844) para and  (G2281) thalassa; along the sea, i.e. Maritime (lacustrine) -- upon the sea coast. <p>see GREEK  (G3844) para <p>see GREEK  (G2281) thalassa "
g3865,παραθεωρέω,Verb,paratheóreó,(par-ath-eh-o-reh'-o),"to compare, to overlook",neglect. ,From  (G3844) para and  (G2334) theoreo; to overlook or disregard -- neglect. <p>see GREEK  (G3844) para <p>see GREEK  (G2334) theoreo
g3866,"παραθήκη, ης, ἡ","Noun, Feminine",parathéké,(par-ath-ay'-kay),a deposit or trust,a deposit or trust,"From  (G3908) paratithemi; a deposit, i.e. (figuratively) trust -- committed unto. <p>see GREEK  (G3908) paratithemi "
g3867,παραινέω,Verb,paraineó,(par-ahee-neh'-o),"to exhort, advise",exhort. ,"From  (G3844) para and  (G134) aineo; to mispraise, i.e. Recommend or advise (a different course) -- admonish, exhort. <p>see GREEK  (G3844) para <p>see GREEK  (G134) aineo "
g3868,παραιτέομαι,Verb,paraiteomai,(par-ahee-teh'-om-ahee),"to beg from, to beg off","refuse, reject. ","From  (G3844) para and the middle voice of  (G154) aiteo; to beg off, i.e. Deprecate, decline, shun -- avoid, (make) excuse, intreat, refuse, reject. <p>see GREEK  (G3844) para <p>see GREEK  (G154) aiteo "
g3869,παρακαθίζω,Verb,parakathizo,(par-ak-ath-id'-zo),to sit down beside,sit. ,From  (G3844) para and  (G2523) kathizo; to sit down near -- sit. <p>see GREEK  (G3844) para <p>see GREEK  (G2523) kathizo
g3870,παρακαλέω,Verb,parakaleó,(par-ak-al-eh'-o),"to call to or for, to exhort, to encourage","beseech, call for, urge","From  (G3844) para and  (G2564) kaleo; to call near, i.e. Invite, invoke (by imploration, hortation or consolation) -- beseech, call for, (be of good) comfort, desire, (give) exhort(-ation), intreat, pray. <p>see GREEK  (G3844) para <p>see GREEK  (G2564) kaleo "
g3871,παρακαλύπτω,Verb,parakaluptó,(par-ak-al-oop'-to),"to cover (by hanging something beside), to hide",hide. ,"From  (G3844) para and  (G2572) kalupto; to cover alongside, i.e. Veil (figuratively) -- hide. <p>see GREEK  (G3844) para <p>see GREEK  (G2572) kalupto "
g3872,παρακαταθήκη,-,parakatathéké,(par-ak-at-ath-ay'-kay),a trust or deposit,deposit,"From a compound of  (G3844) para and  (G2698) katatithemi; something put down alongside, i.e. A deposit (sacred trust) -- that (thing) which is committed (un-)to (trust). <p>see GREEK  (G3844) para <p>see GREEK  (G2698) katatithemi "
g3873,παράκειμαι,Verb,parakeimai,(par-ak'-i-mahee),"to lie beside, be present",be present. ,"From  (G3844) para and  (G2749) keimai; to lie near, i.e. Be at hand (figuratively, be prompt or easy) -- be present. <p>see GREEK  (G3844) para <p>see GREEK  (G2749) keimai "
g3874,"παράκλησις, εως, ἡ","Noun, Feminine",paraklésis,(par-ak'-lay-sis),"a calling to one\'s aid, encouragement, comfort","comfort, consolation, exhortation, entreaty. ","From  (G3870) parakaleo; imploration, hortation, solace -- comfort, consolation, exhortation, intreaty. <p>see GREEK  (G3870) parakaleo "
g3875,"παράκλητος, ου, ὁ","Noun, Masculine",paraklétos,(par-ak'-lay-tos),called to one\'s aid,"advocate, comforter. ","An intercessor, consoler -- advocate, comforter. "
g3876,"παρακοή, ῆς, ἡ","Noun, Feminine",parakoé,(par-ak-o-ay'),"a hearing amiss, by implication disobedience",disobedience. ,"From  (G3878) parakouo; inattention, i.e. (by implication) disobedience -- disobedience. <p>see GREEK  (G3878) parakouo "
g3877,παρακολουθέω,Verb,parakoloutheó,(par-ak-ol-oo-theh'-o),"to follow closely, to investigate","follow, fully know, have understanding. ","From  (G3844) para and  (G190) akoloutheo; to follow near, i.e. (figuratively) attend (as a result), trace out, conform to -- attain, follow, fully know, have understanding. <p>see GREEK  (G3844) para <p>see GREEK  (G190) akoloutheo "
g3878,παρακούω,Verb,parakouó,(par-ak-oo'-o),"to overhear, to hear amiss, to take no heed",neglect to hear. ,"From  (G3844) para and  (G191) akouo; to mishear, i.e. (by implication) to disobey -- neglect to hear. <p>see GREEK  (G3844) para <p>see GREEK  (G191) akouo "
g3879,παρακύπτω,Verb,parakuptó,(par-ak-oop'-to),"to stoop sideways, to stoop to look","look into, stoop down. ","From  (G3844) para and  (G2955) kupto; to bend beside, i.e. Lean over (so as to peer within) -- look (into), stoop down. <p>see GREEK  (G3844) para <p>see GREEK  (G2955) kupto "
g3880,παραλαμβάνω,Verb,paralambanó,(par-al-am-ban'-o),to receive from,"receive, take unto, with. ","From  (G3844) para and  (G2983) lambano; to receive near, i.e. Associate with oneself (in any familiar or intimate act or relation); by analogy, to assume an office; figuratively, to learn -- receive, take (unto, with). <p>see GREEK  (G3844) para <p>see GREEK  (G2983) lambano "
g3881,παραλέγομαι,Verb,paralegomai,(par-al-eg'-om-ahee),to sail past or coast along,"pass, sail by. ","From  (G3844) para and the middle voice of  (G3004) lego (in its original sense); (specially), to lay one's course near, i.e. Sail past -- pass, sail by. <p>see GREEK  (G3844) para <p>see GREEK  (G3004) lego "
g3882,"παράλιος, ον",Adjective,paralios,(par-al'-ee-os),"by the sea, the sea coast",sea coast. ,"From  (G3844) para and  (G251) hals; beside the salt (sea), i.e. Maritime -- sea coast. <p>see GREEK  (G3844) para <p>see GREEK  (G251) hals "
g3883,"παραλλαγή, ῆς, ἡ","Noun, Feminine",parallagé,(par-al-lag-ay'),change,"fickleness, variableness. ","From a compound of  (G3844) para and  (G236) allasso; transmutation (of phase or orbit), i.e. (figuratively) fickleness: variableness. <p>see GREEK  (G3844) para <p>see GREEK  (G236) allasso "
g3884,παραλογίζομαι,Verb,paralogizomai,(par-al-og-id'-zom-ahee),"to miscalculate, to reason falsely","beguile, deceive. ","From  (G3844) para and  (G3049) logizomai; to misreckon, i.e. Delude -- beguile, deceive. <p>see GREEK  (G3844) para <p>see GREEK  (G3049) logizomai "
g3885,"παραλυτικός, ή, όν",Adjective,paralutikos,(par-al-oo-tee-kos'),paralytic,a paralytic,"From a derivative of  (G3886) paraluo; as if dissolved, i.e. ""paralytic"" -- that had (sick of) the palsy. <p>see GREEK  (G3886) paraluo "
g3886,παραλύω,Verb,paraluó,(par-al-oo'-o),to loose from the side,"to weaken, disable, paralyze","From  (G3844) para and  (G3089) luo; to loosen beside, i.e. Relax (perfect passive participle, paralyzed or enfeebled) -- feeble, sick of the (taken with) palsy. <p>see GREEK  (G3844) para <p>see GREEK  (G3089) luo "
g3887,παραμένω,Verb,paramenó,(par-am-en'-o),to remain beside or near,"abide, continue. ","From  (G3844) para and  (G3306) meno; to stay near, i.e. Remain (literally, tarry; or figuratively, be permanent, persevere) -- abide, continue. <p>see GREEK  (G3844) para <p>see GREEK  (G3306) meno <p>see GREEK  (G3306) meno <p>see GREEK  (G3844) para "
g3888,παραμυθέομαι,Verb,paramutheomai,(par-am-oo-theh'-om-ahee),"to encourge, comfort",comfort. ,"From  (G3844) para and the middle voice of a derivative of  (G3454) muthos; to relate near, i.e. (by implication) encourage, console -- comfort. <p>see GREEK  (G3844) para <p>see GREEK  (G3454) muthos "
g3889,"παραμυθία, ας, ἡ","Noun, Feminine",paramuthia,(par-am-oo-thee'-ah),"encouragement, exhortation, comfort",comfort. ,"From  (G3888) paramutheomai; consolation (properly, abstract) -- comfort. <p>see GREEK  (G3888) paramutheomai "
g3890,"παραμύθιον, ου, τό","Noun, Neuter",paramuthion,(par-am-oo'-thee-on),"exhortation, encouragement",comfort. ,"Neuter of  (G3889) paramuthia; consolation (properly, concretely) -- comfort. <p>see GREEK  (G3889) paramuthia "
g3891,παρανομέω,Verb,paranomeó,(par-an-om-eh'-o),to transgress the law,contrary to law. ,"From a compound of  (G3844) para and  (G3551) nomos; to be opposed to law, i.e. To transgress -- contrary to law. <p>see GREEK  (G3844) para <p>see GREEK  (G3551) nomos "
g3892,"παρανομία, ας, ἡ","Noun, Feminine",paranomia,(par-an-om-ee'-ah),lawbreaking,"transgression, iniquity. ",From the same as  (G3891) paranomeo; transgression: iniquity. <p>see GREEK  (G3891) paranomeo
g3893,παραπικραίνω,Verb,parapikrainó,(par-ap-ik-rah'-ee-no),"to embitter, provoke",provoke. ,"From  (G3844) para and  (G4087) pikraino; to embitter alongside, i.e. (figuratively) to exasperate -- provoke. <p>see GREEK  (G3844) para <p>see GREEK  (G4087) pikraino "
g3894,"παραπικρασμός, οῦ, ὁ","Noun, Masculine",parapikrasmos,(par-ap-ik-ras-mos'),provocation,provocation. ,From  (G3893) parapikraino; irritation -- provocation. <p>see GREEK  (G3893) parapikraino
g3895,παραπίπτω,Verb,parapiptó,(par-ap-ip'-to),"to fall in, into or away, to fail",fall away. ,"From  (G3844) para and  (G4098) pipto; to fall aside, i.e. (figuratively) to apostatize -- fall away. <p>see GREEK  (G3844) para <p>see GREEK  (G4098) pipto "
g3896,παραπλέω,Verb,parapleó,(par-ap-leh'-o),to sail by or past,sail by. ,From  (G3844) para and  (G4126) pleo; to sail near -- sail by. <p>see GREEK  (G3844) para <p>see GREEK  (G4126) pleo
g3897,παραπλήσιον,Adverb,paraplésios,(par-ap-lay'-see-on),"coming near, nearly resembling",nigh unto. ,"Neuter of a compound of  (G3844) para and the base of  (G4139) plesion (as adverb); close by, i.e. (figuratively) almost -- nigh unto. <p>see GREEK  (G3844) para <p>see GREEK  (G4139) plesion "
g3898,παραπλησίως,Adverb,paraplésiós,(par-ap-lay-see'-oce),in like manner,likewise. ,"Adverb from the same as  (G3897) paraplesion; in a manner near by, i.e. (figuratively) similarly -- likewise. <p>see GREEK  (G3897) paraplesion "
g3899,παραπορεύομαι,Verb,paraporeuomai,(par-ap-or-yoo'-om-ahee),to go beside or past,"go past, pass by. ","From  (G3844) para and  (G4198) poreuomai; to travel near -- go, pass (by). <p>see GREEK  (G3844) para <p>see GREEK  (G4198) poreuomai "
g3900,"παράπτωμα, ατος, τό","Noun, Neuter",paraptóma,(par-ap'-to-mah),"a false step, a trespass","offense, sin, trespass. ","From  (G3895) parapipto; a side-slip (lapse or deviation), i.e. (unintentional) error or (wilful) transgression -- fall, fault, offence, sin, trespass. <p>see GREEK  (G3895) parapipto "
g3901,παραρρέω,Verb,pararreó,(par-ar-hroo-eh'-o),"to flow by, slip away",drift away,"From  (G3844) para and the alternate of  (G4482) rheo; to flow by, i.e. (figuratively) carelessly pass (miss) -- let slip. <p>see GREEK  (G3844) para <p>see GREEK  (G4482) rheo "
g3902,"παράσημος, ον","Noun, Neuter",parasémos,(par-as'-ay-mos),"marked amiss, marked at the side, marked with a sign",side-marked with a figurehead,"From  (G3844) para and the base of  (G4591) semaino; side-marked, i.e. Labelled (with a badge (figure-head) of a ship) -- sign. <p>see GREEK  (G3844) para <p>see GREEK  (G4591) semaino "
g3903,παρασκευάζω,Verb,paraskeuazó,(par-ask-yoo-ad'-zo),"to prepare, make ready","prepare self, make ready. ","From  (G3844) para and a derivative of  (G4632) skeuos; to furnish aside, i.e. Get ready -- prepare self, be (make) ready. <p>see GREEK  (G3844) para <p>see GREEK  (G4632) skeuos "
g3904,"παρασκευή, ῆς, ἡ","Noun, Feminine",paraskeué,(par-ask-yoo-ay'),"preparation, the day of preparation (for a Sabbath or feast)",preparation. ,As if from  (G3903) paraskeuazo; readiness -- preparation. <p>see GREEK  (G3903) paraskeuazo
g3905,παρατείνω,Verb,parateinó,(par-at-i'-no),"to extend, prolong",continue. ,"From  (G3844) para and teino (to stretch); to extend along, i.e. Prolong (in point of time) -- continue. <p>see GREEK  (G3844) para "
g3906,παρατηρέω,Verb,paratéreó,(par-at-ay-reh'-o),"to watch closely, to observe scrupulously","observe, watch. ","From  (G3844) para and  (G5083) tereo; to inspect alongside, i.e. Note insidiously or scrupulously -- observe, watch. <p>see GREEK  (G3844) para <p>see GREEK  (G5083) tereo "
g3907,"παρατήρησις, εως, ἡ","Noun, Feminine",paratérésis,(par-at-ay'-ray-sis),observation,observation. ,"From  (G3906) paratereo; inspection, i.e. Ocular evidence -- obervation. <p>see GREEK  (G3906) paratereo "
g3908,παρατίθημι,Verb,paratithémi,(par-at-ith'-ay-mee),"to place beside, to set before","entrust, commend, commit ","From  (G3844) para and  (G5087) tithemi; to place alongside, i.e. Present (food, truth); by implication, to deposit (as a trust or for protection) -- allege, commend, commit (the keeping of), put forth, set before. <p>see GREEK  (G3844) para <p>see GREEK  (G5087) tithemi "
g3909,παρατυγχάνω,Verb,paratugchanó,(par-at-oong-khan'-o),to happen to be near or present,meet with. ,"From  (G3844) para and  (G5177) tugchano; to chance near, i.e. Fall in with -- meet with. <p>see GREEK  (G3844) para <p>see GREEK  (G5177) tugchano "
g3910,παραυτίκα,Adverb,parautika,(par-ow-tee'-kah),"immediately, for a moment","immediately, but for a moment. ","From  (G3844) para and a derivative of  (G846) autos; at the very instant, i.e. Momentary -- but for a moment. <p>see GREEK  (G3844) para <p>see GREEK  (G846) autos "
g3911,παραφέρω,Verb,parapheró,(par-af-er'-o),"to bring to, to carry away","remove, take away. ","From  (G3844) para and  (G5342) phero (including its alternate forms); to bear along or aside, i.e. Carry off (literally or figuratively); by implication, to avert -- remove, take away. <p>see GREEK  (G3844) para <p>see GREEK  (G5342) phero "
g3912,παραφρονέω,Verb,paraphroneó,(par-af-ron-eh'-o),"to be beside oneself, to be deranged",to be insane,"From  (G3844) para and  (G5426) phroneo; to misthink, i.e. Be insane (silly) -- as a fool. <p>see GREEK  (G3844) para <p>see GREEK  (G5426) phroneo "
g3913,"παραφρονία, ας, ἡ","Noun, Feminine",paraphronia,(par-af-ron-ee'-ah),madness,madness. ,"From  (G3912) paraphroneo; insanity, i.e. Foolhardiness -- madness. <p>see GREEK  (G3912) paraphroneo "
g3914,παραχειμάζω,Verb,paracheimazó,(par-akh-i-mad'-zo),to winter at,winter. ,"From  (G3844) para and  (G5492) cheimazo; to winter near, i.e. Stay with over the rainy season -- winter. <p>see GREEK  (G3844) para <p>see GREEK  (G5492) cheimazo "
g3915,"παραχειμασία, ας, ἡ","Noun, Feminine",paracheimasia,(par-akh-i-mas-ee'-ah),a wintering,winter in. ,From  (G3914) paracheimazo; a wintering over -- winter in. <p>see GREEK  (G3914) paracheimazo
g3916,παραχρῆμα,Adverb,parachréma,(par-akh-ray'-mah),instantly,"immediately, presently, straightway, soon. ","From  (G3844) para and  (G5536) chrema (in its original sense); at the thing itself, i.e. Instantly -- forthwith, immediately, presently, straightway, soon. <p>see GREEK  (G3844) para <p>see GREEK  (G5536) chrema "
g3917,"πάρδαλις, εως, ἡ","Noun, Feminine",pardalis,(par'-dal-is),"a panther, leopard",leopard. ,Feminine of pardos (a panther); a leopard -- leopard.
g3918,πάρειμι,Verb,pareimi,(par'-i-mee),to sit constantly beside,to be present,"From  (G3844) para and  (G1510) eimi (including its various forms); to be near, i.e. At hand; neuter present participle (singular) time being, or (plural) property -- come, X have, be here, + lack, (be here) present. <p>see GREEK  (G3844) para <p>see GREEK  (G1510) eimi "
g3919,παρεισάγω,Verb,pareisagó,(par-ice-ag'-o),"to introduce, to bring in secretly",introduce secretly,"From  (G3844) para and  (G1521) eisago; to lead in aside, i.e. Introduce surreptitiously -- privily bring in. <p>see GREEK  (G3844) para <p>see GREEK  (G1521) eisago "
