h,4432,מֹלֶךְ,Proper Name Masculine,Molek,(mo'-lek),a heathen god to whom Israelites sacrificed children,Molech ,"From (H4427) malak; Molek (i.e. King), the chief deity of the Ammonites -- Molech. Compare (H4445) Malkam. see HEBREW (H4427) malak see HEBREW (H4445) Malkam "
h,4433,מַלְכָּא,Noun Feminine,malka or malkah,(mal-kaw'),queen,queen ,(Aramaic) corresponding to (H4436) malkah; a queen -- queen. see HEBREW (H4436) malkah
h,4434,מַלְכֹּדֶת,Noun Feminine,malkodeth,(mal-ko'-deth),"a catching instrument, a snare, trap",trap ,From (H3920) lakad; a snare -- trap. see HEBREW (H3920) lakad
h,4435,מִלְכָּה,Proper Name Feminine,Milkah,(mil-kaw'),two Israelite women,Milcah ,"A form of (H4436) malkah; queen; Milcah, the name of a Hebrewess and of an Israelite -- Milcah. see HEBREW (H4436) malkah "
h,4436,מַלְכָּה,Noun Feminine,malkah,(mal-kaw'),queen,queen ,Feminine of (H4428) melek; a queen -- queen. see HEBREW (H4428) melek
h,4437,מַלְכוּ,Noun Feminine,malku,(mal-koo'),"royalty, reign, kingdom","kingdom, kingly, realm, reign ","(Aramaic) corresponding to (H4438) malkuwth; dominion (abstractly or concretely) -- kingdom, kingly, realm, reign. see HEBREW (H4438) malkuwth "
h,4438,מַלְכוּת,Noun Feminine,malkuth,(mal-kooth'),"royalty, royal power, reign, kingdom","empire, kingdom, realm, reign, royal ","Or malkuth {mal-kooth'}; or (in plural) malkuyah {mal-koo-yah'}; from (H4427) malak; a rule; concretely, a dominion -- empire, kingdom, realm, reign, royal. see HEBREW (H4427) malak "
h,4439,מַלְכִּיאֵל,Proper Name Masculine,Malkiel,(mal-kee-ale'),"my king is El, an Asherite",Malchiel ,"From (H4428) melek and (H410) 'el; king of (i.e. Appointed by) God; Malkiel, an Israelite -- Malchiel. see HEBREW (H4428) melek see HEBREW (H410) 'el "
h,4440,מַלְכִּיאֵלִי,Adjective,Malkieli,(mal-kee-ay-lee'),descendant of Malchiel,Malchielite ,Patronymical from (H4439) Malkiy'el; a Malkielite or descendant of Malkiel -- Malchielite. see HEBREW (H4439) Malkiy'el
h,4441,מַלְכִּיָּה,Proper Name Masculine,Malkiyyah or Malkiyahu,(mal-kee-yaw'),"my king is Yah, the name of a number of Isr","Malchiah, Malchijah ","Or Malkiyahuw (Jer. 38:6), {mal-kee-yaw'-hoo}; from (H4428) melek and (H3050) Yahh; king of (i.e. Appointed by) Jah; Malkijah, the name of ten Israelites -- Malchiah, Malchijah. see HEBREW (H4428) melek see HEBREW (H3050) Yahh "
h,4442,מַלְכִּי־צֶדֶק,Proper Name Masculine,Malki-tsedeq,(mal-kee-tseh'-dek),"my king is right, an early king of Salem",Melchizedek ,"From (H4428) melek and (H6664) tsedeq; king of right; Malki-Tsedek, an early king in Palestine -- Melchizedek. see HEBREW (H4428) melek see HEBREW (H6664) tsedeq "
h,4443,מַלְכִּירָם,Proper Name Masculine,Malkiram,(mal-kee-rawm'),"my king is high, a son of Jeconiah",Malchiram ,"From (H4428) melek and (H7311) ruwm; king of a high one (i.e. Of exaltation); Malkiram, an Israelite -- Malchiram. see HEBREW (H4428) melek see HEBREW (H7311) ruwm "
h,4444,מַלְכִּישׁוּעַ,Proper Name Masculine,Malkishua,(mal-kee-shoo'-ah),"my king is wealth, a son of Saul",Malchishua ,"From (H4428) melek and (H7769) shuwa'; king of wealth; Malkishua, an Israelite -- Malchishua. see HEBREW (H4428) melek see HEBREW (H7769) shuwa' "
h,4445,מַלְכָּם,Proper Name Masculine,Malkam,(mal-kawm'),a Benjamite,"Malcham, Milcom ","Or Milkowm {mil-kome'}; from (H4428) melek for (H4432) Molek; Malcam or Milcom, the national idol of the Ammonites -- Malcham, Milcom. see HEBREW (H4428) melek see HEBREW (H4432) Molek "
h,4446,מְלֶכֶת,Noun Feminine,meleketh,(mel-eh'-keth),queen,queen ,From (H4427) malak; a queen -- queen. see HEBREW (H4427) malak
h,4447,מֹלֶכֶת,Proper Name Feminine,Moleketh,(mo-leh'-keth),an Israelite woman,Hammoleketh ,"Feminine active participle of (H4427) malak; queen; Moleketh, an Israelitess -- Hammoleketh (including the article). see HEBREW (H4427) malak "
h,4448,מָלַל,Verb,malal,(maw-lal'),"to speak, utter, say","say, speak, utter ","A primitive root; to speak (mostly poetical) or say -- say, speak, utter. "
h,4449,מְלַל,Verb,melal,(mel-al'),"to speak, say","say, speaking ","(Aramaic) corresponding to (H4448) malal; to speak -- say, speak(-ing). see HEBREW (H4448) malal "
h,4450,מִלֲלַי,Proper Name Masculine,Milalay,(mee-lal-ah'-ee),an Israelite musician,Milalai ,"From (H4448) malal; talkative; Milalai, an Israelite -- Milalai. see HEBREW (H4448) malal "
h,4451,מַלְמָד,Noun Masculine,malmad,(mal-mawd'),an oxgoad,goad ,From (H3925) lamad; a goad for oxen -- goad. see HEBREW (H3925) lamad
h,4452,מָלַץ,Verb,malats,(maw-lats'),probably to be smooth or slippery,be sweet ,"A primitive root; to be smooth, i.e. (figuratively) pleasant -- be sweet. "
h,4453,מֶלְצָר,Noun Masculine,meltsar,(mel-tsawr'),perhaps guardian,Melzar ,Of Persian derivation; the butler or other officer in the Babylonian court -- Melzar.
h,4454,מָלַק,Verb,malaq,(maw-lak'),"to nip, nip off",wring off ,"A primitive root; to crack a joint; by implication, to wring the neck of a fowl (without separating it) -- wring off. "
h,4455,מַלְקוֹחַ,Noun Masculine,malqowach,(mal-ko'-akh),"booty, prey","booty, jaws, prey ","From (H3947) laqach; transitively (in dual) the jaws (as taking food); intransitively, spoil (and captives) (as taken) -- booty, jaws, prey. see HEBREW (H3947) laqach "
h,4456,מַלְקוֹשׁ,Noun Masculine,malqosh,(mal-koshe'),"latter rain, spring rain",latter rain ,"From (H3953) laqash; the spring rain (compare (H3954) leqesh); figuratively, eloquence -- latter rain. see HEBREW (H3953) laqash see HEBREW (H3954) leqesh "
h,4457,מֶלְקָח,Noun Masculine,melqach or malqach,(mel-kawkh'),"tongs, snuffers","snuffers, tongs ","Or malqach {mal-kawkh'}; from (H3947) laqach; (only in dual) tweezers -- snuffers, tongs. see HEBREW (H3947) laqach "
h,4458,מֶלְתָּחָה,Noun Feminine,meltachah,(mel-taw-khaw'),"probably wardrobe, wearing apparel",vestry ,From an unused root meaning to spread out; a wardrobe (i.e. Room where clothing is spread) -- vestry.
h,4459,מַלְתָּעָה,Noun Feminine,maltaah,(mal-taw-aw'),great tooth ,great tooth ,"Transp. For (H4973) mthall'ah; a grinder, i.e. Back tooth -- great tooth. see HEBREW (H4973) mthall'ah "
h,4460,מַמְּגֻרָה,Noun Feminine,mammegurah,(mam-meg-oo-raw'),"granary, storehouse",barn ,From (H4048) magar (in the sense of depositing); a granary -- barn. see HEBREW (H4048) magar
h,4461,מֵמַד,Noun Masculine,memad,(may-mad'),measurement,measure ,From (H4058) madad; a measure -- measure. see HEBREW (H4058) madad
h,4462,מְמוּכָן,Proper Name Masculine,Memukan or Momukan,(mem-oo-kawn'),a prince of Persia and Media,Memucan ,"Or (transp.) Mowmukan (Esth. 1:16) {mo-moo-kawn'}; of Persian derivation; Memucan or Momucan, a Persian satrap -- Memucan. "
h,4463,מָמוֹת,Noun Masculine,mamoth,(maw-mothe'),death,death ,"From (H4191) muwth; a mortal disease; concretely, a corpse -- death. see HEBREW (H4191) muwth "
h,4464,מַמְזֵר,Noun Masculine,mamzer,(mam-zare'),"a bastard, child of incest",bastard ,"From an unused root meaning to alienate; a mongrel, i.e. Born of a Jewish father and a heathen mother -- bastard. "
h,4465,מִמְכָּר,Noun Masculine,mimkar,(mim-kawr'),"a sale, ware","ought, that which cometh of sale, that which ","From (H4376) makar; merchandise; abstractly, a selling -- X ought, (that which cometh of) sale, that which...sold, ware. see HEBREW (H4376) makar "
h,4466,מִמְכֶּרֶת,Noun Feminine,mimkereth,(mim-keh'-reth),a sale,sold as ,Feminine of (H4465) mimkar; a sale -- + sold as. see HEBREW (H4465) mimkar
h,4467,מַמְלָכָה,Noun Feminine,mamlakah,(mam-law-kaw'),"kingdom, sovereignty, dominion, reign","kingdom, king\'s, reign, royal ","From (H4427) malak; dominion, i.e. (abstractly) the estate (rule) or (concretely) the country (realm) -- kingdom, king's, reign, royal. see HEBREW (H4427) malak "
h,4468,מַמְלָכוּת,Noun Masculine,mamlakuth,(mam-law-kooth'),"kingdom, dominion, reign","kingdom, reign ","A form of (H4467) mamlakah and equiv. To it -- kingdom, reign. see HEBREW (H4467) mamlakah "
h,4469,מַמְסָךְ,Noun Masculine,mimsak,(mam-sawk'),a mixed drink,"drink-offering, mixed wine ","From (H4537) macak; mixture, i.e. (specifically) wine mixed (with water or spices) -- drink-offering, mixed wine. see HEBREW (H4537) macak "
h,4470,מֶמֶר,Noun Masculine,memer,(meh'-mer),bitterness,bitterness ,From an unused root meaning to grieve; sorrow -- bitterness.
h,4471,מַמְרֵא,"proper name, masculine; proper name, masculine; proper name, of a location",Mamre,(mam-ray'),"a place in Palestine, also an ally of Abraham",Mamre ,"From (H4754) mara' (in the sense of vigor); lusty; Mamre, an Amorite -- Mamre. see HEBREW (H4754) mara' "
h,4472,מַמְרֹר,Noun Masculine,mamror,(mam-rore'),a bitter thing,bitterness ,"From (H4843) marar; a bitterness, i.e. (figuratively) calamity -- bitterness. see HEBREW (H4843) marar "
h,4473,מִמְשַׁח,Noun Masculine,mimshach,(mim-shakh'),perhaps expanded or far-reaching wings,anointed ,"From (H4886) mashach, in the sense of expansion; outspread (i.e. With outstretched wings) -- anointed. see HEBREW (H4886) mashach "
h,4474,מְמְשָׁלֹ,Noun Masculine,mimshal,(mim-shawl'),"dominion, ruler","dominion, that ruled ","From (H4910) mashal; a ruler or (abstractly) rule -- dominion, that ruled. see HEBREW (H4910) mashal "
h,4475,מֶמְשָׁלָה,Noun Feminine,memshalah,(mem-shaw-law'),"rule, dominion, realm","dominion, government, power, to rule ","Feminine of (H4474) mimshal; rule; also (concretely in plural) a realm or a ruler -- dominion, government, power, to rule. see HEBREW (H4474) mimshal "
h,4476,מִמְשָׁק,Noun Masculine,mimshaq,(mim-shawk'),perhaps possession,breeding ,From the same as (H4943) mesheq; a possession -- breeding. see HEBREW (H4943) mesheq
h,4477,מַמְתַּק,Noun Masculine,mamthaqqim,(mam-tak'),"sweetness, sweet things",most sweet ,From (H4985) mathaq; something sweet (literally or figuratively) -- (most) sweet. see HEBREW (H4985) mathaq
h,4478,מָן,Noun Masculine,man,(mawn),manna (a kind of bread),manna ,"From (H4100) mah; literally, a whatness (so to speak), i.e. Manna (so called from the question about it) -- manna. see HEBREW (H4100) mah "
h,4479,מָן,interrogative pronoun,man,(mawn),who?,"what, whomsoever, ","(Aramaic) from (H4101) mah; who or what (properly, interrogatively, hence, also indefinitely and relatively) -- what, who(-msoever, + -so). see HEBREW (H4101) mah "
h,4480,מִן,Preposition,min or minni or minne,(min),from,"above, after, among, at, because of, by reason of, from among, in, ","Or minniy {min-nee'}; or minney (constructive plural) {min-nay'}; (Isaiah 30:11); for (H4482) men; properly, a part of; hence (prepositionally), from or out of in many senses (as follows) -- above, after, among, at, because of, by (reason of), from (among), in, X neither, X nor, (out) of, over, since, X then, through, X whether, with. see HEBREW (H4482) men "
h,4481,מִן,Preposition,min,(min),"from, out of, by, by reason of, at, more than","according, after, because, before, by, for, from, him, ","(Aramaic) corresponding to (H4480) min -- according, after, + because, + before, by, for, from, X him, X more than, (out) of, part, since, X these, to, upon, + when. see HEBREW (H4480) min "
h,4482,מֵן,Noun Masculine,men,(mane),string (of a harp),stringed instrument,"From an unused root meaning to apportion; a part; hence, a musical chord (as parted into strings) -- in (the same) (Psalm 68:23), stringed instrument (Psalm 150:4), whereby (Psalm 45:8 (defective plural)). "
h,4483,מְנָא,Verb,mena or menah,(men-aw'),"to number, reckon","number, ordain, set ","(Aramaic) or mnah (Aramaic) {men-aw'}; corresponding to (H4487) manah; to count, appoint -- number, ordain, set. see HEBREW (H4487) manah "
h,4484,מְנֵא,Noun Masculine,mene,(men-ay'),"maneh, mina (a measure of weight)",Mene ,(Aramaic) passive participle of (H4483) mna'; numbered -- Mene. see HEBREW (H4483) mna'
h,4485,מַנְגִּינָה,Noun Feminine,manginah,(man-ghee-naw'),"(mocking, derisive) song",music ,From (H5059) nagan; a satire -- music. see HEBREW (H5059) nagan
h,4486,מַנְדַּע,Noun Masculine,manda,(man-dah'),"knowledge, the power of knowing","knowledge, reason, understanding ","(Aramaic) corresponding to (H4093) madda'; wisdom or intelligence -- knowledge, reason, understanding. see HEBREW (H4093) madda' "
h,4487,מָנָה,Verb,manah,(maw-naw'),"to count, number, reckon","appoint, count, number, prepare, set, tell ","A primitive root; properly, to weigh out; by implication, to allot or constitute officially; also to enumerate or enroll -- appoint, count, number, prepare, set, tell. "
h,4488,מָנֶה,Noun Masculine,maneh,(maw-neh'),"maneh, mina (a measure of weight or money)","maneh, pound ","From (H4487) manah; properly, a fixed weight or measured amount, i.e. (techn.) A maneh or mina -- maneh, pound. see HEBREW (H4487) manah "
h,4489,מֹנֶה,Noun Masculine,moneh,(mo-neh'),"a counted number, time",time ,"From (H4487) manah; properly, something weighed out, i.e. (figuratively) a portion of time, i.e. An instance -- time. see HEBREW (H4487) manah "
h,4490,מָנָה,Noun Feminine,manah,(maw-naw'),"part, portion","such things as belonged, part, portion ","From (H4487) manah; properly, something weighed out, i.e. (generally) a division; specifically (of food) a ration; also a lot -- such things as belonged, part, portion. see HEBREW (H4487) manah "
h,4491,מִנְהָג,Noun Masculine,minhag,(min-hawg'),driving (a chariot),driving ,From (H5090) nahag; the driving (of a chariot) -- driving. see HEBREW (H5090) nahag
h,4492,מִנְהָרָה,Noun Feminine,minharah,(min-haw-raw'),"perhaps a cave, stronghold",den ,"From (H5102) nahar; properly, a channel or fissure, i.e. (by implication) a cavern -- den. see HEBREW (H5102) nahar "
h,4493,מָנוֹד,Noun Masculine,manod,(maw-node'),"a shaking, wagging",shaking ,From (H5110) nuwd a nodding or toss (of the head in derision) -- shaking. see HEBREW (H5110) nuwd
h,4494,מָנוֹחַ,Noun Masculine,manoach,(maw-no'-akh),"a resting place, state or condition of rest",place of rest ,"From (H5117) nuwach; quiet, i.e. (concretely) a settled spot, or (figuratively) a home -- (place of) rest. see HEBREW (H5117) nuwach "
h,4495,מָנוֹחַ,Proper Name Masculine,Manoach,(maw-no'-akh),father of Samson,Manoah ,"The same as (H4494) manowach; rest; Manoach, an Israelite -- Manoah. see HEBREW (H4494) manowach "
h,4496,מְנוּחָה,Noun Feminine,menuchah,(men-oo-khaw'),"resting place, rest","comfortable, ease, quiet, resting place, still ","Or mnuchah {men-oo-khaw'}; feminine of (H4495) Manowach; repose or (adverbially) peacefully; figuratively, consolation (specifically, matrimony); hence (concretely) an abode -- comfortable, ease, quiet, rest(-ing place), still. see HEBREW (H4495) Manowach "
h,4497,מָנוֹן,Noun Masculine,manon,(maw-nohn'),perhaps thankless one,son ,"From (H5125) nuwn; a continuator, i.e. Heir -- son. see HEBREW (H5125) nuwn "
h,4498,מָנוֹס,Noun Masculine,manos,(maw-noce'),"flight, place of escape or refuge","escape, way to flee, flight, refuge ","From (H5127) nuwc; a retreat (literally or figuratively); abstractly, a fleeing -- X apace, escape, way to flee, flight, refuge. see HEBREW (H5127) nuwc "
h,4499,מְנוּסָה,Noun Feminine,menusah,(men-oo-saw'),flight,"fleeing, flight ","Or mnucah {men-oo-saw'}; feminine of (H4498) manowc; retreat -- fleeing, flight. see HEBREW (H4498) manowc "
h,4500,מָנוֹר,Noun Masculine,manor,(maw-nore'),a (weaver\'s) beam,beam ,"From (H5214) niyr; a yoke (properly, for plowing), i.e. The frame of a loom -- beam. see HEBREW (H5214) niyr "
h,4501,מְנוֹרָה,Noun Feminine,menorah,(men-o-raw'),a lampstand,candlestick ,Or mnorah {men-o-raw'}; feminine of (H4500) manowr (in the original sense of (H5216) niyr); a chandelier -- candlestick. see HEBREW (H4500) manowr see HEBREW (H5216) niyr
h,4502,מִנְּזָר,Noun Masculine,minzar,(min-ez-awr'),"perhaps consecrated ones, princes",crowned ,From (H5144) nazar; a prince -- crowned. see HEBREW (H5144) nazar
h,4503,מִנְחָה,Noun Feminine,minchah,(min-khaw'),"a gift, tribute, offering","gift, oblation, meat offering, present, sacrifice ","From an unused root meaning to apportion, i.e. Bestow; a donation; euphemistically, tribute; specifically a sacrificial offering (usually bloodless and voluntary) -- gift, oblation, (meat) offering, present, sacrifice. "
h,4504,מִנְחָה,Noun Feminine,minchah,(min-khaw'),"a gift, offering","oblation, meat offering ","(Aramaic) corresponding to (H4503) minchah; a sacrificial offering -- oblation, meat offering. see HEBREW (H4503) minchah "
h,4505,מְנַחֵם,Proper Name Masculine,Menachem,(men-akh-ame'),"comforter, king of Northern Israel",Menahem ,"From (H5162) nacham; comforter; Menachem, an Israelite -- Menahem. see HEBREW (H5162) nacham "
h,4506,מָנַחַת,"proper name, of a location; proper name, masculine",Manachath,(maw-nakh'-ath),a descendant of Seir the Horite,Manahath ,"From (H5117) nuwach; rest; Manachath, the name of an Edomite and of a place in Moab -- Manahath. see HEBREW (H5117) nuwach "
h,4507,מְנִי,Proper Name Masculine,Meni,(men-ee'),"award, a heathen god",number ,"From (H4487) manah; the Apportioner, i.e. Fate (as an idol) -- number. see HEBREW (H4487) manah "
h,4508,מִנִּי,Proper Name Location,Minni,(min-nee'),a region of Armenia,Minni ,"Of foreign derivation; Minni, an Armenian province -- Minni. "
h,4509,מִנְיָמִין,Proper Name Masculine,Minyamin,(min-yaw-meen'),"from the right hand, the name of several Israelites",Miniamin ,"From (H4480) min and (H3225) yamiyn; from (the) right hand; Minjamin, the name of two Israelites -- Miniamin. Compare (H4326) Miyamin. see HEBREW (H4480) min see HEBREW (H3225) yamiyn see HEBREW (H4326) Miyamin "
h,4510,מִנְיָן,Noun Masculine,minyan,(min-yawn'),a number,number ,(Aramaic) from (H4483) mna'; enumeration -- number. see HEBREW (H4483) mna'
h,4511,מִנִּית,Proper Name Location,Minnith,(min-neeth'),a place in Ammonite territory,Minnith ,"From the same as (H4482) men; enumeration; Minnith, a place East of the Jordan -- Minnith. see HEBREW (H4482) men "
h,4512,מִנְלֶה,Noun Masculine,minleh,(min-leh'),"perhaps gain, acquisition",perfection ,"From (H5239) nalah; completion, i.e. (in produce) wealth -- perfection. see HEBREW (H5239) nalah "
h,4513,מָנַע,Verb,mana,(maw-nah'),"to withhold, hold back","deny, keep back, refrain, restrain, withhold ","A primitive root; to debar (negatively or positively) from benefit or injury -- deny, keep (back), refrain, restrain, withhold. "
h,4514,מַנְעוּל,Noun Masculine,manul,(man-ool'),a bolt,lock ,Or maniul {man-ool'}; from (H5274) na'al; a bolt -- lock. see HEBREW (H5274) na'al
h,4515,מִנְעָל,Noun Masculine,minal,(man-awl'),a bolt,shoe ,From (H5274) na'al; a bolt -- shoe. see HEBREW (H5274) na'al
h,4516,מַנְעַם,Noun Masculine,manammim,(man-am'),"delicacies, dainties",dainty ,From (H5276) na'em; a delicacy -- dainty. see HEBREW (H5276) na'em
h,4517,מְנַעְנַע,Noun Masculine,menaanea,(men-ah-ah'),probably (a kind of musical) rattle,cornet ,From (H5128) nuwa'; a sistrum (so called from its rattling sound) -- cornet. see HEBREW (H5128) nuwa'
h,4518,מְנַקִּית,Noun Feminine,menaqqith,(men-ak-keeth'),a sacrificial bowl,bowl ,From (H5352) naqah; a sacrificial basin (for holding blood) -- bowl. see HEBREW (H5352) naqah
h,4519,מְנַשֶּׁה,Proper Name Masculine,Menashsheh,(men-ash-sheh'),"causing to forget, a son of Joseph, also a tribe desc. from him, also a king of Judah , also two Israelites",Manasseh ,"From (H5382) nashah; causing to forget; Menashsheh, a grandson of Jacob, also the tribe descended from him, and its territory -- Manasseh. see HEBREW (H5382) nashah "
h,4520,מְנַשֶּׁי,Adjective,Menashshi,(men-ash-shee'),descendant of Mannasseh,"of Manasseh, Manassites ","From (H4519) Mnashsheh; a Menashshite or descendant of Menashsheh -- of Manasseh, Manassites. see HEBREW (H4519) Mnashsheh "
h,4521,מְנָת,Noun Feminine,menath,(men-awth'),portion,portion ,"From (H4487) manah; an allotment (by courtesy, law or providence) -- portion. see HEBREW (H4487) manah "
h,4522,מַס,Noun Masculine,mas or mis,(mas),"body of forced laborers, forced service, taskworkers, taskwork, serfdom","discomfited, levy, taskmaster, tributary ","Or mic {mees}; from (H4549) macac; properly, a burden (as causing to faint), i.e. A tax in the form of forced labor -- discomfited, levy, task(-master), tribute(-tary). see HEBREW (H4549) macac "
h,4523,מָס,Adjective,mas,(mawce),despairing,is afflicted ,"From (H4549) macac; fainting, i.e. (figuratively) disconsolate -- is afflicted. see HEBREW (H4549) macac "
h,4524,מֵסַב,Noun Masculine,mesab or mesibbim or mesibboth,(may-sab'),that which surrounds or is round,"that compass about, place round about, at table ","Plural masculine mcibbiym {mes-ib-beem'}; or feminine mcibbowth {mes-ib-bohth'}; from (H5437) cabab; a divan (as enclosing the room); abstractly (adverbial) around -- that compass about, (place) round about, at table. see HEBREW (H5437) cabab "
h,4525,מַסְגֵּר,Noun Masculine,masger,(mas-gare'),"a locksmith, smith, a dungeon","prison, smith ","From (H5462) cagar; a fastener, i.e. (of a person) a smith, (of a thing) a prison -- prison, smith. see HEBREW (H5462) cagar "
h,4526,מִסְגֶּרֶת,Noun Feminine,misgereth,(mis-gheh'-reth),"border, rim, fastness","border, close place, hole ","From (H5462) cagar; something enclosing, i.e. A margin (of a region, of a panel); concretely, a stronghold -- border, close place, hole. see HEBREW (H5462) cagar "
h,4527,מַסַּד,noun masculine,massad,(mas-sad'),foundation,foundation ,From (H3245) yacad; a foundation -- foundation. see HEBREW (H3245) yacad
h,4528,מִסְדְּרוֹן,Noun Masculine,misderon,(mis-der-ohn'),"a porch, colonnade",porch ,From the same as (H5468) ceder; a colonnade or internal portico (from its rows of pillars) -- porch. see HEBREW (H5468) ceder
h,4529,מָסָה,Verb,masah,(maw-saw'),"to melt, dissolve, be liquefied","make to consume away, make to melt, water ","A primitive root; to dissolve -- make to consume away, (make to) melt, water. "
h,4530,מִסָּה,Noun,missah or missath,(mis-saw'),sufficiency,"abundance, tribute ","From (H4549) macac (in the sense of flowing); abundance, i.e. (adverbially) liberally: tribute. see HEBREW (H4549) macac "
h,4531,מַסָּה,Noun Feminine,maccah,(mas-saw'),despair,"temptation, trial ","From (H5254) nacah; a testing, of men (judicial) or of God (querulous) -- temptation, trial. see HEBREW (H5254) nacah "
h,4532,מַסָּה,Proper Name Location,Massah,(mas-saw'),a place in the desert where Israelites rebelled,Massah ,"The same as (H4531) maccah; Massah, a place in the Desert -- Massah. see HEBREW (H4531) maccah "
h,4533,מַסְוֶה,Noun Masculine,masveh,(mas-veh'),a veil,vail ,Apparently from an unused root meaning to cover; a veil -- vail.
h,4534,מְסוּכָה,Noun Feminine,mesukah,(mes-oo-kaw'),a hedge,thorn hedge ,For (H4881) msuwkah; a hedge -- thorn hedge. see HEBREW (H4881) msuwkah
h,4535,מַסָּח,Adverb,massach,(mas-sawkh'),"perhaps repulse, defense",broken down ,"From (H5255) nacach in the sense of staving off; a cordon, (adverbially) or (as a) military barrier -- broken down. see HEBREW (H5255) nacach "
h,4536,מִסְחָר,Noun Masculine,mischar,(mis-khawr'),probably merchandise,traffic ,From (H5503) cachar; trade -- traffic. see HEBREW (H5503) cachar
h,4537,מָסַךְ,Verb,masak,(maw-sak'),"to mix, produce by mixing",mingle ,"A primitive root; to mix, especially wine (with spices) -- mingle. "
h,4538,מֶסֶךְ,Noun Masculine,mesek,(meh'-sek),a mixture,mixture ,"From (H4537) macak; a mixture, i.e. Of wine with spices -- mixture. see HEBREW (H4537) macak "
h,4539,מָסָךְ,Noun Masculine,masak,(maw-sawk'),"a covering, screen","covering, curtain, hanging ","From (H5526) cakak; a cover, i.e. Veil -- covering, curtain, hanging. see HEBREW (H5526) cakak "
h,4540,מְסֻכָּה,Noun Feminine,mesukkah,(mes-ook-kaw'),"that with which one is covered, a covering",covering ,"From (H5526) cakak; a covering, i.e. Garniture -- covering. see HEBREW (H5526) cakak "
h,4541,מַסֵּכָה,Noun Feminine,maccekah,(mas-say-kaw'),"a libation, molten metal or image","covering, molten image, vail ","From (H5258) nacak; properly, a pouring over, i.e. Fusion of metal (especially a cast image); by implication, a libation, i.e. League; concretely a coverlet (as if poured out) -- covering, molten (image), vail. see HEBREW (H5258) nacak "
h,4542,מִסְכֵּן,Adjective,misken,(mis-kane'),poor,poor man ,From (H5531) cikluwth; indigent -- poor (man). see HEBREW (H5531) cikluwth
h,4543,מִסְכְּנָה,Noun Feminine,miskenoth,(mis-ken-aw'),"supply, storage",a magazine,By transp. From (H3664) kanac; a magazine: see HEBREW (H3664) kanac
h,4544,מִסְכֵּנֻת,Noun Feminine,miskenuth,(mis-kay-nooth'),"poverty, scarcity",scarceness ,From (H4542) micken; indigence -- scarceness. see HEBREW (H4542) micken
h,4545,מַסֶּכֶת,Noun Feminine,masseketh,(mas-seh'-keth),fabric on a loom,web ,"From (H5259) nacak in the sense of spreading out; something expanded, i.e. The warp in a loom (as stretched out to receive the woof) -- web. see HEBREW (H5259) nacak "
