g4110,"πλάσμα, ατος, τό","Noun, Neuter",plasma,(plas'-mah),that which is molded,"image, thing formed. ",From  (G4111) plasso; something moulded -- thing formed. <p>see GREEK  (G4111) plasso
g4111,πλάσσω,Verb,plassó,(plas'-so),to form,form. ,"A primary verb; to mould, i.e. Shape or fabricate -- form. "
g4112,"πλαστός, ή, όν",Adjective,plastos,(plas-tos'),"formed, molded",feigned. ,"From  (G4111) plasso; moulded, i.e. (by implication) artificial or (figuratively) fictitious (false) -- feigned. <p>see GREEK  (G4111) plasso "
g4113,"πλατεῖα, ας, ἡ","Noun, Feminine",plateia,(plat-i'-ah),"a wide road, street",street. ,"Feminine of  (G4116) platus; a wide ""plat"" or ""place"", i.e. Open square -- street. <p>see GREEK  (G4116) platus "
g4114,"πλάτος, ους, τό","Noun, Neuter",platos,(plat'-os),breadth,breadth. ,From  (G4116) platus; width -- breadth. <p>see GREEK  (G4116) platus
g4115,πλατύνω,Verb,platunó,(plat-oo'-no),to make broad,"make broad, enlarge. ","From  (G4116) platus; to widen (literally or figuratively) -- make broad, enlarge. <p>see GREEK  (G4116) platus "
g4116,"πλατύς, εῖα, ύ",Adjective,platus,(plat-oos'),"broad, subst. a street",wide. ,"From  (G4111) plasso; spread out ""flat"" (""plot""), i.e. Broad -- wide. <p>see GREEK  (G4111) plasso "
g4117,"πλέγμα, ατος, τό","Noun, Neuter",plegma,(pleg'-mah),a braiding,braided hair,From  (G4120) pleko; a plait (of hair) -- broidered hair. <p>see GREEK  (G4120) pleko
g4118,"πλεῖστος, η, ον",Adjective,pleistos,(plice'-tos),"most, very great, much","most, very great, much. ","Irregular superlative of  (G4183) polus; the largest number or very large -- very great, most. <p>see GREEK  (G4183) polus "
g4119,"πλείων, εῖον",Adjective,pleión,(pli-own),"more excellent, very great, many ","more excellent, very great, many ","Or neuter pleion (pli'-on), or pleon (pleh'-on) comparative of  (G4183) polus; more in quantity, number, or quality; also (in plural) the major portion -- X above, + exceed, more excellent, further, (very) great(-er), long(-er), (very) many, greater (more) part, + yet but. <p>see GREEK  (G4183) polus "
g4120,πλέκω,Verb,plekó,(plek'-o),to plait,"braid, weave, plait. ",A primary word; to twine or braid -- plait.
g4121,πλεονάζω,Verb,pleonazó,(pleh-on-ad'-zo),"to superabound, to make to abound","abound, abundant, make to increase","From  (G4119) pleion; to do, make or be more, i.e. Increase (transitively or intransitively); by extension, to superabound -- abound, abundant, make to increase, have over. <p>see GREEK  (G4119) pleion "
g4122,πλεονεκτέω,Verb,pleonekteó,(pleh-on-cek-teh'-o),"to have more, to overreach","take advantage, defraud, make a gain. ","From  (G4123) pleonektes; to be covetous, i.e. (by implication) to over-reach -- get an advantage, defraud, make a gain. <p>see GREEK  (G4123) pleonektes "
g4123,"πλεονέκτης, ου, ὁ","Noun, Masculine",pleonektés,(pleh-on-ek'-tace),one desirous of having more,covetous. ,"From  (G4119) pleion and  (G2192) echo; holding (desiring) more, i.e. Eager for gain (avaricious, hence a defrauder) -- covetous. <p>see GREEK  (G4119) pleion <p>see GREEK  (G2192) echo "
g4124,"πλεονεξία, ας, ἡ","Noun, Feminine",pleonexia,(pleh-on-ex-ee'-ah),"advantage, covetousness","covetousness, greediness. ","From  (G4123) pleonektes; avarice, i.e. (by implication) fraudulency, extortion -- covetous(-ness) practices, greediness. <p>see GREEK  (G4123) pleonektes "
g4125,"πλευρά, ᾶς, ἡ","Noun, Feminine",pleura,(plyoo-rah'),the side,side. ,"Of uncertain affinity; a rib, i.e. (by extension) side -- side. "
g4126,πλέω,Verb,pleó,(pleh'-o),to sail,sail. ,Another form for pleuo (plyoo'-o); which is used as an alternate in certain tenses; probably a form of  (G4150) pluno (through the idea of plunging through the water); to pass in a vessel -- sail. See also  (G4130) pletho. <p>see GREEK  (G4150) pluno <p>see GREEK  (G4130) pletho
g4127,"πληγή, ῆς, ἡ","Noun, Feminine",plégé,(play-gay'),"a blow, wound","wound, stripe","From  (G4141) plesso; a stroke; by implication, a wound; figuratively, a calamity -- plague, stripe, wound(-ed). <p>see GREEK  (G4141) plesso "
g4128,"πλῆθος, ους, τό","Noun, Neuter",pléthos,(play'-thos),a great number,"company, multitude. ","From  (G4130) pletho; a fulness, i.e. A large number, throng, populace -- bundle, company, multitude. <p>see GREEK  (G4130) pletho "
g4129,πληθύνω,Verb,pléthunó,(play-thoo'-no),"to increase, to be increased",multiply. ,"From another form of  (G4128) plethos; to increase (transitively or intransitively) -- abound, multiply. <p>see GREEK  (G4128) plethos "
g4130,πλήθω,"Verb<br><span class=""tophdg"">Phonetic Spelling: </span>(play\'-tho)<br><span class=""tophdg"">Definition: </span>furnish, accomplish, fill, supply<br><span class=""tophdg"">Usage: </span>I fill, fulfill, complete.<div class=""vheading2"">HELPS Word-studies</div><p class=""discovery""><b>4130</b> <i>pl\xe1\xb8\x97th\xc5\x8d</i> (or <i>pimpl\xc4\x93mi</i>) \xe2\x80\x93 properly, <i>fill</i> to the maximum (<i>full extent</i>), &quot;the limit&quot; (<i>CBL</i>).  <a href=""/greek/4130.htm"">4130</a> <i>/pl\xe1\xb8\x97th\xc5\x8d</i> (&quot;full&quot;) implies &quot;filled to one\'s (individual) <i>capacity</i>.&quot;</p><p class=""discovery"">[This root (<i>pl\xc4\x93-</i>) expresses <i>totality</i>, and implies full <i>quantity</i> (&quot;up to the max&quot;).  <i>DNTT</i> (1,733) notes its cognates (<i>pl\xc4\x93r\xc4\x93s, pl\xc4\x93ro\xc5\x8d, pl\xc4\x93r\xc5\x8dma</i>) all come from the<i> root</i> (<i>pl\xc4\x93-/pl\xc4\x93th\xc5\x8d</i>) meaning &quot;full in quantity.&quot;  Thus <a href=""/greek/4130.htm"">4130</a> <i>/pl\xe1\xb8\x97th\xc5\x8d</i> (&quot;to fill or complete&quot;) refers to &quot;that which is complete in itself because of <i>plentitude</i>, <i>entire number or quantity</i>.\xc2\xa0.\xc2\xa0.\xc2\xa0.\xc2\xa0the <i>whole aggregate</i>,&quot; <i>WS</i>, 395,96).</p><p class=""discovery"">4130 (<i>pl\xc4\x93th\xc5\x8d</i>) may be a <i>by-form</i> derived from the same root as <i>pimpl\xc4\x93mi</i>.  All these terms (cognates) emphasize the idea of &quot;<i>maximum</i> (<i>full</i> extent).&quot;]</p><iframe width=""100%"" height=""85"" scrolling=no src=""/discovery.htm"" frameborder=0 cellpadding=0></iframe><div class=""vheading2"">Thayer\'s Greek Lexicon</div><span class=""maintitle"">STRONGS NT 4130: \xcf\x80\xce\xaf\xce\xbc\xcf\x80\xce\xbb\xce\xb7\xce\xbc\xce\xb9</span><br><br><span class=""arttitle""><span class=""grktitle"">\xcf\x80\xce\xaf\xce\xbc\xcf\x80\xce\xbb\xce\xb7\xce\xbc\xce\xb9</span></span>; (a lengthened form of the theme <span class=""greek2"">\xce\xa0\xce\x9b\xce\x91\xce\xa9</span>, whence <span class=""greek2"">\xcf\x80\xce\xbb\xce\xad\xce\xbf\xcf\x82</span>, <span class=""greek2"">\xcf\x80\xce\xbb\xce\xae\xcf\x81\xce\xb7\xcf\x82</span> (cf. <span class=""abbreviation"">Curtius</span>, \xc2\xa7 366)): 1 aorist <span class=""greek2"">\xe1\xbc\x94\xcf\x80\xce\xbb\xce\xb7\xcf\x83\xce\xb1</span>; passive, 1 future <span class=""greek2"">\xcf\x80\xce\xbb\xce\xb7\xcf\x83\xce\xb8\xce\xae\xcf\x83\xce\xbf\xce\xbc\xce\xb1\xce\xb9</span>; 1 aorist <span class=""greek2"">\xe1\xbc\x90\xcf\x80\xce\xbb\xce\xae\xcf\x83\xce\xb8\xce\xb7\xce\xbd</span>; from <span class=""abbreviation"">Homer</span> on; the <span class=""manuref"">Sept.</span> for <span class=""hebrew"">\xd7\x9e\xd6\xb8\xd7\x9c\xd6\xb5\xd7\x90</span>, also for <span class=""hebrew"">\xd7\x94\xd6\xb4\xd7\xa9\xd6\xb0\xd7\x82\xd7\x91\xd6\xb4\xd6\xbc\xd7\x99\xd7\xa2\xd6\xb7 </span> (to satiate) and passive, <span class=""hebrew"">\xd7\xa9\xd6\xb8\xd7\x82\xd7\x91\xd6\xb7\xd7\xa2 </span> (to be full); <span class=""accented"">to fill</span>: <span class=""greek2"">\xcf\x84\xce\xaf</span>, <a href=""/interlinear/luke/5-7.htm"">Luke 5:7</a>; <span class=""greek2"">\xcf\x84\xce\xaf</span> <span class=""greek2"">\xcf\x84\xce\xaf\xce\xbd\xce\xbf\xcf\x82</span> (<span class=""abbreviation"">Winer</span>\'s Grammar, \xc2\xa7 30, 8 b.), a thing with something, <a href=""/interlinear/matthew/27-48.htm"">Matthew 27:48</a>; (<a href=""/interlinear/john/19-29.htm"">John 19:29</a> <span class=""manuref"">R</span> <span class=""manuref"">G</span>); in the passive, <a href=""/interlinear/matthew/22-10.htm"">Matthew 22:10</a>; <a href=""/interlinear/acts/19-29.htm"">Acts 19:29</a>; (<span class=""greek2"">\xe1\xbc\x90\xce\xba</span> <span class=""greek2"">\xcf\x84\xe1\xbf\x86\xcf\x82</span> <span class=""greek2"">\xe1\xbd\x80\xcf\x83\xce\xbc\xe1\xbf\x86\xcf\x82</span>, <a href=""/interlinear/john/12-3.htm"">John 12:3</a> <span class=""manuref"">Tr</span> marginal reading; cf. <span class=""abbreviation"">Winer</span>s Grammar, as above note; <span class=""abbreviation"">Buttmann</span>, \xc2\xa7 132, 12). what wholly takes possession of the mind is said to fill it: passive, <span class=""greek2"">\xcf\x86\xce\xbf\xce\xb2\xce\xbf\xe1\xbf\xa6</span>, <a href=""/interlinear/luke/5-26.htm"">Luke 5:26</a>; <span class=""greek2"">\xce\xb8\xce\xac\xce\xbc\xce\xb2\xce\xbf\xcf\x85\xcf\x82</span>, <a href=""/interlinear/acts/3-10.htm"">Acts 3:10</a>; <span class=""greek2"">\xe1\xbc\x80\xce\xbd\xce\xbf\xce\xaf\xce\xb1\xcf\x82</span>, <a href=""/interlinear/luke/6-11.htm"">Luke 6:11</a>; <span class=""greek2"">\xce\xb6\xce\xae\xce\xbb\xce\xbf\xcf\x85</span>, <a href=""/interlinear/acts/5-17.htm"">Acts 5:17</a>; <a href=""/interlinear/acts/13-45.htm"">Acts 13:45</a>; <span class=""greek2"">\xce\xb8\xcf\x85\xce\xbc\xce\xbf\xe1\xbf\xa6</span>, <a href=""/interlinear/luke/4-28.htm"">Luke 4:28</a>; <a href=""/interlinear/acts/3-10.htm"">Acts 3:10</a>; <span class=""greek2"">\xcf\x80\xce\xbd\xce\xb5\xcf\x8d\xce\xbc\xce\xb1\xcf\x84\xce\xbf\xcf\x82</span> <span class=""greek2"">\xe1\xbc\x81\xce\xb3\xce\xaf\xce\xbf\xcf\x85</span>, <a href=""/interlinear/luke/1-15.htm"">Luke 1:15, 41, 67</a>; <a href=""/interlinear/acts/2-4.htm"">Acts 2:4</a>; <a href=""/interlinear/acts/4-8.htm"">Acts 4:8, 31</a>; <a href=""/interlinear/acts/9-17.htm"">Acts 9:17</a>; <a href=""/interlinear/acts/13-9.htm"">Acts 13:9</a>. prophecies are said <span class=""greek2"">\xcf\x80\xce\xbb\xce\xb7\xcf\x83\xce\xb8\xe1\xbf\x86\xce\xbd\xce\xb1\xce\xb9</span>, i. e. <span class=""accented"">to come to pass, to be confirmed by the event,</span> <a href=""/interlinear/luke/21-22.htm"">Luke 21:22</a> <span class=""manuref"">G</span> <span class=""manuref"">L</span> <span class=""manuref"">T</span> <span class=""manuref"">Tr</span> <span class=""manuref"">WH</span> (for <span class=""manuref"">Rec.</span> <span class=""greek2"">\xcf\x80\xce\xbb\xce\xb7\xcf\x81\xcf\x89\xce\xb8\xe1\xbf\x86\xce\xbd\xce\xb1\xce\xb9</span>). time is said <span class=""greek2"">\xcf\x80\xce\xbb\xce\xb7\xcf\x83\xce\xb8\xe1\xbf\x86\xce\xbd\xce\xb1\xce\xb9</span>, <span class=""accented"">to be fulfilled or completed,</span> i. e. <span class=""accented"">finished, elapsed,</span> <a href=""/interlinear/luke/1-23.htm"">Luke 1:23, 57</a> (<span class=""abbreviation"">Winer</span>s Grammar, 324 (304); <span class=""abbreviation"">Buttmann</span>, 267 (230)); <BIBLE/CHAPTER_VERSE:Luke 2:6, 21>f; so <span class=""hebrew"">\xd7\xa0\xd6\xb4\xd7\x9e\xd6\xb0\xd7\x9c\xd6\xb8\xd7\x90</span>, <a href=""/interlinear/job/15-32.htm"">Job 15:32</a>; and <span class=""hebrew"">\xd7\x9e\xd6\xb4\xd7\x9c\xd6\xb5\xd6\xbc\xd7\x90</span> to (ful-)fill the time, i. e. <span class=""accented"">to complete, fill up,</span> <a href=""/interlinear/genesis/29-27.htm"">Genesis 29:27</a>; <a href=""/interlinear/job/39-2.htm"">Job 39:2</a>. (Compare: <span class=""greek2"">\xe1\xbc\x90\xce\xbc\xcf\x80\xce\xaf\xcf\x80\xce\xbb\xce\xb7\xce\xbc\xce\xb9</span>.)<FOOTNOTE:1>   <p><span class=""maintitle"">STRONGS NT 4130: \xcf\x80\xce\xbb\xce\xae\xce\xb8\xcf\x89</span><span class=""arttitle""><span class=""grktitle"">\xcf\x80\xce\xbb\xce\xae\xce\xb8\xcf\x89</span></span>, see  <span class=""greek2""><span class=""lexref"">\xcf\x80\xce\xaf\xce\xbc\xcf\x80\xce\xbb\xce\xb7\xce\xbc\xce\xb9</span></span>.   <br><br><iframe width=""100%"" height=""85"" scrolling=no src=""/bsoft.htm"" frameborder=0 cellpadding=0></iframe><div class=""vheading2"">Strong\'s Exhaustive Concordance</div>furnish, accomplish, fill, supply<p>A prolonged form of a primary pleo (pleh\'-o) (which appears only as an alternate in certain tenses and in the reduplicated form pimplemi) to ""fill"" (literally or figuratively (imbue, influence, supply)); specially, to fulfil (time) -- accomplish, full (...come), furnish. <div cla",pléthó,(play'-tho),"furnish, accomplish, fill, supply","furnish, accomplish, fill, supply","A prolonged form of a primary pleo (pleh'-o) (which appears only as an alternate in certain tenses and in the reduplicated form pimplemi) to ""fill"" (literally or figuratively (imbue, influence, supply)); specially, to fulfil (time) -- accomplish, full (...come), furnish. "
g4131,"πλήκτης, ου, ὁ","Noun, Masculine",pléktés,(plake'-tace),a striker,"bully, striker. ","From  (G4141) plesso; a smiter, i.e. Pugnacious (quarrelsome) -- striker. <p>see GREEK  (G4141) plesso "
g4132,"πλημμύρα, ας, ἡ","Noun, Feminine",plémmura,(plame-moo'-rah),a flood,flood. ,"Prolonged from  (G4130) pletho; flood-tide, i.e. (by analogy) a freshet -- flood. <p>see GREEK  (G4130) pletho "
g4133,πλήν,Adverb,plén,(plane),"yet, except","nevertheless, however, notwithstanding, save, than. ","From  (G4119) pleion; moreover (besides), i.e. Albeit, save that, rather, yet -- but (rather), except, nevertheless, notwithstanding, save, than. <p>see GREEK  (G4119) pleion "
g4134,"πλήρης, ες",Adjective,plérés,(play'-race),full,full. ,"From  (G4130) pletho; replete, or covered over; by analogy, complete -- full. <p>see GREEK  (G4130) pletho "
g4135,πληροφορέω,Verb,plérophoreó,(play-rof-or-eh'-o),"to bring in full measure, to fulfill","fulfill, fully know, make full proof of. ","From  (G4134) pleres and  (G5409) phoreo; to carry out fully (in evidence), i.e. Completely assure (or convince), entirely accomplish -- most surely believe, fully know (persuade), make full proof of. <p>see GREEK  (G4134) pleres <p>see GREEK  (G5409) phoreo "
g4136,"πληροφορία, ας, ἡ","Noun, Feminine",plérophoria,(play-rof-or-ee'-ah),full assurance,full assurance. ,From  (G4135) plerophoreo; entire confidence -- (full) assurance. <p>see GREEK  (G4135) plerophoreo
g4137,πληρόω,Verb,pléroó,(play-ro'-o),"to make full, to complete","accomplish, complete, fulfill","From  (G4134) pleres; to make replete, i.e. (literally) to cram (a net), level up (a hollow), or (figuratively) to furnish (or imbue, diffuse, influence), satisfy, execute (an office), finish (a period or task), verify (or coincide with a prediction), etc. -- accomplish, X after, (be) complete, end, expire, fill (up), fulfil, (be, make) full (come), fully preach, perfect, supply. <p>see GREEK  (G4134) pleres "
g4138,"πλήρωμα, ατος, τό","Noun, Neuter",pléróma,(play'-ro-mah),"fullness, a filling up","fullness, fulfilling, full,  ","From  (G4137) pleroo; repletion or completion, i.e. (subjectively) what fills (as contents, supplement, copiousness, multitude), or (objectively) what is filled (as container, performance, period) -- which is put in to fill up, piece that filled up, fulfilling, full, fulness. <p>see GREEK  (G4137) pleroo "
g4139,πλησίον,Adverb,plésion,(play-see'-on),"near, neighboring","near, neighbor. ","Neuter of a derivative of pelas (near); (adverbially) close by; as noun, a neighbor, i.e. Fellow (as man, countryman, Christian or friend) -- near, neighbour. "
g4140,"πλησμονή, ῆς, ἡ","Noun, Feminine",plésmoné,(place-mon-ay'),a filling up,"gratification, satisfaction. ","From a presumed derivative of  (G4130) pletho; a filling up, i.e. (figuratively) gratification -- satisfying. <p>see GREEK  (G4130) pletho "
g4141,πλήσσω,Verb,pléssó,(place'-so),to strike,"smite, strike. ","Apparently another form of  (G4111) plasso (through the idea of flattening out); to pound, i.e. (figuratively) to inflict with (calamity) -- smite. Compare  (G5180) tupto. <p>see GREEK  (G5180) tupto <p>see GREEK  (G4111) plasso "
g4142,"πλοιάριον, ου, τό","Noun, Neuter",ploiarion,(ploy-ar'-ee-on),a little boat,"boat, small ship. ","Neuter of a presumed derivative of  (G4143) ploion; a boat -- boat, little (small) ship. <p>see GREEK  (G4143) ploion "
g4143,"πλοῖον, ου, τό","Noun, Neuter",ploion,(ploy'-on),a boat,a boat,"From  (G4126) pleo; a sailer, i.e. Vessel -- ship(-ing). <p>see GREEK  (G4126) pleo "
g4144,"πλόος, οῦς","Noun, Masculine",ploos or plous,(plo'-os),a voyage,"course, sailing, voyage. ","From  (G4126) pleo; a sail, i.e. Navigation -- course, sailing, voyage. <p>see GREEK  (G4126) pleo "
g4145,"πλούσιος, α, ον",Adjective,plousios,(ploo'-see-os),wealthy,rich. ,"From  (G4149) ploutos; wealthy; figuratively, abounding with -- rich. <p>see GREEK  (G4149) ploutos "
g4146,πλουσίως,Adverb,plousiós,(ploo-see'-oce),richly,"abundantly, richly. ","Adverb from  (G4145) plousios; copiously -- abundantly, richly. <p>see GREEK  (G4145) plousios "
g4147,πλουτέω,Verb,plouteó,(ploo-teh'-o),to be rich,be rich. ,"From  (G4148) ploutizo; to be (or become) wealthy (literally or figuratively) -- be increased with goods, (be made, wax) rich. <p>see GREEK  (G4148) ploutizo "
g4148,πλουτίζω,Verb,ploutizó,(ploo-tid'-zo),to make rich,enrich. ,From  (G4149) ploutos; to make wealthy (figuratively) -- en- (make) rich. <p>see GREEK  (G4149) ploutos
g4149,"πλοῦτος, ου, ὁ","Noun, Masculine; Noun, Neuter",ploutos,(ploo'-tos),wealth,riches. ,"From the base of  (G4130) pletho; wealth (as fulness), i.e. (literally) money, possessions, or (figuratively) abundance, richness, (specially), valuable bestowment -- riches. <p>see GREEK  (G4130) pletho "
g4150,πλύνω,Verb,plunó,(ploo'-no),to wash,wash. ,"A prolonged form of an obsolete pluo (to ""flow""); to ""plunge"", i.e. Launder clothing -- wash. Compare  (G3068) louo,  (G3538) nipto. <p>see GREEK  (G3068) louo <p>see GREEK  (G3538) nipto "
g4151,"πνεῦμα, ατος, τό","Noun, Neuter",pneuma,(pnyoo'-mah),"wind, spirit","spirit, ghost","From  (G4154) pneo; a current of air, i.e. Breath (blast) or a breeze; by analogy or figuratively, a spirit, i.e. (human) the rational soul, (by implication) vital principle, mental disposition, etc., or (superhuman) an angel, demon, or (divine) God, Christ's spirit, the Holy Spirit -- ghost, life, spirit(-ual, -ually), mind. Compare  (G5590) psuche. <p>see GREEK  (G4154) pneo <p>see GREEK  (G5590) psuche "
g4152,"πνευματικός, ή, όν",Adjective,pneumatikos,(pnyoo-mat-ik-os'),spiritual,spiritual. ,"From  (G4151) pneuma; non-carnal, i.e. (humanly) ethereal (as opposed to gross), or (daemoniacally) a spirit (concretely), or (divinely) supernatural, regenerate, religious -- spiritual. Compare  (G5591) psuchikos. <p>see GREEK  (G4151) pneuma <p>see GREEK  (G5591) psuchikos "
g4153,πνευματικῶς,Adverb,pneumatikós,(pnyoo-mat-ik-oce'),spiritually,spiritually. ,"Adverb from  (G4152) pneumatikos; non-physically, i.e. Divinely, figuratively -- spiritually. <p>see GREEK  (G4152) pneumatikos "
g4154,πνέω,Verb,pneó,(pneh'-o),to blow,blow. ,"A primary word; to breathe hard, i.e. Breeze -- blow. Compare  (G5594) psucho. <p>see GREEK  (G5594) psucho "
g4155,πνίγω,Verb,pnigó,(pnee'-go),to choke,"choke, take by the throat. ","Strengthened from  (G4154) pneo; to wheeze, i.e. (causative, by implication) to throttle or strangle (drown) -- choke, take by the throat. <p>see GREEK  (G4154) pneo "
g4156,"πνικτός, ή, όν",Adjective,pniktos,(pnik-tos'),strangled,strangled. ,"From  (G4155) pnigo; throttled, i.e. (neuter concretely) an animal choked to death (not bled) -- strangled. <p>see GREEK  (G4155) pnigo "
g4157,"πνοή, ῆς, ἡ","Noun, Feminine",pnoé,(pno-ay'),"a blowing, wind, breath","breath, wind. ","From  (G4154) pneo; respiration, a breeze -- breath, wind. <p>see GREEK  (G4154) pneo "
g4158,"ποδήρης, ες",Adjective,podérés,(pod-ay'-race),reaching to the feet,"long robe, dress",From  (G4228) pous and another element of uncertain affinity; a dress ( (G2066) esthes implied) reaching the ankles -- garment down to the foot. <p>see GREEK  (G4228) pous <p>see GREEK  (G2066) esthes
g4159,πόθεν,"Adverb, Interrogative",pothen,(poth'-en),from where,whence. ,"From the base of  (G4213) posis with enclitic adverb of origin; from which (as interrogative) or what (as relative) place, state, source or cause -- whence. <p>see GREEK  (G4213) posis "
g4160,ποιέω,Verb,poieó,(poy-eh'-o),"to make, do",to make or do,"Apparently a prolonged form of an obsolete primary; to make or do (in a very wide application, more or less direct) -- abide, + agree, appoint, X avenge, + band together, be, bear, + bewray, bring (forth), cast out, cause, commit, + content, continue, deal, + without any delay, (would) do(-ing), execute, exercise, fulfil, gain, give, have, hold, X journeying, keep, + lay wait, + lighten the ship, make, X mean, + none of these things move me, observe, ordain, perform, provide, + have purged, purpose, put, + raising up, X secure, shew, X shoot out, spend, take, tarry, + transgress the law, work, yield. Compare  (G4238) prasso. <p>see GREEK  (G4238) prasso "
g4161,"ποίημα, ατος, τό","Noun, Neuter",poiéma,(poy'-ay-mah),a work,workmanship. ,"From  (G4160) poieo; a product, i.e. Fabric (literally or figuratively) -- thing that is made, workmanship. <p>see GREEK  (G4160) poieo "
g4162,"ποίησις, εως, ἡ","Noun, Feminine",poiésis,(poy'-ay-sis),"a making, a doing",deed. ,"From  (G4160) poieo; action, i.e. Performance (of the law) -- deed. <p>see GREEK  (G4160) poieo "
g4163,"ποιητής, οῦ, ὁ","Noun, Masculine",poiétés,(poy-ay-tace'),"a maker, a doer","poet, doer ","From  (G4160) poieo; a performer; specially, a ""poet""; --doer, poet. <p>see GREEK  (G4160) poieo "
g4164,"ποικίλος, η, ον",Adjective,poikilos,(poy-kee'-los),many colored,"diverse, manifold. ","Of uncertain derivation; motley, i.e. Various in character -- divers, manifold. "
g4165,ποιμαίνω,Verb,poimainó,(poy-mah'-ee-no),to act as a shepherd,"to shepherd, rule","From  (G4166) poimen; to tend as a shepherd of (figuratively, superviser) -- feed (cattle), rule. <p>see GREEK  (G4166) poimen "
g4166,"ποιμήν, ένος, ὁ","Noun, Masculine",poimén,(poy-mane'),a shepherd,"shepherd, pastor. ","Of uncertain affinity; a shepherd (literally or figuratively) -- shepherd, pastor. "
g4167,"ποίμνη, ης, ἡ","Noun, Feminine",poimné,(poym'-nay),a flock,"flock, fold. ","Contraction from  (G4165) poimaino; a flock (literally or figuratively) -- flock, fold. <p>see GREEK  (G4165) poimaino "
g4168,"ποίμνιον, ου, τό","Noun, Neuter",poimnion,(poym'-nee-on),a flock,flock. ,"Neuter of a presumed derivative of  (G4167) poimne; a flock, i.e. (figuratively) group (of believers) -- flock. <p>see GREEK  (G4167) poimne "
g4169,"ποῖος, α, ον",Interrogative Pronoun,poios,(poy'-os),of what sort?,"what manner of, which. ","From the base of  (G4226) pou and  (G3634) hoios; individualizing interrogative (of character) what sort of, or (of number) which one -- what (manner of), which. <p>see GREEK  (G4226) pou <p>see GREEK  (G3634) hoios "
g4170,πολεμέω,Verb,polemeó,(pol-em-eh'-o),to make war,"to battle, make war. ","From  (G4171) polemos; to be (engaged) in warfare, i.e. To battle (literally or figuratively): -fight, (make) war. <p>see GREEK  (G4171) polemos "
g4171,"πόλεμος, ου, ὁ","Noun, Masculine",polemos,(pol'-em-os),war,"battle, fight, war. ","From pelomai (to bustle); warfare (literally or figuratively; a single encounter or a series) -- battle, fight, war. "
g4172,"πόλις, εως, ἡ","Noun, Feminine",polis,(pol'-is),a city,city. ,"Probably from the same as  (G4171) polemos, or perhaps from  (G4183) polus; a town (properly, with walls, of greater or less size) -- city. <p>see GREEK  (G4183) polus <p>see GREEK  (G4171) polemos "
g4173,"πολιτάρχης, ου, ὁ","Noun, Masculine",politarchés,(pol-it-ar'-khace),the ruler of a city,ruler of the city. ,"From  (G4172) polis and  (G757) archo; a town-officer, i.e. Magistrate -- ruler of the city. <p>see GREEK  (G4172) polis <p>see GREEK  (G757) archo "
g4174,"πολιτεία, ας, ἡ","Noun, Feminine",politeia,(pol-ee-ti'-ah),citizenship,citizenship,"From  (G4177) polites (""polity""); citizenship; concretely, a community -- commonwealth, freedom. <p>see GREEK  (G4177) polites "
g4175,"πολίτευμα, ατος, τό","Noun, Neuter",politeuma,(pol-it'-yoo-mah),"a form of government, citizenship","citizenship, community, conversation. ","From  (G4176) politeuomai; a community, i.e. (abstractly) citizenship (figuratively) -- conversation. <p>see GREEK  (G4176) politeuomai "
g4176,πολιτεύομαι,Verb,politeuomai,(pol-it-yoo'-om-ahee),to live as a citizen,"let conversation be, live. ","Middle voice of a derivative of  (G4177) polites; to behave as a citizen (figuratively) -- let conversation be, live. <p>see GREEK  (G4177) polites "
g4177,"πολίτης, ου, ὁ","Noun, Masculine",polités,(pol-ee'-tace),a citizen,citizen. ,From  (G4172) polis; a townsman -- citizen. <p>see GREEK  (G4172) polis
g4178,πολλάκις,Adverb,pollakis,(pol-lak'-is),often,often,"Multiplicative adverb from  (G4183) polus; many times, i.e. Frequently -- oft(-en, -entimes, -times). <p>see GREEK  (G4183) polus "
