g,0816,ἀτενίζω,Verb,atenizó,(at-en-id'-zo),"to look fixedly, gaze","stare, fasten eyes, look stedfastly. ","From a compound of  (G1) a (as a particle of union) and teino (to stretch); to gaze intently -- behold earnestly (stedfastly), fasten (eyes), look (earnestly, stedfastly, up stedfastly), set eyes. <p>see GREEK  (G1) a "
g,0817,ἄτερ,Preposition,ater,(at'-er),without,"in the absence of, without. ","A particle probably akin to  (G427) aneu; aloof, i.e. Apart from (literally or figuratively) -- in the absence of, without. <p>see GREEK  (G427) aneu "
g,0818,ἀτιμάζω,Verb,atimazó,(at-im-ad'-zo),to dishonor,"despise, dishonor, suffer shame","From  (G820) atimos; to render infamous, i.e. (by implication) contemn or maltreat -- despise, dishonour, suffer shame, entreat shamefully. <p>see GREEK  (G820) atimos "
g,0819,"ἀτιμία, ας, ἡ","Noun, Feminine",atimia,(at-ee-mee'-ah),dishonor,"dishonor, reproach, shame, vile. ","From  (G820) atimos; infamy, i.e. (subjectively) comparative indignity, (objectively) disgrace -- dishonour, reproach, shame, vile. <p>see GREEK  (G820) atimos "
g,0820,"ἄτιμος, ον",Adjective,atimos,(at'-ee-mos),"without honor, dishonored","despised, without honor, less honorable. ","From  (G1) a (as a negative particle) and  (G5092) time; (negatively) unhonoured or (positively) dishonoured -- despised, without honour, less honourable (comparative degree). <p>see GREEK  (G1) a <p>see GREEK  (G5092) time "
g,0821,ἀτιμόω,Verb,atimoó,(at-ee-mo'-o),handle shamefully,handle shamefully. ,"From  (G820) atimos; used like  (G818) atimazo, to maltreat -- handle shamefully. <p>see GREEK  (G820) atimos <p>see GREEK  (G818) atimazo "
g,0822,"ἀτμίς, ίδος, ἡ","Noun, Feminine",atmis,(at-mece'),vapor,vapor. ,From the same as  (G109) aer; mist -- vapour. <p>see GREEK  (G109) aer
g,0823,"ἄτομος, ον",Adjective,atomos,(at'-om-os),"uncut, indivisible, (an indivisible) moment (of time)",moment. ,"From  (G1) a (as a negative particle) and the base of  (G5114) tomoteros; uncut, i.e. (by implication) indivisible (an ""atom"" of time) -- moment. <p>see GREEK  (G1) a <p>see GREEK  (G5114) tomoteros "
g,0824,"ἄτοπος, ον",Adjective,atopos,(at'-op-os),"out of place, strange","amiss, harmful, unreasonable. ","From  (G1) a (as a negative particle) and  (G5117) topos; out of place, i.e. (figuratively) improper, injurious, wicked -- amiss, harm, unreasonable. <p>see GREEK  (G1) a <p>see GREEK  (G5117) topos "
g,0825,"Ἀττάλεια, ας, ἡ","Noun, Feminine",Attaleia,(at-tal'-i-ah),"Attalia, a city of Pamphylia",Attalia. ,"From Attalos (a king of Pergamus); Attaleia, a place in Pamphylia -- Attalia. "
g,0826,αὐγάζω,Verb,augazó,(ow-gad'-zo),to shine forth,shine. ,From  (G827) auge; to beam forth (figuratively) -- shine. <p>see GREEK  (G827) auge
g,0827,"αὐγή, ῆς, ἡ","Noun, Feminine",augé,(owg'-ay),"brightness, daylight",break of day. ,"Of uncertain derivation; a ray of light, i.e. (by implication) radiance, dawn -- break of day. "
g,0828,"Αὐγούστος, ου, ὁ","Noun, Masculine",Augoustos,(ow'-goos-tos),"Augustus, the name of a Roman emperor",Augustus. ,"From Latin (""august""); Augustus, a title of the Roman emperor -- Augustus. "
g,0829,"αὐθάδης, ες",Adjective,authadés,(ow-thad'-ace),self-pleasing,self-willed. ,"From  (G846) autos and the base of  (G2237) hedone; self-pleasing, i.e. Arrogant -- self-willed. <p>see GREEK  (G846) autos <p>see GREEK  (G2237) hedone "
g,0830,"αὐθαίρετος, ον",Adjective,authairetos,(ow-thah'-ee-ret-os),"self-chosen, of one\'s own accord",of own accord,"From  (G846) autos and the same as  (G140) hairetizo; self-chosen, i.e. (by implication) voluntary -- of own accord, willing of self. <p>see GREEK  (G846) autos <p>see GREEK  (G140) hairetizo "
g,0831,αὐθεντέω,Verb,authenteó,(ow-then-teh'-o),"to govern, exercise authority","govern, exercise authority","From a compound of  (G846) autos and an obsolete hentes (a worker); to act of oneself, i.e. (figuratively) dominate -- usurp authority over. <p>see GREEK  (G846) autos "
g,0832,αὐλέω,Verb,auleó,(ow-leh'-o),to play on a flute,play the flute,From  (G836) aulos; to play the flute -- pipe. <p>see GREEK  (G836) aulos
g,0833,"αὐλή, ῆς, ἡ","Noun, Feminine",aulé,(ow-lay'),"a courtyard, a court","courtyard, hall","From the same as  (G109) aer; a yard (as open to the wind); by implication, a mansion -- court, (sheep-)fold, hall, palace. <p>see GREEK  (G109) aer "
g,0834,"αὐλητής, οῦ, ὁ","Noun, Masculine",aulétés,(ow-lay-tace'),a flute player,flute player,"From  (G832) auleo; a flute-player -- minstrel, piper. <p>see GREEK  (G832) auleo "
g,0835,αὐλίζομαι,Verb,aulizomai,(ow-lid'-zom-ahee),"to lodge in the open, to lodge","abide, lodge, spend the night","Middle voice from  (G833) aule; to pass the night (properly, in the open air) -- abide, lodge. <p>see GREEK  (G833) aule "
g,0836,"αὐλός, οῦ, ὁ","Noun, Masculine",aulos,(ow-los'),"a pipe, flute",flute,From the same as  (G109) aer; a flute (as blown) -- pipe. <p>see GREEK  (G109) aer
g,0837,αὐξάνω,Verb,auxanó,(owx-an'-o),"to make to grow, to grow","grow up, increase. ","A prolonged form of a primary verb; to grow (""wax""), i.e. Enlarge (literal or figurative, active or passive) -- grow (up), (give the) increase. "
g,0838,"αὔξησις, εως, ἡ","Noun, Feminine",auxésis,(owx'-ay-sis),growth,increase. ,From  (G837) auzano; growth -- increase. <p>see GREEK  (G837) auzano
g,0839,αὔριον,Adverb,aurion,(ow'-ree-on),tomorrow,"tomorrow, next day. ","From a derivative of the same as  (G109) aer (meaning a breeze, i.e. The morning air); properly, fresh, i.e. (adverb with ellipsis of  (G2250) hemera) to-morrow -- (to-)morrow, next day. <p>see GREEK  (G109) aer <p>see GREEK  (G2250) hemera "
g,0840,"αὐστηρός, ά, όν",Adjective,austéros,(ow-stay-ros'),"harsh, severe","austere, strict","From a (presumed) derivative of the same as  (G109) aer (meaning blown); rough (properly as a gale), i.e. (figuratively) severe -- austere. <p>see GREEK  (G109) aer "
g,0841,"αὐτάρκεια, ας, ἡ","Noun, Feminine",autarkeia,(ow-tar'-ki-ah),"self-satisfaction, self-sufficiency","contentment, sufficiency. ","From  (G842) autarkes; self-satisfaction, i.e. (abstractly) contentedness, or (concretely) a competence -- contentment, sufficiency. <p>see GREEK  (G842) autarkes "
g,0842,"αὐτάρκης, ες",Adjective,autarkés,(ow-tar'-kace),"self-sufficient, sufficient",content. ,"From  (G846) autos and  (G714) arkeo; self-complacent, i.e. Contented -- content. <p>see GREEK  (G846) autos <p>see GREEK  (G714) arkeo "
g,0843,"αὐτοκατάκριτος, ον",Adjective,autokatakritos,(ow-tok-at-ak'-ree-tos),self-condemned,self-condemned,From  (G846) autos and a derivative or  (G2632) katakrino; self-condemned -- condemned of self. <p>see GREEK  (G846) autos <p>see GREEK  (G2632) katakrino
g,0844,"αὐτόματος, η, ον",Adjective,automatos,(ow-tom'-at-os),"acting of one\'s own will, of its own accord","of own accord, of self. ","From  (G846) autos and the same as  (G3155) maten; self-moved (""automatic""), i.e. Spontaneous -- of own accord, of self. <p>see GREEK  (G846) autos <p>see GREEK  (G3155) maten "
g,0845,"αὐτόπτης, ου, ὁ","Noun, Masculine",autoptés,(ow-top'-tace),an eyewitness,eye-witness. ,"From  (G846) autos and  (G3700) optanomai; self-seeing, i.e. An eye-witness -- eye-witness. <p>see GREEK  (G846) autos <p>see GREEK  (G3700) optanomai "
g,0846,"αὐτός, αὐτή, αὐτό",Personal Pronoun,autos,(ow-tos'),"(1) self (emphatic) (2) he, she, it (used for the third person pronoun) (3) the same","herself, himself, itself, he, she, it, same","From the particle au (perhaps akin to the base of  (G109) aer through the idea of a baffling wind) (backward); the reflexive pronoun self, used (alone or in the comparative  (G1438) heautou) of the third person, and (with the proper personal pronoun) of the other persons -- her, it(-self), one, the other, (mine) own, said, (self-), the) same, ((him-, my-, thy-)self, (your-)selves, she, that, their(-s), them(-selves), there(-at, - by, -in, -into, -of, -on, -with), they, (these) things, this (man), those, together, very, which. Compare  (G848) hautou. <p>see GREEK  (G109) aer <p>see GREEK  (G1438) heautou <p>see GREEK  (G848) hautou "
g,0847,αὐτοῦ,Adverb,autou,(ow-too'),"there, here","here, there.","Genitive (i.e. Possessive) of  (G846) autos, used as an adverb of location; properly, belonging to the same spot, i.e. In this (or that) place -- (t-)here. <p>see GREEK  (G846) autos "
g,0848,αὑτοῦ,-,hautou,(how-too'),"her own, his own, their own, themselves, they","her own, his own, their own, themselves, they. ","Contracted for  (G1438) heautou; self (in some oblique case or reflexively, relation) -- her (own), (of) him(-self), his (own), of it, thee, their (own), them(-selves), they. <p>see GREEK  (G1438) heautou "
g,0849,"αὐτόχειρ, ρος, ὁ",Adjective,autocheir,(ow-tokh'-ire),the very act,with one's own hands. ,"From  (G846) autos and  (G5495) cheir; self-handed, i.e. Doing personally -- with... Own hands. <p>see GREEK  (G846) autos <p>see GREEK  (G5495) cheir "
g,0850,"αὐχμηρός, ά, όν",Adjective,auchmeros,(owkh-may-ros'),to boast,"dark, gloomy","From auchmos (probably from a base akin to that of  (G109) aer) (dust, as dried by wind); properly, dirty, i.e. (by implication) obscure -- dark. <p>see GREEK  (G109) aer "
g,0851,ἀφαιρέω,Verb,aphaireó,(af-ahee-reh'-o),"to take from, take away","cut off, take away. ","From  (G575) apo and  (G138) haireomai; to remove (literally or figuratively) -- cut (smite) off, take away. <p>see GREEK  (G575) apo <p>see GREEK  (G138) haireomai "
g,0852,"ἀφανής, ές",Adjective,aphanés,(af-an-ace'),unseen,"invisible, hidden",From  (G1) a (as a negative particle) and  (G5316) phaino; non-apparent) -- that is not manifest. <p>see GREEK  (G1) a <p>see GREEK  (G5316) phaino
g,0853,ἀφανίζω,Verb,aphanizó,(af-an-id'-zo),"to make unseen, destroy","corrupt, disfigure, destroy","From  (G852) aphanes; to render unapparent, i.e. (actively) consume (becloud), or (passively) disappear (be destroyed) -- corrupt, disfigure, perish, vanish away. <p>see GREEK  (G852) aphanes "
g,0854,"ἀφανισμός, οῦ, ὁ","Noun, Masculine",aphanismos,(af-an-is-mos'),a vanishing,vanish away. ,"From  (G853) aphanizo; disappearance, i.e. (figuratively) abrogation -- vanish away. <p>see GREEK  (G853) aphanizo "
g,0855,"ἄφαντος, ον",Adjective,aphantos,(af'-an-tos),invisible,vanished out of sight. ,"From  (G1) a (as a negative particle) and a derivative of  (G5316) phaino; non-manifested, i.e. Invisible -- vanished out of sight. <p>see GREEK  (G1) a <p>see GREEK  (G5316) phaino "
g,0856,"ἀφεδρών, ῶνος, ὁ","Noun, Masculine",aphedrón,(af-ed-rone'),"a place of sitting apart, a privy, drain",draught. ,"From a compound of  (G575) apo and the base of  (G1476) hedraios; a place of sitting apart, i.e. A privy -- draught. <p>see GREEK  (G575) apo <p>see GREEK  (G1476) hedraios "
g,0857,"ἀφειδία, ας, ἡ","Noun, Feminine",apheidia,(af-i-dee'-ah),unsparing treatment,neglect. ,"From a compound of  (G1) a (as a negative particle) and  (G5339) pheidomai; unsparingness, i.e. Austerity (asceticism) -- neglecting. <p>see GREEK  (G1) a <p>see GREEK  (G5339) pheidomai "
g,0858,"ἀφελότης, τητος, ἡ","Noun, Feminine",aphelotés,(af-el-ot'-ace),simplicity,"singleness, simplicity","From a compound of  (G1) a (as a negative particle) and phellos (in the sense of a stone as stubbing the foot); smoothness, i.e. (figuratively) simplicity -- singleness. <p>see GREEK  (G1) a "
g,0859,"ἄφεσις, εως, ἡ","Noun, Feminine",aphesis,(af'-es-is),"dismissal, release, pardon","deliverance, forgiveness, liberty, remission. ","From  (G863) aphiemi; freedom; (figuratively) pardon -- deliverance, forgiveness, liberty, remission. <p>see GREEK  (G863) aphiemi "
g,0860,"ἁφή, ῆς, ἡ","Noun, Feminine",haphé,(haf-ay'),a joint,joint. ,From  (G680) haptomai; probably a ligament (as fastening) -- joint. <p>see GREEK  (G680) haptomai
g,0861,"ἀφθαρσία, ας, ἡ","Noun, Feminine",aphtharsia,(af-thar-see'-ah),incorruptibility,"incorruptibility, immortality","From  (G862) aphthartos; incorruptibility; genitive, unending existence; (figuratively) genuineness -- immortality, incorruption, sincerity. <p>see GREEK  (G862) aphthartos "
g,0862,"ἄφθαρτος, ον",Adjective,aphthartos,(af'-thar-tos),"undecaying, imperishable","incorruptible, immortal. ","From  (G1) a (as a negative particle) and a derivative of  (G5351) phtheiro; undecaying (in essence or continuance) -- not (in-, un-)corruptible, immortal. <p>see GREEK  (G1) a <p>see GREEK  (G5351) phtheiro "
g,0863,ἀφίημι,Verb,aphiémi,(af-ee'-ay-mee),"to send away, leave alone, permit","lay aside, leave, let go, omit","From  (G575) apo and hiemi (to send; an intensive form of eimi, to go); to send forth, in various applications (as follow) -- cry, forgive, forsake, lay aside, leave, let (alone, be, go, have), omit, put (send) away, remit, suffer, yield up. <p>see GREEK  (G575) apo "
g,0864,ἀφικνέομαι,Verb,aphikneomai,(af-ik-neh'-om-ahee),to arrive at,"come abroad, go forth",From  (G575) apo and the base of  (G2425) hikanos; to go (i.e. Spread) forth (by rumor) -- come abroad. <p>see GREEK  (G575) apo <p>see GREEK  (G2425) hikanos
g,0865,"ἀφιλάγαθος, ον",Adjective,aphilagathos,(af-il-ag'-ath-os),without love of good,despiser of those that are good. ,From  (G1) a (as a negative particle) and  (G5358) philagathos; hostile to virtue -- despiser of those that are good. <p>see GREEK  (G1) a <p>see GREEK  (G5358) philagathos
g,0866,"ἀφιλάργυρος, ον",Adjective,aphilarguros,(af-il-ar'-goo-ros),without love of money,"without covetousness, not greedy. ","From  (G1) a (as a negative particle) and  (G5366) philarguros; unavaricious -- without covetousness, not greedy of filthy lucre. <p>see GREEK  (G1) a <p>see GREEK  (G5366) philarguros "
g,0867,"ἄφιξις, εως, ἡ","Noun, Feminine",aphixis,(af'-ix-is),"arrival, by implication departure",departing. ,"From  (G864) aphikneomai; properly, arrival, i.e. (by implication) departure -- departing. <p>see GREEK  (G864) aphikneomai "
g,0868,ἀφίστημι,Verb,aphistémi,(af-is'-tay-mee),"to lead away, to depart from","depart, fall away, refrain, withdraw self. ","From  (G575) apo and  (G2476) histemi; to remove, i.e. (actively) instigate to revolt; usually (reflexively) to desist, desert, etc. -- depart, draw (fall) away, refrain, withdraw self. <p>see GREEK  (G575) apo <p>see GREEK  (G2476) histemi "
g,0869,ἄφνω,Adverb,aphnó,(af'-no),suddenly,suddenly. ,"Adverb from  (G852) aphanes (contraction); unawares, i.e. Unexpectedly -- suddenly. <p>see GREEK  (G852) aphanes "
g,0870,ἀφόβως,Adverb,aphobós,(af-ob'-oce),without fear,without fear. ,Adverb from a compound of  (G1) a (as a negative particle) and  (G5401) phobos; fearlessly -- without fear. <p>see GREEK  (G1) a <p>see GREEK  (G5401) phobos
g,0871,ἀφομοιόω,Verb,aphomoioó,(af-om-oy-o'-o),to make like,make like. ,From  (G575) apo and  (G3666) homoioo; to assimilate closely -- make like. <p>see GREEK  (G575) apo <p>see GREEK  (G3666) homoioo
g,0872,ἀφοράω,Verb,aphoraó,(af-or-ah'-o),to look away from all else at,look. ,From  (G575) apo and  (G3708) horao; to consider attentively -- look. <p>see GREEK  (G575) apo <p>see GREEK  (G3708) horao
g,0873,ἀφορίζω,Verb,aphorizó,(af-or-id'-zo),"to mark off by boundaries from, set apart","divide, separate, sever. ","From  (G575) apo and  (G3724) horizo; to set off by boundary, i.e. (figuratively) limit, exclude, appoint, etc. -- divide, separate, sever. <p>see GREEK  (G575) apo <p>see GREEK  (G3724) horizo "
g,0874,"ἀφορμή, ῆς, ἡ","Noun, Feminine",aphormé,(af-or-may'),"a starting point, an occasion",occasion. ,"From a compound of  (G575) apo and  (G3729) hormao; a starting-point, i.e. (figuratively) an opportunity -- occasion. <p>see GREEK  (G575) apo <p>see GREEK  (G3729) hormao "
g,0875,ἀφρίζω,Verb,aphrizó,(af-rid'-zo),to foam at the mouth,foam. ,From  (G876) aphros; to froth at the mouth (in epilepsy) -- foam. <p>see GREEK  (G876) aphros
g,0876,"ἀφρός, οῦ, ὁ","Noun, Masculine",aphros,(af-ros'),foam,foaming. ,"Apparently a primary word; froth, i.e. Slaver -- foaming. "
g,0877,"ἀφροσύνη, ῆς, ἡ","Noun, Feminine",aphrosuné,(af-ros-oo'-nay),foolishness,"folly, foolishly. ","From  (G878) aphron; senselessness, i.e. (euphemistically) egotism; (morally) recklessness -- folly, foolishly(-ness). <p>see GREEK  (G878) aphron "
g,0878,"ἄφρων, ονος, ον",Adjective,aphrón,(af'-rone),"without reason, foolish","foolish, unwise. ","From  (G1) a (as a negative particle) and  (G5424) phren; properly, mindless, i.e. Stupid, (by implication) ignorant, (specially) egotistic, (practically) rash, or (morally) unbelieving -- fool(-ish), unwise. <p>see GREEK  (G1) a <p>see GREEK  (G5424) phren "
g,0879,ἀφυπνόω,Verb,aphupnoo,(af-oop-no'-o),to fall asleep,fall asleep. ,"From a compound of  (G575) apo and  (G5258) hupnos; properly, to become awake, i.e. (by implication) to drop (off) in slumber -- fall asleep. <p>see GREEK  (G575) apo <p>see GREEK  (G5258) hupnos "
g,0880,"ἄφωνος, ον",Adjective,aphónos,(af'-o-nos),"without voice, speechless","speechless, mute, silent","From  (G1) a (as a negative particle) and  (G5456) phone; voiceless, i.e. Mute (by nature or choice); figuratively, unmeaning -- dumb, without signification. <p>see GREEK  (G1) a <p>see GREEK  (G5456) phone "
g,0881,"Ἄχαζ, ὁ","Proper Noun, Indeclinable",Achaz,(akh-adz'),"Ahaz, a king of Judah",Achaz. ,"Of Hebrew origin ( (H271) 'Achaz); Achaz, an Israelite -- Achaz. <p>see HEBREW  (H271) 'Achaz "
g,0882,"Ἀχαϊα, ας, ἡ","Noun, Feminine",Achaia,(ach-ah-ee'-ah),"Achaia, a Roman province including most of Greece",Achaia. ,"Of uncertain derivation; Achaia (i.e. Greece), a country of Europe -- Achaia. "
g,0883,"Ἀχαϊκός, οῦ, ὁ","Noun, Masculine",Achaikos,(ach-ah-ee-kos'),"an Achaian, Achaicus, a Christian at Corinth",Achaicus. ,"From  (G882) Achaia; an Achaian; Achaicus, a Christian -- Achaicus. <p>see GREEK  (G882) Achaia "
g,0884,"ἀχάριστος, ον",Adjective,acharistos,(ach-ar'-is-tos),"ungracious, ungrateful",unthankful. ,"From  (G1) a (as a negative particle) and a presumed derivative of  (G5483) charizomai; thankless, i.e. Ungrateful -- unthankful. <p>see GREEK  (G1) a <p>see GREEK  (G5483) charizomai "
g,0885,"Ἀχείμ, ὁ","Proper Noun, Indeclinable",Achim,(akh-ime'),"Achim, an ancestor of Christ",Achim. ,"Probably of Hebrew origin (compare  (H3137) Yowqiym); Achim, an Israelite -- Achim. <p>see HEBREW  (H3137) Yowqiym "
g,0886,"ἀχειροποίητος, ον",Adjective,acheiropoiétos,(akh-i-rop-oy'-ay-tos),not made by hands,not made with hands. ,"From  (G1) a (as a negative particle) and  (G5499) cheiropoietos; unmanufactured, i.e. Inartificial -- made without (not made with) hands. <p>see GREEK  (G1) a <p>see GREEK  (G5499) cheiropoietos "
g,0887,"ἀχλύς, ύος, ἡ","Noun, Feminine",achlus,(akh-looce'),a mist,mist. ,"Of uncertain derivation; dimness of sight, i.e. (probably) a cataract -- mist. "
g,0888,"ἀχρεῖος, ον",Adjective,achreios,(akh-ri'-os),useless,unprofitable. ,"From  (G1) a (as a negative particle) and a derivative of  (G5534) chre (compare  (G5532) chreia); useless, i.e. (euphemistically) unmeritorious -- unprofitable. <p>see GREEK  (G1) a <p>see GREEK  (G5534) chre <p>see GREEK  (G5532) chreia "
g,0889,ἀχρειόω,Verb,achreioó,(akh-ri-o'-o),to make useless,"become unprofitable, render useless","From  (G888) achreios; to render useless, i.e. Spoil -- become unprofitable. <p>see GREEK  (G888) achreios "
g,0890,"ἄχρηστος, ον",Adjective,achréstos,(akh'-race-tos),useless,"unprofitable, useless","From  (G1) a (as a negative particle) and  (G5543) chrestos; inefficient, i.e. (by implication) detrimental -- unprofitable. <p>see GREEK  (G1) a <p>see GREEK  (G5543) chrestos "
g,0891,ἄχρι,Adverb,achri or achris,(akh'-ree),"until, as far as","as far as, for, until, while. ","Or achris akh'-rece; akin to  (G206) akron (through the idea of a terminus); (of time) until or (of place) up to -- as far as, for, in(-to), till, (even, un-)to, until, while. Compare  (G3360) mechri. <p>see GREEK  (G206) akron <p>see GREEK  (G3360) mechri "
g,0892,"ἄχυρον, ου, τό","Noun, Neuter",achuron,(akh'-oo-ron),chaff,chaff. ,Perhaps remotely from cheo (to shed forth); chaff (as diffusive) -- chaff.
g,0893,"ἀψευδής, ές",Adjective,apseudés,(aps-yoo-dace'),free from falsehood,that cannot lie. ,From  (G1) a (as a negative particle) and  (G5579) pseudos; veracious -- that cannot lie. <p>see GREEK  (G1) a <p>see GREEK  (G5579) pseudos
g,0894,"ἄψινθος, οῦ, ὁ","Noun, Feminine; Noun, Masculine",apsinthos,(ap'-sin-thos),wormwood,wormwood. ,"Of uncertain derivation; wormwood (as a type of bitterness, i.e. (figuratively) calamity) -- wormwood. "
g,0895,"ἄψυχος, ον",Adjective,apsuchos,(ap'-soo-khos),lifeless,without life. ,"From  (G1) a (as a negative particle) and  (G5590) psuche; lifeless, i.e. Inanimate (mechanical) -- without life. <p>see GREEK  (G1) a <p>see GREEK  (G5590) psuche "
g,0896,"Βάαλ, ὁ","Proper Noun, Indeclinable",Baal,(bah'-al),"Baal, a Canaanite deity",Baal. ,"Of Hebrew origin ( (H1168) Ba'al); Baal, a Phoenician deity (used as a symbol of idolatry) -- Baal. <p>see HEBREW  (H1168) Ba'al "
g,0897,"Βαβυλών, ῶνος, ἡ","Noun, Feminine",Babulón,(bab-oo-lone'),"gate of god(s), Babylon, a large city situated astride the Euphrates river",Babylon. ,"Of Hebrew origin ( (H894) Babel); Babylon, the capitol of Chaldaea (literally or figuratively (as a type of tyranny)) -- Babylon. <p>see HEBREW  (H894) Babel "
g,0898,"βαθμός, οῦ, ὁ","Noun, Masculine",bathmos,(bath-mos'),"a step, degree",degree. ,"From the same as  (G899) bathos; a step, i.e. (figuratively) grade (of dignity) -- degree. <p>see GREEK  (G899) bathos "
g,0899,"βάθος, ους, τό","Noun, Neuter",bathos,(bath'-os),depth,"deepness, depth. ","From the same as  (G901) bathus; profundity, i.e. (by implication) extent; (figuratively) mystery -- deep(-ness, things), depth. <p>see GREEK  (G901) bathus "
g,0900,βαθύνω,Verb,bathunó,(bath-oo'-no),to deepen,deep. ,From  (G901) bathus; to deepen -- deep. <p>see GREEK  (G901) bathus
g,0901,"βαθύς, εῖα, ύ",Adjective,bathus,(bath-oos'),deep,deep,"From the base of  (G939) basis; profound (as going down), literally or figuratively -- deep, very early. <p>see GREEK  (G939) basis "
g,0902,"βαΐον, ου, τό","Noun, Neuter",baion,(bah-ee'-on),a palm branch,palm branch,A diminutive of a derivative probably of the base of  (G939) basis; a palm twig (as going out far) -- branch. <p>see GREEK  (G939) basis
g,0903,"Βαλαάμ, ὁ","Proper Noun, Indeclinable",Balaam,(bal-ah-am'),"Balaam, an unrighteous prophet",Balaam. ,"Of Hebrew origin ( (H1109) Bil'am); Balaam, a Mesopotamian (symbolic of a false teacher) -- Balaam. <p>see HEBREW  (H1109) Bil'am "
g,0904,"Βαλάκ, ὁ","Proper Noun, Indeclinable",Balak,(bal-ak'),"Balak, a king of the Moabites",Balak,"Of Hebrew origin ( (H1111) Balaq); Balak, a Moabite -- Balac. <p>see HEBREW  (H1111) Balaq "
g,0905,"βαλάντιον, ου, τό","Noun, Neuter",ballantion,(bal-an'-tee-on),a purse,"bag, purse. ","Probably remotely from  (G906) ballo (as a depository); a pouch (for money) -- bag, purse. <p>see GREEK  (G906) ballo "
g,0906,βάλλω,Verb,balló,(bal'-lo),"to throw, cast","cast out, send, throw down, thrust ","A primary verb; to throw (in various applications, more or less violent or intense) -- arise, cast (out), X dung, lay, lie, pour, put (up), send, strike, throw (down), thrust. Compare  (G4496) rhipto. <p>see GREEK  (G4496) rhipto "
g,0907,βαπτίζω,Verb,baptizó,(bap-tid'-zo),"to dip, sink","baptize, wash. ","From a derivative of  (G911) bapto; to immerse, submerge; to make whelmed (i.e. Fully wet); used only (in the New Testament) of ceremonial ablution, especially (technically) of the ordinance of Christian baptism -- Baptist, baptize, wash. <p>see GREEK  (G911) bapto "
g,0908,"βάπτισμα, ατος, τό","Noun, Neuter",baptisma,(bap'-tis-mah),(the result of) a dipping or sinking,baptism. ,From  (G907) baptizo; baptism (technically or figuratively) -- baptism. <p>see GREEK  (G907) baptizo
g,0909,"βαπτισμός, οῦ, ὁ","Noun, Masculine",baptismos,(bap-tis-mos'),(the act of) a dipping or washing,"baptism, washing. ","From  (G907) baptizo; ablution (ceremonial or Christian) -- baptism, washing. <p>see GREEK  (G907) baptizo "
g,0910,"βαπτιστής, οῦ, ὁ","Noun, Masculine",baptistés,(bap-tis-tace'),a baptizer,Baptist. ,"From  (G907) baptizo; a baptizer, as an epithet of Christ's forerunner -- Baptist. <p>see GREEK  (G907) baptizo "
g,0911,βάπτω,Verb,baptó,(bap'-to),to dip,dip. ,"A primary verb; to whelm, i.e. Cover wholly with a fluid; in the New Testament only in a qualified or special sense, i.e. (literally) to moisten (a part of one's person), or (by implication) to stain (as with dye) -- dip. "
g,0912,"Βαραββᾶς, ᾶ, ὁ","Noun, Masculine",Barabbas,(bar-ab-bas'),"son of Abba, Barabbas, the Israelite robber released instead of Christ",Barabbas. ,"Of Chaldee origin ( (G1347) dikaiosis and  (G5) Abba); son of Abba; Bar-abbas, an Israelite -- Barabbas. <p>see HEBREW  (H1347) ga'own <p>see HEBREW  (H5) 'Abagtha' "
