h,4216,מַזָּרָה,Noun Feminine,mazzaroth,(maz-zaw-raw'),perhaps a constellation,Mazzoroth ,"Apparently from (H5144) nazar in the sense of distinction; some noted constellation (only in the plural), perhaps collectively, the zodiac -- Mazzoroth. Compare (H4208) mazzalah. see HEBREW (H5144) nazar see HEBREW (H4208) mazzalah "
h,4217,מִזְרָח,Noun Masculine,mizrach,(miz-rawkh'),"place of sunrise, the east","east side, sunrise ","From (H2224) zarach; sunrise, i.e. The east -- east (side, -ward), (sun-)rising (of the sun). see HEBREW (H2224) zarach "
h,4218,מִזְרָע,Noun Masculine,mizra,(miz-raw'),place of sowing,thing sown ,From (H2232) zara'; a planted field -- thing sown. see HEBREW (H2232) zara'
h,4219,מִזְרָק,Noun Masculine,mizraq,(miz-rawk'),"bowl, basin","bason, bowl ","From (H2236) zaraq; a bowl (as if for sprinkling) -- bason, bowl. see HEBREW (H2236) zaraq "
h,4220,מֵחַ,Noun Masculine,meach,(may'-akh),a fatling,fatling one ,"From (H4229) machah in the sense of greasing; fat; figuratively, rich -- fatling (one). see HEBREW (H4229) machah "
h,4221,מֹחַ,Noun Masculine,moach,(mo'-akh),marrow,marrow ,"From the same as (H4220) meach; fat, i.e. Marrow -- marrow. see HEBREW (H4220) meach "
h,4222,מָחָא,Verb,macha,(maw-khaw'),"to strike, clap",clap ,A primitive root; to rub or strike the hands together (in exultation) -- clap.
h,4223,מְחָא,Verb,mecha,(mekh-aw'),to smite,"hang, smite, stay ","(Aramaic) corresponding to (H4222) macha'; to strike in pieces; also to arrest; specifically to impale -- hang, smite, stay. see HEBREW (H4222) macha' "
h,4224,מַחֲבֵא,Noun Masculine,machabe\',(makh-ab-ay'),a hiding place,hiding lurking place ,Or machaboo {makh-ab-o'}; from (H2244) chaba'; a refuge -- hiding (lurking) place. see HEBREW (H2244) chaba'
h,4225,מַחְבֶּרֶת,Noun Feminine,machbereth,(makh-beh'-reth),"something joined, place of joining",coupling ,"From (H2266) chabar; a junction, i.e. Seam or sewed piece -- coupling. see HEBREW (H2266) chabar "
h,4226,מְחַבְּרָה,Noun Feminine,mechabberah,(mekh-ab-ber-aw'),"a binder, clamp, joint","coupling, joining ","From (H2266) chabar; a joiner, i.e. Brace or cramp -- coupling, joining. see HEBREW (H2266) chabar "
h,4227,מַחֲבַת,Noun Feminine,machabath,(makh-ab-ath'),"a flat plate, pan, griddle",pan ,From the same as (H2281) chabeth; a pan for baking in -- pan. see HEBREW (H2281) chabeth
h,4228,מַחֲגֹרֶת,Noun Feminine,machagoreth,(makh-ag-o'-reth),"girding, cincture",girding ,From (H2296) chagar; a girdle -- girding. see HEBREW (H2296) chagar
h,4229,מָחָה,Verb,machah,(maw-khaw'),"to wipe, wipe out","abolish, blot out, destroy, full of marrow, put out, reach unto, utterly, wipe away, ","A primitive root; properly, to stroke or rub; by implication, to erase; also to smooth (as if with oil), i.e. Grease or make fat; also to touch, i.e. Reach to -- abolish, blot out, destroy, full of marrow, put out, reach unto, X utterly, wipe (away, out). "
h,4230,מְחוּגָה,Noun Feminine,mechugah,(mekk-oo-gaw'),a compass,compass ,"From (H2328) chuwg; an instrument for marking a circle, i.e. Compasses -- compass. see HEBREW (H2328) chuwg "
h,4231,מָחוֹז,Noun Masculine,machoz,(maw-khoze'),a city,haven ,From an unused root meaning to enclose; a harbor (as shut in by the shore) -- haven.
h,4232,מְחוּיָאֵל,Proper Name Masculine,Mechuyael or Mechiyyayel,(mekh-oo-yaw-ale'),"smitten of God, great-grandson of Cain",Mehujael ,"Or Mchiyyauel {mekh-ee-yaw-ale'}; from (H4229) machah and (H410) 'el; smitten of God; Mechujael or Mechijael, an anxediluvian patriarch -- Mehujael. see HEBREW (H4229) machah see HEBREW (H410) 'el "
h,4233,מַחֲוִים,Adjective,Machavim,(makh-av-eem'),a description of Eliel,Mahavite ,"Apparently a patrial, but from an unknown place (in the plural only for a singular); a Machavite or inhabitant of some place named Machaveh -- Mahavite. "
h,4234,מָחוֹל,Noun Masculine,machol,(maw-khole'),a dance,dancing ,From (H2342) chuwl; a (round) dance -- dance(-cing). see HEBREW (H2342) chuwl
h,4235,מָחוֹל,Proper Name Masculine,Machol,(maw-khole'),father of Heman,Mahol ,"The same as (H4234) machowl; dancing; Machol, an Israelite -- Mahol. see HEBREW (H4234) machowl "
h,4236,מַחֲזֶה,Noun Masculine,machazeh,(makh-az-eh'),a vision,vision ,From (H2372) chazah; a vision -- vision. see HEBREW (H2372) chazah
h,4237,מֶחֱזָה,Noun Feminine,mechezah,(mekh-ez-aw'),"light, place of seeing, a window",light ,From (H2372) chazah; a window -- light. see HEBREW (H2372) chazah
h,4238,מַחֲזִיאוֹת,Proper Name Feminine,Machazioth,(makh-az-ee-oth'),"visions, an Israelite",Mahazioth ,"Feminine plural from (H2372) chazah; visions; Machazioth, an Israelite -- Mahazioth. see HEBREW (H2372) chazah "
h,4239,מְחִי,Noun Masculine,mechi,(mekh-ee'),a smiting,engines ,"From (H4229) machah; a stroke, i.e. Battering-ram -- engines. see HEBREW (H4229) machah "
h,4240,מְחִידָא,Proper Name Masculine,Mechida,(mek-ee-daw'),an Israelite,Mehida ,"From (H2330) chuwd; junction; Mechida, one of the Nethinim -- Mehida. see HEBREW (H2330) chuwd "
h,4241,מִחְיָה,Noun Feminine,michyah,(mikh-yaw'),"preservation of life, sustenance","preserve life, quick, recover selves, reviving, sustenance, victuals ","From (H2421) chayah; preservation of life; hence, sustenance; also the live flesh, i.e. The quick -- preserve life, quick, recover selves, reviving, sustenance, victuals. see HEBREW (H2421) chayah "
h,4242,מְחִיר,Noun Masculine,mechir,(mekk-eer'),"price, hire","gain, hire, price, sold, worth ","From an unused root meaning to buy; price, payment, wages -- gain, hire, price, sold, worth. "
h,4243,מְחִיר,Proper Name Masculine,Mechir,(mekh-eer'),an Israelite,Mehir ,"The same as (H4242) mchiyr; price; Mechir, an Israelite -- Mehir. see HEBREW (H4242) mchiyr "
h,4244,מַחְלָה,Proper Name Feminine,Machlah,(makh-law'),"a daughter of Zelophehad, also a Gileadite",Mahlah ,"From (H2470) chalah; sickness; Machlah, the name apparently of two Israelitesses -- Mahlah. see HEBREW (H2470) chalah "
h,4245,מַחֲלֶה,Noun Masculine,machaleh,(makh-al-eh'),"sickness, disease","disease, infirmity, sickness ","Or (feminine) machalah {makk-al-aw'}; from (H2470) chalah; sickness -- disease, infirmity, sickness. see HEBREW (H2470) chalah "
h,4246,מְחֹלָה,Noun Feminine,mecholah,(mek-o-law'),a dance,"company, dancing ","Feminine of (H4284) machashabah; a dance -- company, dances(-cing). see HEBREW (H4284) machashabah "
h,4247,מְחִלָּה,Noun Feminine,mechillah,(mekh-il-law'),a hole,cave ,From (H2490) chalal; a cavern (as if excavated) -- cave. see HEBREW (H2490) chalal
h,4248,מַחְלוֹן,Proper Name Masculine,Machlon,(makh-lone'),the first husband of Ruth,Mahlon ,"From (H2470) chalah; sick; Machlon, an Israelite -- Mahlon. see HEBREW (H2470) chalah "
h,4249,מַחְלִי,Proper Name Masculine,Machli,(makh-lee'),"a Levite, also a son of Mushi",Mahli ,"From (H2470) chalah; sick; Machli, the name of two Israelites -- Mahli. see HEBREW (H2470) chalah "
h,4250,מַחְלִי,Adjective,Machli,(makh-lee'),descendant of Mahli,Mahlites ,Patronymical from (H4249) Machliy; a Machlite or (collectively) descendants of Machli -- Mahlites. see HEBREW (H4249) Machliy
h,4251,מַחְלֻי,Noun Masculine,machluy or machaluy,(makh-loo'-ee),"sickness, suffering (caused by wounds)",disease ,From (H2470) chalah; a disease -- disease. see HEBREW (H2470) chalah
h,4252,מַחֲלָף,Noun Masculine,machalaph,(makh-al-awf'),a knife,knife ,From (H2498) chalaph; a (sacrificial) knife (as gliding through the flesh) -- knife. see HEBREW (H2498) chalaph
h,4253,מַחְלָפָה,Noun Feminine,machalaphah,(makh-law-faw'),a plait (of hair),lock ,From (H2498) chalaph; a ringlet of hair (as gliding over each other) -- lock. see HEBREW (H2498) chalaph
h,4254,מַחֲלָצָה,Noun Feminine,machalatsah,(makh-al-aw-tsaw'),robe of state,"changeable suit of apparel, change of raiment ","From (H2502) chalats; a mantle (as easily drawn off) -- changeable suit of apparel, change of raiment. see HEBREW (H2502) chalats "
h,4255,מַחְלְקָה,Noun Feminine,machlqah,(makh-lek-aw'),"class, division",course ,(Aramaic) corresponding to (H4256) machaloqeth; a section (of the Levites) -- course. see HEBREW (H4256) machaloqeth
h,4256,מַחֲלֹקֶת,Noun Feminine,machaloqeth,(makh-al-o'-keth),"division, course","company, course, division, portion ","From (H2505) chalaq; a section (of Levites, people or soldiers) -- company, course, division, portion. See also (H5555) Cela' ham-machlqowth. see HEBREW (H2505) chalaq see HEBREW (H5555) Cela' ham-machlqowth "
h,4257,מַחֲלַת,Noun Feminine,Machalath,(makh-al-ath'),"in psalm titles, probably the name of a tune",Mahalath ,"From (H2470) chalah; sickness; Machalath, probably the title (initial word) of a popular song -- Mahalath. see HEBREW (H2470) chalah "
h,4258,מַחֲלַת,Proper Name Feminine,Machalath,(makh-al-ath'),"daughter of Ishmael, also a granddaughter of David",Mahalath ,"The same as (H4257) machalath; sickness; Machalath, the name of an Ishmaelitess and of an Israelitess -- Mahalath. see HEBREW (H4257) machalath "
h,4259,מְחֹלָתִי,Adjective,Mecholathi,(mekh-o-law-thee'),inhab. of Abel-meholah,Mecholathite ,Patrial from (H65) 'Abel Mchowlah; a Mecholathite or inhabitant of Abel-Mecholah -- Mecholathite. see HEBREW (H65) 'Abel Mchowlah
h,4260,מַחֲמָאָה,Noun Feminine,machamaah,(makh-am-aw-aw'),smoother than butter,than butter ,"A denominative from (H2529) chem'ah; something buttery (i.e. Unctuous and pleasant), as (figuratively) flattery -- X than butter. see HEBREW (H2529) chem'ah "
h,4261,מַחְמָד,Noun Masculine,machmad,(makh-mawd'),"desire, desirable thing","beloved, desire, goodly, lovely, pleasant thing ","From (H2530) chamad; delightful; hence, a delight, i.e. Object of affection or desire -- beloved, desire, goodly, lovely, pleasant (thing). see HEBREW (H2530) chamad "
h,4262,מַחְמֻד,Noun Masculine,machmud or machmod,(makh-mood'),a desirable or precious thing,pleasant thing ,"Or machmuwd {makh-mood'}; from (H2530) chamad; desired; hence, a valuable -- pleasant thing. see HEBREW (H2530) chamad "
h,4263,מַחְמָל,Noun Masculine,machmal,(makh-mawl'),"a thing pitied, an object of compassion",pitieth ,"From (H2550) chamal; properly, sympathy; (by paronomasia with (H4261) machmad) delight -- pitieth. see HEBREW (H2550) chamal see HEBREW (H4261) machmad "
h,4264,מַחֲנֶה,Noun Masculine,machaneh,(makh-an-eh'),"an encampment, camp","army, band, battle, camp, company, drove, host, tents","From (H2583) chanah; an encampment (of travellers or troops); hence, an army, whether literal (of soldiers) or figurative (of dancers, angels, cattle, locusts, stars; or even the sacred courts) -- army, band, battle, camp, company, drove, host, tents. see HEBREW (H2583) chanah "
h,4265,מַחֲנֵה־דָן,Proper Name Location,Machaneh-dan,(makh-an-ay'-dawn),"camp of Dan, a place where the Danites stayed",Mahaneh-dan ,"From (H4264) machaneh and (H1835) Dan; camp of Dan; Machaneh-Dan, a place in Palestine -- Mahaneh-dan. see HEBREW (H4264) machaneh see HEBREW (H1835) Dan "
h,4266,מַחֲניִם,Proper Name Location,Machanayim,(makh-an-ah'-yim),"two camps, a place East of the Jordan",Mahanaim ,"Dual of (H4264) machaneh; double camp; Machanajim, a place in Palestine -- Mahanaim. see HEBREW (H4264) machaneh "
h,4267,מַחֲנַק,Noun Masculine,machanaq,(makh-an-ak'),"strangling, suffocation",strangling ,From (H2614) chanaq: choking -- strangling. see HEBREW (H2614) chanaq
h,4268,מַחֲסֶה,Noun Masculine,machaseh or machseh,(makh-as-eh'),"refuge, shelter","hope, place of refuge, shelter, trust ","Or machceh {makh-seh'}; from (H2620) chacah; a shelter (literally or figuratively) -- hope, (place of) refuge, shelter, trust. see HEBREW (H2620) chacah "
h,4269,מַחְסוֹם,Noun Masculine,machsom,(makh-sohm'),a muzzle,bridle ,From (H2629) chacam; a muzzle -- bridle. see HEBREW (H2629) chacam
h,4270,מַחְסוֹר,Noun Masculine,machsor,(makh-sore'),"a need, thing needed, poverty","lack, need, penury, poor, poverty, want ","Or machcor {makh-sore'}; from (H2637) chacer; deficiency; hence, impoverishment -- lack, need, penury, poor, poverty, want. see HEBREW (H2637) chacer "
h,4271,מַחְסֵיָה,Proper Name Masculine,Machseyah,(makh-say-yaw'),"Yah is a refuge, an Israelite",Maaseiah ,"From (H4268) machaceh and (H3050) Yahh; refuge of (i.e. In) Jah; Machsejah, an Israelite -- Maaseiah. see HEBREW (H4268) machaceh see HEBREW (H3050) Yahh "
h,4272,מָחַץ,Verb,machats,(maw-khats'),"to smite through, wound severely, shatter","dip, pierce through, smite through, strike through, wound ","A primitive root; to dash asunder; by implication, to crush, smash or violently plunge; figuratively, to subdue or destroy -- dip, pierce (through), smite (through), strike through, wound. "
h,4273,מַחַץ,Noun Masculine,machats,(makh'-ats),a severe wound,stroke ,From (H4272) machats; a contusion -- stroke. see HEBREW (H4272) machats
h,4274,מַחְצֵב,Noun Masculine,machtseb,(makh-tsabe'),a hewing,hewedn ,"From (H2672) chatsab; properly, a hewing; concretely, a quarry -- hewed(-n). see HEBREW (H2672) chatsab "
h,4275,מֶחֱצָה,Noun Feminine,mechetsah,(mekh-ets-aw'),half,half ,From (H2673) chatsah; a halving -- half. see HEBREW (H2673) chatsah
h,4276,מַחֲצִית,Noun Feminine,machatsith,(makh-ats-eeth'),"half, middle","half so much, midday ","From (H2673) chatsah; a halving or the middle -- half (so much), mid(-day). see HEBREW (H2673) chatsah "
h,4277,מָחַק,Verb,machaq,(maw-khak'),"to utterly destroy, annihilate",smite off ,A primitive root; to crush -- smite off.
h,4278,מֶחְקָר,Noun Masculine,mechqar,(mekh-kawr'),a range (an area to explore),deep place ,"From (H2713) chaqar; properly, scrutinized, i.e. (by implication) a recess -- deep place. see HEBREW (H2713) chaqar "
h,4279,מָחָר,Noun Masculine,machar,(maw-khar'),"tomorrow, in time to come","time to come, tomorrow ","Probably from (H309) 'achar; properly, deferred, i.e. The morrow; usually (adverbially) tomorrow; indefinitely, hereafter -- time to come, tomorrow. see HEBREW (H309) 'achar "
h,4280,מַחֲרָאָה,Noun Feminine,macharaah,(makh-ar-aw-aw'),"a cloaca, cesspool",draught house ,From the same as (H2716) chere'; a sink -- draught house. see HEBREW (H2716) chere'
h,4281,מַחֲרֵשָׁה,Noun Feminine,machareshah,(makh-ar-ay-shaw'),a plowshare,mattock ,From (H2790) charash; probably a pick-axe -- mattock. see HEBREW (H2790) charash
h,4282,מַחֲרֶשֶׁת,Noun Feminine,macharesheth,(makh-ar-eh'-sheth),share ,share ,From (H2790) charash; probably a hoe -- share. see HEBREW (H2790) charash
h,4283,מָחֱרָת,Noun Feminine,mochorath or mochoratham,(mokh-or-awth'),the morrow,"morrow, next day ","Or mochoratham (1 Sam. 30:17) {mokh-or-aw- thawm'}; feminine from the same as (H4279) machar; the morrow or (adverbially) tomorrow -- morrow, next day. see HEBREW (H4279) machar "
h,4284,מַחֲשָׁבָה,Noun Feminine,machashabah or machashebeth,(makh-ash-aw-baw'),"thought, device","cunning work, curious work, imagination, invented, means, purpose, thought","Or machashebeth {makh-ash-eh'-beth}; from (H2803) chashab; a contrivance, i.e. (concretely) a texture, machine, or (abstractly) intention, plan (whether bad, a plot; or good, advice) -- cunning (work), curious work, device(-sed), imagination, invented, means, purpose, thought. see HEBREW (H2803) chashab "
h,4285,מַחְשָׁךְ,Noun Masculine,machshak,(makh-shawk'),dark place,"darkness, place ","From (H2821) chashak; darkness; concretely, a dark place -- dark(-ness, place). see HEBREW (H2821) chashak "
h,4286,מַחְשׂף,Noun Masculine,machsoph,(makh-sofe'),"a laying bare, stripping","peeling, made appear ",From (H2834) chasaph; a peeling -- made appear. see HEBREW (H2834) chasaph
h,4287,מַחַת,Proper Name Masculine,Machath,(makh'-ath),two Levites,Mahath ,"Probably from (H4229) machah; erasure; Machath, the name of two Israelites -- Mahath. see HEBREW (H4229) machah "
h,4288,מְחִתָּה,Noun Feminine,mechittah,(mekh-it-taw'),"terror, destruction, ruin","destruction, dismaying, ruin, terror ","From (H2846) chathah; properly, a dissolution; concretely, a ruin, or (abstractly) consternation -- destruction, dismaying, ruin, terror. see HEBREW (H2846) chathah "
h,4289,מַחְתָּה,Noun Feminine,machtah,(makh-taw'),"a fireholder, censer, snuff dish","censer, firepan, snuffdish ","The same as (H4288) mchittah in the sense of removal; a pan for live coals -- censer, firepan, snuffdish. see HEBREW (H4288) mchittah "
h,4290,מַחְתֶּרֶת,Noun Masculine,machtereth,(makh-teh'-reth),"a breaking in, burglary","breaking up, secret search ","From (H2864) chathar; a burglary; figuratively, unexpected examination -- breaking up, secret search. see HEBREW (H2864) chathar "
h,4291,מְטָא,Verb,meta or metah,(met-aw'),"to reach, attain","come, reach ","(Aramaic) or mtah (Aramaic) {met-aw'}; apparently corresponding to (H4672) matsa' in the intransitive sense of being found present; to arrive, extend or happen -- come, reach. see HEBREW (H4672) matsa' "
h,4292,מַטְאֲטֵא,Noun Masculine,matate,(mat-at-ay'),"broom, besom",besom ,"Apparently a denominative from (H2916) tiyt; a broom (as removing dirt (compare Engl. \""to dust\"", i.e. Remove dust)) -- besom. see HEBREW (H2916) tiyt "
h,4293,מַטְבֵּחַ,Noun Masculine,matbeach,(mat-bay'-akh),a slaughtering place,slaughter ,From (H2873) tabach; slaughter -- slaughter. see HEBREW (H2873) tabach
h,4294,מַטֶּה,Noun Masculine,matteh or mattah,(mat-teh'),"a staff, rod, shaft, branch, a tribe","rod, staff, tribe ","Or (feminine) mattah {mat-taw'}; from (H5186) natah; a branch (as extending); figuratively, a tribe; also a rod, whether for chastising (figuratively, correction), ruling (a sceptre), throwing (a lance), or walking (a staff; figuratively, a support of life, e.g. Bread) -- rod, staff, tribe. see HEBREW (H5186) natah "
h,4295,מַטָּה,Adverb,mattah,(mat'-taw),downwards,"beneath, downward, less, very low, underneath ","From (H5786) avar with directive enclitic appended; downward, below or beneath; often adverbially with or without prefixes -- beneath, down(-ward), less, very low, under(-neath). see HEBREW (H5786) avar "
h,4296,מִטָּה,Noun Feminine,mittah,(mit-taw'),"a couch, bed","bedchamber, bier ","From (H5186) natah; a bed (as extended) for sleeping or eating; by analogy, a sofa, litter or bier -- bed((-chamber)), bier. see HEBREW (H5186) natah "
h,4297,מֻטֶּה,Noun Masculine,mutteh,(moot-teh'),"that which is perverted, perverted justice",perverseness ,"From (H5186) natah; a stretching, i.e. Distortion (figuratively, iniquity) -- perverseness. see HEBREW (H5186) natah "
h,4298,מֻטֶּה,Noun Feminine,muttah,(moot-taw'),"spreading, outspreading",stretching out ,From (H5186) natah; expansion -- stretching out. see HEBREW (H5186) natah
h,4299,מַטְוֶה,Noun Masculine,matveh,(mat-veh'),"that which is spun, yarn",spun ,From (H2901) tavah; something spun -- spun. see HEBREW (H2901) tavah
h,4300,מְטִיל,Noun Masculine,metil,(met-eel'),a wrought metal rod,bar ,From (H2904) tuwl in the sense of hammering out; an iron bar (as forged) -- bar. see HEBREW (H2904) tuwl
h,4301,מַטְמוֹן,Noun Masculine,matmon,(mat-mone'),"hidden treasure, treasure","hidden riches, hid treasures ","Or matmon {mat-mone'}; or matmun {mat-moon'}; from (H2934) taman; a secret storehouse; hence, a secreted valuable (buried); generally money -- hidden riches, (hid) treasure(-s). see HEBREW (H2934) taman "
h,4302,מַטָּע,Noun Masculine,matta,(mat-taw'),"place or act of planting, a plantation",garden or vineyard,"From (H5193) nata'; something planted, i.e. The place (a garden or vineyard), or the thing (a plant, figuratively or men); by implication, the act, planting -- plant(-ation, -ing). see HEBREW (H5193) nata' "
h,4303,מַטְעַם,Noun Masculine,matam or matammah,(mat-am'),"tasty or savory food, dainties","dainty meat, savoury meat ","Or (feminine) matiammah {mat-am-maw'}; from (H2938) ta'am; a delicacy -- dainty (meat), savoury meat. see HEBREW (H2938) ta'am "
h,4304,מִטְפַּחַת,Noun Feminine,mitpachath,(mit-pakh'-ath),a cloak,"vail, wimple ","From (H2946) taphach; a wide cloak (for a woman) -- vail, wimple. see HEBREW (H2946) taphach "
h,4305,מָטַר,Verb,matar,(maw-tar'),to rain,cause to rain upon ,A primitive root; to rain -- (cause to) rain (upon).
h,4306,מָטַר,Noun Masculine,matar,(maw-tawr'),rain,rain ,From (H4305) matar; rain -- rain. see HEBREW (H4305) matar
h,4307,מַטָּרָא,Noun Feminine,mattara or mattarah,(mat-taw-raw'),"a guard, ward, prison, target, mark","mark, prison ","Or mattarah {mat-taw-raw'}; from (H5201) natar; a jail (as a guard-house); also an aim (as being closely watched) -- mark, prison. see HEBREW (H5201) natar "
h,4308,מַטְרֵד,Proper Name Feminine,Matred,(mat-rade'),an Edomite woman,Matred ,"From (H2956) tarad; propulsive; Matred, an Edomitess -- Matred. see HEBREW (H2956) tarad "
h,4309,מַטְרִי,Adjective,Matri,(mat-ree'),a Benjamite family,Matri ,"From (H4305) matar; rainy; Matri, an Israelite -- Matri. see HEBREW (H4305) matar "
h,4310,מִי,pronoun interrogative; feminine,mi,(me),who?,"any man, he, him, O that! What, which, whom would to God ","An interrogative pronoun of persons, as (H4100) mah is of things, who? (occasionally, by a peculiar idiom, of things); also (indefinitely) whoever; often used in oblique construction with prefix or suffix -- any (man), X he, X him, + O that! What, which, who(-m, -se, -soever), + would to God. see HEBREW (H4100) mah "
h,4311,מֵידְבָא,Proper Name Location,Medeba,(may-deb-aw'),a city in Moab,Medeba ,"From (H4325) mayim and (H1679) dobe'; water of quiet; Medeba, a place in Palestine -- Medeba. see HEBREW (H4325) mayim see HEBREW (H1679) dobe' "
h,4312,מֵידָד,Proper Name Masculine,Medad,(may-dawd'),an Israelite,Medad ,"From (H3032) yadad in the sense of loving; affectionate; Medad, an Israelite -- Medad. see HEBREW (H3032) yadad "
h,4313,מֵי הַיַּרְקוֹן,Proper Name Location,Me Hayyarqon,(may hah'-ee-yar-kone'),a place in Dan near Joppa,Me-jarkon ,"From (H4325) mayim and (H3420) yeraqown with the art. Interposed; water of the yellowness; Me-haj-Jarkon, a place in Palestine -- Me-jarkon. see HEBREW (H4325) mayim see HEBREW (H3420) yeraqown "
h,4314,מֵי זָהָב,Proper Name Masculine,Me Zahab,(may zaw-hawb'),an Edomite,Mezahab ,"From (H4325) mayim and (H2091) zahab, water of gold; Me-Zahab, an Edomite -- Mezahab. see HEBREW (H4325) mayim see HEBREW (H2091) zahab "
h,4315,מֵיטָב,Noun Masculine,metab,(may-tawb'),the best,best ,From (H3190) yatab; the best part -- best. see HEBREW (H3190) yatab
h,4316,מִיכְא,Proper Name Masculine,Mika,(mee-kaw'),three Israelites,Micha ,"A variation for (H4318) Miykah; Mica, the name of two Israelites -- Micha. see HEBREW (H4318) Miykah "
h,4317,מִיכָאֵל,Proper Name Masculine,Mikael,(me-kaw-ale'),"Who is like God? an angel, also a number of Isr",Michael ,"From (H4310) miy and (the prefix derivative from) (H3588) kiy and (H410) 'el; who (is) like God?; Mikael, the name of an archangel and of nine Israelites -- Michael. see HEBREW (H4310) miy see HEBREW (H3588) kiy see HEBREW (H410) 'el "
h,4318,מִיכָה,Proper Name Masculine,Mikah,(mee-kaw'),the name of several Israelites,"Micah, Micaiah, Michah ","An abbrev. Of (H4320) Miykayah; Micah, the name of seven Israelites -- Micah, Micaiah, Michah. see HEBREW (H4320) Miykayah "
h,4319,מִיכָהוּ,Proper Name Masculine,Mikahu,(me-kaw'-hoo),Micaiah,Micaiah,"A contr. For (H4321) Miykayhuw; Mikehu, an Israelite prophet -- Micaiah (2 Chronicles 18:8). see HEBREW (H4321) Miykayhuw "
h,4320,מִיכָיָה,Proper Name Masculine,Mikayah,(me-kaw-yaw'),Who is like Yah? the name of several Israelites,"Micah, Michaiah ","From (H4310) miy and (the prefix derivative from) (H3588) kiy and (H3050) Yahh; who (is) like Jah?; Micajah, the name of two Israelites -- Micah, Michaiah. Compare (H4318) Miykah. see HEBREW (H4310) miy see HEBREW (H3588) kiy see HEBREW (H3050) Yahh see HEBREW (H4318) Miykah "
h,4321,מִיכָיְהוּ,Proper Name Masculine,Mikayehu,(me-kaw-yeh-hoo'),Who is like Yah? three Israelites,"Micah, Micaiah, Michaiah ","Or Mikayhuw (Jeremiah 36:11) {me-kaw-yeh-hoo'}; abbrev. For (H4322) Miykayahuw; Mikajah, the name of three Israelites -- Micah, Micaiah, Michaiah. see HEBREW (H4322) Miykayahuw "
h,4322,מִיכָיָהוּ,proper name; masculine; feminine,Mikayahu,(me-kaw-yaw'-hoo),"Who is like Yah? an Israelite, also an Israelite woman",Michaiah ,"For (H4320) Miykayah; Mikajah, the name of an Israelite and an Israelitess -- Michaiah. see HEBREW (H4320) Miykayah "
h,4323,מִיכָל,Noun Masculine,mikal,(me-kawl'),"a brook, stream",brook ,"From (H3201) yakol; properly, a container, i.e. A streamlet -- brook. see HEBREW (H3201) yakol "
h,4324,מִיכָל,Proper Name Feminine,Mikal,(me-kawl'),wife of David,Michal ,"Apparently the same as (H4323) miykal; revulet; Mikal, Saul's daughter -- Michal. see HEBREW (H4323) miykal "
h,4325,מַיִם,Noun Masculine,mayim,(mah'-yim),"waters, water","waste, wasting, watering, course, ","Dual of a primitive noun (but used in a singular sense); water; figuratively, juice; by euphemism, urine, semen -- + piss, wasting, water(-ing, (-course, -flood, -spring)). "
h,4326,מִיָּמִן,Proper Name Masculine,Miyyamin,(me-yaw-meem'),the name of several Israelites,"Miamin, Mijamin ","A form for (H4509) Minyamiyn; Mijamin, the name of three Israelites -- Miamin, Mijamin. see HEBREW (H4509) Minyamiyn "
